symbol,name,price,marketCap,volume,industry
VSEE,VSee Health Inc. Common Stock,0.1909,9029459.0,396399,Health Care
TNON,Tenon Medical Inc. Common Stock,0.7823,8837157.0,113794,Health Care
MTR,Mesa Royalty Trust Common Stock,4.72,8796145.0,6758,Energy
DTST,Data Storage Corporation Common Stock,3.95,8560195.0,16370,Technology
GRDX,GridAI Technologies Corp. Common Stock,2.52,8471996.0,44018,Health Care
MTEX,Mannatech Incorporated Common Stock,4.38,8451955.0,476,Health Care
ACON,Aclarion Inc. Common Stock,3.42,8420895.0,59245,Health Care
YHGJ,Yunhong Green CTI Ltd. Common Stock,3.2,8311562.0,15016,Industrials
IPDN,Professional Diversity Network Inc. Common Stock,0.81,8298276.0,18366,Technology
CELZ,Creative Medical Technology Holdings Inc. Common Stock,2.24,8280536.0,39762,Finance
FLDDW,Fold Holdings Inc. Warrant,0.1648,8276012.0,38300,Finance
SNES,SenesTech Inc. Common Stock,1.555,8188232.0,41397,Industrials
DETX,Liberty Defense Holdings Ltd. Common Shares,4.125,8185250.0,44044,Telecommunications
PMCB,PharmaCyte  Biotech Inc. Common Stock,0.7553,8108636.0,74298,Health Care
CETY,Clean Energy Technologies Inc. Common Stock,0.661,8041796.0,108037,Consumer Discretionary
HWH,HWH International Inc. Common Stock,1.07,7999748.0,8166,Health Care
ENVB,Enveric Biosciences Inc. Common Stock,3.99,7922285.0,604683,Health Care
NXL,Nexalin Technology Inc. Common Stock,0.3803,7827200.0,141663,Health Care
CWD,CaliberCos Inc. Class A Common Stock,1.09,7687838.0,25989,Finance
FBLG,FibroBiologics Inc. Common Stock,1.46,7605198.0,290187,Health Care
XPON,Expion360 Inc. Common Stock,0.7008,7600971.0,93970,Miscellaneous
ONFO,Onfolio Holdings Inc. Common Stock,1.28,7504914.0,544551,Technology
ACXP,Acurx Pharmaceuticals Inc. Common Stock,2.16,7478836.0,80196,Health Care
MTVA,MetaVia Inc. Common Stock,1.44,7436693.0,68674,Health Care
SCKT,Socket Mobile Inc. Common Stock,0.902,7417108.0,11569,Technology
SILO,Silo Pharma Inc. Common Stock,0.455,7401300.0,384175,Consumer Discretionary
ONCO,Onconetix Inc. Common Stock,0.635,7280003.0,1001282,Health Care
SONM,DNA X Inc. Common Stock,4.89,7277631.0,13679,Utilities
IQST,iQSTEL Inc. Common Stock,1.42,7200455.0,124877,Telecommunications
RNAZ,TransCode Therapeutics Inc. Common Stock,7.83,7179859.0,5251,Health Care
MSS,Maison Solutions Inc. Class A Common Stock,1.22,7178603.0,19039,Consumer Staples
BCAB,BioAtla Inc. Common Stock,4.27,7075074.0,27724,Health Care
OLB,The OLB Group Inc. Common Stock,0.5646,7060746.0,747087,Real Estate
JCTC,Jewett-Cameron Trading Company Common Shares,2.0,7040226.0,27144,Consumer Discretionary
TGL,Treasure Global Inc. Common Stock,4.2,7038045.0,6734,Real Estate
TULP,Bloomia Holdings Inc. Common Stock,3.92,6950626.0,1475,Consumer Staples
NVNO,enVVeno Medical Corporation Common Stock,10.5,6882971.0,19370,Health Care
XBIO,Xenetic Biosciences Inc. Common Stock,2.97,6804436.0,2069,Health Care
RENX,RenX Enterprises Corp. Common Stock,2.71,6795425.0,161975,Finance
PCSA,Processa Pharmaceuticals Inc. Common Stock,2.55,6783099.0,35525,Health Care
XAIR,Beyond Air Inc. Common Stock,0.514,6781040.0,126397,Health Care
UGRO,urban-gro Inc. Common Stock,6.0,6768840.0,273698,Consumer Discretionary
BMRA,Biomerica Inc. Common Stock,2.19,6767689.0,5513,Health Care
POLA,Polar Power Inc. Common Stock,1.85,6734294.0,114650,Miscellaneous
LUCY,Innovative Eyewear Inc. Common Stock,1.0312,6497242.0,22628,Health Care
HSCS,HeartSciences Inc. Common Stock,1.99,6337553.0,5916,Health Care
CJMB,Callan JMB Inc. Common Stock,1.11,6246378.0,561198,Real Estate
TCRT,Alaunos Therapeutics Inc. Common Stock,2.61,6207240.0,11504,Health Care
DAIC,CID HoldCo Inc. Common Stock,0.2115,6195538.0,98264,Technology
NDRA,ENDRA Life Sciences Inc. Common Stock,4.95,6141717.0,10639,Health Care
CAPS,Capstone Holding Corp. Common Stock,0.4221,6093396.0,286085,Health Care
BRTX,BioRestorative Therapies Inc. Common Stock (NV),0.2332,5941509.0,836722,Health Care
MITQ,Moving iMage Technologies Inc. Common Stock,0.596,5927289.0,122041,Consumer Discretionary
TWAV,TaoWeave Inc. Common Stock,1.77,5889162.0,68957,Technology
CTNT,Cheetah Net Supply Chain Service Inc Class A Common Stock,2.99,5858439.0,426916,Consumer Discretionary
APVO,Aptevo Therapeutics Inc. Common Stock,4.92,5814087.0,4315,Health Care
BKYI,BIO-key International Inc. Common Stock,5.33,5784180.0,30196,Technology
DSS,DSS Inc. Common Stock,0.5733,5757376.0,74824,Consumer Discretionary
SLE,Super League Enterprise Inc. Common Stock,3.93,5739565.0,5587,Consumer Discretionary
HYFM,Hydrofarm Holdings Group Inc. Common Stock,1.2,5717534.0,42167,Consumer Discretionary
MBIO,Mustang Bio Inc. Common Stock,0.7544,5716449.0,34549,Health Care
CODX,Co-Diagnostics Inc. Common Stock,1.55,5583821.0,37105,Health Care
CDIO,Cardio Diagnostics Holdings Inc. Common stock,1.88,5563802.0,77017,Health Care
BNZI,Banzai International Inc. Class A Common Stock,0.3006,5558726.0,1946627,Technology
NWTG,Newton Golf Company Inc. Common Stock,1.21,5556396.0,12861,Consumer Discretionary
MKZR,MacKenzie Realty Capital Inc. Common Stock,2.8,5505920.0,56872,Real Estate
CYCU,Cycurion Inc. Common Stock,0.993,5471418.0,750635,Technology
MGRX,Mangoceuticals Inc. Common Stock,0.3178,5392246.0,1690189,Health Care
ESLAW,Estrella Immunopharma Inc. Warrant,0.1257,5363019.0,2503,Health Care
COCHW,Envoy Medical Inc Warrant,0.0696,5350925.0,4400,Health Care
DRMA,Dermata Therapeutics Inc. Common Stock,1.33,5349450.0,109872,Health Care
SOPA,Society Pass Incorporated Common Stock,0.407,5285849.0,222760,Real Estate
ASTC,Astrotech Corporation (DE) Common Stock,2.97,5224090.0,72979,Industrials
SUNE,SUNation Energy Inc. Common Stock,1.52,5178056.0,2867461,Utilities
VSTD,Vestand Inc. Class A Common Stock,0.3633,5167935.0,35858,Consumer Discretionary
SQFT,Presidio Property Trust Inc. Class A Common Stock,3.45,4973789.0,15395,Real Estate
NXGL,NexGel Inc Common Stock,0.5811,4925225.0,57116,Health Care
EEIQ,EpicQuest Education Group International Limited Common Stock,3.28,4852691.0,15306,Real Estate
XHLD,TEN Holdings Inc. Common Stock,1.22,4852480.0,67040,Real Estate
INBS,Intelligent Bio Solutions Inc. Common Stock,2.41,4822827.0,65336,Health Care
AMST,Amesite Inc. Common Stock,1.05,4801349.0,368448,Technology
AQB,AquaBounty Technologies Inc. Common Stock,0.9325,4799768.0,6026,Consumer Staples
INDP,Indaptus Therapeutics Inc. Common Stock,2.14,4798573.0,45190,Health Care
BFRGW,Bullfrog AI Holdings Inc. Warrants,0.26,4796247.0,5148,Health Care
SNYR,Synergy CHC Corp. Common Stock,0.32,4730203.0,459457,Health Care
PULM,Pulmatrix Inc. Common Stock,1.29,4711448.0,4180,Health Care
USGOW,U.S. GoldMining Inc. Warrant,0.3483,4640155.0,94449,Basic Materials
VEEAW,Veea Inc. Warrant,0.0909,4582048.0,5065,Finance
PGYWW,Pagaya Technologies Ltd. Warrants,0.0552,4555459.0,26413,Finance
HCTI,Healthcare Triangle Inc. Common Stock,2.3,4525452.0,63176,Technology
MTNB,Matinas Biopharma Holdings Inc. Common Stock,0.699,4477928.0,33408,Health Care
ERNA,Ernexa Therapeutics Inc. Common Stock,0.1525,4446051.0,466815,Health Care
FEED,ENvue Medical Inc. Common Stock,1.19,4404081.0,131807,Health Care
VIVK,Vivakor Inc. Common Stock,2.12,4384247.0,85678,Uncategorized
WHLRP,Wheeler Real Estate Investment Trust Inc. Class B Preferred Stock,7.25,4381712.0,100,Real Estate
SXTP,60 Degrees Pharmaceuticals Inc. Common Stock,1.66,4377068.0,83194,Health Care
BOXL,Boxlight Corporation Class A Common Stock,1.08,4321844.0,42331,Real Estate
ALZN,Alzamend Neuro Inc. Common Stock,1.12,4261310.0,30149,Health Care
AMIX,Autonomix Medical Inc. Common Stock,0.37,4221457.0,392367,Health Care
JTAI,Jet.AI Inc. Common Stock,7.03,4190217.0,547826,Consumer Discretionary
ISPC,iSpecimen Inc. Common Stock,5.62,4167545.0,9598112,Health Care
REVB,Revelation Biosciences Inc. Common Stock,1.12,4166870.0,28285,Health Care
GBR,New Concept Energy Inc Common Stock,0.7959,4084506.0,108562,Energy
FFAIW,Faraday Future Intelligent Electric Inc. Warrant,0.0129,3989565.0,61789,Industrials
FABC,Fabric.AI Inc. Common Stock,2.74,3989372.0,598981,Consumer Discretionary
LMFA,LM Funding America Inc. Common Stock,0.2425,3932569.0,425981,Finance
WALDW,Waldencast plc Warrant ,0.0305,3911926.0,40964,Consumer Discretionary
SHPH,Shuttle Pharmaceuticals Holdings Inc. Common Stock,0.6917,3867495.0,18296773,Health Care
EVGOW,EVgo Inc. Warrants,0.0123,3857034.0,35145,Technology
OLOX,Olenox Industries Inc. Common Stock,0.6196,3830219.0,109750,Consumer Discretionary
VIVS,VivoSim Labs Inc. Common Stock,1.44,3755465.0,88172,Health Care
EZRA,Reliance Global Group Inc. Common Stock,0.17,3613012.0,523253,Finance
ENSC,Ensysce Biosciences Inc. Common Stock,0.389,3609072.0,371637,Health Care
SNGX,Soligenix Inc. Common Stock,0.345,3555597.0,925732,Health Care
PDYNW,Palladyne AI Corp Warrants,0.075,3543317.0,196696,Technology
SHFS,SHF Holdings Inc. Class A Common Stock,0.7822,3524191.0,153112,Finance
ALBT,Avalon GloboCare Corp. Common Stock,0.4199,3495083.0,207408,Health Care
SGLY,Singularity Future Technology Ltd. Common Stock,0.4651,3392203.0,87984,Industrials
IVDA,Iveda Solutions Inc. Common Stock,0.3028,3373113.0,177199,Technology
GOVX,GeoVax Labs Inc. Common Stock,1.155,3340918.0,4298015,Health Care
FLYE,Fly-E Group Inc. Common Stock,2.01,3281096.0,4907,Industrials
BTOG,Bit Origin Limited Class A Ordinary Shares,2.22,3278589.0,60893,Finance
BLUWW,Blue Water Acquisition Corp. III Warrant.,0.4402,3189249.0,2554,Uncategorized
ARTL,Artelo Biosciences Inc. Common Stock,3.39,3180271.0,122267,Health Care
TRUG,TruGolf Holdings Inc. Class A Common Stock,2.26,3152182.0,18226,Consumer Discretionary
GRI,GRI Bio Inc. Common Stock,2.18,3150163.0,24671,Health Care
DCOY,Decoy Therapeutics Inc. Common Stock,5.9,3138611.0,4279,Health Care
HCWB,HCW Biologics Inc. Common Stock,0.452,3043815.0,455865,Health Care
AEMD,Aethlon Medical Inc. Common Stock,2.3,3024753.0,8564,Health Care
GWAV,Greenwave Technology Solutions Inc. Common Stock,3.63,3011561.0,10849,Industrials
DRCT,Direct Digital Holdings Inc. Class A Common Stock,3.99,2966318.0,411984,Consumer Discretionary
GNLN,Greenlane Holdings Inc. Class A Common Stock,4.68,2948143.0,39380,Consumer Discretionary
NCPL,Netcapital Inc. Common Stock,0.374,2935114.0,60471,Finance
ZEOWW,Zeo Energy Corporation Warrants,0.0503,2916079.0,594,Miscellaneous
IPST,IP Strategy Holdings Inc. Common Stock,5.5,2913141.0,33599,Consumer Staples
FUSEW,Fusemachines Inc. Warrants,0.1,2893924.0,8723,Technology
DFNSW,T3 Defense Inc. Warrants,0.0758,2867024.0,116691,Consumer Discretionary
NUWE,Nuwellis Inc. Common Stock,1.07,2820218.0,47914,Health Care
PW,Power REIT (MD) Common Stock,0.76,2790928.0,11148,Real Estate
SOBR,SOBR Safe Inc. Common Stock,0.9821,2756341.0,250073273,Consumer Discretionary
GPACW,General Purpose Acquisition Corp. Warrant,0.2751,2741777.0,1,Industrials
CXAIW,CXApp Inc. Warrant,0.0396,2733011.0,10720,Technology
RMCOW,Royalty Management Holding Corporation Warrant,0.1801,2728462.0,24,Miscellaneous
BNBX,BNB Plus Corp. Common Stock,0.4951,2697042.0,105931,Consumer Discretionary
OGEN,Oragenics Inc. Common Stock,0.62,2688338.0,32777,Health Care
JAGX,Jaguar Health Inc. Common Stock,6.69,2684463.0,61948,Health Care
VBIO,Valion Bio Inc. Common Stock,0.92,2647692.0,40295,Health Care
IVF,INVO Fertility Inc. Common Stock,1.9,2645216.0,23121,Health Care
BIVIW,BioVie Inc. Warrant,0.3499,2639495.0,4813,Health Care
ZNB,Zeta Network Group Class A Ordinary Shares,1.65,2608315.0,18724,Consumer Discretionary
UK,Ucommune International Ltd Ordinary Shares,3.78,2562655.0,241308,Real Estate
PFSA,Profusa Inc. Common Stock,0.5615,2476365.0,278369,Health Care
BBLG,Bone Biologics Corp Common Stock,1.3134,2357894.0,8604,Health Care
VSEEW,VSee Health Inc. Warrant,0.0495,2341321.0,787,Health Care
RKDA,Arcadia Biosciences Inc. Common Stock,1.12,2303710.0,50549,Consumer Staples
BCGWW,Binah Capital Group Inc. Warrants,0.1351,2258332.0,14424,Finance
LIDRW,AEye Inc. Warrant,0.0498,2258227.0,517,Consumer Discretionary
AMPGZ,Amplitech Group Inc. Series B Right,0.0889,2251952.0,12131,Telecommunications
VEEE,Twin Vee PowerCats Co. Common Stock,0.1694,2218005.0,4384701,Industrials
ADIL,Adial Pharmaceuticals Inc Common Stock,1.55,2213354.0,61734,Health Care
SNOA,Sonoma Pharmaceuticals Inc. Common Stock,1.2,2187406.0,316109,Health Care
TRNR,Interactive Strength Inc. Common Stock,1.05,2159869.0,71260,Technology
OSRHW,OSR Holdings Inc. Warrant,0.065,2153109.0,12830,Health Care
MEHA,Functional Brands Inc. Common Stock,0.0961,2105827.0,1566717,Health Care
BJDX,Bluejay Diagnostics Inc. Common Stock,1.92,1986653.0,102004,Health Care
FCUV,Focus Universal Inc. Common Stock,1.22,1974707.0,53351,Industrials
CNSP,CNS Pharmaceuticals Inc. Common Stock,2.3111,1875340.0,12381,Health Care
RAINW,Rain Enhancement Technologies Holdco Inc. Warrants,0.2275,1862960.0,106,Technology
HOLOW,MicroCloud Hologram Inc. Warrant,0.0798,1828406.0,6710,Technology
KUST,Kustom Entertainment Inc. Common Stock,3.36,1769420.0,41097,Technology
SCLXW,Scilex Holding Company Warrant,0.198,1681271.0,10051,Health Care
NVVE,Nuvve Holding Corp. Common Stock,0.315,1673250.0,390863,Industrials
VGASW,Verde Clean Fuels Inc. Warrant,0.0372,1657246.0,11752,Industrials
SDSTW,Stardust Power Inc. Warrant,0.16,1594636.0,503,Industrials
GCTK,GlucoTrack Inc. Common Stock,0.8,1555423.0,1255421,Health Care
AMODW,Alpha Modus Holdings Inc. Warrant,0.0299,1521770.0,3822,Miscellaneous
XXII,22nd Century Group Inc. Common Stock,1.37,1515734.0,61274231,Health Care
CMCT,Creative Media & Community Trust Corporation Common stock,5.52,1490229.0,31985,Real Estate
BIAFW,bioAffinity Technologies Inc. Warrant,0.33,1484563.0,1,Health Care
GIPR,Generation Income Properties Inc. Common Stock,0.262,1427423.0,126204,Real Estate
STSSW,Sharps Technology Inc. Warrant,0.0316,1221800.0,2478,Finance
IPW,iPower Inc. Common Stock,0.9181,1214166.0,848781,Consumer Discretionary
WHLR,Wheeler Real Estate Investment Trust Inc. Common Stock,1.96,1184573.0,1779403,Real Estate
BNAIW,Brand Engagement Network Inc. Warrant,0.202,1183307.0,20519,Technology
FRGT,Freight Technologies Inc. Ordinary Shares,0.7422,1160983.0,29593,Consumer Discretionary
MOBXW,Mobix Labs Inc Warrants,0.11,1148879.0,160,Technology
AREB,American Rebel Holdings Inc. Common Stock,0.32,1104533.0,4253511,Industrials
KIDZ,Classover Holdings Inc. Class B Common Stock,0.845,1103104.0,710625,Real Estate
RCKTW,Rocket Pharmaceuticals Inc. Warrant,0.01,1091228.0,300,Health Care
ASBP,Aspire Biopharma Holdings Inc. Common Stock,0.2122,1066123.0,4873436,Health Care
AMPGR,Amplitech Group Inc. Series A Right,0.0408,1033517.0,2674,Telecommunications
AERTW,Aeries Technology Inc. Warrant,0.02,1004194.0,131062,Consumer Discretionary
AUUD,Auddia Inc. Common Stock,1.82,911663.0,727627,Technology
ERNAW,Ernexa Therapeutics Inc. Warrants,0.0301,877548.0,924,Uncategorized
SDOT,Sadot Group Inc. Common Stock,0.47,862764.0,10759405,Consumer Discretionary
SRTAW,Strata Critical Medical Inc. Warrants,0.0099,855822.0,23352,Consumer Discretionary
BTBDW,BT Brands Inc. Warrant,0.139,855507.0,400,Consumer Discretionary
AIMDW,Ainos Inc. Warrants,0.11,799261.0,10,Health Care
BZFDW,BuzzFeed Inc. Warrant,0.0209,786649.0,1001,Consumer Discretionary
SABSW,SAB Biotherapeutics Inc. Warrant,0.0151,769361.0,17021,Health Care
IVDAW,Iveda Solutions Inc. Warrant,0.0663,738565.0,5060,Technology
XBPEW,XBP Europe Holdings Inc. Warrant,0.059,694315.0,5000,Technology
RMSGW,Real Messenger Corporation Warrants,0.0695,665204.0,102,Technology
INHD,Inno Holdings Inc. Common Stock,0.077,647818.0,16755765,Industrials
SEATW,Vivid Seats Inc. Warrant,0.0566,621887.0,102,Consumer Discretionary
FOXXW,Foxx Development Holdings Inc. Warrant,0.0872,610853.0,7218,Telecommunications
SWAGW,Stran & Company Inc. Warrant,0.0326,609299.0,10,Consumer Discretionary
ONFOW,Onfolio Holdings Inc. Warrant,0.1,586321.0,85106,Technology
NXGLW,NexGel Inc Warrant,0.0599,507694.0,594,Health Care
DFLIW,Dragonfly Energy Holdings Corp. Warrant,0.0405,492026.0,2680,Miscellaneous
JSPRW,Japer Therapeutics Inc. Warrants,0.0174,487145.0,8853,Health Care
DAICW,CID HoldCo Inc. Warrants,0.0161,471622.0,5754,Technology
EDBL,Edible Garden AG Incorporated Common Stock,0.489,446827.0,280845,Consumer Staples
TALKW,Talkspace Inc. Warrant,0.0026,434398.0,39683,Health Care
NRXPW,NRX Pharmaceuticals Inc. Warrant,0.0125,413345.0,62621,Health Care
MYSEW,Myseum.AI Inc. Series A Warrant,0.0749,380587.0,19491,Telecommunications
BFRIW,Biofrontera Inc. Warrants,0.0301,350615.0,50,Health Care
BTMWW,Bitcoin Depot Inc. Warrant,0.0298,338187.0,76086,Finance
SRZNW,Surrozen Inc. Warrant,0.0255,292911.0,429,Health Care
LUCYW,Innovative Eyewear Inc. Series A Warrants 8/16/27,0.0448,282270.0,6,Health Care
CELUW,Celularity Inc. Warrant,0.009,259540.0,2,Health Care
CINGW,Cingulate Inc. Warrants,0.0208,254812.0,31924,Health Care
HSCSW,HeartSciences Inc. Warrant,0.0659,209872.0,1,Health Care
BNZIW,Banzai International Inc. Warrant,0.011,203413.0,43037,Technology
NCPLW,Netcapital Inc. Warrants,0.0246,193058.0,1,Finance
WGSWW,GeneDx Holdings Corp. Warrant,0.0062,181590.0,6923,Technology
ADTX,Aditxt Inc. Common Stock,0.1951,176462.0,772915,Health Care
LNZAW,LanzaTech Global Inc. Warrant,0.0164,165462.0,9615,Industrials
BENFW,Beneficient Warrant,0.0108,153508.0,577,Finance
TVGNW,Tevogen Bio Holdings Inc. Warrant,0.0348,144914.0,510,Health Care
GIPRW,Generation Income Properties Inc Warrant,0.0256,139473.0,1300,Real Estate
SHFSW,SHF Holdings Inc. Warrants,0.0296,133362.0,44246,Finance
KITTW,Nauticus Robotics Inc. Warrant,0.0284,123814.0,465744,Industrials
SXTPW,60 Degrees Pharmaceuticals Inc. Warrant,0.046,121292.0,2,Health Care
CYCUW,Cycurion Inc. Warrant,0.0218,120118.0,52417,Technology
FGIWW,FGI Industries Ltd. Warrant,0.0621,119687.0,6800,Industrials
LTRYW,Sports Entertainment Gaming Global Corporation Warrants,0.0089,112527.0,31711,Technology
LRHC,La Rosa Holdings Corp. Common Stock,1.89,101115.0,8170137,Finance
TNONW,Tenon Medical Inc. Warrant,0.008,90371.0,10500,Health Care
DTSTW,Data Storage Corporation Warrant,0.0397,86035.0,85562,Technology
ACONW,Aclarion Inc. Warrant,0.0346,85194.0,5732,Health Care
ICUCW,SeaStar Medical Holding Corporation Warrant,0.02,79940.0,42358,Health Care
ASBPW,Aspire Biopharma Holdings Inc. Warrant,0.0153,76869.0,15537,Health Care
EDBLW,Edible Garden AG Incorporated Warrant,0.079,72187.0,6821,Consumer Staples
MNTSW,Momentus Inc. Warrant,0.0114,65322.0,85907,Industrials
DRMAW,Dermata Therapeutics Inc. Warrant,0.016,64354.0,16124,Health Care
MSAIW,MultiSensor AI Holdings Inc. Warrant,0.031,62381.0,9025,Technology
APLMW,Apollomics Inc. Warrant,0.0184,40407.0,53079,Health Care
AREBW,American Rebel Holdings Inc. Warrants,0.0116,40039.0,26583,Industrials
CDIOW,Cardio Diagnostics Holdings Inc. Warrant,0.0129,38177.0,1384,Health Care
CDTTW,CDT Equity Inc. Warrant,0.0075,36438.0,1,Health Care
PIIIW,P3 Health Partners Inc. Warrant,0.005,36187.0,600,Health Care
REVBW,Revelation Biosciences Inc. Warrant,0.008,29763.0,10546,Health Care
SQFTW,Presidio Property Trust Inc. Series A Common Stock Purchase Warrants,0.0193,27824.0,7159,Real Estate
XOSWW,Xos Inc. Warrants,0.0023,27729.0,4616,Consumer Discretionary
NXPLW,NextPlat Corp Warrants,0.0073,19729.0,11888,Telecommunications
KIDZW,Classover Holdings Inc. Warrants,0.0141,18407.0,14717,Real Estate
ORGNW,Origin Materials Inc. Warrants,0.002,10850.0,80220,Industrials
KPLTW,Katapult Holdings Inc. Warrant,0.0019,9054.0,10000,Consumer Discretionary
CTDD,Qwest Corporation 6.75% Notes due 2057,18.59,19.0,111619,Telecommunications
CTBB,Qwest Corporation 6.5% Notes due 2056,18.19,18.0,133738,Telecommunications
ALFUU,Centurion Acquisition Corp. Unit,10.8,0.0,2,Finance
FAX,abrdn Asia-Pacific Income Fund Inc. Common Stock,15.05,0.0,131530,Finance
USA,Liberty All-Star Equity Fund Common Stock,5.83,0.0,1013665,Finance
ALFUW,Centurion Acquisition Corp. Warrant,0.12,0.0,1877,Finance
CCD,Calamos Dynamic Convertible & Income Fund Common Stock,24.72,0.0,88301,Finance
FCO,abrdn Global Income Fund Inc. Common Stock,2.64,0.0,131243,Finance
FCT,First Trust Senior Floating Rate Income Fund II Common Shares of Beneficial Interest,9.76,0.0,46675,Finance
MKLYU,McKinley Acquisition Corporation Units,10.2368,0.0,1131,Finance
CRANR,Crane Harbor Acquisition Corp. II Rights,0.22,0.0,280,Finance
EVOXU,Evolution Global Acquisition Corp Units,10.19,0.0,1600,Finance
EVOX,Evolution Global Acquisition Corp Class A Ordinary Shares,10.0,0.0,91340,Finance
EVG,Eaton Vance Short Diversified Income Fund Eaton Vance Short Duration Diversified Income Fund Common Shares of Beneficial Interest,10.74,0.0,27053,Finance
KFII,K&F Growth Acquisition Corp. II Class A Ordinary shares,10.48,0.0,7130,Uncategorized
NAC,Nuveen California Quality Municipal Income Fund,11.95,0.0,523693,Finance
UTF,Cohen & Steers Infrastructure Fund Inc Common Stock,27.08,0.0,312916,Finance
MYXXU,Maywood Acquisition Corp. 2 Units,10.05,0.0,1413,Finance
ALCYW,Alchemy Investments Acquisition Corp 1 Warrants,0.137,0.0,600,Finance
UTG,Reaves Utility Income Fund Common Shares of Beneficial Interest,43.14,0.0,236178,Finance
ALCY,Alchemy Investments Acquisition Corp 1 Class A Ordinary Shares,11.9,0.0,10,Finance
UYSCU,UY Scuti Acquisition Corp. Units,10.51,0.0,399,Uncategorized
KFIIU,K&F Growth Acquisition Corp. II Unit,10.7,0.0,32,Finance
MKLY,McKinley Acquisition Corporation Class A Ordinary Shares,10.13,0.0,2,Uncategorized
MMU,Western Asset Managed Municipals Fund Inc. Common Stock,10.2,0.0,108702,Finance
EXG,Eaton Vance Tax-Managed Global Diversified Equity Income Fund Common Shares of Beneficial Interest,9.44,0.0,445610,Finance
EVV,Eaton Vance Limited Duration Income Fund Common Shares of Beneficial Interest,9.48,0.0,298177,Finance
NAD,Nuveen Quality Municipal Income Fund Common Stock,11.7,0.0,772003,Finance
EVT,Eaton Vance Tax Advantaged Dividend Income Fund Common Shares of Beneficial Interest,26.22,0.0,101380,Finance
NAZ,Nuveen Arizona Quality Municipal Income Fund Common Stock,12.61,0.0,20336,Finance
NBB,Nuveen Taxable Municipal Income Fund Common Shares of Beneficial Interest,15.82,0.0,90560,Finance
NBH,Neuberger Municipal Fund Inc. Common Stock,10.2,0.0,67790,Finance
ATIIW,Archimedes Tech SPAC Partners II Co. Warrant,1.11,0.0,20391,Finance
BEAGU,Bold Eagle Acquisition Corp. Units,10.76,0.0,12,Uncategorized
BEAG,Bold Eagle Acquisition Corp. Class A Ordinary Shares,10.54,0.0,56523,Uncategorized
BDCIW,BTC Development Corp. Warrant,0.49,0.0,4500,Finance
FACTU,FACT II Acquisition Corp. Unit,11.02,0.0,652,Finance
BKHAR,Black Hawk Acquisition Corporation Rights,1.4,0.0,163197,Health Care
BKHAU,Black Hawk Acquisition Corporation Units,11.6,0.0,100,Uncategorized
BCV,Bancroft Fund Ltd.,24.49,0.0,18141,Finance
PLMKU,Plum Acquisition Corp. IV Unit,10.7,0.0,100,Uncategorized
CTAAU,ClearThink 1 Acquisition Corp. Units,10.02,0.0,2,Finance
CEE,The Central and Eastern Europe Fund Inc. (The) Common Stock,20.13,0.0,7015,Finance
KF,Korea Fund Inc. (The) New Common Stock,59.59,0.0,9856,Finance
FACTW,FACT II Acquisition Corp. Warrant,0.71,0.0,3819,Finance
ATII,Archimedes Tech SPAC Partners II Co. Ordinary Shares,10.65,0.0,120901,Uncategorized
EVOXW,Evolution Global Acquisition Corp Warrants,0.3899,0.0,230,Finance
FACT,FACT II Acquisition Corp. Class A Ordinary Shares,10.56,0.0,80929,Uncategorized
VBF,Invesco Bond Fund Common Stock,15.04,0.0,95329,Finance
BIXIW,Bitcoin Infrastructure Acquisition Corp Ltd. Warrant,0.24,0.0,8,Uncategorized
BDCI,BTC Development Corp. Class A Ordinary Shares,10.02,0.0,1226,Finance
JBK,Lehman ABS 3.50 3.50% Adjustable Corp Backed Tr Certs GS Cap I,26.46,0.0,1020,Finance
JCE,Nuveen Core Equity Alpha Fund Common Shares of Beneficial Interest,16.19,0.0,28895,Finance
JFR,Nuveen Floating Rate Income Fund Common Stock,7.53,0.0,642845,Finance
JGH,Nuveen Global High Income Fund Common Shares of Beneficial Interest,12.78,0.0,80583,Finance
TSI,TCW Strategic Income Fund Inc. Common Stock,4.575,0.0,77686,Finance
TVA,Texas Ventures Acquisition III Corp Class A Ordinary Share,10.52,0.0,106133,Uncategorized
TVACW,Texas Ventures Acquisition III Corp Warrants,0.5402,0.0,11611,Uncategorized
TVAIR,Thayer Ventures Acquisition Corporation II Rights,0.17,0.0,70106,Uncategorized
TVC,Tennessee Valley Authority Common Stock,24.2,0.0,10613,Utilities
TVE,Tennessee Valley Authority,23.84,0.0,19931,Utilities
UYSCR,UY Scuti Acquisition Corp. Rights,0.1482,0.0,15,Finance
DMII,Drugs Made In America Acquisition II Corp. Ordinary Shares,10.02,0.0,306632,Finance
DMIIR,Drugs Made In America Acquisition II Corp. Right,0.09,0.0,11936,Finance
DMO,Western Asset Mortgage Opportunity Fund Inc. Common Stock,11.09,0.0,31019,Finance
DNMX,Dynamix Corporation III Class A Ordinary Shares,9.98,0.0,194,Finance
DNMXU,Dynamix Corporation III Unit,10.1,0.0,23,Finance
DNMXW,Dynamix Corporation III Warrants,0.29,0.0,1077,Finance
DNP,DNP Select Income Fund Inc. Common Stock,10.7,0.0,769456,Finance
FLC,Flaherty & Crumrine Total Return Fund Inc Common Stock,17.25,0.0,31178,Finance
KBONU,Karbon Capital Partners Corp. Units,10.15,0.0,9273,Finance
KBONW,Karbon Capital Partners Corp. Warrant,0.61,0.0,1000,Finance
KCHV,Kochav Defense Acquisition Corp. Class A Ordinary Shares,10.29,0.0,2025,Uncategorized
CCII,Cohen Circle Acquisition Corp. II Class A Ordinary Shares,10.245,0.0,291016,Uncategorized
PYT,PPlus Tr GSC-2 Tr Ctf Fltg Rate,23.12,0.0,274,Finance
QETA,Quetta Acquisition Corporation Common Stock,11.5,0.0,49,Finance
QETAR,Quetta Acquisition Corporation Right,1.18,0.0,1630,Finance
QQQX,Nuveen NASDAQ 100 Dynamic Overwrite Fund Shares of Beneficial Interest,30.21,0.0,75772,Finance
NEWTH,NewtekOne Inc. 8.625% Fixed Rate Senior Notes due 2029,25.44,0.0,5964,Finance
CCIIW,Cohen Circle Acquisition Corp. II Warrant,0.58,0.0,2900,Uncategorized
CCIX,Churchill Capital Corp IX Ordinary Shares,10.78,0.0,3454,Technology
CCIXW,Churchill Capital Corp IX Warrant,0.44,0.0,25571,Technology
ALIS,Calisa Acquisition Corp Ordinary shares,10.05,0.0,429,Uncategorized
ALISU,Calisa Acquisition Corp Units,10.5,0.0,1500,Uncategorized
