symbol,name,price,marketCap,volume,industry
BCO,Brinks Company (The) Common Stock,103.02,4242425824.0,413523,Industrials
REGCP,Regency Centers Corporation 6.25% Series A Cumulative Redeemable Preferred Stock,23.14,4236859721.0,6301,Real Estate
HGV,Hilton Grand Vacations Inc. Common Stock ,53.1,4235461444.0,944135,Consumer Discretionary
TWST,Twist Bioscience Corporation Common Stock,67.86,4225731368.0,1295367,Health Care
FRMI,Fermi Inc. Common Stock,6.6,4207989977.0,14281820,Real Estate
WAY,Waystar Holding Corp. Common Stock,21.92,4204538571.0,3329576,Technology
PLNT,Planet Fitness Inc. Common Stock,52.88,4200934048.0,2096687,Consumer Discretionary
NWE,NorthWestern Energy Group Inc. Common Stock,68.23,4196691932.0,582887,Utilities
SFBS,ServisFirst Bancshares Inc. Common Stock,76.75,4195371665.0,253432,Finance
BLLN,BillionToOne Inc. Class A Common Stock,91.12,4191108502.0,814932,Health Care
TVTX,Travere Therapeutics Inc. Common Stock,45.04,4188400441.0,1382235,Health Care
OXLCO,Oxford Lane Capital Corp. Preferred Stock Shares 6.00% Series 2029,24.105,4184628000.0,1791,Finance
RUM,Rumble Inc. Class A Common Stock,9.57,4171358097.0,2596720,Technology
BETA,Beta Technologies Inc. Class A Common Stock,18.03,4160531023.0,1149635,Industrials
SLM,SLM Corporation Common Stock,22.06,4160361470.0,2868732,Finance
RDNT,RadNet Inc. Common Stock,52.89,4158964742.0,920820,Health Care
CVSA,Covista Inc. Common Shares,122.07,4154150376.0,326754,Real Estate
VRNS,Varonis Systems Inc. Common Stock,36.11,4145938957.0,2620706,Technology
DOCS,Doximity Inc. Class A Common Stock,22.55,4123764660.0,4036094,Technology
SEZL,Sezzle Inc. Common Stock,122.54,4120654908.0,591385,Finance
RNG,RingCentral Inc. Class A Common Stock,49.1,4117457456.0,2388362,Technology
AMRX,Amneal Pharmaceuticals Inc. Class A Common Stock,12.9,4115394017.0,1401359,Health Care
RDW,Redwire Corporation Common Stock,20.68,4113639295.0,57167515,Industrials
CVCO,Cavco Industries Inc. Common Stock When Issued,534.89,4110083527.0,136799,Consumer Discretionary
LRN,Stride Inc. Common Stock,96.5,4103647060.0,700126,Real Estate
BRC,Brady Corporation Common Stock,87.05,4101168370.0,282675,Consumer Discretionary
ENVA,Enova International Inc. Common Stock,164.33,4089334960.0,250705,Finance
THO,Thor Industries Inc. Common Stock,77.75,4089333791.0,888098,Industrials
FULT,Fulton Financial Corporation Common Stock,21.33,4076879389.0,1704922,Finance
SKT,Tanger Inc. Common Stock,35.42,4068902642.0,713093,Real Estate
REGCO,Regency Centers Corporation 5.875% Series B Cumulative Redeemable Preferred Stock,22.21,4066579706.0,8610,Real Estate
OPLN,OPENLANE Inc. Common Stock,38.21,4048200710.0,1741409,Consumer Discretionary
PDI,PIMCO Dynamic Income Fund Common Stock,16.65,4047448500.0,4297231,Finance
LOPE,Grand Canyon Education Inc. Common Stock,152.4,4040778710.0,423720,Real Estate
POST,Post Holdings Inc. Common Stock,89.13,4039602090.0,1517310,Consumer Staples
USAC,USA Compression Partners LP Common Units Representing Limited Partner Interests,27.85,4037480170.0,278389,Utilities
AZZ,AZZ Inc.,134.24,4029042310.0,326943,Industrials
QLYS,Qualys Inc. Common Stock,114.02,4023759985.0,979530,Technology
BDC,Belden Inc Common Stock,103.25,4020972130.0,439270,Industrials
VNT,Vontier Corporation Common Stock ,28.46,4007168000.0,2478974,Industrials
SOUN,SoundHound AI Inc Class A Common Stock,9.25,4003119124.0,34033604,Technology
CRGY,Crescent Energy Company Class A Common Stock,12.1,3996044699.0,6545236,Energy
BOX,Box Inc. Class A Common Stock,28.79,3985970462.0,4211955,Technology
LASR,nLIGHT Inc. Common Stock,70.58,3981326681.0,1145050,Technology
KTB,Kontoor Brands Inc. Common Stock ,71.55,3954737286.0,785421,Industrials
KRC,Kilroy Realty Corporation Common Stock,34.0,3953479438.0,918708,Real Estate
CRK,Comstock Resources Inc. Common Stock,13.42,3941398065.0,2452162,Energy
BILL,BILL Holdings Inc. Common Stock,39.51,3935066684.0,3549836,Technology
SKY,Champion Homes Inc. Common Stock,71.65,3933144639.0,632504,Consumer Discretionary
HP,Helmerich & Payne Inc. Common Stock,39.23,3920291247.0,1208431,Energy
INSW,International Seaways Inc. Common Stock ,79.06,3913841266.0,507800,Consumer Discretionary
TPC,Tutor Perini Corporation Common Stock,74.26,3907167845.0,966444,Consumer Discretionary
GFF,Griffon Corporation Common Stock,85.18,3906919629.0,396669,Industrials
LIF,Life360 Inc. Common Stock,48.14,3900865605.0,1585188,Technology
UNMA,Unum Group 6.250% Junior Subordinated Notes due 2058,22.77,3878032475.0,14048,Finance
UCB,United Community Banks Inc. Common Stock,32.31,3867075435.0,1187436,Finance
MWA,MUELLER WATER PRODUCTS Common Stock,24.67,3860141519.0,1773186,Industrials
SLGN,Silgan Holdings Inc. Common Stock,36.5,3857311167.0,964855,Industrials
PII,Polaris Inc. Common Stock,67.75,3854037814.0,979293,Consumer Discretionary
VCYT,Veracyte Inc. Common Stock,48.18,3844409732.0,1527166,Health Care
CPRX,Catalyst Pharmaceuticals Inc. Common Stock,31.27,3826853620.0,1591159,Health Care
CII,BlackRock Enhanced Large Cap Core Fund Inc. Common Stock,25.68,3820220255.0,80328,Finance
BNL,Broadstone Net Lease Inc. Common Stock,19.86,3808483782.0,1134963,Real Estate
NVST,Envista Holdings Corporation Common Stock,23.37,3802951561.0,3332721,Health Care
UCTT,Ultra Clean Holdings Inc. Common Stock,84.7,3796961414.0,871434,Technology
CATY,Cathay General Bancorp Common Stock,56.5,3787504338.0,421036,Finance
STUB,StubHub Holdings Inc. Class A Common Stock,10.08,3784407994.0,4914916,Consumer Discretionary
INOD,Innodata Inc. Common Stock,115.32,3765815885.0,2902633,Technology
ITRI,Itron Inc. Common Stock,84.79,3759533232.0,619200,Industrials
TXG,10x Genomics Inc. Class A Common Stock,29.59,3756633633.0,3026551,Industrials
BBWI,Bath & Body Works Inc.,18.63,3755096558.0,6466149,Consumer Discretionary
KFY,Korn Ferry Common Stock,72.28,3750398648.0,379318,Consumer Discretionary
HHH,Howard Hughes Holdings Inc. Common Stock,62.89,3749790402.0,428436,Real Estate
INDB,Independent Bank Corp. Common Stock,77.55,3747767381.0,534778,Finance
DAN,Dana Incorporated Common Stock ,34.6,3744955185.0,1089337,Consumer Discretionary
IRT,Independence Realty Trust Inc. Common Stock,15.86,3738434857.0,3066706,Real Estate
ASBA,Associated Banc-Corp 6.625% Fixed-Rate Reset Subordinated Notes due 2033,24.75,3734795171.0,30173,Finance
OII,Oceaneering International Inc. Common Stock,37.44,3734462123.0,1234000,Energy
ATMU,Atmus Filtration Technologies Inc. Common Stock,45.7,3732429960.0,1058465,Consumer Discretionary
KAI,Kadant Inc Common Stock,315.67,3727577200.0,94809,Industrials
KNSA,Kiniksa Pharmaceuticals International plc Class A Ordinary Shares,48.43,3726108115.0,750446,Health Care
LEU,Centrus Energy Corp. Class A Common Stock,189.0,3718158066.0,1194034,Industrials
RUN,Sunrun Inc. Common Stock,15.58,3716597891.0,13548129,Miscellaneous
EE,Excelerate Energy Inc. Class A Common Stock,32.62,3714087691.0,324355,Utilities
TDW,Tidewater Inc. Common Stock,74.56,3707917413.0,516518,Consumer Discretionary
GPI,Group 1 Automotive Inc. Common Stock,311.51,3706406101.0,173930,Consumer Discretionary
MMSI,Merit Medical Systems Inc. Common Stock,62.05,3701583753.0,715236,Health Care
ACAD,ACADIA Pharmaceuticals Inc. Common Stock,21.52,3684995922.0,1119232,Health Care
EXTR,Extreme Networks Inc. Common Stock,28.13,3678787615.0,2281150,Telecommunications
DORM,Dorman Products Inc. Common Stock,122.71,3666917038.0,368188,Consumer Discretionary
WSFS,WSFS Financial Corporation Common Stock,70.36,3661819077.0,409933,Finance
RNST,Renasant Corporation Common Stock,39.68,3661357722.0,736072,Finance
BANF,BancFirst Corporation Common Stock,108.48,3643451262.0,128143,Finance
CRNX,Crinetics Pharmaceuticals Inc. Common Stock,34.52,3639795980.0,799179,Health Care
VKTX,Viking Therapeutics Inc. Common Stock,31.27,3630623457.0,1490130,Health Care
CNS,Cohen & Steers Inc Common Stock,70.54,3625326341.0,216461,Finance
CNK,Cinemark Holdings Inc Cinemark Holdings Inc. Common Stock,31.03,3623924162.0,4846566,Consumer Discretionary
DAVE,Dave Inc. Class A Common Stock,282.56,3620545262.0,866056,Finance
BFH,Bread Financial Holdings Inc. Common Stock,89.39,3611987540.0,535681,Consumer Discretionary
FG,F&G Annuities & Life Inc. Common Stock,27.23,3607566278.0,811181,Finance
JOE,St. Joe Company (The) Common Stock,62.77,3603609756.0,229867,Real Estate
BHF,Brighthouse Financial Inc. Common Stock,62.66,3599552888.0,461242,Finance
YETI,YETI Holdings Inc. Common Stock,47.38,3589429344.0,972407,Consumer Discretionary
IRTC,iRhythm Holdings Inc. Common Stock,109.17,3587589081.0,431011,Health Care
CDP,COPT Defense Properties Common Shares of Beneficial Interest,31.64,3587244578.0,711700,Real Estate
FOUR,Shift4 Payments Inc. Class A Common Stock,45.21,3586460654.0,1508465,Consumer Discretionary
AAP,Advance Auto Parts Inc.,59.3,3577522034.0,2458539,Consumer Discretionary
BMI,Badger Meter Inc. Common Stock,122.54,3576399748.0,370997,Industrials
CALM,Cal-Maine Foods Inc. Common Stock,75.14,3559876822.0,691644,Consumer Staples
NSIT,Insight Enterprises Inc. Common Stock,117.77,3557115305.0,689269,Consumer Discretionary
CVBF,CVB Financial Corporation Common Stock,20.1,3546749440.0,1347428,Finance
BTU,Peabody Energy Corporation Common Stock ,29.06,3540496883.0,5422667,Energy
HGTY,Hagerty Inc. Class A Common Stock,10.29,3533116797.0,184926,Finance
FULTP,Fulton Financial Corporation Depositary Shares Each Representing a 1/40th Interest in a Share of Fixed Rate Non-Cumulative Perpetual Preferred Stock Series A,18.48,3532148669.0,1119,Finance
DTB,DTE Energy Company 2020 Series G 4.375% Junior Subordinated Debentures due 2080,16.9499,3526059103.0,39471,Utilities
MHO,M/I Homes Inc. Common Stock,137.66,3522734405.0,343427,Consumer Discretionary
OSIS,OSI Systems Inc. Common Stock (DE),213.37,3516954239.0,278289,Technology
OTTR,Otter Tail Corporation Common Stock,83.62,3510714623.0,307523,Utilities
CVI,CVR Energy Inc. Common Stock,34.92,3510528517.0,601435,Energy
BULL,Webull Corporation Class A Ordinary Shares,6.6,3510003189.0,14351834,Finance
OGN,Organon & Co. Common Stock ,13.36,3508347516.0,3527584,Health Care
DTG,DTE Energy Company 2021 Series E 4.375% Junior Subordinated Debentures,16.86,3507357357.0,80521,Utilities
NAN,Nuveen New York Quality Municipal Income Fund Common Stock,11.58,3500816964.0,88481,Finance
NTRSO,Northern Trust Corporation Depositary Shares Each Representing a 1/1000th Interest in a Share of Series E Non-Cumulative Perpetual Preferred Stock,18.885,3494617467.0,19406,Finance
VECO,Veeco Instruments Inc. Common Stock,57.245,3493861849.0,628066,Technology
GBDC,Golub Capital BDC Inc. Common Stock,13.36,3480215618.0,1830540,Finance
AB,AllianceBernstein Holding L.P.  Units,37.25,3479293524.0,416123,Finance
NHI,National Health Investors Inc. Common Stock,71.76,3478284629.0,440465,Real Estate
ABG,Asbury Automotive Group Inc Common Stock,186.62,3474640456.0,310864,Consumer Discretionary
TDC,Teradata Corporation Common Stock,36.83,3465703000.0,3300191,Technology
BRZE,Braze Inc. Class A Common Stock,28.27,3465330918.0,6401256,Technology
PTRN,Pattern Group Inc. Series A Common Stock,19.59,3464806605.0,2735941,Consumer Discretionary
FIZZ,National Beverage Corp. Common Stock,36.98,3462515132.0,286401,Consumer Staples
APLE,Apple Hospitality REIT Inc. Common Shares,14.65,3458389666.0,3044214,Real Estate
GPGI,GPGI Inc. Class A Common Stock,11.93,3458042124.0,2378944,Finance
BFAM,Bright Horizons Family Solutions Inc. Common Stock,65.51,3446263279.0,1406522,Consumer Discretionary
BELFB,Bel Fuse Inc. Class B Common Stock,269.86,3433349711.0,366268,Uncategorized
MSGE,Madison Square Garden Entertainment Corp. Class A Common Stock,72.35,3422533680.0,546544,Consumer Discretionary
SXI,Standex International Corporation Common Stock,282.39,3421132824.0,191469,Industrials
SMG,Scotts Miracle-Gro Company (The) Common Stock,58.73,3417025160.0,1532349,Industrials
BATRA,Atlanta Braves Holdings Inc. Series A Common Stock,53.24,3415017030.0,37692,Consumer Discretionary
ASO,Academy Sports and Outdoors Inc. Common Stock,52.59,3392482767.0,1242400,Consumer Discretionary
ANF,Abercrombie & Fitch Company Common Stock,75.65,3384469416.0,1680173,Consumer Discretionary
COLM,Columbia Sportswear Company Common Stock,66.01,3375803680.0,562155,Consumer Discretionary
IAC,IAC Inc. Common Stock,45.38,3375366851.0,2450441,Technology
FIBK,First Interstate BancSystem Inc. Common Stock (DE),34.73,3373772188.0,932387,Finance
MMED,MiniMed Group Inc. Common Stock,12.0,3369839856.0,1086641,Health Care
FUL,H. B. Fuller Company Common Stock,61.83,3368949388.0,725162,Industrials
CC,Chemours Company (The) Common Stock,22.32,3356430465.0,2355918,Industrials
AVA,Avista Corporation Common Stock,40.5,3346856415.0,1132770,Utilities
TNGX,Tango Therapeutics Inc.,23.1,3341368384.0,3146397,Health Care
BKU,BankUnited Inc. Common Stock,45.8,3328822501.0,639886,Finance
AMBA,Ambarella Inc. Ordinary Shares,75.67,3318998494.0,2898262,Technology
ORKA,Oruka Therapeutics Inc. Common Stock,55.01,3317768676.0,1126554,Health Care
GPK,Graphic Packaging Holding Company,11.21,3316897608.0,9298436,Consumer Discretionary
CBU,Community Financial System Inc. Common Stock,62.7,3295194048.0,244428,Finance
HWKN,Hawkins Inc. Common Stock,157.9,3295084990.0,150028,Consumer Discretionary
QTWO,Q2 Holdings Inc. Common Stock,52.57,3290904237.0,1503310,Technology
ICUI,ICU Medical Inc. Common Stock,131.64,3290155529.0,307304,Health Care
CSQ,Calamos Strategic Total Return Common Stock,20.67,3284207147.0,243544,Finance
NATL,NCR Atleos Corporation Common Stock,44.47,3280988462.0,545991,Miscellaneous
MMS,Maximus Inc. Common Stock,62.43,3280094862.0,645542,Consumer Discretionary
CAKE,Cheesecake Factory Incorporated (The) Common Stock,65.88,3273271714.0,993717,Consumer Discretionary
WSBC,WesBanco Inc. Common Stock,33.89,3259559178.0,693449,Finance
ARLP,Alliance Resource Partners L.P. Common Units representing Limited Partners Interests,25.31,3256354253.0,268103,Energy
GNW,Genworth Financial Inc Common Stock,8.5,3255578676.0,2999331,Finance
SKYW,SkyWest Inc. Common Stock,81.9,3248177014.0,427655,Consumer Discretionary
DNLI,Denali Therapeutics Inc. Common Stock,20.41,3239265732.0,1679049,Health Care
KN,Knowles Corporation Common Stock,37.81,3235048555.0,865397,Consumer Staples
FHB,First Hawaiian Inc. Common Stock,26.59,3234646192.0,1592655,Finance
TENB,Tenable Holdings Inc. Common Stock,29.32,3233174248.0,5912009,Technology
CON,Concentra Group Holdings Parent Inc. Common Stock,25.25,3231034945.0,986060,Health Care
RCUS,Arcus Biosciences Inc. Common Stock,25.67,3228597069.0,1450150,Health Care
RWTN,Redwood Trust Inc. 9.125% Senior Notes Due 2029,24.92,3220248723.0,2036,Real Estate
UPST,Upstart Holdings Inc. Common stock,33.61,3216865834.0,4265417,Finance
OPCH,Option Care Health Inc. Common Stock,20.46,3212782732.0,2328700,Health Care
BEAM,Beam Therapeutics Inc. Common Stock,31.14,3203658724.0,1648257,Health Care
KBH,KB Home Common Stock,51.11,3201951853.0,2022983,Consumer Discretionary
NSA,National Storage Affiliates Trust Common Shares of Beneficial Interest,41.45,3200459493.0,831230,Real Estate
USLM,United States Lime & Minerals Inc. Common Stock,111.22,3190018268.0,133633,Industrials
MCHB,Mechanics Bancorp Class A Common Stock,14.4,3188175552.0,379688,Finance
SLG,SL Green Realty Corp Common Stock,44.74,3182109369.0,892399,Real Estate
ELF,e.l.f. Beauty Inc. Common Stock,53.49,3179473736.0,4115361,Consumer Discretionary
RWTO,Redwood Trust Inc. 9.00% Senior Notes Due 2029,24.6,3178897214.0,6613,Real Estate
BATRK,Atlanta Braves Holdings Inc. Series C Common Stock,49.54,3177684892.0,283737,Consumer Discretionary
AVNT,Avient Corporation Common Stock,34.61,3174088880.0,825688,Industrials
RHI,Robert Half Inc. Common Stock,30.99,3170078323.0,2511489,Consumer Discretionary
BRUN,Boost Run Inc. Class A Common Stock,39.2,3166356323.0,3983276,Technology
UNFI,United Natural Foods Inc. Common Stock,52.08,3163962337.0,543436,Consumer Discretionary
CRVL,CorVel Corp. Common Stock,62.3,3158060826.0,171538,Finance
LBRDP,Liberty Broadband Corporation Series A Cumulative Redeemable Preferred Stock,22.0,3156950060.0,2735,Telecommunications
SHOO,Steven Madden Ltd. Common Stock,43.18,3155829126.0,788498,Consumer Discretionary
ADEA,Adeia Inc. Common Stock,28.61,3155504159.0,4243993,Technology
VC,Visteon Corporation Common Stock,118.15,3153898581.0,365234,Consumer Discretionary
FFBC,First Financial Bancorp. Common Stock,30.02,3149979807.0,1157022,Finance
CHEF,The Chefs' Warehouse Inc. Common Stock,76.97,3138654104.0,353092,Consumer Discretionary
ARCB,ArcBest Corporation Common Stock,140.8,3134740224.0,256711,Industrials
CLMT,Calumet Inc. Common Stock,35.82,3121610806.0,720984,Energy
GEO,Geo Group Inc (The) REIT,23.34,3118650749.0,1478175,Consumer Discretionary
VAC,Marriott Vacations Worldwide Corporation Common Stock,90.67,3113885613.0,951265,Finance
FGN,F&G Annuities & Life Inc. 7.950% Senior Notes due 2053,24.62,3104546252.0,15421,Finance
AMPX,Amprius Technologies Inc. Common Stock,21.75,3080390948.0,9545517,Miscellaneous
DYN,Dyne Therapeutics Inc. Common Stock,18.63,3079796019.0,1442252,Health Care
LFST,LifeStance Health Group Inc. Common Stock,7.94,3079405390.0,2221755,Health Care
PRK,Park National Corporation Common Stock,169.45,3066382281.0,95532,Finance
NTCT,NetScout Systems Inc. Common Stock,42.88,3065714819.0,809735,Technology
ITGR,Integer Holdings Corporation Common Stock,90.16,3061368284.0,611938,Health Care
HAE,Haemonetics Corporation Common Stock,67.22,3054878977.0,735910,Health Care
SFNC,Simmons First National Corporation Class A Common Stock,21.05,3053601599.0,1163885,Finance
FSK,FS KKR Capital Corp. Common Stock,10.9,3052724120.0,3099103,Finance
PAY,Paymentus Holdings Inc. Class A Common Stock,24.26,3051649316.0,1340152,Consumer Discretionary
BHE,Benchmark Electronics Inc. Common Stock,85.03,3050624371.0,406804,Technology
CTRI,Centuri Holdings Inc. Common Stock,30.22,3050245486.0,1979457,Utilities
ATRO,Astronics Corporation Common Stock,85.1,3050014211.0,436868,Industrials
EOSE,Eos Energy Enterprises Inc. Class A Common Stock,8.97,3045440822.0,22859365,Miscellaneous
BELFA,Bel Fuse Inc. Class A Common Stock,239.24,3043780423.0,140804,Uncategorized
HAYW,Hayward Holdings Inc. Common Stock,14.01,3039651518.0,2031573,Industrials
PENG,Penguin Solutions Inc. Common Stock,59.71,3030133703.0,3105731,Technology
APAM,Artisan Partners Asset Management Inc. Class A Common Stock,37.36,3028317988.0,713475,Finance
GPOR,Gulfport Energy Corporation Common Shares,168.45,3026986026.0,211417,Energy
CURB,Curbline Properties Corp. Common Stock,28.67,3025812992.0,749453,Finance
BXMT,Blackstone Mortgage Trust Inc. Common Stock,17.93,3024495514.0,1217821,Real Estate
CCC,CCC Intelligent Solutions Holdings Inc. Common Stock,5.14,3016874355.0,11613754,Technology
MZTI,The Marzetti Company Common Stock,109.68,3007644960.0,254913,Consumer Staples
AEHR,Aehr Test Systems Common Stock,93.62,3005581910.0,1528308,Industrials
KLRA,Kailera Therapeutics Inc. Common Stock,23.18,3003330793.0,299269,Health Care
HYMC,Hycroft Mining Holding Corporation Class A Common Stock,32.84,3000282137.0,1602794,Basic Materials
KALU,Kaiser Aluminum Corporation Common Stock,183.41,2997030546.0,207162,Industrials
AWR,American States Water Company Common Stock,76.4,2994318689.0,290673,Utilities
WRBY,Warby Parker Inc. Class A Common Stock,24.38,2991797454.0,2428448,Health Care
FSLY,Fastly Inc. Class A Common Stock,19.08,2986020000.0,8120046,Technology
MPT,Medical Properties Trust Inc. common stock,4.99,2984519000.0,7151350,Real Estate
PATK,Patrick Industries Inc. Common Stock,90.22,2967626579.0,413075,Consumer Discretionary
WK,Workiva Inc. Class A Common Stock,52.83,2964784521.0,1116744,Technology
LXP,LXP Industrial Trust Common Stock (Maryland REIT),50.21,2960005628.0,422329,Real Estate
IPAR,Interparfums Inc. Common Stock,92.4,2959182164.0,351991,Consumer Discretionary
FRSH,Freshworks Inc. Class A Common Stock,10.68,2952316904.0,19063993,Technology
BOH,Bank of Hawaii Corporation Common Stock,74.45,2949784716.0,469204,Finance
GRBK,Green Brick Partners Inc. Common Stock,68.31,2947322592.0,258601,Consumer Discretionary
CWK,Cushman & Wakefield Ltd. Common Shares,12.54,2938128333.0,3279205,Finance
HTGC,Hercules Capital Inc. Common Stock,15.69,2935890677.0,1721591,Finance
OLN,Olin Corporation Common Stock,25.74,2931728574.0,2516112,Industrials
EXPO,Exponent Inc. Common Stock,60.39,2929617275.0,688607,Consumer Discretionary
WT,WisdomTree Inc. Common Stock,19.15,2928825263.0,2839092,Finance
FA,First Advantage Corporation Common Stock,17.07,2928137392.0,939338,Technology
BKD,Brookdale Senior Living Inc. Common Stock,12.19,2910847613.0,6133579,Health Care
HIW,Highwoods Properties Inc. Common Stock,26.39,2910096474.0,1400133,Real Estate
NIC,Nicolet Bankshares Inc. Common Stock,136.86,2908535718.0,153295,Finance
BKV,BKV Corporation Common Stock,26.56,2905308388.0,738464,Energy
BSM,Black Stone Minerals L.P. Common units representing limited partner interests,13.66,2902740861.0,346971,Energy
AKR,Acadia Realty Trust Common Stock,21.7,2897321960.0,1095131,Real Estate
CPK,Chesapeake Utilities Corporation Common Stock,120.62,2895454272.0,199191,Utilities
BANC,Banc of California Inc. Common Stock,18.82,2893100491.0,2577106,Finance
SBCF,Seacoast Banking Corporation of Florida Common Stock,29.72,2890174064.0,806364,Finance
LILPV,Liberty Latin America Ltd. 9.0% Fixed Rate Cumulative Perpetual Redeemable Series A Preference Shares,13.0,2880019714.0,3735,Telecommunications
GEF,Greif Inc. Class A Common Stock,62.4,2878905557.0,187084,Uncategorized
BWIN,The Baldwin Insurance Group Inc. Class A Common Stock,20.19,2878440349.0,1414801,Finance
DBD,Diebold Nixdorf Incorporated Common stock,82.88,2870001129.0,278373,Miscellaneous
PARR,Par Pacific Holdings Inc.  Common Stock,57.1,2863238217.0,896573,Energy
DBRG,DigitalBridge Group Inc.,15.67,2857775226.0,3021300,Real Estate
OUST,Ouster Inc. Common Stock,44.93,2851306819.0,3727810,Industrials
POWWP,Outdoor Holding Company 8.75% Series A Cumulative Redeemable Perpetual Preferred Stock,24.28,2847770170.0,4945,Industrials
PFS,Provident Financial Services Inc Common Stock,21.84,2846050924.0,867033,Finance
PLMR,Palomar Holdings Inc. Common stock,107.24,2842275126.0,227713,Finance
CECO,CECO Environmental Corp. Common Stock,79.03,2835045640.0,1621041,Industrials
KD,Kyndryl Holdings Inc. Common Stock,12.89,2834745546.0,4683528,Technology
RH,RH Common Stock,149.33,2822451835.0,783126,Consumer Discretionary
PHIN,PHINIA Inc. Common Stock,76.24,2822447342.0,243695,Consumer Discretionary
DK,Delek US Holdings Inc. Common Stock,45.96,2816775430.0,656630,Energy
TR,Tootsie Roll Industries Inc. Common Stock,37.45,2815160728.0,220925,Consumer Staples
VOYG,Voyager Technologies Inc. Class A Common Stock,47.49,2814359361.0,2645977,Industrials
EEFT,Euronet Worldwide Inc. Common Stock,73.88,2812987945.0,623965,Finance
WOR,Worthington Enterprises Inc. Common Shares,56.98,2806435598.0,191161,Industrials
PTON,Peloton Interactive Inc. Class A Common Stock,6.48,2805787674.0,13359260,Consumer Discretionary
ZIONP,Zions Bancorporation N.A. Depositary Shares (Each representing 1/40th Interest in a Share of Series A Floating-Rate Non-Cumulative Perpetual Preferred Stock),19.0729,2805467516.0,2829,Finance
NHC,National HealthCare Corporation Common Stock,179.4,2802163595.0,145248,Health Care
PCTTU,PureCycle Technologies Inc. Unit,15.49,2801576390.0,1578,Industrials
UE,Urban Edge Properties Common Shares of Beneficial Interest,22.19,2796383667.0,811634,Finance
QUBT,Quantum Computing Inc. Common Stock,12.39,2794378489.0,32254634,Technology
DX,Dynex Capital Inc. Common Stock,12.97,2790507264.0,3536226,Real Estate
CALY,Callaway Golf Company Common Stock,15.24,2773315322.0,2433175,Consumer Discretionary
VISN,Vistance Networks Inc. Common Stock,12.27,2767739372.0,5704111,Technology
ATKR,Atkore Inc. Common Stock,81.91,2765876758.0,335315,Miscellaneous
GRAL,GRAIL Inc. Common Stock ,64.4,2763828589.0,2612565,Health Care
WHR,Whirlpool Corporation Common Stock,42.44,2751093255.0,2067864,Consumer Discretionary
ALHC,Alignment Healthcare Inc. Common Stock,13.3,2749559846.0,12723994,Health Care
IRON,Disc Medicine Inc. Common Stock,71.97,2749188435.0,636557,Health Care
HLIO,Helios Technologies Inc. Common Stock,83.05,2744500032.0,226784,Industrials
FTAIM,FTAI Aviation Ltd. 9.500% Fixed-Rate Reset Series D Cumulative Perpetual Redeemable Preferred Shares,26.71,2739991182.0,4957,Industrials
GPCR,Structure Therapeutics Inc. American Depositary Shares,38.55,2739922592.0,670526,Health Care
AMR,Alpha Metallurgical Resources Inc. Common Stock,215.37,2738348571.0,332864,Energy
RLAY,Relay Therapeutics Inc. Common Stock,14.26,2732018713.0,2260747,Health Care
NN,NextNav Inc. Common Stock,19.93,2719188194.0,2198561,Industrials
DKL,Delek Logistics Partners L.P. Common Units representing Limited Partner Interests,51.13,2718490271.0,82396,Energy
PENN,PENN Entertainment Inc. Common Stock,20.24,2708989829.0,5617671,Consumer Discretionary
AEO,American Eagle Outfitters Inc. Common Stock,16.14,2703848109.0,9424069,Consumer Discretionary
UNIT,Uniti Group Inc. Common Stock,11.13,2702538207.0,1378821,Real Estate
NMIH,NMI Holdings Inc. Common Stock,35.53,2699281287.0,1027703,Finance
NMFCZ,New Mountain Finance Corporation 8.250% Notes due 2028,25.255,2686146070.0,4528,Uncategorized
ARQT,Arcutis Biotherapeutics Inc. Common Stock,21.47,2685540040.0,1602432,Health Care
PRVA,Privia Health Group Inc. Common Stock,21.31,2685323690.0,802621,Health Care
CARG,CarGurus Inc. Class A Common Stock ,29.73,2681262424.0,1396291,Technology
FBK,FB Financial Corporation Common Stock,51.91,2674582912.0,384765,Finance
HTFL,Heartflow Inc. Common Stock,31.0,2673465668.0,1246196,Health Care
MGEE,MGE Energy Inc,72.63,2669618930.0,395145,Energy
HUBG,Hub Group Inc. Class A Common Stock,43.59,2665681501.0,984173,Industrials
FCPT,Four Corners Property Trust Inc. Common Stock,24.28,2664710503.0,718822,Real Estate
