symbol,name,price,marketCap,volume,industry
CADL,Candel Therapeutics Inc. Common Stock,9.27,679215116.0,1481981,Health Care
TRON,Tron Inc. Common Stock,1.43,678366352.0,648217,Consumer Discretionary
CCOI,Cogent Communications Holdings Inc.,13.52,677050004.0,1455603,Consumer Discretionary
DGICA,Donegal Group Inc. Class A Common Stock,18.27,676896247.0,141274,Finance
RIGL,Rigel Pharmaceuticals Inc. Common Stock,36.55,676251024.0,291880,Health Care
PAR,PAR Technology Corporation Common Stock,16.38,675612740.0,1299422,Miscellaneous
TCBX,Third Coast Bancshares Inc. Common Stock,40.63,674135845.0,97403,Finance
BTBT,Bit Digital Inc. Ordinary Shares,1.93,673937511.0,35707394,Finance
NB,NioCorp Developments Ltd. Common Stock,4.62,672612162.0,3660315,Basic Materials
CSTL,Castle Biosciences Inc. Common Stock,22.12,670898538.0,457806,Health Care
MAX,MediaAlpha Inc. Class A Common Stock,10.76,670890541.0,605951,Consumer Discretionary
RSVR,Reservoir Media Inc. Common Stock,10.21,670406100.0,31398,Consumer Discretionary
ACRS,Aclaris Therapeutics Inc. Common Stock,4.79,668989027.0,1482443,Health Care
FBIOP,Fortress Biotech Inc. 9.375% Series A Cumulative Redeemable Perpetual Preferred Stock,20.13,668699919.0,13115,Health Care
AROW,Arrow Financial Corporation Common Stock,40.36,667111207.0,116608,Finance
NXP,Nuveen Select Tax Free Income Portfolio Common Stock,14.25,666887360.0,125217,Finance
VRRM,Verra Mobility Corporation Class A Common Stock,4.39,666870207.0,6135990,Consumer Discretionary
SLRC,SLR Investment Corp. Common Stock,12.21,666112081.0,471463,Finance
VMO,Invesco Municipal Opportunity Trust Common Stock,9.87,665639561.0,297803,Finance
NEWTI,NewtekOne Inc. 8.00% Fixed Rate Senior Notes due 2028,25.2301,664102958.0,636,Finance
BCAL,California BanCorp Common Stock,20.62,663238671.0,336329,Finance
PKE,Park Aerospace Corp. Common Stock,31.74,662663245.0,326942,Industrials
TRTX,TPG RE Finance Trust Inc. Common Stock,8.57,662531351.0,653086,Real Estate
TIPT,Tiptree Inc. Common Stock,17.63,662360422.0,196670,Finance
FEIM,Frequency Electronics Inc. Common Stock,67.27,662066429.0,181104,Industrials
NEWTG,NewtekOne Inc. 8.50% Fixed Rate Senior Notes due 2029,25.145,661862969.0,7974,Finance
FOF,Cohen & Steers Closed-End Opportunity Fund Inc. Common Stock,13.46,661405933.0,37017,Finance
DLY,DoubleLine Yield Opportunities Fund Common Shares of Beneficial Interest,13.76,659733919.0,159996,Finance
MGRE,Affiliated Managers Group Inc. 6.750% Junior Subordinated Notes due 2064,23.18,658591620.0,21613,Finance
CRMD,CorMedix Inc. Common Stock,8.39,658211365.0,1382585,Health Care
NMFC,New Mountain Finance Corporation Common Stock,6.95,656444111.0,1320037,Finance
BBNX,Beta Bionics Inc. Common Stock,14.73,656393767.0,1481563,Health Care
CASS,Cass Information Systems Inc Common Stock,50.92,655398907.0,80921,Consumer Discretionary
VTS,Vitesse Energy Inc. Common Stock,15.68,654050808.0,548238,Energy
MNTN,MNTN Inc. Class A Common Stock,8.38,653792189.0,888666,Consumer Discretionary
SGP,SpyGlass Pharma Inc. Common Stock,19.55,653622090.0,79694,Health Care
PACK,Ranpak Holdings Corp Class A Common Stock,7.64,653562845.0,986212,Consumer Discretionary
PSTL,Postal Realty Trust Inc. Class A Common Stock,23.6,651923049.0,391813,Real Estate
PFIS,Peoples Financial Services Corp. Common Stock,65.0,650707265.0,77188,Finance
BSTZ,BlackRock Science and Technology Term Trust Common Shares of Beneficial Interest,29.35,650332311.0,171641,Finance
RMT,Royce Micro-Cap Trust Inc. Common Stock,14.05,650080953.0,157078,Finance
NVCT,Nuvectis Pharma Inc. Common Stock,24.48,649345048.0,1283628,Health Care
CCSI,Consensus Cloud Solutions Inc. Common Stock,35.2,647607840.0,154846,Technology
ORN,Orion Group Holdings Inc. Common,15.97,646454070.0,558334,Industrials
RMR,The RMR Group Inc. Class A Common Stock,20.72,644254854.0,117277,Consumer Discretionary
HY,Hyster-Yale Inc. Class A common stock,35.94,643897518.0,94395,Industrials
IRWD,Ironwood Pharmaceuticals Inc. Class A Common Stock,3.91,643638417.0,1764513,Health Care
ONT,Onterris Inc. Common Stock,17.8,643278241.0,1074902,Consumer Discretionary
DNUT,Krispy Kreme Inc. Common Stock,3.73,643052000.0,3248651,Consumer Staples
NPB,Northpointe Bancshares Inc. Common Stock,18.56,641838988.0,222434,Finance
FBRT,Franklin BSP Realty Trust Inc. Common Stock,8.32,640332235.0,1214291,Real Estate
KRUS,Kura Sushi USA Inc. Class A Common Stock,52.64,639464508.0,398993,Consumer Discretionary
RILYT,BRC Group Holdings Inc. 6.00% Senior Notes Due 2028,20.94,638608562.0,18841,Finance
VLGEA,Village Super Market Inc. Class A Common Stock,43.02,637104303.0,56390,Consumer Staples
HIFS,Hingham Institution for Savings Common Stock,295.82,635243868.0,30312,Finance
RILYL,BRC Group Holdings Inc. Depositary Shares each representing 1/1000th in a share of 7.375% Series B Cumulative Perpetual Preferred Stock par value $0.0001,15.8001,635080216.0,9680,Finance
BHB,Bar Harbor Bankshares Inc. Common Stock,37.79,632684110.0,155131,Finance
FTH,Faeth Therapeutics Inc. Common Stock,24.54,632610623.0,103042,Health Care
GYRE,Gyre Therapeutics Inc. Common Stock,6.48,628743527.0,134435,Health Care
KELYB,Kelly Services Inc. Class B Common Stock,18.12,628205723.0,681,Consumer Discretionary
AQST,Aquestive Therapeutics Inc. Common Stock,4.99,625996094.0,2226214,Health Care
MSBI,Midland States Bancorp Inc. Common Stock,30.19,625832632.0,191785,Finance
RILYP,BRC Group Holdings Inc. Depositary Shares each representing a 1/1000th fractional interest in a share of Series A Cumulative Perpetual Preferred Stock,15.56,625429470.0,19122,Finance
AUROW,Aurora Innovation Inc. Warrant,0.3181,623858703.0,4369,Technology
NTGR,NETGEAR Inc. Common Stock,23.21,622954149.0,263809,Utilities
TCMD,Tactile Systems Technology Inc. Common Stock,27.49,620071587.0,152955,Health Care
CNNE,Cannae Holdings Inc. Common Stock,13.99,614727679.0,367536,Consumer Discretionary
RGR,Sturm Ruger & Company Inc. Common Stock,38.55,614650953.0,329691,Industrials
CSV,Carriage Services Inc. Common Stock,38.64,613306754.0,109261,Consumer Discretionary
BHFAM,Brighthouse Financial Inc. Depositary shares each representing a 1/1000th Interest in a Share of 4.625% Non-Cumulative Preferred Stock Series D,10.66,612372068.0,140140,Finance
NABL,N-able Inc. Common Stock,3.25,612229443.0,1567111,Technology
KRT,Karat Packaging Inc. Common Stock,30.66,612087992.0,248605,Industrials
CLDT,Chatham Lodging Trust (REIT) Common Shares of Beneficial Interest,13.06,609656733.0,442198,Real Estate
XFLT,XAI Floating Rate & Alternative Income Trust Common Shares of Beneficial Interest,17.17,608994694.0,57054,Finance
NFBK,Northfield Bancorp Inc. Common Stock (Delaware),14.58,608916962.0,285405,Finance
FDMT,4D Molecular Therapeutics Inc. Common Stock,11.62,607450071.0,1048616,Health Care
AMSF,AMERISAFE Inc. Common Stock,32.46,607124407.0,179922,Finance
DNA,Ginkgo Bioworks Holdings Inc. Class A Common Stock,9.73,604577899.0,1200091,Health Care
IHRT,iHeartMedia Inc. Class A Common Stock,3.995,603853826.0,699425,Consumer Discretionary
NCDL,Nuveen Churchill Direct Lending Corp. Common Stock,12.22,603509934.0,650291,Uncategorized
LEGH,Legacy Housing Corporation Common Stock (TX),25.33,602387953.0,138309,Consumer Discretionary
RWT,Redwood Trust Inc. Common Stock,4.81,602287695.0,1912950,Real Estate
METCB,Ramaco Resources Inc. Class B Common Stock,9.06,602161503.0,35858,Energy
RRBI,Red River Bancshares Inc. Common Stock,91.44,602104602.0,112074,Consumer Discretionary
MG,Mistras Group Inc Common Stock,18.86,600062604.0,170816,Consumer Discretionary
IIM,Invesco Value Municipal Income Trust Common Stock,12.7,597769175.0,81685,Finance
MNPR,Monopar Therapeutics Inc. Common Stock,88.99,596149527.0,300353,Health Care
ACNB,ACNB Corporation Common Stock,58.37,596077008.0,72261,Finance
BBOT,BridgeBio Oncology Therapeutics Inc. Common Stock  ,7.44,595996854.0,357682,Health Care
SSSSL,SuRo Capital Corp. 6.00% Notes due 2026,24.9114,595086189.0,10486,Finance
SLDP,Solid Power Inc. Class A Common Stock,2.64,593956947.0,4363998,Miscellaneous
NRIM,Northrim BanCorp Inc Common Stock,26.68,593490357.0,188584,Finance
SMC,Summit Midstream Corporation Common Stock,29.18,593484813.0,45584,Utilities
PHR,Phreesia Inc. Common Stock,9.59,592776016.0,1142804,Consumer Discretionary
NUAI,New Era Energy & Digital Inc. Common Stock,5.85,592551929.0,7919120,Energy
ANGX,Angel Studios Inc. Class A Common Stock,3.16,589063070.0,1048156,Consumer Discretionary
GOOD,Gladstone Commercial Corporation Real Estate Investment Trust,12.16,588629035.0,498045,Real Estate
CARS,Cars.com Inc. Common Stock ,10.32,588441921.0,591377,Technology
SFIX,Stitch Fix Inc. Class A Common Stock,4.41,588408025.0,2752811,Consumer Discretionary
GRNT,Granite Ridge Resources Inc. Common Stock,4.46,588256115.0,1181731,Energy
KE,Kimball Electronics Inc. Common Stock,24.43,587515238.0,197484,Technology
WHFCL,WhiteHorse Finance Inc. 7.875% Notes due 2028,25.25,586887972.0,1150,Uncategorized
GAIN,Gladstone Investment Corporation Business Development Company,14.73,586577574.0,179412,Finance
PRTH,Priority Technology Holdings Inc. Common Stock,7.09,583898155.0,783595,Consumer Discretionary
UNTY,Unity Bancorp Inc. Common Stock,58.14,583778042.0,58729,Finance
IIIN,Insteel Industries Inc. Common Stock,29.98,582608745.0,280488,Industrials
TRAX,First Tracks Biotherapeutics Inc. Ordinary Shares ,16.69,582353839.0,481147,Health Care
CIVB,Civista Bancshares Inc. Common Stock,28.0,581933744.0,207661,Finance
ADV,Advantage Solutions Inc. Class A Common Stock,43.67,580604878.0,113350,Consumer Discretionary
ILPT,Industrial Logistics Properties Trust Common Shares of Beneficial Interest,8.7,579989598.0,384469,Real Estate
TECX,Tectonic Therapeutic Inc. Common Stock,30.72,579661394.0,95765,Health Care
MLR,Miller Industries Inc. Common Stock,50.79,578788416.0,148734,Consumer Discretionary
UHT,Universal Health Realty Income Trust Common Stock,41.67,578196169.0,281345,Real Estate
RILYZ,BRC Group Holdings Inc. 5.25% Senior Notes due 2028,18.95,577919401.0,57945,Finance
ETD,Ethan Allen Interiors Inc. Common Stock,22.68,577122969.0,784861,Consumer Discretionary
KRNY,Kearny Financial Corp Common Stock,8.89,575531052.0,782182,Finance
ALT,Altimmune Inc. Common Stock,2.95,573698754.0,3494100,Health Care
BWB,Bridgewater Bancshares Inc. Common Stock,20.53,572445525.0,470155,Finance
MGR,Affiliated Managers Group Inc. 5.875% Junior Subordinated Notes due 2059,20.08,570514225.0,23177,Finance
MDXG,MiMedx Group Inc Common Stock,3.83,570462150.0,835049,Health Care
IIIV,i3 Verticals Inc. Class A Common Stock,20.39,569523570.0,493386,Technology
NRDS,NerdWallet Inc. Class A Common Stock,8.62,567185509.0,808159,Technology
SFST,Southern First Bancshares Inc. Common Stock,59.96,566931693.0,163247,Finance
EVH,Evolent Health Inc Class A Common Stock,5.03,565779767.0,1837181,Consumer Discretionary
EVGO,EVgo Inc. Class A Common Stock,1.8,564946857.0,4015569,Technology
VGM,Invesco Trust for Investment Grade Municipals Common Stock (DE),10.41,564554787.0,87891,Finance
PRME,Prime Medicine Inc. Common Stock,3.12,563526447.0,3805488,Health Care
BBCP,Concrete Pumping Holdings Inc. Common Stock,11.16,562390567.0,399252,Consumer Discretionary
CBNK,Capital Bancorp Inc. Common Stock,34.4,561038888.0,72412,Finance
BWBBP,Bridgewater Bancshares Inc. Depositary Shares Each Representing a 1/100th Interest in a Share of 5.875% Non-Cumulative Perpetual Preferred Stock Series A,20.11,560734510.0,2350,Finance
FIP,FTAI Infrastructure Inc. Common Stock ,4.69,554187073.0,1294577,Energy
PUBM,PubMatic Inc. Class A Common Stock,11.92,553604434.0,474418,Technology
NPCE,Neuropace Inc. Common Stock,16.22,553000544.0,155532,Health Care
CTKB,Cytek Biosciences Inc. Common Stock,4.28,552730272.0,1488893,Industrials
VKQ,Invesco Municipal Trust Common Stock,9.96,551141729.0,178578,Finance
FISN,Deep Fission Inc. Common Stock,9.76,550426160.0,1339074,Utilities
RFI,Cohen & Steers Total Return Realty Fund Inc. Common Stock,11.19,549861247.0,80192,Finance
FET,Forum Energy Technologies Inc. Common Stock,48.56,548936128.0,266774,Consumer Discretionary
DC,Dakota Gold Corp. Common Stock,4.09,547765917.0,2604513,Basic Materials
ACHV,Achieve Life Sciences Inc. Common Shares,5.3,544093002.0,2083796,Health Care
MRLN,Merlin Inc. Common Stock,5.63,543430413.0,2891722,Technology
FLGT,Fulgent Genetics Inc. Common Stock,19.13,543303918.0,266285,Health Care
ELMT,The Elmet Group Co. Common Stock,18.11,542935319.0,435928,Industrials
BME,Blackrock Health Sciences Trust,40.72,542920493.0,34509,Finance
BDN,Brandywine Realty Trust Common Stock,3.12,541980956.0,2183959,Real Estate
NGS,Natural Gas Services Group Inc. Common Stock,42.94,540973793.0,175225,Energy
CLPT,ClearPoint Neuro Inc. Common Stock,17.98,539212343.0,647438,Health Care
RYAM,Rayonier Advanced Materials Inc. Common Stock,7.99,538834007.0,874593,Basic Materials
VELO,Velo3D Inc. Common stock,18.05,537908086.0,3465785,Technology
MBUU,Malibu Boats Inc. Class A Common Stock,27.39,537858882.0,431895,Industrials
EBF,Ennis Inc. Common Stock,21.23,537082315.0,305290,Consumer Discretionary
OLP,One Liberty Properties Inc. Common Stock,24.53,535231059.0,145148,Real Estate
ANGO,AngioDynamics Inc. Common Stock,12.95,535079949.0,408595,Health Care
TLRY,Tilray Brands Inc. Common Stock ,4.59,534838734.0,2865357,Health Care
OXM,Oxford Industries Inc. Common Stock,35.82,534825984.0,578086,Industrials
HBCP,Home Bancorp Inc. Common Stock,68.18,534710582.0,114276,Finance
PROK,ProKidney Corp. Class A Ordinary Shares,1.77,534645538.0,590128,Health Care
TREE,LendingTree Inc. Common Stock,38.21,533144818.0,444570,Finance
ASIX,AdvanSix Inc. Common Stock ,19.77,532980142.0,260704,Industrials
WNC,Wabash National Corporation Common Stock,13.1,532828968.0,1800058,Industrials
BSRR,Sierra Bancorp Common Stock,40.66,531799621.0,79278,Finance
ACIC,American Coastal Insurance Corporation Common Stock,10.95,530681315.0,408700,Finance
XMAX,XMAX Inc. Common Stock,8.34,530443399.0,1057186,Consumer Discretionary
IQI,Invesco Quality Municipal Income Trust Common Stock,10.01,529366808.0,116235,Finance
CERS,Cerus Corporation Common Stock,2.64,528974091.0,2784625,Technology
XOMA,XOMA Royalty Corporation Common Stock,42.15,528604415.0,164723,Health Care
CTRN,Citi Trends Inc. Common Stock,63.44,528445557.0,217320,Consumer Discretionary
PKOH,Park-Ohio Holdings Corp. Common Stock,36.53,525965114.0,85342,Industrials
EGY,VAALCO Energy Inc.  Common Stock,5.04,525461595.0,1742016,Energy
TOI,The Oncology Institute Inc. Common Stock,5.25,524910398.0,1513810,Health Care
KYTX,Kyverna Therapeutics Inc. Common Stock,8.62,524054727.0,872067,Health Care
FBIZ,First Business Financial Services Inc. Common Stock,62.44,522133645.0,64003,Finance
MLAB,Mesa Laboratories Inc. Common Stock,94.45,521829733.0,180986,Industrials
EIKN,Eikon Therapeutics Inc. Common Stock,9.63,521354988.0,285691,Health Care
SSTK,Shutterstock Inc. Common Stock,14.19,521312419.0,250590,Technology
MSBIP,Midland States Bancorp Inc. Depositary Shares Each Representing a 1/40th Interest in a Share of 7.750% Fixed-Rate Reset Non-Cumulative Perpetual Preferred Stock Series A,25.1,520317955.0,338,Finance
CTEV,Claritev Corporation Class A Common Stock,30.49,519787087.0,154088,Consumer Discretionary
ARVN,Arvinas Inc. Common Stock,8.05,519395644.0,677184,Health Care
AHRT,AH Realty Trust Inc. Common Stock,6.8,516496693.0,864361,Finance
RGNX,REGENXBIO Inc. Common Stock,9.97,515425281.0,2384377,Health Care
CHCT,Community Healthcare Trust Incorporated Common Stock,18.03,515149428.0,188376,Real Estate
TYG,Tortoise Energy Infrastructure Corporation Common Stock,43.1,514092619.0,209618,Finance
BWMN,Bowman Consulting Group Ltd. Common Stock,29.05,508599673.0,195424,Consumer Discretionary
AIOT,PowerFleet Inc. Common Stock,3.79,508545528.0,1078509,Telecommunications
OOMA,Ooma Inc. Common Stock,18.49,508475000.0,336691,Technology
GCBC,Greene County Bancorp Inc. Common Stock,29.84,508040472.0,61314,Finance
SD,SandRidge Energy Inc. Common Stock,13.74,507256879.0,309273,Energy
VCV,Invesco California Value Municipal Income Trust Common Stock,10.59,507160660.0,249122,Finance
CLFD,Clearfield Inc. Common Stock,36.96,502266442.0,172951,Utilities
MRAM,Everspin Technologies Inc. Common Stock,21.4,501778148.0,1633006,Technology
OSPN,OneSpan Inc. Common Stock,13.52,501224932.0,312856,Technology
IDR,Idaho Strategic Resources Inc. Common Stock,31.66,500540136.0,304599,Basic Materials
TRC,Tejon Ranch Co Common Stock,18.51,499848371.0,95632,Finance
ITIC,Investors Title Company Common Stock,264.64,499639261.0,24949,Finance
FTHY,First Trust High Yield Opportunities 2027 Term Fund Common Stock,13.57,499009461.0,117758,Finance
GEMI,Gemini Space Station Inc. Class A Common Stock,4.18,498631920.0,1302571,Finance
HUYA,HUYA Inc. American depositary shares each  representing one Class A ordinary share,2.23,498479250.0,968185,Technology
CPS,Cooper-Standard Holdings Inc. Common Stock,28.06,498213269.0,122241,Consumer Discretionary
STRO,Sutro Biopharma Inc. Common Stock,30.03,497610283.0,377550,Health Care
COFS,ChoiceOne Financial Services Inc. Common Stock,33.09,495523908.0,96126,Finance
BBBY,Bed Bath & Beyond Inc. Common Stock,6.7,495387917.0,3730991,Consumer Discretionary
KLC,KinderCare Learning Companies Inc. Common Stock,4.18,495030290.0,422357,Consumer Discretionary
LOCO,El Pollo Loco Holdings Inc. Common Stock,16.23,494289487.0,195077,Consumer Discretionary
CABA,Cabaletta Bio Inc. Common Stock,3.03,494056032.0,2999347,Health Care
YORW,York Water Company (The) Common Stock,30.43,493250186.0,84589,Utilities
MYGN,Myriad Genetics Inc. Common Stock,5.22,493019656.0,1924919,Health Care
OBT,Orange County Bancorp Inc. Common Stock,36.74,492606393.0,79889,Finance
PRTA,Prothena Corporation plc Ordinary Shares,9.4,492120428.0,477941,Health Care
KIDS,OrthoPediatrics Corp. Common Stock,19.14,491610785.0,200372,Health Care
PCTTW,PureCycle Technologies Inc. Warrant,2.71,490140221.0,12071,Industrials
ETO,Eaton Vance Tax-Advantage Global Dividend Opp Common Stock,29.9,490005326.0,66934,Finance
TITN,Titan Machinery Inc. Common Stock,20.99,489112758.0,170688,Consumer Discretionary
HQL,abrdn Life Sciences Investors Shares of Beneficial Interest,18.89,485088324.0,163695,Finance
RZLT,Rezolute Inc. Common Stock (NV),5.03,484350425.0,2689952,Health Care
MTW,Manitowoc Company Inc. (The) Common Stock,13.47,483702096.0,220418,Industrials
TWI,Titan International Inc. (DE) Common Stock,7.51,483433420.0,391413,Industrials
JOUT,Johnson Outdoors Inc. Class A Common Stock,46.08,482673807.0,67980,Consumer Discretionary
ALTI,AlTi Global Inc. Class A Common Stock,3.18,482144731.0,132085,Finance
FRPH,FRP Holdings Inc. Common Stock,25.06,480407092.0,65715,Finance
XRN,Chiron Real Estate Inc. Common Stock,36.22,479365543.0,171731,Real Estate
CTNM,Contineum Therapeutics Inc. Class A Common Stock,12.82,479293353.0,341427,Health Care
CBIO,Crescent Biopharma Inc. Common Stock,17.36,478648792.0,175788,Health Care
GUT,Gabelli Utility Trust (The) Common Stock,6.52,478561669.0,347494,Finance
SRTA,Strata Critical Medical Inc. Class A Common Stock,5.51,476761401.0,1064069,Consumer Discretionary
VITL,Vital Farms Inc. Common Stock,11.11,476046324.0,1989908,Consumer Staples
PDLB,Ponce Financial Group Inc. Common Stock,19.68,476017892.0,99663,Finance
PANL,Pangaea Logistics Solutions Ltd. Common Shares,7.27,475566490.0,392325,Consumer Discretionary
ASPN,Aspen Aerogels Inc. Common Stock,5.73,474887806.0,1263267,Consumer Discretionary
SERV,Serve Robotics Inc. Common Stock,6.12,473524572.0,5775480,Consumer Discretionary
RPD,Rapid7 Inc. Common Stock,7.08,473160775.0,1480242,Technology
BXC,Bluelinx Holdings Inc. Common Stock,60.7,472391377.0,244606,Consumer Discretionary
MNRO,Monro Inc. Common Stock,15.71,471696929.0,1058465,Consumer Discretionary
OCGN,Ocugen Inc. Common Stock,1.39,470545380.0,6545631,Health Care
HTZWW,Hertz Global Holdings Inc Warrant,1.49,470489139.0,535523,Consumer Discretionary
CCCC,C4 Therapeutics Inc. Common Stock,4.25,469910694.0,2735792,Health Care
BNTC,Benitec Biopharma Inc. Common Stock,13.63,468249572.0,192417,Health Care
OVID,Ovid Therapeutics Inc. Common Stock,2.5,466600255.0,2805117,Health Care
MGRB,Affiliated Managers Group Inc. 4.750% Junior Subordinated Notes due 2060,16.42,466526074.0,13575,Finance
NRC,NRC Health Common Stock,20.7,466509607.0,87952,Health Care
WTI,W&T Offshore Inc. Common Stock,3.13,465674195.0,3590478,Energy
MEI,Methode Electronics Inc. Common Stock,13.09,463784211.0,865892,Technology
OIS,Oil States International Inc. Common Stock,7.67,461683493.0,929502,Consumer Discretionary
STTK,Shattuck Labs Inc. Common Stock,6.01,460849907.0,1356519,Health Care
BWFG,Bankwell Financial Group Inc. Common Stock,57.78,460690340.0,113405,Finance
EOLS,Evolus Inc. Common Stock,6.97,459007614.0,603147,Health Care
CTGO,Contango Silver & Gold Inc. Common Stock,14.83,456337059.0,636239,Basic Materials
LWAY,Lifeway Foods Inc. Common Stock,29.75,454636168.0,431069,Consumer Staples
ACTG,Acacia Research Corporation (Acacia Tech) Common Stock,4.7,453968920.0,186126,Miscellaneous
FSTR,L.B. Foster Company Common Stock,43.31,452965431.0,94964,Industrials
KREF,KKR Real Estate Finance Trust Inc. Common Stock,7.04,452674936.0,628434,Real Estate
GDYN,Grid Dynamics Holdings Inc. Class A Common Stock,5.41,452416952.0,2360700,Technology
ERII,Energy Recovery Inc. Common Stock,8.77,452051921.0,925176,Technology
RBB,RBB Bancorp Common Stock,26.605,450579300.0,352874,Finance
CBAN,Colony Bankcorp Inc. Common Stock,21.28,450277756.0,348931,Finance
IPI,Intrepid Potash Inc Common Stock,33.47,449603514.0,261002,Industrials
FVR,FrontView REIT Inc. Common Stock,19.82,448963195.0,494139,Real Estate
MAGN,Magnera Corporation Common Stock,12.5,447500000.0,356763,Basic Materials
PACB,Pacific Biosciences of California Inc. Common Stock,1.44,447266431.0,6200624,Industrials
TASK,TaskUs Inc. Class A Common Stock,4.88,446901640.0,627118,Technology
BSVN,Bank7 Corp. Common stock,46.93,446742392.0,16323,Finance
CRNC,Cerence Inc. Common Stock,9.88,446455553.0,763768,Technology
CYH,Community Health Systems Inc. Common Stock,3.16,445296810.0,858289,Health Care
ETB,Eaton Vance Tax-Managed Buy-Write Income Fund Eaton Vance Tax-Managed Buy-Write Income Fund Common Shares of Beneficial Interest,15.16,445270394.0,41297,Finance
MATV,Mativ Holdings Inc. Common Stock,8.07,444797644.0,502372,Basic Materials
WTBA,West Bancorporation Common Stock,26.07,443922593.0,57473,Finance
DDD,3D Systems Corporation Common Stock,3.01,442310630.0,2989915,Technology
GOGO,Gogo Inc. Common Stock,3.27,442229970.0,2079766,Consumer Discretionary
NVEC,NVE Corporation Common Stock,91.17,441004424.0,116584,Technology
VMD,Viemed Healthcare Inc. Common Shares,11.47,439723119.0,533320,Health Care
EVN,Eaton Vance Municipal Income Trust Common Stock,11.05,438322151.0,110642,Finance
CBK,Commercial Bancgroup Inc. Common Stock,31.99,438303595.0,119098,Finance
BLW,Blackrock Limited Duration Income Trust,12.26,437819962.0,187124,Consumer Discretionary
INV,Innventure Inc. Common Stock,5.2,437032690.0,2403471,Finance
VREX,Varex Imaging Corporation Common Stock,10.37,436577000.0,274679,Technology
CAL,Caleres Inc. Common Stock,12.97,435658980.0,527996,Consumer Discretionary
EBS,Emergent BioSolutions Inc. Common Stock,8.43,434956775.0,891796,Health Care
SHOE,Shoe Station Group Inc. Common Stock,15.98,433877902.0,549769,Consumer Discretionary
GBFH,GBank Financial Holdings Inc. Common Stock,29.9,432663525.0,60292,Finance
PBFS,Pioneer Bancorp Inc. Common Stock,17.23,432073281.0,16890,Finance
WEAV,Weave Communications Inc. Common Stock,5.43,432041398.0,1096805,Technology
MOBI,Mobia Medical Inc. Common Stock,12.98,431572098.0,58518,Health Care
FRBA,First Bank Common Stock,17.15,431055011.0,108479,Finance
STRZ,Starz Entertainment Corp. Common Shares,25.65,430639876.0,134241,Consumer Discretionary
PAYS,Paysign Inc. Common Stock,7.69,429915394.0,584896,Technology
BMRC,Bank of Marin Bancorp Common Stock,26.54,429674824.0,197550,Finance
DIN,Dine Brands Global Inc. Common Stock,33.85,429393174.0,328441,Consumer Discretionary
SWMR,Swarmer Inc Common Stock,38.23,428568087.0,324932,Technology
AMCX,AMC Global Media Inc. Class A Common Stock,9.75,428295192.0,361814,Telecommunications
SGMT,Sagimet Biosciences Inc. Series A Common Stock,6.93,427940023.0,1377422,Health Care
RR,Richtech Robotics Inc. Class B Common Stock,1.91,427068308.0,11946913,Industrials
CCRN,Cross Country Healthcare Inc. Common Stock $0.0001 Par Value,13.2,426791125.0,253775,Consumer Discretionary
RLGT,Radiant Logistics Inc. Common Stock,9.09,425699844.0,124847,Industrials
FPI,Farmland Partners Inc. Common Stock,9.72,423959194.0,507833,Real Estate
FWRD,Forward Air Corporation Common Stock,13.39,423459366.0,629685,Industrials
DCTH,Delcath Systems Inc. Common Stock,12.24,422544959.0,469064,Health Care
MGRD,Affiliated Managers Group Inc. 4.200% Junior Subordinated Notes due 2061,14.85,421919136.0,16129,Finance
PLAY,Dave & Buster's Entertainment Inc. Common Stock,12.09,420595310.0,1359851,Consumer Discretionary
AIV,Apartment Investment and Management Company Common Stock,2.92,420060054.0,1192548,Real Estate
GLAD,Gladstone Capital Corporation Common Stock,18.56,419327361.0,141818,Consumer Discretionary
YEXT,Yext Inc. Common Stock,4.16,417032163.0,1450983,Technology
OPTX,Syntec Optics Holdings Inc. Class A Common Stock,10.33,416091140.0,373814,Technology
VKI,Invesco Advantage Municipal Income Trust II Common Shares of Beneficial Interest (DE),9.36,415640347.0,152124,Finance
SGU,Star Group L.P. Common Stock,12.61,414035895.0,41221,Consumer Discretionary
ISTR,Investar Holding Corporation Common Stock,29.97,413393742.0,298596,Finance
IPSC,Century Therapeutics Inc. Common Stock,2.29,413012513.0,1104666,Health Care
NATH,Nathan's Famous Inc. Common Stock,100.79,412675080.0,23020,Consumer Discretionary
CLMB,Climb Global Solutions Inc. Common Stock,22.14,411742008.0,145967,Technology
