symbol,name,price,marketCap,volume,industry
OPENW,Opendoor Technologies Inc  Series K Warrants each whole warrant exercisable to purchase one share of Common Stock at an exercise price of $9.00 per warrant,0.7001,675412116.0,452688,Finance
HIPO,Hippo Holdings Inc. Common Stock,25.9,674330250.0,142574,Finance
SWBI,Smith & Wesson Brands Inc. Common Stock,15.14,673635299.0,445836,Industrials
RSVR,Reservoir Media Inc. Common Stock,10.25,673032569.0,121380,Consumer Discretionary
ALOY,REalloys Inc. Common Stock,10.99,672736343.0,4239741,Technology
DLY,DoubleLine Yield Opportunities Fund Common Shares of Beneficial Interest,13.99,670761448.0,150131,Finance
PAR,PAR Technology Corporation Common Stock,16.26,670663196.0,3129574,Miscellaneous
HOV,Hovnanian Enterprises Inc. Class A Common Stock,112.78,669709519.0,83727,Consumer Discretionary
NXP,Nuveen Select Tax Free Income Portfolio Common Stock,14.3,669227316.0,124934,Finance
CBLL,CeriBell Inc. Common Stock,17.61,668170947.0,384326,Health Care
SDHC,Smith Douglas Homes Corp. Class A Common Stock,13.15,667798475.0,190209,Consumer Discretionary
RWT,Redwood Trust Inc. Common Stock,5.32,666147721.0,1018043,Real Estate
GRNT,Granite Ridge Resources Inc. Common Stock,5.05,666074750.0,1324161,Energy
TIPT,Tiptree Inc. Common Stock,17.72,665741729.0,459276,Finance
OXM,Oxford Industries Inc. Common Stock,44.67,665619585.0,268433,Industrials
NEWTI,NewtekOne Inc. 8.00% Fixed Rate Senior Notes due 2028,25.2299,664097694.0,3597,Finance
HPP,Hudson Pacific Properties Inc. Common Stock,12.24,663922374.0,931088,Finance
CRMD,CorMedix Inc. Common Stock,8.45,662918479.0,1196563,Health Care
BVS,Bioventus Inc. Class A Common Stock,7.93,662430845.0,866773,Health Care
NCDL,Nuveen Churchill Direct Lending Corp. Common Stock,13.41,662280542.0,234922,Uncategorized
NGVC,Natural Grocers by Vitamin Cottage Inc. Common Stock,28.67,660579335.0,164621,Consumer Staples
NEWTG,NewtekOne Inc. 8.50% Fixed Rate Senior Notes due 2029,25.07,659888830.0,5390,Finance
PHR,Phreesia Inc. Common Stock,10.66,658914737.0,2207582,Consumer Discretionary
GDYN,Grid Dynamics Holdings Inc. Class A Common Stock,7.86,657300784.0,2960687,Technology
IHRT,iHeartMedia Inc. Class A Common Stock,4.345,656757165.0,844864,Consumer Discretionary
VMO,Invesco Municipal Opportunity Trust Common Stock,9.73,656197865.0,186413,Finance
CLFD,Clearfield Inc. Common Stock,48.24,655555550.0,350023,Utilities
XFLT,XAI Octagon Floating Rate & Alternative Income Trust Common Shares of Beneficial Interest,18.46,654749101.0,114496,Finance
CCSI,Consensus Cloud Solutions Inc. Common Stock,35.51,653311205.0,266917,Technology
DSGN,Design Therapeutics Inc. Common Stock,10.44,652050809.0,1522341,Health Care
RILYT,BRC Group Holdings Inc. 6.00% Senior Notes Due 2028,21.38,652027271.0,42123,Finance
HRTG,Heritage Insurance Holdings Inc. Common Stock,21.38,648881397.0,560771,Finance
CWBC,Community West Bancshares Common Stock,23.9,648507523.0,290351,Finance
CNNE,Cannae Holdings Inc. Common Stock,14.75,648122464.0,426841,Consumer Discretionary
TRTX,TPG RE Finance Trust Inc. Common Stock,8.38,647842791.0,576451,Real Estate
RMT,Royce Micro-Cap Trust Inc. Common Stock,13.98,646842116.0,179286,Finance
IMMX,Immix Biopharma Inc. Common Stock,9.22,643469480.0,1193159,Health Care
CSV,Carriage Services Inc. Common Stock,40.51,642988007.0,104655,Consumer Discretionary
FBRT,Franklin BSP Realty Trust Inc. Common Stock,8.34,641871495.0,765624,Real Estate
VELO,Velo3D Inc. Common stock,21.51,641019553.0,2658134,Technology
TLRY,Tilray Brands Inc. Common Stock ,5.49,639709074.0,3321654,Health Care
SWMR,Swarmer Inc Common Stock,57.01,639096695.0,738216,Technology
BHFAM,Brighthouse Financial Inc. Depositary shares each representing a 1/1000th Interest in a Share of 4.625% Non-Cumulative Preferred Stock Series D,11.08,636499298.0,25592,Finance
CSTL,Castle Biosciences Inc. Common Stock,20.97,636019093.0,312153,Health Care
GAIN,Gladstone Investment Corporation Business Development Company,15.9,633169275.0,254461,Finance
MEC,Mayville Engineering Company Inc. Common Stock,30.88,632854905.0,956982,Industrials
KRUS,Kura Sushi USA Inc. Class A Common Stock,52.0,631689864.0,819658,Consumer Discretionary
TRAX,First Tracks Biotherapeutics Inc. Ordinary Shares ,18.09,631203172.0,854767,Health Care
INN,Summit Hotel Properties Inc. Common Stock,5.82,630684754.0,769144,Real Estate
TCBX,Third Coast Bancshares Inc. Common Stock,37.97,630000936.0,64493,Finance
DGICA,Donegal Group Inc. Class A Common Stock,16.92,626879283.0,185021,Finance
SWIM,Latham Group Inc. Common Stock,5.32,624629653.0,584770,Industrials
RILYP,BRC Group Holdings Inc. Depositary Shares each representing a 1/1000th fractional interest in a share of Series A Cumulative Perpetual Preferred Stock,16.82,624536557.0,9319,Finance
PSTL,Postal Realty Trust Inc. Class A Common Stock,22.58,623746714.0,432682,Real Estate
CADL,Candel Therapeutics Inc. Common Stock,8.51,623529734.0,1629548,Health Care
HY,Hyster-Yale Inc. Class A common stock,34.77,622935913.0,70589,Industrials
ELA,Envela Corporation Common Stock,23.99,622863789.0,133655,Consumer Discretionary
RGR,Sturm Ruger & Company Inc. Common Stock,38.94,620869212.0,90266,Industrials
KE,Kimball Electronics Inc. Common Stock,25.76,619500308.0,189183,Technology
MCS,Marcus Corporation (The) Common Stock,20.07,616717643.0,214826,Consumer Discretionary
RILYL,BRC Group Holdings Inc. Depositary Shares each representing 1/1000th in a share of 7.375% Series B Cumulative Perpetual Preferred Stock par value $0.0001,16.6,616367827.0,3534,Finance
AIV,Apartment Investment and Management Company Common Stock,4.28,615704463.0,847147,Real Estate
GEMI,Gemini Space Station Inc. Class A Common Stock,5.16,615536054.0,1480736,Finance
RMR,The RMR Group Inc. Class A Common Stock,19.79,615338010.0,152465,Consumer Discretionary
SIBN,SI-BONE Inc. Common Stock,13.87,615124555.0,763206,Health Care
PRME,Prime Medicine Inc. Common Stock,3.4,614099333.0,2493887,Health Care
WASH,Washington Trust Bancorp Inc. Common Stock,32.17,613340127.0,168993,Finance
SGP,SpyGlass Pharma Inc. Common Stock,18.32,612499064.0,44741,Health Care
RILYZ,BRC Group Holdings Inc. 5.25% Senior Notes due 2028,20.0,609941320.0,69114,Finance
BCAL,California BanCorp Common Stock,18.93,608880118.0,145005,Finance
DNUT,Krispy Kreme Inc. Common Stock,3.53,608572000.0,2688800,Consumer Staples
SMC,Summit Midstream Corporation Common Stock,29.83,606705002.0,191365,Utilities
GOOD,Gladstone Commercial Corporation Real Estate Investment Trust,12.53,606539622.0,642885,Real Estate
RYAM,Rayonier Advanced Materials Inc. Common Stock,8.99,606272556.0,728471,Basic Materials
HIFS,Hingham Institution for Savings Common Stock,282.3,606211020.0,25248,Finance
ACRS,Aclaris Therapeutics Inc. Common Stock,4.34,606140371.0,2228502,Health Care
CTGO,Contango Silver & Gold Inc. Common Stock,19.65,604654296.0,353278,Basic Materials
TASK,TaskUs Inc. Class A Common Stock,6.6,604416153.0,437955,Technology
CARE,Carter Bankshares Inc. Common Stock,27.14,603105351.0,250509,Finance
AROW,Arrow Financial Corporation Common Stock,36.39,601491001.0,45312,Finance
SSSSL,SuRo Capital Corp. 6.00% Notes due 2026,25.16,601024772.0,4696,Finance
ASIX,AdvanSix Inc. Common Stock ,22.29,600916912.0,136760,Industrials
IDR,Idaho Strategic Resources Inc. Common Stock,37.89,599035558.0,180802,Basic Materials
CABA,Cabaletta Bio Inc. Common Stock,3.67,598411101.0,2714592,Health Care
CASS,Cass Information Systems Inc Common Stock,46.47,598122294.0,94811,Consumer Discretionary
HUYA,HUYA Inc. American depositary shares each  representing one Class A ordinary share,2.67,596833900.0,2294179,Technology
RRBI,Red River Bancshares Inc. Common Stock,90.62,596705152.0,85474,Consumer Discretionary
NPB,Northpointe Bancshares Inc. Common Stock,17.25,596536775.0,188826,Finance
WTI,W&T Offshore Inc. Common Stock,3.99,593623015.0,7537771,Energy
TDUP,ThredUp Inc. Class A Common Stock,4.6,593587892.0,1424312,Consumer Discretionary
NFBK,Northfield Bancorp Inc. Common Stock (Delaware),14.18,592211421.0,343580,Finance
ONT,Onterris Inc. Common Stock,16.31,589430792.0,748540,Consumer Discretionary
PACK,Ranpak Holdings Corp Class A Common Stock,6.89,589404189.0,519770,Consumer Discretionary
GOGO,Gogo Inc. Common Stock,4.35,588287575.0,1905906,Consumer Discretionary
IIIV,i3 Verticals Inc. Class A Common Stock,21.05,587958370.0,811815,Technology
IIM,Invesco Value Municipal Income Trust Common Stock,12.49,587884803.0,138690,Finance
WHFCL,WhiteHorse Finance Inc. 7.875% Notes due 2028,25.23,586423110.0,6306,Uncategorized
BHB,Bar Harbor Bankshares Inc. Common Stock,34.97,585471377.0,87388,Finance
ALT,Altimmune Inc. Common Stock,3.01,585367204.0,2294472,Health Care
EIKN,Eikon Therapeutics Inc. Common Stock,10.79,584155796.0,213101,Health Care
RPD,Rapid7 Inc. Common Stock,8.74,584099601.0,2845558,Technology
MAX,MediaAlpha Inc. Class A Common Stock,9.35,582976446.0,602620,Consumer Discretionary
ILPT,Industrial Logistics Properties Trust Common Shares of Beneficial Interest,8.74,582656217.0,800480,Real Estate
MLAB,Mesa Laboratories Inc. Common Stock,105.26,581541816.0,230883,Industrials
PFIS,Peoples Financial Services Corp. Common Stock,58.04,581031533.0,38086,Finance
MAMA,Mama's Creations Inc. Common Stock,14.25,580074750.0,478765,Consumer Staples
OSPN,OneSpan Inc. Common Stock,15.54,576112089.0,1059197,Technology
NRDS,NerdWallet Inc. Class A Common Stock,8.75,575739351.0,978355,Technology
CRNC,Cerence Inc. Common Stock,12.74,575692687.0,1544642,Technology
MGR,Affiliated Managers Group Inc. 5.875% Junior Subordinated Notes due 2059,20.18,573355431.0,69785,Finance
FET,Forum Energy Technologies Inc. Common Stock,50.68,572901214.0,249498,Consumer Discretionary
BBNX,Beta Bionics Inc. Common Stock,12.8,570389696.0,707038,Health Care
MSBI,Midland States Bancorp Inc. Common Stock,27.49,569862175.0,133241,Finance
IRWD,Ironwood Pharmaceuticals Inc. Class A Common Stock,3.46,569562385.0,1699562,Health Care
AMSF,AMERISAFE Inc. Common Stock,30.44,569342789.0,231735,Finance
CERS,Cerus Corporation Common Stock,2.84,569047886.0,2558418,Technology
NUAI,New Era Energy & Digital Inc. Common Stock,5.61,568242106.0,19133246,Energy
ELMT,The Elmet Group Co. Common Stock,18.95,568118404.0,5068805,Industrials
DNA,Ginkgo Bioworks Holdings Inc. Class A Common Stock,9.14,567917986.0,1080423,Health Care
PUBM,PubMatic Inc. Class A Common Stock,12.22,567537432.0,917054,Technology
EGY,VAALCO Energy Inc.  Common Stock,5.44,567164896.0,1250759,Energy
LEGH,Legacy Housing Corporation Common Stock (TX),23.75,564813024.0,52991,Consumer Discretionary
GYRE,Gyre Therapeutics Inc. Common Stock,5.81,563734551.0,125483,Health Care
UHT,Universal Health Realty Income Trust Common Stock,40.61,563488035.0,74963,Real Estate
PRAA,PRA Group Inc. Common Stock,14.76,562959507.0,955452,Finance
NPCE,Neuropace Inc. Common Stock,16.51,562887730.0,170003,Health Care
SD,SandRidge Energy Inc. Common Stock,15.23,562265085.0,401904,Energy
ORN,Orion Group Holdings Inc. Common,13.83,559828415.0,529099,Industrials
PROK,ProKidney Corp. Class A Ordinary Shares,1.85,558810308.0,1467103,Health Care
VGM,Invesco Trust for Investment Grade Municipals Common Stock (DE),10.3,558589270.0,177559,Finance
CTRN,Citi Trends Inc. Common Stock,44.28,557380168.0,120879,Consumer Discretionary
TREE,LendingTree Inc. Common Stock,39.89,556585888.0,202316,Finance
BWMN,Bowman Consulting Group Ltd. Common Stock,31.76,556045632.0,83192,Consumer Discretionary
MG,Mistras Group Inc Common Stock,17.46,555519250.0,264288,Consumer Discretionary
BWBBP,Bridgewater Bancshares Inc. Depositary Shares Each Representing a 1/100th Interest in a Share of 5.875% Non-Cumulative Perpetual Preferred Stock Series A,19.92,555436671.0,859,Finance
CARS,Cars.com Inc. Common Stock ,9.91,553998998.0,801628,Technology
ARVN,Arvinas Inc. Common Stock,8.58,553591879.0,794280,Health Care
OPTU,Optimum Communications Inc. Class A common stock,1.16,552703634.0,125085123,Telecommunications
RIGL,Rigel Pharmaceuticals Inc. Common Stock,29.86,552472109.0,363981,Health Care
MBUU,Malibu Boats Inc. Class A Common Stock,28.01,550033855.0,249359,Industrials
KRT,Karat Packaging Inc. Common Stock,27.49,548802965.0,94692,Industrials
UNTY,Unity Bancorp Inc. Common Stock,54.59,548132840.0,51642,Finance
CTKB,Cytek Biosciences Inc. Common Stock,4.24,547564569.0,774612,Industrials
DDD,3D Systems Corporation Common Stock,3.72,546643037.0,8495926,Technology
BLZE,Backblaze Inc. Class A Common Stock,9.11,546600000.0,2688810,Technology
RFI,Cohen & Steers Total Return Realty Fund Inc. Common Stock,11.12,546421543.0,154789,Finance
TECX,Tectonic Therapeutic Inc. Common Stock,28.89,545130784.0,157473,Health Care
XMAX,XMAX Inc. Common Stock,8.56,544435911.0,993477,Consumer Discretionary
RBBN,Ribbon Communications Inc. Common Stock,3.09,544269717.0,712494,Technology
ACHV,Achieve Life Sciences Inc. Common Shares,5.3,544093002.0,1547363,Health Care
CBIO,Crescent Biopharma Inc. Common Stock,19.72,543718558.0,423439,Health Care
ZSQR,Z Squared Inc. Common Stock,10.56,543116566.0,332402,Finance
SFST,Southern First Bancshares Inc. Common Stock,57.26,541402748.0,103963,Finance
PRTH,Priority Technology Holdings Inc. Common Stock,6.57,541073467.0,234232,Consumer Discretionary
TCMD,Tactile Systems Technology Inc. Common Stock,23.98,540899115.0,421983,Health Care
ACNB,ACNB Corporation Common Stock,52.92,540421368.0,65348,Finance
SUJA,Suja Life Inc. Class A Common Stock,13.99,540363918.0,312068,Consumer Staples
FIP,FTAI Infrastructure Inc. Common Stock ,4.57,540007446.0,1121510,Energy
VKQ,Invesco Municipal Trust Common Stock,9.75,539521271.0,154052,Finance
CPS,Cooper-Standard Holdings Inc. Common Stock,30.25,537097341.0,142222,Consumer Discretionary
MLR,Miller Industries Inc. Common Stock,47.12,536966138.0,74188,Consumer Discretionary
BDN,Brandywine Realty Trust Common Stock,3.08,535032483.0,1606568,Real Estate
NRIM,Northrim BanCorp Inc Common Stock,24.04,534764175.0,101262,Finance
IIIN,Insteel Industries Inc. Common Stock,27.46,533636963.0,220565,Industrials
BME,Blackrock Health Sciences Trust,40.0,533320720.0,53197,Finance
MDXG,MiMedx Group Inc Common Stock,3.58,533225717.0,1396518,Health Care
CIVB,Civista Bancshares Inc. Common Stock,25.56,531222375.0,95584,Finance
SRTA,Strata Critical Medical Inc. Class A Common Stock,6.12,529542608.0,798093,Consumer Discretionary
AIOT,PowerFleet Inc. Common Stock,3.93,527198799.0,1947356,Telecommunications
MSBIP,Midland States Bancorp Inc. Depositary Shares Each Representing a 1/40th Interest in a Share of 7.750% Fixed-Rate Reset Non-Cumulative Perpetual Preferred Stock Series A,25.35,525500405.0,3833,Finance
ETD,Ethan Allen Interiors Inc. Common Stock,20.64,525212437.0,571093,Consumer Discretionary
KRNY,Kearny Financial Corp Common Stock,8.11,525034515.0,387865,Finance
TYG,Tortoise Energy Infrastructure Corporation Common Stock,43.95,524231337.0,332653,Finance
IQI,Invesco Quality Municipal Income Trust Common Stock,9.9,523549590.0,134138,Finance
XOMA,XOMA Royalty Corporation Common Stock,41.69,522835541.0,119272,Health Care
BWB,Bridgewater Bancshares Inc. Common Stock,18.7,521418963.0,50497,Finance
EBF,Ennis Inc. Common Stock,20.6,521033040.0,166363,Consumer Discretionary
ANGX,Angel Studios Inc. Class A Common Stock,2.79,520090496.0,1500827,Consumer Discretionary
AHRT,AH Realty Trust Inc. Common Stock,6.8,516496693.0,1388431,Finance
WEAV,Weave Communications Inc. Common Stock,6.48,515585315.0,1555870,Technology
ASPN,Aspen Aerogels Inc. Common Stock,6.22,515497758.0,1252727,Consumer Discretionary
CBNK,Capital Bancorp Inc. Common Stock,31.63,515191180.0,62167,Finance
FLGT,Fulgent Genetics Inc. Common Stock,18.09,513767270.0,514188,Health Care
TITN,Titan Machinery Inc. Common Stock,22.04,513734041.0,143054,Consumer Discretionary
IPI,Intrepid Potash Inc Common Stock,38.19,513007416.0,334940,Industrials
TRC,Tejon Ranch Co Common Stock,18.88,509839938.0,113139,Finance
ALIT,Alight Inc. Class A Common Stock,0.9486,509627743.0,22867684,Consumer Discretionary
OLP,One Liberty Properties Inc. Common Stock,23.28,507956749.0,51810,Real Estate
ACIC,American Coastal Insurance Corporation Common Stock,10.48,507903213.0,250909,Finance
ETO,Eaton Vance Tax-Advantage Global Dividend Opp Common Stock,30.99,507868397.0,28715,Finance
VCV,Invesco California Value Municipal Income Trust Common Stock,10.6,507639565.0,73745,Finance
FDMT,4D Molecular Therapeutics Inc. Common Stock,9.71,507602426.0,1075325,Health Care
OIS,Oil States International Inc. Common Stock,8.42,506828554.0,1528827,Consumer Discretionary
SSTK,Shutterstock Inc. Common Stock,13.7,503310792.0,4920817,Technology
CLDT,Chatham Lodging Trust (REIT) Common Shares of Beneficial Interest,10.77,502756739.0,528602,Real Estate
HBCP,Home Bancorp Inc. Common Stock,64.06,502398942.0,40751,Finance
PRTA,Prothena Corporation plc Ordinary Shares,9.59,502067543.0,457849,Health Care
AQST,Aquestive Therapeutics Inc. Common Stock,4.0,501800476.0,1413065,Health Care
PANL,Pangaea Logistics Solutions Ltd. Common Shares,7.64,499770012.0,621897,Consumer Discretionary
KYTX,Kyverna Therapeutics Inc. Common Stock,8.22,499736643.0,671751,Health Care
OOMA,Ooma Inc. Common Stock,18.14,499027917.0,445778,Technology
FTHY,First Trust High Yield Opportunities 2027 Term Fund Common Stock,13.56,498641731.0,107192,Finance
SPT,Sprout Social Inc Class A Common Stock,8.29,498274910.0,2069296,Technology
ADV,Advantage Solutions Inc. Class A Common Stock,37.44,497775283.0,80973,Consumer Discretionary
NGS,Natural Gas Services Group Inc. Common Stock,39.45,497005499.0,132186,Energy
CHCT,Community Healthcare Trust Incorporated Common Stock,17.25,492863429.0,195831,Real Estate
SFIX,Stitch Fix Inc. Class A Common Stock,3.61,492846297.0,2197394,Consumer Discretionary
BSRR,Sierra Bancorp Common Stock,37.68,492823653.0,63473,Finance
SES,SES AI Corporation Class A Common Stock,1.33,491146874.0,9826605,Miscellaneous
PACB,Pacific Biosciences of California Inc. Common Stock,1.58,490750667.0,8207805,Industrials
INV,Innventure Inc. Common Stock,5.835,490401105.0,3430474,Finance
ALTI,AlTi Global Inc. Class A Common Stock,3.23,489725623.0,104120,Finance
CTNM,Contineum Therapeutics Inc. Class A Common Stock,13.09,489387675.0,130695,Health Care
ABAT,American Battery Technology Company Common Stock,3.58,488363584.0,5992489,Basic Materials
NVEC,NVE Corporation Common Stock,100.95,488311908.0,142292,Technology
MVST,Microvast Holdings Inc. Common Stock,1.46,486409781.0,4068903,Miscellaneous
CCCC,C4 Therapeutics Inc. Common Stock,4.38,484284432.0,3774632,Health Care
MGRB,Affiliated Managers Group Inc. 4.750% Junior Subordinated Notes due 2060,16.94,481300347.0,50209,Finance
CAL,Caleres Inc. Common Stock,14.19,480221371.0,642823,Consumer Discretionary
ALMU,Aeluma Inc. Common Stock,26.21,479782830.0,2285863,Technology
SCVL,Shoe Carnival Inc. Common Stock,17.45,479598958.0,614296,Consumer Discretionary
YORW,York Water Company (The) Common Stock,29.53,478661781.0,136858,Utilities
TOI,The Oncology Institute Inc. Common Stock,4.78,477918420.0,1400360,Health Care
OVID,Ovid Therapeutics Inc. Common Stock,2.56,477798661.0,1980941,Health Care
DVLT,Datavault AI Inc. Common Stock,0.5565,476120250.0,63998316,Technology
KLC,KinderCare Learning Companies Inc. Common Stock,4.02,476081762.0,790593,Consumer Discretionary
FBIZ,First Business Financial Services Inc. Common Stock,56.42,471793406.0,29883,Finance
MNRO,Monro Inc. Common Stock,15.7,471396676.0,1587375,Consumer Discretionary
TWI,Titan International Inc. (DE) Common Stock,7.3,469915308.0,577632,Industrials
OSS,One Stop Systems Inc. Common Stock,18.96,469620562.0,2062081,Technology
EVH,Evolent Health Inc Class A Common Stock,4.17,469046049.0,2869892,Consumer Discretionary
STRO,Sutro Biopharma Inc. Common Stock,28.25,468114902.0,216263,Health Care
PKOH,Park-Ohio Holdings Corp. Common Stock,32.5,467940493.0,55289,Industrials
BBBY,Bed Bath & Beyond Inc. Common Stock,6.31,466551903.0,3926402,Consumer Discretionary
XRN,Chiron Real Estate Inc. Common Stock,35.18,465601319.0,175805,Real Estate
COFS,ChoiceOne Financial Services Inc. Common Stock,31.0,464226085.0,126308,Finance
JOUT,Johnson Outdoors Inc. Class A Common Stock,44.31,464133603.0,52415,Consumer Discretionary
OCGN,Ocugen Inc. Common Stock,1.37,463774943.0,5571560,Health Care
NPWR,NET Power Inc. Class A Common Stock,2.05,460761446.0,1302073,Energy
GUT,Gabelli Utility Trust (The) Common Stock,6.27,460211912.0,102863,Finance
CTEV,Claritev Corporation Class A Common Stock,26.99,460119825.0,152081,Consumer Discretionary
YEXT,Yext Inc. Common Stock,4.59,459614739.0,1744412,Technology
BBW,Build-A-Bear Workshop Inc. Common Stock,36.38,457677826.0,384049,Consumer Discretionary
ETB,Eaton Vance Tax-Managed Buy-Write Income Fund Eaton Vance Tax-Managed Buy-Write Income Fund Common Shares of Beneficial Interest,15.57,457312667.0,66057,Finance
NRC,NRC Health Common Stock,20.25,456368094.0,190201,Health Care
PDLB,Ponce Financial Group Inc. Common Stock,18.84,455700055.0,139219,Finance
IMXI,International Money Express Inc. Common Stock,15.12,455028719.0,592694,Consumer Discretionary
GLOO,Gloo Holdings Inc. Class A Common Stock,5.52,454888417.0,102560,Technology
AMCX,AMC Global Media Inc. Class A Common Stock,10.33,453773265.0,648109,Telecommunications
OBT,Orange County Bancorp Inc. Common Stock,33.77,452784918.0,51284,Finance
HQL,abrdn Life Sciences Investors Shares of Beneficial Interest,17.6,451961594.0,99587,Finance
CLNE,Clean Energy Fuels Corp. Common Stock,2.05,451460500.0,1404045,Utilities
ANGO,AngioDynamics Inc. Common Stock,10.91,450789363.0,370970,Health Care
FPI,Farmland Partners Inc. Common Stock,10.3,449257170.0,396149,Real Estate
LOCO,El Pollo Loco Holdings Inc. Common Stock,14.75,449215646.0,378778,Consumer Discretionary
LAB,Standard BioTools Inc. Common Stock,1.15,448923337.0,2375621,Industrials
GEVO,Gevo Inc. Common Stock,1.84,447876845.0,3752976,Industrials
CMCO,Columbus McKinnon Corporation Common Stock,15.57,447471929.0,277790,Industrials
ACTG,Acacia Research Corporation (Acacia Tech) Common Stock,4.63,447207681.0,180266,Miscellaneous
BLW,Blackrock Limited Duration Income Trust,12.52,447104888.0,173818,Consumer Discretionary
GCBC,Greene County Bancorp Inc. Common Stock,26.24,446748726.0,16002,Finance
MOBI,Mobia Medical Inc. Common Stock,13.5,446652779.0,108528,Health Care
SGMT,Sagimet Biosciences Inc. Series A Common Stock,7.19,443995492.0,736593,Health Care
PLAY,Dave & Buster's Entertainment Inc. Common Stock,12.78,443969596.0,1655139,Consumer Discretionary
FRPH,FRP Holdings Inc. Common Stock,23.12,443216758.0,48727,Finance
ITIC,Investors Title Company Common Stock,234.46,442659542.0,47186,Finance
ALTO,Alto Ingredients Inc. Common Stock,5.71,442440224.0,3810502,Industrials
GLAD,Gladstone Capital Corporation Common Stock,19.55,441694499.0,133421,Consumer Discretionary
UPB,Upstream Bio Inc. Common Stock,8.08,439713487.0,595120,Health Care
TSSI,TSS Inc. Common Stock,15.66,439638151.0,2329802,Consumer Discretionary
EBS,Emergent BioSolutions Inc. Common Stock,8.49,438052553.0,852309,Health Care
OPTX,Syntec Optics Holdings Inc. Class A Common Stock,10.84,436633878.0,943336,Technology
MATV,Mativ Holdings Inc. Common Stock,7.91,435978855.0,534130,Basic Materials
STRZ,Starz Entertainment Corp. Common Shares,25.92,435172928.0,186914,Consumer Discretionary
ATNI,ATN International Inc. Common Stock,28.28,434970523.0,67979,Telecommunications
PAYS,Paysign Inc. Common Stock,7.75,433269741.0,1738920,Technology
STTK,Shattuck Labs Inc. Common Stock,5.65,433244921.0,714016,Health Care
FSTR,L.B. Foster Company Common Stock,41.35,432466418.0,107733,Industrials
VITL,Vital Farms Inc. Common Stock,10.07,431483932.0,3095677,Consumer Staples
MNPR,Monopar Therapeutics Inc. Common Stock,64.4,431419593.0,92913,Health Care
CCAP,Crescent Capital BDC Inc. Common stock,11.7,431097638.0,215295,Finance
MGRD,Affiliated Managers Group Inc. 4.200% Junior Subordinated Notes due 2061,15.14,430158634.0,19075,Finance
EVN,Eaton Vance Municipal Income Trust Common Stock,10.83,429595375.0,167313,Finance
EOLS,Evolus Inc. Common Stock,6.52,429372977.0,874424,Health Care
ASMB,Assembly Biosciences Inc. Common Stock,26.92,427829007.0,219029,Health Care
KIDS,OrthoPediatrics Corp. Common Stock,16.65,427655150.0,174385,Health Care
FULC,Fulcrum Therapeutics Inc. Common Stock,6.42,427623976.0,3121481,Health Care
KREF,KKR Real Estate Finance Trust Inc. Common Stock,6.65,427597773.0,1012934,Real Estate
ULH,Universal Logistics Holdings Inc. Common Stock,16.2,427188994.0,58447,Industrials
LDI,loanDepot Inc. Class A Common Stock,1.26,425658113.0,1220923,Finance
IPSC,Century Therapeutics Inc. Common Stock,2.36,425637349.0,910322,Health Care
GBFH,GBank Financial Holdings Inc. Common Stock,29.41,425573052.0,72099,Finance
CCRN,Cross Country Healthcare Inc. Common Stock $0.0001 Par Value,13.09,423234532.0,579740,Consumer Discretionary
VREX,Varex Imaging Corporation Common Stock,10.03,422263000.0,403258,Technology
CLMB,Climb Global Solutions Inc. Common Stock,22.67,421598524.0,169703,Technology
BLND,Blend Labs Inc. Class A Common Stock,1.74,421282981.0,3391966,Technology
BMBL,Bumble Inc. Class A Common Stock,3.22,419988361.0,3556861,Technology
FJET,Starfighters Space Inc. Common Stock,9.5,419652734.0,9276719,Consumer Discretionary
BSVN,Bank7 Corp. Common stock,44.08,419612287.0,8483,Finance
GETY,Getty Images Holdings Inc. Class A Common Stock,1.0,418959244.0,3279401,Consumer Discretionary
GTN,Gray Media Inc. Common Stock,4.07,418145512.0,1259904,Industrials
DUOT,Duos Technologies Group Inc. Common Stock,14.24,417566199.0,1063687,Technology
CATX,Perspective Therapeutics Inc. Common Stock,3.66,417409081.0,1479066,Health Care
CBAN,Colony Bankcorp Inc. Common Stock,19.72,417268673.0,234720,Finance
SGU,Star Group L.P. Common Stock,12.7,416990949.0,30481,Consumer Discretionary
MTW,Manitowoc Company Inc. (The) Common Stock,11.6,416551174.0,316660,Industrials
KELYA,Kelly Services Inc. Class A Common Stock,12.01,416376972.0,531198,Consumer Discretionary
