symbol,name,price,marketCap,volume,industry
OXLCM,Oxford Lane Capital Corp. Preferred Stock Shares 8.25% Series 2031,24.82,4308752000.0,33613,Finance
OCTV,Octave Intelligence plc Class B Ordinary Shares,16.02,4300373364.0,1036370,Technology
KRC,Kilroy Realty Corporation Common Stock,36.92,4293013554.0,1340735,Real Estate
VRNS,Varonis Systems Inc. Common Stock,37.29,4281419654.0,3859697,Technology
FHI,Federated Hermes Inc. Common Stock,56.38,4279955376.0,684717,Finance
PLNT,Planet Fitness Inc. Common Stock,53.86,4278787969.0,1782148,Consumer Discretionary
LBRT,Liberty Energy Inc. Class A common stock,26.21,4277247013.0,6547454,Energy
TDS,Telephone and Data Systems Inc. Common Shares,37.55,4273190000.0,839389,Telecommunications
OXLCZ,Oxford Lane Capital Corp. 5.00% Notes due 2027,24.595,4269692000.0,781,Finance
OXLCN,Oxford Lane Capital Corp. 7.125% Series 2029 Term Preferred Stock,24.5904,4268893440.0,1271,Finance
ELC,Entergy Louisiana Inc. Collateral Trust Mortgage Bonds 4.875 % Series due September 1 2066,20.0,4264751040.0,21562,Utilities
VNT,Vontier Corporation Common Stock ,30.25,4259200000.0,1588707,Industrials
WING,Wingstop Inc. Common Stock,155.79,4242559432.0,1238452,Consumer Discretionary
BFH,Bread Financial Holdings Inc. Common Stock,104.91,4239105189.0,856427,Consumer Discretionary
NVST,Envista Holdings Corporation Common Stock,26.04,4237435115.0,2345016,Health Care
STUB,StubHub Holdings Inc. Class A Common Stock,11.27,4231178382.0,7919383,Consumer Discretionary
TNGX,Tango Therapeutics Inc.,29.12,4212149236.0,4762936,Health Care
OXLCL,Oxford Lane Capital Corp. 6.75% Notes due 2031,24.26,4211536000.0,2338,Finance
KBR,KBR Inc. Common Stock,33.19,4208158673.0,1338222,Industrials
KVYO,Klaviyo Inc. Series A Common Stock,14.06,4207874171.0,6886583,Technology
REGCP,Regency Centers Corporation 6.25% Series A Cumulative Redeemable Preferred Stock,22.96,4203902298.0,5233,Real Estate
CVSA,Covista Inc. Common Shares,122.81,4179333232.0,279696,Real Estate
OPLN,OPENLANE Inc. Common Stock,39.41,4175336037.0,865132,Consumer Discretionary
RXO,RXO Inc. Common Stock,25.3,4172483894.0,1733254,Consumer Discretionary
HHH,Howard Hughes Holdings Inc. Common Stock,69.89,4167162525.0,533596,Real Estate
CLSK,CleanSpark Inc. Common Stock,16.23,4164757675.0,19536316,Finance
OXLCO,Oxford Lane Capital Corp. Preferred Stock Shares 6.00% Series 2029,23.93,4154248000.0,1867,Finance
LUNR,Intuitive Machines Inc. Class A Common Stock,19.13,4151610754.0,11479860,Industrials
DAVE,Dave Inc. Class A Common Stock,323.22,4141536805.0,733518,Finance
ATMU,Atmus Filtration Technologies Inc. Common Stock,50.69,4139975375.0,944313,Consumer Discretionary
UCB,United Community Banks Inc. Common Stock,34.55,4135173516.0,1159936,Finance
CATY,Cathay General Bancorp Common Stock,61.62,4130725970.0,581687,Finance
OPEN,Opendoor Technologies Inc Common Stock,4.28,4129072785.0,37124512,Finance
BRC,Brady Corporation Common Stock,87.64,4128964916.0,219724,Consumer Discretionary
MMSI,Merit Medical Systems Inc. Common Stock,69.2,4128115966.0,687538,Health Care
GPGI,GPGI Inc. Class A Common Stock,14.24,4127621110.0,2262759,Finance
POST,Post Holdings Inc. Common Stock,90.84,4117103712.0,890096,Consumer Staples
MWA,MUELLER WATER PRODUCTS Common Stock,26.23,4104236402.0,1747413,Industrials
HLNE,Hamilton Lane Incorporated Class A Common Stock,73.79,4097840135.0,1036613,Finance
EPAM,EPAM Systems Inc. Common Stock,78.39,4095442514.0,2112102,Technology
OLED,Universal Display Corporation Common Stock,87.56,4093508016.0,584452,Technology
WHD,Cactus Inc. Class A Common Stock,50.98,4087416578.0,975764,Consumer Discretionary
CNR,Core Natural Resources Inc. Common Stock,80.83,4074447116.0,840916,Energy
QLYS,Qualys Inc. Common Stock,115.34,4070342718.0,542338,Technology
EE,Excelerate Energy Inc. Class A Common Stock,35.7,4064774083.0,346062,Utilities
MHO,M/I Homes Inc. Common Stock,158.83,4064477012.0,490990,Consumer Discretionary
INDB,Independent Bank Corp. Common Stock,83.84,4051744902.0,449791,Finance
EXTR,Extreme Networks Inc. Common Stock,30.93,4044966262.0,1570752,Telecommunications
REGCO,Regency Centers Corporation 5.875% Series B Cumulative Redeemable Preferred Stock,22.09,4044608091.0,2461,Real Estate
BNL,Broadstone Net Lease Inc. Common Stock,21.09,4044356645.0,2231588,Real Estate
PII,Polaris Inc. Common Stock,70.92,4034366964.0,836168,Consumer Discretionary
COLD,Americold Realty Trust Inc. Common Stock,14.14,4034227575.0,3895136,Real Estate
MAT,Mattel Inc. Common Stock,13.88,4033528000.0,3738923,Consumer Discretionary
MKTX,MarketAxess Holdings Inc. Common Stock,113.46,4032306337.0,672100,Finance
EXLS,ExlService Holdings Inc. Common Stock,26.34,4024302403.0,2985889,Consumer Discretionary
ONDS,Ondas Inc. Common Stock,7.68,4019833021.0,74614212,Technology
LIF,Life360 Inc. Common Stock,49.42,4004586169.0,642615,Technology
FLY,Firefly Aerospace Inc. Common Stock,24.98,4002675721.0,7164599,Industrials
ACAD,ACADIA Pharmaceuticals Inc. Common Stock,23.36,4000069923.0,1495958,Health Care
RNST,Renasant Corporation Common Stock,43.29,3994460075.0,918129,Finance
SMG,Scotts Miracle-Gro Company (The) Common Stock,68.54,3987789962.0,1201026,Industrials
WSFS,WSFS Financial Corporation Common Stock,76.62,3987614805.0,574509,Finance
PDI,PIMCO Dynamic Income Fund Common Stock,16.4,3986676000.0,3345114,Finance
MMED,MiniMed Group Inc. Common Stock,14.13,3967986430.0,1111733,Health Care
CDP,COPT Defense Properties Common Shares of Beneficial Interest,34.97,3964789599.0,1631486,Real Estate
BCO,Brinks Company (The) Common Stock,96.24,3963221329.0,368941,Industrials
CRK,Comstock Resources Inc. Common Stock,13.46,3953145899.0,2208856,Energy
ANF,Abercrombie & Fitch Company Common Stock,88.83,3946868799.0,1454384,Consumer Discretionary
HGTY,Hagerty Inc. Class A Common Stock,11.48,3941708535.0,280059,Finance
DORM,Dorman Products Inc. Common Stock,131.87,3940643385.0,336318,Consumer Discretionary
DNLI,Denali Therapeutics Inc. Common Stock,24.82,3939175672.0,1522695,Health Care
THO,Thor Industries Inc. Common Stock,75.49,3929811088.0,772279,Industrials
APLE,Apple Hospitality REIT Inc. Common Shares,16.64,3928164099.0,5148591,Real Estate
GEO,Geo Group Inc (The) REIT,29.38,3925705184.0,2096765,Consumer Discretionary
CHEF,The Chefs' Warehouse Inc. Common Stock,95.63,3899564661.0,455115,Consumer Discretionary
BMI,Badger Meter Inc. Common Stock,133.58,3898608441.0,802529,Industrials
PI,Impinj Inc. Common Stock,127.98,3898166496.0,322387,Technology
IRT,Independence Realty Trust Inc. Common Stock,16.51,3892165618.0,3208653,Real Estate
CVBF,CVB Financial Corporation Common Stock,22.05,3890837072.0,2601398,Finance
CAKE,Cheesecake Factory Incorporated (The) Common Stock,78.17,3883904826.0,1013554,Consumer Discretionary
CNK,Cinemark Holdings Inc Cinemark Holdings Inc. Common Stock,33.16,3872682088.0,1168435,Consumer Discretionary
CNS,Cohen & Steers Inc Common Stock,74.99,3854029236.0,517003,Finance
PTRN,Pattern Group Inc. Series A Common Stock,21.79,3853911992.0,1598218,Consumer Discretionary
KBH,KB Home Common Stock,61.51,3853493611.0,4574003,Consumer Discretionary
SXI,Standex International Corporation Common Stock,317.84,3850606808.0,287169,Industrials
CPRX,Catalyst Pharmaceuticals Inc. Common Stock,31.42,3845210769.0,1180840,Health Care
ABG,Asbury Automotive Group Inc Common Stock,206.33,3841617004.0,250614,Consumer Discretionary
NTSK,Netskope Inc. Class A Common Stock,9.5,3837274666.0,5943446,Technology
BANF,BancFirst Corporation Common Stock,114.24,3836908851.0,172952,Finance
ELF,e.l.f. Beauty Inc. Common Stock,64.54,3836291548.0,2954740,Consumer Discretionary
JOE,St. Joe Company (The) Common Stock,66.82,3836119228.0,238068,Real Estate
ACHR,Archer Aviation Inc. Class A Common Stock,5.05,3835969945.0,40887154,Industrials
LOPE,Grand Canyon Education Inc. Common Stock,144.65,3835292916.0,349607,Real Estate
SKYW,SkyWest Inc. Common Stock,96.7,3835149173.0,553096,Consumer Discretionary
CRNX,Crinetics Pharmaceuticals Inc. Common Stock,36.18,3814826725.0,1762843,Health Care
DOCS,Doximity Inc. Class A Common Stock,20.83,3809224739.0,3365868,Technology
GPI,Group 1 Automotive Inc. Common Stock,317.51,3777795259.0,279212,Consumer Discretionary
YETI,YETI Holdings Inc. Common Stock,49.64,3760643154.0,975730,Consumer Discretionary
CALM,Cal-Maine Foods Inc. Common Stock,79.025,3743934867.0,729343,Consumer Staples
LFST,LifeStance Health Group Inc. Common Stock,9.65,3742602269.0,3438321,Health Care
BELFB,Bel Fuse Inc. Class B Common Stock,294.15,3742384264.0,323907,Uncategorized
SMR,NuScale Power Corporation Class A Common Stock,10.21,3731562603.0,33372149,Industrials
OTTR,Otter Tail Corporation Common Stock,88.82,3729032203.0,264744,Utilities
CON,Concentra Group Holdings Parent Inc. Common Stock,29.14,3728806269.0,815027,Health Care
IRTC,iRhythm Holdings Inc. Common Stock,112.47,3696035028.0,482957,Health Care
ASBA,Associated Banc-Corp 6.625% Fixed-Rate Reset Subordinated Notes due 2033,24.47,3692542943.0,22685,Finance
CII,BlackRock Enhanced Large Cap Core Fund Inc. Common Stock,24.76,3683358782.0,76862,Finance
FIBK,First Interstate BancSystem Inc. Common Stock (DE),37.88,3679772257.0,888669,Finance
UNMA,Unum Group 6.250% Junior Subordinated Notes due 2058,21.6,3678765984.0,34382,Finance
BKU,BankUnited Inc. Common Stock,50.43,3665338837.0,2138901,Finance
KFY,Korn Ferry Common Stock,70.63,3664784955.0,928448,Consumer Discretionary
ATRO,Astronics Corporation Common Stock,84.86,3649696473.0,781143,Industrials
NHI,National Health Investors Inc. Common Stock,75.21,3645509852.0,1520859,Real Estate
WAY,Waystar Holding Corp. Common Stock,19.0,3644444929.0,2703883,Technology
KAI,Kadant Inc Common Stock,308.39,3641611596.0,120872,Industrials
WSBC,WesBanco Inc. Common Stock,37.86,3641396002.0,1781945,Finance
PLUG,Plug Power Inc. Common Stock,2.61,3641130304.0,53335976,Energy
FLNC,Fluence Energy Inc. Class A Common Stock,19.75,3639535668.0,8162490,Miscellaneous
BHF,Brighthouse Financial Inc. Common Stock,63.09,3624254576.0,329424,Finance
RCUS,Arcus Biosciences Inc. Common Stock,28.8,3622267066.0,1789186,Health Care
OII,Oceaneering International Inc. Common Stock,36.29,3619755086.0,1142084,Energy
MSGE,Madison Square Garden Entertainment Corp. Class A Common Stock,76.51,3619323453.0,587523,Consumer Discretionary
ITRI,Itron Inc. Common Stock,81.61,3618534109.0,434899,Industrials
BETA,Beta Technologies Inc. Class A Common Stock,15.68,3618254378.0,1524201,Industrials
PTEN,Patterson-UTI Energy Inc. Common Stock,9.52,3613960057.0,16333046,Energy
LRN,Stride Inc. Common Stock,84.81,3606531680.0,675647,Real Estate
BATRA,Atlanta Braves Holdings Inc. Series A Common Stock,56.16,3602316987.0,107102,Consumer Discretionary
LASR,nLIGHT Inc. Common Stock,63.81,3599439721.0,953382,Technology
USAC,USA Compression Partners LP Common Units Representing Limited Partner Interests,24.81,3596764202.0,367366,Utilities
BFAM,Bright Horizons Family Solutions Inc. Common Stock,67.92,3573045366.0,1169302,Consumer Discretionary
ICUI,ICU Medical Inc. Common Stock,142.95,3572832976.0,322724,Health Care
BULL,Webull Corporation Class A Ordinary Shares,6.71,3568503242.0,11113282,Finance
GNW,Genworth Financial Inc Common Stock,9.29,3558155988.0,3234437,Finance
BWIN,The Baldwin Insurance Group Inc. Class A Common Stock,24.87,3545656834.0,3016983,Finance
DTG,DTE Energy Company 2021 Series E 4.375% Junior Subordinated Debentures,17.02,3540641887.0,96704,Utilities
OGN,Organon & Co. Common Stock ,13.48,3539859620.0,3099183,Health Care
DTB,DTE Energy Company 2020 Series G 4.375% Junior Subordinated Debentures due 2080,16.99,3534401038.0,20408,Utilities
SLG,SL Green Realty Corp Common Stock,49.62,3529196846.0,1126208,Real Estate
BOX,Box Inc. Class A Common Stock,25.46,3524932545.0,1959241,Technology
FHB,First Hawaiian Inc. Common Stock,28.96,3522954258.0,2277586,Finance
OSIS,OSI Systems Inc. Common Stock (DE),213.72,3522723251.0,340694,Technology
FUL,H. B. Fuller Company Common Stock,64.6,3519879192.0,1168494,Industrials
CDNL,Cardinal Infrastructure Group Inc. Class A Common Stock,81.94,3512510426.0,800277,Industrials
FOUR,Shift4 Payments Inc. Class A Common Stock,44.22,3507925019.0,2908095,Consumer Discretionary
BKD,Brookdale Senior Living Inc. Common Stock,14.69,3507822103.0,6847492,Health Care
NAN,Nuveen New York Quality Municipal Income Fund Common Stock,11.6,3506863280.0,46259,Finance
FG,F&G Annuities & Life Inc. Common Stock,26.44,3502903136.0,740162,Finance
CBU,Community Financial System Inc. Common Stock,66.6,3500158271.0,543367,Finance
FULTP,Fulton Financial Corporation Depositary Shares Each Representing a 1/40th Interest in a Share of Fixed Rate Non-Cumulative Perpetual Preferred Stock Series A,18.29,3495833288.0,2699,Finance
AAP,Advance Auto Parts Inc.,57.94,3495474312.0,1933632,Consumer Discretionary
BEAM,Beam Therapeutics Inc. Common Stock,33.9,3487605355.0,3038056,Health Care
MCHB,Mechanics Bancorp Class A Common Stock,15.67,3469354924.0,444625,Finance
MIAX,Miami International Holdings Inc. Common Stock,36.49,3463159568.0,2263690,Finance
GRBK,Green Brick Partners Inc. Common Stock,80.22,3461194822.0,371776,Consumer Discretionary
HWKN,Hawkins Inc. Common Stock,165.33,3456455112.0,164780,Consumer Discretionary
OPCH,Option Care Health Inc. Common Stock,22.01,3456175363.0,2210581,Health Care
FFBC,First Financial Bancorp. Common Stock,32.92,3454274992.0,1113633,Finance
RLAY,Relay Therapeutics Inc. Common Stock,18.02,3452382693.0,4597053,Health Care
RUN,Sunrun Inc. Common Stock,14.42,3439880719.0,53478745,Miscellaneous
KN,Knowles Corporation Common Stock,40.15,3435260499.0,956566,Consumer Staples
NSA,National Storage Affiliates Trust Common Shares of Beneficial Interest,44.44,3431324967.0,773382,Real Estate
ARQT,Arcutis Biotherapeutics Inc. Common Stock,27.37,3423531946.0,2069732,Health Care
GPCR,Structure Therapeutics Inc. American Depositary Shares,48.16,3422948691.0,756155,Health Care
NSIT,Insight Enterprises Inc. Common Stock,113.3,3422103796.0,375706,Consumer Discretionary
HAYW,Hayward Holdings Inc. Common Stock,15.76,3419336754.0,2852126,Industrials
VAC,Marriott Vacations Worldwide Corporation Common Stock,99.15,3405114796.0,528264,Finance
AVA,Avista Corporation Common Stock,41.13,3398918626.0,793762,Utilities
NTRSO,Northern Trust Corporation Depositary Shares Each Representing a 1/1000th Interest in a Share of Series E Non-Cumulative Perpetual Preferred Stock,18.35,3395617184.0,123803,Finance
AVNT,Avient Corporation Common Stock,36.82,3376768349.0,993516,Industrials
LEU,Centrus Energy Corp. Class A Common Stock,171.13,3366605237.0,652978,Industrials
DYN,Dyne Therapeutics Inc. Common Stock,20.33,3360829473.0,2186261,Health Care
CRGY,Crescent Energy Company Class A Common Stock,10.17,3358659057.0,5781118,Energy
GEF,Greif Inc. Class A Common Stock,72.68,3353186793.0,235127,Uncategorized
PVH,PVH Corp. Common Stock,72.71,3352519369.0,1362752,Industrials
IPAR,Interparfums Inc. Common Stock,104.25,3338687669.0,242881,Consumer Discretionary
BILL,BILL Holdings Inc. Common Stock,33.46,3332506485.0,2380460,Technology
NIC,Nicolet Bankshares Inc. Common Stock,156.38,3323372904.0,250403,Finance
ADEA,Adeia Inc. Common Stock,30.06,3315430095.0,2942416,Technology
BATRK,Atlanta Braves Holdings Inc. Series C Common Stock,51.66,3313669793.0,469312,Consumer Discretionary
HAE,Haemonetics Corporation Common Stock,72.87,3311648781.0,524005,Health Care
CURB,Curbline Properties Corp. Common Stock,31.28,3301270680.0,972736,Finance
COLM,Columbia Sportswear Company Common Stock,64.51,3299092492.0,454306,Consumer Discretionary
BHE,Benchmark Electronics Inc. Common Stock,91.88,3296382068.0,564934,Technology
WRBY,Warby Parker Inc. Class A Common Stock,26.85,3294904087.0,3240862,Health Care
SFNC,Simmons First National Corporation Class A Common Stock,22.7,3292957544.0,1971339,Finance
CALY,Callaway Golf Company Common Stock,18.08,3290127364.0,2512466,Consumer Discretionary
PENG,Penguin Solutions Inc. Common Stock,64.72,3284378718.0,2712978,Technology
WDFC,WD-40 Company Common Stock,244.08,3284194520.0,280645,Industrials
AB,AllianceBernstein Holding L.P.  Units,35.16,3284079471.0,612444,Finance
HP,Helmerich & Payne Inc. Common Stock,32.76,3273737988.0,1774244,Energy
PRK,Park National Corporation Common Stock,180.83,3272315774.0,114706,Finance
BELFA,Bel Fuse Inc. Class A Common Stock,257.19,3272153013.0,174097,Uncategorized
PBLS,Parabilis Medicines Inc. Common Stock,27.32,3244269643.0,599960,Health Care
BOH,Bank of Hawaii Corporation Common Stock,81.75,3239018140.0,350936,Finance
UWMC,UWM Holdings Corporation Class A Common Stock,2.02,3234198008.0,25529221,Finance
ARCB,ArcBest Corporation Common Stock,145.18,3232255580.0,439212,Industrials
RWTN,Redwood Trust Inc. 9.125% Senior Notes Due 2029,24.9,3217664254.0,4827,Real Estate
GBDC,Golub Capital BDC Inc. Common Stock,12.35,3217115485.0,1023800,Finance
TDW,Tidewater Inc. Common Stock,64.6,3212600119.0,1010185,Consumer Discretionary
NATL,NCR Atleos Corporation Common Stock,43.48,3207946443.0,651331,Miscellaneous
CSQ,Calamos Strategic Total Return Common Stock,20.16,3203174460.0,228017,Finance
RWTO,Redwood Trust Inc. 9.00% Senior Notes Due 2029,24.77,3200865203.0,26347,Real Estate
BANC,Banc of California Inc. Common Stock,20.74,3188252082.0,3311337,Finance
HIW,Highwoods Properties Inc. Common Stock,28.91,3187983670.0,1833913,Real Estate
IDYA,IDEAYA Biosciences Inc. Common Stock,36.28,3187594178.0,2256259,Health Care
GPK,Graphic Packaging Holding Company,10.77,3186707158.0,6181428,Consumer Discretionary
CC,Chemours Company (The) Common Stock,21.17,3183496100.0,6212886,Industrials
ASO,Academy Sports and Outdoors Inc. Common Stock,51.21,3175960779.0,1911015,Consumer Discretionary
CTRI,Centuri Holdings Inc. Common Stock,31.45,3174395120.0,2308132,Utilities
LXP,LXP Industrial Trust Common Stock (Maryland REIT),53.8,3171645146.0,466864,Real Estate
ALMS,Alumis Inc. Common Stock,24.85,3168175703.0,956418,Health Care
NHC,National HealthCare Corporation Common Stock,202.81,3167819391.0,103248,Health Care
PPLI,People Incorporated Common Stock,42.58,3167419580.0,828487,Technology
VC,Visteon Corporation Common Stock,118.16,3154165521.0,655337,Consumer Discretionary
PLMR,Palomar Holdings Inc. Common stock,118.91,3151575301.0,252444,Finance
FIZZ,National Beverage Corp. Common Stock,33.59,3145102306.0,434701,Consumer Staples
CRVL,CorVel Corp. Common Stock,61.93,3139305087.0,211960,Finance
SBCF,Seacoast Banking Corporation of Florida Common Stock,32.26,3137180865.0,859525,Finance
AD,Array Digital Infrastructure Inc. Common Shares,36.25,3132000000.0,240148,Telecommunications
AWR,American States Water Company Common Stock,79.87,3130317195.0,249361,Utilities
UPST,Upstart Holdings Inc. Common stock,32.65,3124982728.0,4795586,Finance
ARLP,Alliance Resource Partners L.P. Common Units representing Limited Partners Interests,24.24,3118689336.0,389560,Energy
ICHR,Ichor Holdings Ordinary Shares,89.38,3116417197.0,868448,Technology
ITGR,Integer Holdings Corporation Common Stock,91.38,3102793188.0,401991,Health Care
LBRDP,Liberty Broadband Corporation Series A Cumulative Redeemable Preferred Stock,21.62,3102420923.0,6361,Telecommunications
FGN,F&G Annuities & Life Inc. 7.950% Senior Notes due 2053,24.59,3100763295.0,31630,Finance
AEO,American Eagle Outfitters Inc. Common Stock,18.5,3100106661.0,5318936,Consumer Discretionary
UNFI,United Natural Foods Inc. Common Stock,51.18,3097369585.0,801452,Consumer Discretionary
ADPT,Adaptive Biotechnologies Corporation Common Stock,19.34,3095258541.0,5523803,Health Care
PHIN,PHINIA Inc. Common Stock,83.49,3090846387.0,606904,Consumer Discretionary
SHOO,Steven Madden Ltd. Common Stock,42.29,3090783088.0,982499,Consumer Discretionary
PRVA,Privia Health Group Inc. Common Stock,24.51,3088563287.0,911483,Health Care
MZTI,The Marzetti Company Common Stock,112.56,3086620320.0,368489,Consumer Staples
TENB,Tenable Holdings Inc. Common Stock,27.92,3078793486.0,1864167,Technology
RHI,Robert Half Inc. Common Stock,30.08,3076991157.0,2657853,Consumer Discretionary
USLM,United States Lime & Minerals Inc. Common Stock,107.18,3074142762.0,177445,Industrials
DAN,Dana Incorporated Common Stock ,28.28,3060905568.0,1556187,Consumer Discretionary
AEHR,Aehr Test Systems Common Stock,95.2,3056306322.0,1479410,Industrials
CWK,Cushman & Wakefield Ltd. Common Shares,13.0,3045906565.0,1987908,Finance
PFS,Provident Financial Services Inc Common Stock,23.37,3045430865.0,1316655,Finance
RGTIW,Rigetti Computing Inc. Warrants,9.09,3021505156.0,198616,Technology
HTFL,Heartflow Inc. Common Stock,34.91,3010667305.0,1687817,Health Care
BSM,Black Stone Minerals L.P. Common units representing limited partner interests,14.16,3008990527.0,284046,Energy
RNG,RingCentral Inc. Class A Common Stock,35.85,3006330953.0,1278913,Technology
COHU,Cohu Inc. Common Stock,63.66,3003182590.0,1276357,Industrials
NMIH,NMI Holdings Inc. Common Stock,39.45,2997091100.0,509889,Finance
MGRC,McGrath RentCorp Common Stock,121.79,2991377968.0,255526,Consumer Discretionary
MMS,Maximus Inc. Common Stock,56.78,2983241811.0,796182,Consumer Discretionary
TDC,Teradata Corporation Common Stock,31.69,2982029000.0,3435461,Technology
PATK,Patrick Industries Inc. Common Stock,90.28,2969600172.0,635260,Consumer Discretionary
HLIO,Helios Technologies Inc. Common Stock,89.57,2959962286.0,480297,Industrials
RH,RH Common Stock,156.54,2958757687.0,1118278,Consumer Discretionary
BXMT,Blackstone Mortgage Trust Inc. Common Stock,17.47,2946901094.0,3062553,Real Estate
CXW,CoreCivic Inc. Common Stock,29.8,2946876108.0,1278334,Real Estate
CPK,Chesapeake Utilities Corporation Common Stock,122.04,2929541032.0,220134,Utilities
UE,Urban Edge Properties Common Shares of Beneficial Interest,23.23,2927444461.0,2076144,Finance
AKR,Acadia Realty Trust Common Stock,21.84,2916014359.0,3776751,Real Estate
ELVN,Enliven Therapeutics Inc. Common Stock,47.77,2909429270.0,2972617,Health Care
ASH,Ashland Inc. Common Stock,63.44,2904776573.0,851228,Consumer Discretionary
ROG,Rogers Corporation Common Stock,162.14,2893961465.0,283681,Industrials
MGEE,MGE Energy Inc,78.72,2893465540.0,217855,Energy
GPOR,Gulfport Energy Corporation Common Shares,160.96,2892393415.0,271693,Energy
PK,Park Hotels & Resorts Inc. Common Stock ,14.34,2887528714.0,4759317,Consumer Discretionary
TARS,Tarsus Pharmaceuticals Inc. Common Stock,67.11,2887337888.0,910201,Health Care
DBD,Diebold Nixdorf Incorporated Common stock,83.36,2886622757.0,741522,Miscellaneous
NTCT,NetScout Systems Inc. Common Stock,40.29,2880542212.0,576147,Technology
DBRG,DigitalBridge Group Inc.,15.73,2868717569.0,1776284,Real Estate
FA,First Advantage Corporation Common Stock,16.72,2868099426.0,1291160,Technology
RARE,Ultragenyx Pharmaceutical Inc. Common Stock,29.11,2867021311.0,1727819,Health Care
KALU,Kaiser Aluminum Corporation Common Stock,174.87,2857481771.0,400149,Industrials
CLMT,Calumet Inc. Common Stock,32.74,2853197593.0,856839,Energy
TR,Tootsie Roll Industries Inc. Common Stock,37.94,2851994607.0,361530,Consumer Staples
BTU,Peabody Energy Corporation Common Stock ,23.29,2837514535.0,2437239,Energy
VERA,Vera Therapeutics Inc. Class A Common Stock,39.51,2836142537.0,2532034,Health Care
HTGC,Hercules Capital Inc. Common Stock,15.15,2834846639.0,1158945,Finance
CWT,California Water Service Group Common Stock,47.3,2831059293.0,505691,Utilities
VISN,Vistance Networks Inc. Common Stock,12.55,2830898869.0,3756452,Technology
CENT,Central Garden & Pet Company Common Stock,45.15,2825070672.0,85916,Consumer Discretionary
APAM,Artisan Partners Asset Management Inc. Class A Common Stock,34.85,2824863006.0,612472,Finance
WOR,Worthington Enterprises Inc. Common Shares,57.3,2822196556.0,733102,Industrials
BKV,BKV Corporation Common Stock,25.78,2819986832.0,725090,Energy
QTWO,Q2 Holdings Inc. Common Stock,45.03,2818897048.0,641684,Technology
FBK,FB Financial Corporation Common Stock,54.68,2817302902.0,404547,Finance
CARG,CarGurus Inc. Class A Common Stock ,31.2,2813837458.0,1080141,Technology
FSK,FS KKR Capital Corp. Common Stock,10.04,2811866987.0,3183356,Finance
EXPO,Exponent Inc. Common Stock,57.94,2810763784.0,488224,Consumer Discretionary
TRN,Trinity Industries Inc. Common Stock,35.32,2808134366.0,532821,Industrials
FTAIM,FTAI Aviation Ltd. 9.500% Fixed-Rate Reset Series D Cumulative Perpetual Redeemable Preferred Shares,27.3399,2804608196.0,10871,Industrials
DX,Dynex Capital Inc. Common Stock,13.01,2799113300.0,4392815,Real Estate
WAFD,WaFd Inc. Common Stock,37.74,2788551235.0,704042,Finance
GRAL,GRAIL Inc. Common Stock ,64.58,2771553576.0,642449,Health Care
KLRA,Kailera Therapeutics Inc. Common Stock,21.37,2768817043.0,473968,Health Care
IVT,InvenTrust Properties Corp. Common Stock,35.46,2763605489.0,1119514,Real Estate
AMBA,Ambarella Inc. Ordinary Shares,62.99,2763256973.0,1074441,Technology
FCPT,Four Corners Property Trust Inc. Common Stock,25.15,2760192305.0,771926,Real Estate
POWWP,Outdoor Holding Company 8.75% Series A Cumulative Redeemable Perpetual Preferred Stock,23.75,2758882983.0,1392,Industrials
UNIT,Uniti Group Inc. Common Stock,11.32,2748673181.0,2123654,Real Estate
CLOV,Clover Health Investments Corp. Class A Common Stock,5.21,2744025328.0,8272563,Health Care
SOUN,SoundHound AI Inc Class A Common Stock,6.34,2743759486.0,28538235,Technology
PAY,Paymentus Holdings Inc. Class A Common Stock,21.73,2733402293.0,794995,Consumer Discretionary
BCC,Boise Cascade L.L.C. Common Stock,77.66,2732834898.0,431699,Consumer Discretionary
PENN,PENN Entertainment Inc. Common Stock,20.38,2727727901.0,3662806,Consumer Discretionary
WT,WisdomTree Inc. Common Stock,17.83,2726942791.0,3756773,Finance
DK,Delek US Holdings Inc. Common Stock,44.41,2721779740.0,887038,Energy
RDW,Redwire Corporation Common Stock,11.38,2717832426.0,21101751,Industrials
ZIONP,Zions Bancorporation N.A. Depositary Shares (Each representing 1/40th Interest in a Share of Series A Floating-Rate Non-Cumulative Perpetual Preferred Stock),18.46,2715314942.0,1532,Finance
