symbol,name,price,marketCap,volume,industry
GAIN,Gladstone Investment Corporation Business Development Company,16.82,669805485.0,367837,Finance
BH,Biglari Holdings Inc. Class B Common Stock,290.2,665810503.0,52757,Consumer Discretionary
TRTX,TPG RE Finance Trust Inc. Common Stock,8.61,665623679.0,611938,Real Estate
FET,Forum Energy Technologies Inc. Common Stock,58.74,665445312.0,451309,Consumer Discretionary
XFLT,XAI Octagon Floating Rate & Alternative Income Trust Common Shares of Beneficial Interest,18.76,665389660.0,157254,Finance
NXP,Nuveen Select Tax Free Income Portfolio Common Stock,14.18,663611422.0,165900,Finance
METCB,Ramaco Resources Inc. Class B Common Stock,10.07,661368840.0,61116,Energy
RSVR,Reservoir Media Inc. Common Stock,10.07,660594205.0,45402,Consumer Discretionary
MITK,Mitek Systems Inc. Common Stock,14.54,658898842.0,826230,Technology
KE,Kimball Electronics Inc. Common Stock,27.21,658866586.0,125449,Technology
DNUT,Krispy Kreme Inc. Common Stock,3.82,658486279.0,2043944,Consumer Staples
MVST,Microvast Holdings Inc. Common Stock,1.98,657425233.0,1736020,Miscellaneous
HOV,Hovnanian Enterprises Inc. Class A Common Stock,110.46,655932909.0,85919,Consumer Discretionary
SMC,Summit Midstream Corporation Common Stock,32.2,655071616.0,60945,Utilities
HZO,MarineMax Inc.  (FL) Common Stock,29.68,653795611.0,318764,Consumer Discretionary
SHBI,Shore Bancshares Inc Common Stock,19.5,652285569.0,193512,Finance
VMO,Invesco Municipal Opportunity Trust Common Stock,9.63,649453797.0,305605,Finance
VLGEA,Village Super Market Inc. Class A Common Stock,44.01,649234200.0,35848,Consumer Staples
TIPT,Tiptree Inc. Common Stock,17.12,648455216.0,271518,Finance
ASPI,ASP Isotopes Inc. Common Stock,5.15,648402752.0,2811013,Industrials
AMWD,American Woodmark Corporation Common Stock,44.34,646015842.0,131443,Basic Materials
BALY,Bally's Corporation Common Stock,13.24,645359121.0,33159,Consumer Discretionary
CWBC,Community West Bancshares Common Stock,23.77,644318534.0,153267,Finance
CARS,Cars.com Inc. Common Stock ,11.07,643508200.0,512898,Technology
WYFI,WhiteFiber Inc. Ordinary Shares,16.65,638783277.0,613646,Finance
SPIR,Spire Global Inc. Class A Common Stock,18.18,636506979.0,955659,Consumer Discretionary
FCEL,FuelCell Energy Inc. Common Stock,13.31,634568132.0,10296645,Energy
CNNE,Cannae Holdings Inc. Common Stock,13.67,633258909.0,544056,Consumer Discretionary
OXM,Oxford Industries Inc. Common Stock,42.53,633163419.0,164587,Industrials
RYAM,Rayonier Advanced Materials Inc. Common Stock,9.31,627434099.0,662840,Basic Materials
TCBX,Third Coast Bancshares Inc. Common Stock,37.8,626046889.0,84571,Finance
PD,PagerDuty Inc. Common Stock,7.35,624599193.0,2395242,Technology
IMSR,Terrestrial Energy Inc. Common Stock  ,7.58,623797252.0,1724122,Uncategorized
NXDR,Nextdoor Holdings Inc. Class A Common Stock,1.65,623065973.0,2008901,Technology
GOOD,Gladstone Commercial Corporation Real Estate Investment Trust,12.85,622029860.0,308968,Real Estate
RMT,Royce Micro-Cap Trust Inc. Common Stock,13.38,619080652.0,121451,Finance
AVR,Anteris Technologies Global Corp. Common Stock,6.36,618395863.0,1052565,Health Care
RILYT,BRC Group Holdings Inc. 6.00% Senior Notes Due 2028,20.25,617565587.0,45868,Finance
ACRS,Aclaris Therapeutics Inc. Common Stock,4.41,615916829.0,1076519,Health Care
PRME,Prime Medicine Inc. Common Stock,3.41,615900181.0,1847017,Health Care
NPB,Northpointe Bancshares Inc. Common Stock,17.83,615030088.0,136201,Finance
HIFS,Hingham Institution for Savings Common Stock,286.39,614993886.0,23808,Finance
WTI,W&T Offshore Inc. Common Stock,4.13,614451893.0,5356797,Energy
AROW,Arrow Financial Corporation Common Stock,37.14,613798964.0,61337,Finance
SSTK,Shutterstock Inc. Common Stock,16.69,613157454.0,263151,Technology
AIV,Apartment Investment and Management Company Common Stock,4.26,612827340.0,1477136,Real Estate
CRMD,CorMedix Inc. Common Stock,7.79,611065439.0,735816,Health Care
FTK,Flotek Industries Inc. Common Stock,16.88,610622825.0,150895,Industrials
CASS,Cass Information Systems Inc Common Stock,47.3,610221084.0,53786,Real Estate
HSTM,HealthStream Inc. Common Stock,20.72,609616215.0,197863,Technology
OCGN,Ocugen Inc. Common Stock,1.8,609333340.0,3772469,Health Care
MG,Mistras Group Inc Common Stock,19.28,609162435.0,156404,Consumer Discretionary
PSTL,Postal Realty Trust Inc. Class A Common Stock,22.17,609066300.0,268109,Real Estate
BZH,Beazer Homes USA Inc. Common Stock,20.63,608725408.0,631077,Consumer Discretionary
WASH,Washington Trust Bancorp Inc. Common Stock,31.94,608135939.0,260276,Finance
VITL,Vital Farms Inc. Common Stock,14.18,607591078.0,3215474,Consumer Staples
DGICA,Donegal Group Inc. Class A Common Stock,16.41,607218639.0,179691,Finance
MOV,Movado Group Inc. Common Stock,27.45,606040771.0,127269,Consumer Discretionary
BCAL,California BanCorp Common Stock,18.84,605749294.0,105291,Finance
PSNL,Personalis Inc. Common Stock,5.78,605038262.0,1970977,Health Care
BRCB,Black Rock Coffee Bar Inc. Class A Common Stock,12.08,604674149.0,208744,Consumer Discretionary
GOGO,Gogo Inc. Common Stock,4.47,604516198.0,1607607,Consumer Discretionary
CTRN,Citi Trends Inc. Common Stock,47.96,603702639.0,100567,Consumer Discretionary
DNA,Ginkgo Bioworks Holdings Inc. Class A Common Stock,9.7,602713836.0,2108726,Health Care
RRBI,Red River Bancshares Inc. Common Stock,91.34,600760169.0,132070,Consumer Discretionary
SSSSL,SuRo Capital Corp. 6.00% Notes due 2026,25.08,599113724.0,3502,Finance
BSTZ,BlackRock Science and Technology Term Trust Common Shares of Beneficial Interest,26.97,597596675.0,242956,Finance
CTKB,Cytek Biosciences Inc. Common Stock,4.62,596638752.0,431322,Industrials
WHFCL,WhiteHorse Finance Inc. 7.875% Notes due 2028,25.63,595720345.0,211,Uncategorized
ZVRA,Zevra Therapeutics Inc. Common Stock,10.07,595286540.0,684967,Health Care
RMR,The RMR Group Inc. Class A Common Stock,18.56,594999765.0,295784,Consumer Discretionary
TYG,Tortoise Energy Infrastructure Corporation Common Stock,49.76,593532453.0,111518,Finance
TASK,TaskUs Inc. Class A Common Stock,6.54,592270588.0,410473,Technology
SXC,SunCoke Energy Inc. Common Stock,6.97,591361105.0,1488272,Industrials
ULH,Universal Logistics Holdings Inc. Common Stock,22.4,590241299.0,59919,Industrials
NHPAP,National Healthcare Properties Inc. 7.375% Series A Cumulative Redeemable Perpetual Preferred Stock,20.7601,589839760.0,2302,Real Estate
ORN,Orion Group Holdings Inc. Common,14.57,589783080.0,581001,Industrials
STRO,Sutro Biopharma Inc. Common Stock,35.59,589651098.0,199301,Health Care
PAR,PAR Technology Corporation Common Stock,14.26,588170798.0,1215880,Miscellaneous
PHR,Phreesia Inc. Common Stock,9.67,587578839.0,1630569,Real Estate
NFBK,Northfield Bancorp Inc. Common Stock (Delaware),14.06,587201798.0,126030,Finance
SIBN,SI-BONE Inc. Common Stock,13.21,583901458.0,1024687,Health Care
NHPBP,National Healthcare Properties Inc. 7.125% Series B Cumulative Redeemable Perpetual Preferred Stock,20.55,583870361.0,1467,Real Estate
PROK,ProKidney Corp. Class A Ordinary Shares,1.93,582795069.0,386172,Health Care
AUROW,Aurora Innovation Inc. Warrant,0.2969,581974028.0,201115,Technology
GTN,Gray Media Inc. Common Stock,5.66,581745492.0,720824,Industrials
BHB,Bar Harbor Bankshares Inc. Common Stock,34.65,580113904.0,61652,Finance
MGR,Affiliated Managers Group Inc. 5.875% Junior Subordinated Notes due 2059,20.41,579890206.0,14729,Finance
NPCE,Neuropace Inc. Common Stock,17.07,579534164.0,154017,Health Care
KRT,Karat Packaging Inc. Common Stock,28.97,578349287.0,36661,Industrials
TDUP,ThredUp Inc. Class A Common Stock,4.48,577891400.0,2361124,Consumer Discretionary
GRPN,Groupon Inc. Common Stock,14.89,577714728.0,1398382,Consumer Discretionary
FBRX,Forte Biosciences Inc. Common Stock,28.19,577297851.0,287031,Health Care
WEST,Westrock Coffee Company Common Stock,5.9,575591976.0,483763,Consumer Staples
MAMA,Mama's Creations Inc. Common Stock,14.15,575296550.0,333729,Consumer Staples
ERII,Energy Recovery Inc. Common Stock,11.04,574100523.0,858672,Technology
CARE,Carter Bankshares Inc. Common Stock,25.88,573500282.0,251788,Finance
HY,Hyster-Yale Inc. Class A common stock,39.67,573383277.0,75750,Industrials
PRTA,Prothena Corporation plc Ordinary Shares,10.64,572782928.0,516365,Health Care
RFI,Cohen & Steers Total Return Realty Fund Inc. Common Stock,11.63,571482244.0,99584,Finance
ACIC,American Coastal Insurance Corporation Common Stock,11.82,571412026.0,91510,Finance
MLAB,Mesa Laboratories Inc. Common Stock,103.31,570768431.0,219314,Industrials
GLOO,Gloo Holdings Inc. Class A Common Stock,7.03,568524002.0,194829,Technology
RILYZ,BRC Group Holdings Inc. 5.25% Senior Notes due 2028,18.63,568160340.0,90054,Finance
IIM,Invesco Value Municipal Income Trust Common Stock,12.07,568116059.0,134811,Finance
PFIS,Peoples Financial Services Corp. Common Stock,56.71,567422566.0,195491,Finance
MAX,MediaAlpha Inc. Class A Common Stock,9.1,567388840.0,1132027,Real Estate
MSBI,Midland States Bancorp Inc. Common Stock,26.39,566492094.0,107472,Finance
GEMI,Gemini Space Station Inc. Class A Common Stock,4.72,566331050.0,1875410,Finance
SD,SandRidge Energy Inc. Common Stock,15.34,566326093.0,400708,Energy
FEIM,Frequency Electronics Inc. Common Stock,57.53,566206060.0,340632,Industrials
INN,Summit Hotel Properties Inc. Common Stock,5.19,564665180.0,1005096,Real Estate
AMSF,AMERISAFE Inc. Common Stock,30.18,564479809.0,209008,Finance
TRDA,Entrada Therapeutics Inc. Common Stock,14.5,562898932.0,323351,Health Care
UHT,Universal Health Realty Income Trust Common Stock,40.56,562792957.0,60402,Real Estate
ALOY,REalloys Inc. Common Stock,9.85,562710810.0,2401475,Technology
BWMN,Bowman Consulting Group Ltd. Common Stock,32.76,561013165.0,133734,Consumer Discretionary
RDVT,Red Violet Inc. Common Stock ,39.65,559556303.0,77127,Technology
JOUT,Johnson Outdoors Inc. Class A Common Stock,53.34,557565900.0,56318,Consumer Discretionary
VGM,Invesco Trust for Investment Grade Municipals Common Stock (DE),10.24,555335352.0,192564,Finance
BWBBP,Bridgewater Bancshares Inc. Depositary Shares Each Representing a 1/100th Interest in a Share of 5.875% Non-Cumulative Perpetual Preferred Stock Series A,19.94,554821826.0,229,Finance
NRIM,Northrim BanCorp Inc Common Stock,24.73,549987187.0,76590,Finance
KELYB,Kelly Services Inc. Class B Common Stock,16.0619,549503748.0,2611,Consumer Discretionary
MDXG,MiMedx Group Inc Common Stock,3.68,548120290.0,2627489,Health Care
TECX,Tectonic Therapeutic Inc. Common Stock,29.06,547737410.0,117266,Health Care
ALT,Altimmune Inc. Common Stock,2.82,547642190.0,4888169,Health Care
FFIC,Flushing Financial Corporation Common Stock,16.14,546881724.0,130685,Finance
EMBC,Embecta Corp. Common Stock,9.23,546599252.0,746078,Health Care
CERS,Cerus Corporation Common Stock,2.72,545003609.0,24812195,Technology
MLR,Miller Industries Inc. Common Stock,47.83,543909846.0,145207,Consumer Discretionary
CPS,Cooper-Standard Holdings Inc. Common Stock,30.62,543666796.0,134950,Consumer Discretionary
RIGL,Rigel Pharmaceuticals Inc. Common Stock,29.4,543312559.0,197087,Health Care
BMBL,Bumble Inc. Class A Common Stock,4.16,542593659.0,2391067,Technology
ALTI,AlTi Global Inc. Class A Common Stock,3.6,542423340.0,167104,Finance
MSBIP,Midland States Bancorp Inc. Depositary Shares Each Representing a 1/40th Interest in a Share of 7.750% Fixed-Rate Reset Non-Cumulative Perpetual Preferred Stock Series A,25.26,542235328.0,730,Finance
TREE,LendingTree Inc. Common Stock,38.81,541516629.0,1473970,Finance
MCS,Marcus Corporation (The) Common Stock,17.58,540377749.0,191858,Consumer Discretionary
KYTX,Kyverna Therapeutics Inc. Common Stock,8.87,536903699.0,533077,Health Care
FMNB,Farmers National Banc Corp. Common Stock,14.21,536267765.0,302814,Finance
ANGX,Angel Studios Inc. Class A Common Stock,3.15,534987719.0,3769889,Consumer Discretionary
EBF,Ennis Inc. Common Stock,21.12,534185330.0,146044,Consumer Discretionary
IPI,Intrepid Potash Inc Common Stock,39.72,533588193.0,191336,Industrials
ACNB,ACNB Corporation Common Stock,51.53,533515958.0,102950,Finance
VKQ,Invesco Municipal Trust Common Stock,9.64,533434365.0,246081,Finance
UNTY,Unity Bancorp Inc. Common Stock,53.15,532373095.0,37061,Finance
ETD,Ethan Allen Interiors Inc. Common Stock,20.82,529792778.0,613250,Consumer Discretionary
LDI,loanDepot Inc. Class A Common Stock,1.57,529125083.0,1072803,Finance
TRC,Tejon Ranch Co Common Stock,19.57,528472859.0,151200,Finance
STTK,Shattuck Labs Inc. Common Stock,6.99,528316691.0,390148,Health Care
MNRO,Monro Inc. Common Stock,17.58,527745623.0,730937,Consumer Discretionary
KRNY,Kearny Financial Corp Common Stock,8.13,526329298.0,236002,Finance
BME,Blackrock Health Sciences Trust,39.39,525187579.0,36531,Finance
BDN,Brandywine Realty Trust Common Stock,3.02,524609781.0,2191134,Real Estate
EIKN,Eikon Therapeutics Inc. Common Stock,9.68,524061212.0,158836,Health Care
AQST,Aquestive Therapeutics Inc. Common Stock,4.2,521995076.0,973815,Health Care
TCMD,Tactile Systems Technology Inc. Common Stock,22.89,520756885.0,331215,Health Care
NGS,Natural Gas Services Group Inc. Common Stock,41.29,520186491.0,71346,Energy
CYRX,CryoPort Inc. Common Stock,10.35,519548327.0,314259,Health Care
CIVB,Civista Bancshares Inc. Common Stock,25.07,519339716.0,41646,Finance
IQI,Invesco Quality Municipal Income Trust Common Stock,9.8,518261211.0,165912,Finance
CBNK,Capital Bancorp Inc. Common Stock,31.61,517450769.0,59452,Finance
SFIX,Stitch Fix Inc. Class A Common Stock,3.79,517420351.0,1163932,Consumer Discretionary
MATV,Mativ Holdings Inc. Common Stock,9.39,515218577.0,416829,Basic Materials
CCAP,Crescent Capital BDC Inc. Common stock,13.93,514982140.0,175141,Finance
LEGH,Legacy Housing Corporation Common Stock (TX),21.62,514822812.0,92837,Consumer Discretionary
ILPT,Industrial Logistics Properties Trust Common Shares of Beneficial Interest,7.7,513324127.0,454525,Real Estate
IIIN,Insteel Industries Inc. Common Stock,26.4,513037721.0,352686,Industrials
VSTM,Verastem Inc. Common Stock,5.84,513002530.0,2040219,Health Care
BTBT,Bit Digital Inc. Ordinary Shares,1.57,512726234.0,12247310,Finance
EVER,EverQuote Inc. Class A Common Stock,14.49,512558798.0,1943454,Technology
VCV,Invesco California Value Municipal Income Trust Common Stock,10.69,511949712.0,144848,Finance
UPB,Upstream Bio Inc. Common Stock,9.4,511547868.0,489708,Health Care
CLNE,Clean Energy Fuels Corp. Common Stock,2.33,511274114.0,1151993,Utilities
BWB,Bridgewater Bancshares Inc. Common Stock,18.34,510302522.0,40127,Finance
TWI,Titan International Inc. (DE) Common Stock,7.88,507251045.0,736273,Industrials
SCVL,Shoe Carnival Inc. Common Stock,18.43,506533456.0,239701,Consumer Discretionary
CCSI,Consensus Cloud Solutions Inc. Common Stock,27.46,505207707.0,80323,Technology
HPP,Hudson Pacific Properties Inc. Common Stock,9.31,504993243.0,833410,Finance
BLMN,Bloomin' Brands Inc. Common Stock,5.92,504547528.0,2097393,Consumer Discretionary
INV,Innventure Inc. Common Stock,6.3,504436710.0,2060043,Finance
PANL,Pangaea Logistics Solutions Ltd. Common Shares,7.72,504259955.0,557201,Consumer Discretionary
MRAM,Everspin Technologies Inc. Common Stock,21.49,503888430.0,4677864,Technology
CHCT,Community Healthcare Trust Incorporated Common Stock,17.61,503149275.0,198862,Real Estate
CVGW,Calavo Growers Inc. Common Stock,28.11,502440361.0,189334,Consumer Discretionary
OLP,One Liberty Properties Inc. Common Stock,22.89,499302477.0,48332,Real Estate
FTHY,First Trust High Yield Opportunities 2027 Term Fund Common Stock,13.56,498641731.0,34846,Finance
CBIO,Crescent Biopharma Inc. Common Stock,18.07,498224865.0,982238,Health Care
PACB,Pacific Biosciences of California Inc. Common Stock,1.6,496779358.0,4991042,Industrials
GDYN,Grid Dynamics Holdings Inc. Class A Common Stock,5.81,495905410.0,2801236,Technology
HBCP,Home Bancorp Inc. Common Stock,63.26,495799997.0,81304,Finance
ACTG,Acacia Research Corporation (Acacia Tech) Common Stock,5.13,494919156.0,184445,Miscellaneous
TITN,Titan Machinery Inc. Common Stock,21.22,494620524.0,110147,Consumer Discretionary
XOMA,XOMA Royalty Corporation Common Stock,41.38,493072907.0,375578,Health Care
GEVO,Gevo Inc. Common Stock,2.03,493051258.0,2676900,Industrials
IMMX,Immix Biopharma Inc. Common Stock,9.3,493012456.0,803677,Health Care
CTNM,Contineum Therapeutics Inc. Class A Common Stock,13.2,492835675.0,462233,Health Care
KLC,KinderCare Learning Companies Inc. Common Stock,4.16,492661724.0,1009723,Consumer Discretionary
RILYL,BRC Group Holdings Inc. Depositary Shares each representing 1/1000th in a share of 7.375% Series B Cumulative Perpetual Preferred Stock par value $0.0001,14.015,492640312.0,35131,Finance
AGL,agilon health inc. Common Stock,29.58,491205332.0,340444,Health Care
ETO,Eaton Vance Tax-Advantage Global Dividend Opp Common Stock,29.97,491152496.0,30828,Finance
PTLO,Portillo's Inc. Class A Common Stock,6.49,490543801.0,1412626,Consumer Discretionary
FULC,Fulcrum Therapeutics Inc. Common Stock,7.36,490421243.0,767209,Health Care
OOMA,Ooma Inc. Common Stock,17.73,487748896.0,333571,Technology
AHRT,AH Realty Trust Inc. Common Stock,6.08,487474269.0,634324,Finance
VREX,Varex Imaging Corporation Common Stock,11.61,486459000.0,286240,Technology
LYEL,Lyell Immunopharma Inc. Common Stock,20.83,486016475.0,54249,Health Care
MTW,Manitowoc Company Inc. (The) Common Stock,13.51,485120430.0,155318,Industrials
ADV,Advantage Solutions Inc. Class A Common Stock,36.96,485062855.0,77589,Real Estate
OVID,Ovid Therapeutics Inc. Common Stock,2.79,482773595.0,953624,Health Care
RBBN,Ribbon Communications Inc. Common Stock,2.75,482645980.0,863955,Technology
IMXI,International Money Express Inc. Common Stock,15.94,480379524.0,293660,Real Estate
PACK,Ranpak Holdings Corp Class A Common Stock,5.61,479819586.0,1889148,Consumer Discretionary
BSRR,Sierra Bancorp Common Stock,36.56,478686807.0,26773,Finance
MBUU,Malibu Boats Inc. Class A Common Stock,25.71,478271175.0,161245,Industrials
MGRB,Affiliated Managers Group Inc. 4.750% Junior Subordinated Notes due 2060,16.82,477890900.0,41042,Finance
PUBM,PubMatic Inc. Class A Common Stock,10.23,477478365.0,750938,Technology
FBIOP,Fortress Biotech Inc. 9.375% Series A Cumulative Redeemable Perpetual Preferred Stock,14.35,476693683.0,2248,Health Care
FDMT,4D Molecular Therapeutics Inc. Common Stock,9.09,475177341.0,794038,Health Care
RILYP,BRC Group Holdings Inc. Depositary Shares each representing a 1/1000th fractional interest in a share of Series A Cumulative Perpetual Preferred Stock,13.5,474537582.0,37444,Finance
CADL,Candel Therapeutics Inc. Common Stock,6.47,474058446.0,1594189,Health Care
FBIZ,First Business Financial Services Inc. Common Stock,56.54,472796866.0,32001,Finance
RGNX,REGENXBIO Inc. Common Stock,9.12,470749165.0,565282,Health Care
XRN,Chiron Real Estate Inc. Common Stock,35.47,469439420.0,73070,Real Estate
SFST,Southern First Bancshares Inc. Common Stock,56.81,468552405.0,74519,Finance
FPI,Farmland Partners Inc. Common Stock,10.71,467270339.0,592427,Real Estate
NATR,Nature's Sunshine Products Inc. Common Stock,26.66,466752829.0,56876,Health Care
DVLT,Datavault AI Inc. Common Stock,0.7438,463035736.0,53701658,Technology
ELA,Envela Corporation Common Stock,17.8,462149873.0,62518,Consumer Discretionary
ANGO,AngioDynamics Inc. Common Stock,11.16,461119091.0,260387,Health Care
ALMU,Aeluma Inc. Common Stock,25.58,460515435.0,2294368,Technology
BLW,Blackrock Limited Duration Income Trust,12.86,459246714.0,94907,Consumer Discretionary
BBNX,Beta Bionics Inc. Common Stock,10.29,458539842.0,466681,Health Care
COFS,ChoiceOne Financial Services Inc. Common Stock,30.6,457681660.0,65060,Finance
WEAV,Weave Communications Inc. Common Stock,5.75,457485301.0,5143659,Technology
OBT,Orange County Bancorp Inc. Common Stock,34.1,457202229.0,51944,Finance
ELMT,The Elmet Group Co. Common Stock,15.65,455765153.0,429134,Industrials
SWMR,Swarmer Inc Common Stock,36.84,454921650.0,257737,Technology
CAL,Caleres Inc. Common Stock,13.43,454501270.0,535724,Consumer Discretionary
ETB,Eaton Vance Tax-Managed Buy-Write Income Fund Eaton Vance Tax-Managed Buy-Write Income Fund Common Shares of Beneficial Interest,15.45,453788099.0,88395,Finance
MYGN,Myriad Genetics Inc. Common Stock,4.8,453326539.0,2010328,Health Care
BBW,Build-A-Bear Workshop Inc. Common Stock,36.02,453148854.0,315014,Consumer Discretionary
GUT,Gabelli Utility Trust (The) Common Stock,6.17,452872009.0,122826,Finance
MEC,Mayville Engineering Company Inc. Common Stock,22.24,451880549.0,111067,Industrials
HQL,abrdn Life Sciences Investors Shares of Beneficial Interest,17.55,450677612.0,64967,Finance
AURA,Aura Biosciences Inc. Common Stock,7.01,450040444.0,205909,Health Care
NPWR,NET Power Inc. Class A Common Stock,1.99,447275745.0,813187,Energy
AVIR,Atea Pharmaceuticals Inc. Common Stock,5.58,446551212.0,199133,Health Care
NMRA,Neumora Therapeutics Inc. Common Stock,2.44,445758905.0,3502551,Health Care
BGS,B&G Foods Inc. Common Stock,5.54,445477378.0,1066680,Consumer Staples
ITIC,Investors Title Company Common Stock,234.83,443358101.0,8590,Finance
SSP,E.W. Scripps Company (The) Class A Common Stock,4.97,442473340.0,507665,Industrials
CMCO,Columbus McKinnon Corporation Common Stock,15.38,442011449.0,221931,Industrials
APPS,Digital Turbine Inc. Common Stock,3.68,441231753.0,942840,Miscellaneous
BYND,Beyond Meat Inc. Common Stock,0.9487,439780872.0,113159647,Consumer Staples
SRTA,Strata Critical Medical Inc. Class A Common Stock,5.08,439149185.0,424021,Consumer Discretionary
CATX,Perspective Therapeutics Inc. Common Stock,3.85,438968357.0,1002878,Health Care
PRTH,Priority Technology Holdings Inc. Common Stock,5.33,438965059.0,148277,Real Estate
PRTC,PureTech Health plc American Depositary Shares,18.14,438414849.0,45078,Health Care
EBS,Emergent BioSolutions Inc. Common Stock,8.47,437428873.0,1407277,Health Care
AIOT,PowerFleet Inc. Common Stock,3.26,437320123.0,946571,Telecommunications
RXT,Rackspace Technology Inc. Common Stock,1.77,437038486.0,6108914,Technology
GBFH,GBank Financial Holdings Inc. Common Stock,30.66,436532297.0,85657,Finance
LTBR,Lightbridge Corporation Common Stock,12.57,435570348.0,718709,Consumer Discretionary
CRNC,Cerence Inc. Common Stock,9.67,435324853.0,764829,Technology
GLAD,Gladstone Capital Corporation Common Stock,19.26,435142509.0,192492,Consumer Discretionary
ASMB,Assembly Biosciences Inc. Common Stock,27.37,434980681.0,70847,Health Care
QUAD,Quad Graphics Inc Class A Common Stock,8.43,434646779.0,807682,Consumer Discretionary
ATNI,ATN International Inc. Common Stock,28.2,433740055.0,50933,Telecommunications
TSSI,TSS Inc. Common Stock,14.99,432616916.0,784570,Consumer Discretionary
VHI,Valhi Inc. Common Stock,15.25,431609968.0,13649,Basic Materials
MGRD,Affiliated Managers Group Inc. 4.200% Junior Subordinated Notes due 2061,15.16,430726875.0,2901,Finance
ABAT,American Battery Technology Company Common Stock,3.27,430689231.0,3420159,Basic Materials
IVVD,Invivyd Inc. Common Stock,1.52,429861872.0,1877485,Health Care
ATOM,Atomera Incorporated Common Stock,11.09,429437726.0,8193056,Technology
OSPN,OneSpan Inc. Common Stock,11.54,427803275.0,1176061,Technology
EVH,Evolent Health Inc Class A Common Stock,3.75,427568528.0,1510368,Consumer Discretionary
LXEO,Lexeo Therapeutics Inc. Common Stock,5.77,427482354.0,448587,Health Care
CLYM,Climb Bio Inc. Common Stock,8.91,425617718.0,1791093,Health Care
CABO,Cable One Inc. Common Stock,75.01,425470372.0,364434,Telecommunications
PDLB,Ponce Financial Group Inc. Common Stock,17.6,425160226.0,22829,Finance
RPD,Rapid7 Inc. Common Stock,6.35,424003356.0,2922272,Technology
CTEV,Claritev Corporation Class A Common Stock,24.93,422985316.0,62535,Real Estate
NVEC,NVE Corporation Common Stock,87.2,421800875.0,103004,Technology
YORW,York Water Company (The) Common Stock,29.15,421175174.0,147183,Utilities
VNDA,Vanda Pharmaceuticals Inc. Common Stock,7.0,420945434.0,828450,Health Care
ZUMZ,Zumiez Inc. Common Stock,24.37,420521945.0,105711,Consumer Discretionary
FLGT,Fulgent Genetics Inc. Common Stock,14.13,420331045.0,1440970,Health Care
CYH,Community Health Systems Inc. Common Stock,2.98,419931802.0,1416197,Health Care
CBAN,Colony Bankcorp Inc. Common Stock,19.83,419847006.0,186547,Finance
ALTO,Alto Ingredients Inc. Common Stock,5.43,419698536.0,1641611,Industrials
LAND,Gladstone Land Corporation Common Stock,9.78,418941684.0,522217,Real Estate
BMRC,Bank of Marin Bancorp Common Stock,25.87,418827720.0,133377,Finance
IPSC,Century Therapeutics Inc. Common Stock,2.31,416618195.0,443886,Health Care
TTGT,TechTarget Inc. Common Stock,5.76,416444792.0,398939,Telecommunications
ENTA,Enanta Pharmaceuticals Inc. Common Stock,14.35,416427586.0,161454,Health Care
BWFG,Bankwell Financial Group Inc. Common Stock,52.16,415881069.0,45941,Finance
AVBC,Avidia Bancorp Inc. Common Stock,20.66,414775325.0,36522,Finance
MGPI,MGP Ingredients Inc.,19.4,414601998.0,227186,Consumer Staples
BSVN,Bank7 Corp. Common stock,43.49,413995879.0,7956,Finance
RBB,RBB Bancorp Common Stock,24.24,413877614.0,289747,Finance
ALIT,Alight Inc. Class A Common Stock,0.7819,412301812.0,16827635,Real Estate
EVN,Eaton Vance Municipal Income Trust Common Stock,10.39,412141824.0,108241,Finance
CLDT,Chatham Lodging Trust (REIT) Common Shares of Beneficial Interest,8.76,412070111.0,387398,Real Estate
YEXT,Yext Inc. Common Stock,4.11,411550452.0,2011020,Technology
GCBC,Greene County Bancorp Inc. Common Stock,24.14,411027628.0,2698,Finance
PKOH,Park-Ohio Holdings Corp. Common Stock,28.54,410927910.0,37923,Industrials
LWAY,Lifeway Foods Inc. Common Stock,27.1,410554160.0,60751,Consumer Staples
BNTC,Benitec Biopharma Inc. Common Stock,11.95,410534291.0,74460,Health Care
NATH,Nathan's Famous Inc. Common Stock,100.26,410505045.0,35828,Consumer Discretionary
SGU,Star Group L.P. Common Stock,12.47,410001816.0,25121,Consumer Discretionary
BXC,Bluelinx Holdings Inc. Common Stock,52.1,409880912.0,90071,Consumer Discretionary
LRMR,Larimar Therapeutics Inc. Common Stock,3.94,409298772.0,2193127,Health Care
