symbol,name,price,marketCap,volume,industry
CSAI,Cloudastructure Inc. Class A Common Stock,0.29,7247572.0,4872792,Technology
IDAI,T Stamp Inc. Class A Common Stock,1.29,7223954.0,302620,Technology
HYPG,Grayscale Hyperliquid Staking ETF ,21.4355,7073715.0,98090,Uncategorized
SILO,Silo Pharma Inc. Common Stock,6.22,7019954.0,33378,Consumer Discretionary
YCBD,cbdMD Inc. Common Stock,0.6611,6940174.0,139141,Consumer Discretionary
AUUD,Auddia Inc. Common Stock,1.29,6919625.0,270360,Technology
NXL,Nexalin Technology Inc. Common Stock,0.3348,6890735.0,99673,Health Care
SNGX,Soligenix Inc. Common Stock,0.391,6749328.0,982590,Health Care
ACON,Aclarion Inc. Common Stock,2.74,6746565.0,151486,Health Care
BTBD,BT Brands Inc. Common Stock,1.085,6710426.0,36421,Consumer Discretionary
XBIO,Xenetic Biosciences Inc. Common Stock,2.9,6644062.0,20538,Health Care
DFNSW,T3 Defense Inc. Warrants,0.07,6638273.0,4469,Consumer Discretionary
AMST,Amesite Inc. Common Stock,1.12,6555343.0,123944,Technology
POLA,Polar Power Inc. Common Stock,1.8,6552286.0,172186,Miscellaneous
CYCU,Cycurion Inc. Common Stock,0.6127,6532870.0,499684,Technology
LABT,Lakewood-Amedex Biotherapeutics Inc. Common Stock,3.72,6512935.0,531162,Health Care
NXTC,NextCure Inc. Common Stock,1.77,6393410.0,120338,Health Care
BNZI,Banzai International Inc. Class A Common Stock,2.95,6331234.0,146721,Technology
ACXP,Acurx Pharmaceuticals Inc. Common Stock,1.47,6317675.0,43220,Health Care
BCAB,BioAtla Inc. Common Stock,3.79,6289710.0,44489,Health Care
MGRX,Mangoceuticals Inc. Common Stock,0.359,6163104.0,1075187,Health Care
VVOS,Vivos Therapeutics Inc. Common Stock,0.4414,6133076.0,269844,Health Care
DSS,DSS Inc. Common Stock,0.61,6125936.0,117000,Consumer Discretionary
CNSP,CNS Pharmaceuticals Inc. Common Stock,4.17,6094242.0,13605,Health Care
FLDDW,Fold Holdings Inc. Warrant,0.1199,6088924.0,3200,Finance
XAIR,Beyond Air Inc. Common Stock,0.479,6079796.0,566700,Health Care
AQB,AquaBounty Technologies Inc. Common Stock,1.18,6073701.0,257417,Consumer Staples
AIDX,20/20 Biolabs Inc. Common Stock,0.5669,6015675.0,180475,Health Care
CDIO,Cardio Diagnostics Holdings Inc. Common stock,2.03,6007722.0,25908,Health Care
MTR,Mesa Royalty Trust Common Stock,3.19,5944852.0,4750,Energy
APVO,Aptevo Therapeutics Inc. Common Stock,4.735,5900307.0,11958,Health Care
OLB,The OLB Group Inc. Common Stock,0.3932,5766250.0,152492,Consumer Discretionary
CWD,CaliberCos Inc. Class A Common Stock,0.647,5719625.0,210171,Finance
ELAB,PMGC Holdings Inc. Common Stock,1.25,5679689.0,248636,Health Care
MITQ,Moving iMage Technologies Inc. Common Stock,0.57,5666411.0,46973,Consumer Discretionary
PULM,Pulmatrix Inc. Common Stock,1.53,5587996.0,28349,Health Care
XHLD,TEN Holdings Inc. Common Stock,1.23,5507255.0,11924,Consumer Discretionary
SNOA,Sonoma Pharmaceuticals Inc. Common Stock,1.15,5503671.0,36287,Health Care
WHLRP,Wheeler Real Estate Investment Trust Inc. Class B Preferred Stock,10.03,5502338.0,29361,Real Estate
VSEE,VSee Health Inc. Common Stock,0.113,5491735.0,4677113,Health Care
SMTK,SmartKem Inc. Common Stock,0.255,5468784.0,1132701,Technology
BMRA,Biomerica Inc. Common Stock,1.75,5407971.0,6578,Health Care
EEIQ,EpicQuest Education Group International Limited Common Stock,3.28,5400923.0,8110,Real Estate
SDOT,Sadot Group Inc. Common Stock,7.25,5365000.0,409723,Consumer Discretionary
PCSA,Processa Pharmaceuticals Inc. Common Stock,1.93,5342302.0,32780,Health Care
ADIL,Adial Pharmaceuticals Inc Common Stock,2.48,5316180.0,141136,Health Care
CDT,CDT Equity Inc. Common Stock,1.09,5295602.0,2513616,Health Care
GNPX,Genprex Inc. Common Stock,0.483,5277844.0,195238,Health Care
ENVB,Enveric Biosciences Inc. Common Stock,1.31,5277305.0,163814,Health Care
INBS,Intelligent Bio Solutions Inc. Common Stock,2.2,5262061.0,66082,Health Care
ALZN,Alzamend Neuro Inc. Common Stock,1.37,5212495.0,39917,Health Care
XPON,Expion360 Inc. Common Stock,0.452,5170111.0,180206,Miscellaneous
SCKT,Socket Mobile Inc. Common Stock,0.6256,5155543.0,172501,Technology
OLOX,Olenox Industries Inc. Common Stock,5.2,4996909.0,13263,Consumer Discretionary
SLE,Super League Enterprise Inc. Common Stock,3.1,4987742.0,12208,Consumer Discretionary
NXGL,NexGel Inc Common Stock,0.5401,4982553.0,973165,Health Care
CTNT,Cheetah Net Supply Chain Service Inc Class A Common Stock,1.67,4942183.0,246941,Consumer Discretionary
LUCY,Innovative Eyewear Inc. Common Stock,0.765,4898852.0,51854,Health Care
ORGN,Origin Materials Inc. Common Stock,0.8901,4898016.0,218047,Industrials
DRMA,Dermata Therapeutics Inc. Common Stock,1.21,4866793.0,20803,Health Care
TNON,Tenon Medical Inc. Common Stock,0.4,4739870.0,3118131,Health Care
IVDA,Iveda Solutions Inc. Common Stock,0.425,4734390.0,706253,Technology
NWTG,Newton Golf Company Inc. Common Stock,1.03,4729825.0,11292,Consumer Discretionary
MBIO,Mustang Bio Inc. Common Stock,0.6999,4711811.0,59464,Health Care
RNAZ,TransCode Therapeutics Inc. Common Stock,4.895,4651728.0,11469,Health Care
LIMN,Liminatus Pharma Inc. Class A Common Stock,0.1031,4626884.0,1276491,Uncategorized
SXTP,60 Degrees Pharmaceuticals Inc. Common Stock,1.69,4494197.0,19037,Health Care
TWAV,TaoWeave Inc. Common Stock,1.3,4492994.0,111051,Technology
RMSG,Real Messenger Corporation Ordinary Shares,0.499,4426769.0,268095,Technology
NCPL,Netcapital Inc. Common Stock,0.5548,4354014.0,200984,Finance
RENX,RenX Enterprises Corp. Common Stock,1.66,4339036.0,65657,Finance
CETX,Cemtrex Inc. Common Stock,3.88,4315270.0,40569,Technology
ENSC,Ensysce Biosciences Inc. Common Stock,0.28,4302348.0,1448187,Health Care
TOIIW,The Oncology Institute Inc. Warrant,0.0425,4249275.0,50,Health Care
FLZH,Flash Sports & Media Holdings Inc. Common Stock,2.66,4173857.0,78885,Consumer Discretionary
MSS,Maison Solutions Inc. Class A Common Stock,0.7093,4173593.0,106057,Consumer Staples
MTNB,Matinas Biopharma Holdings Inc. Common Stock,0.65,4164024.0,49626,Health Care
FBLG,FibroBiologics Inc. Common Stock,0.7694,4154077.0,151741,Health Care
CJMB,Callan JMB Inc. Common Stock,0.73,4121666.0,16625,Consumer Discretionary
CXAIW,CXApp Inc. Warrant,0.0588,4121249.0,26940,Technology
HYFM,Hydrofarm Holdings Group Inc. Common Stock,0.8505,4052303.0,330505,Consumer Discretionary
ARTL,Artelo Biosciences Inc. Common Stock,1.16,4043226.0,267857,Health Care
BIAF,bioAffinity Technologies Inc. Common Stock,0.8505,4033973.0,361555,Health Care
REVB,Revelation Biosciences Inc. Common Stock,1.03,4025673.0,19339,Health Care
VEEAW,Veea Inc. Warrant,0.0798,4022524.0,160,Finance
GOVX,GeoVax Labs Inc. Common Stock,1.38,3991747.0,1142736,Health Care
ALBT,Avalon GloboCare Corp. Common Stock,0.323,3891391.0,299047,Health Care
SQFT,Presidio Property Trust Inc. Class A Common Stock,2.7,3879981.0,3573,Real Estate
HCTI,Healthcare Triangle Inc. Common Stock,1.9,3852788.0,39627,Technology
ISPC,iSpecimen Inc. Common Stock,2.68,3851581.0,124886,Health Care
CAPS,Capstone Holding Corp. Common Stock,0.2609,3766328.0,187151,Consumer Discretionary
FEED,ENvue Medical Inc. Common Stock,0.612,3728206.0,226307,Health Care
FLYE,Fly-E Group Inc. Common Stock,2.27,3705516.0,12141,Industrials
ONCO,Onconetix Inc. Common Stock,1.0,3691492.0,1688224,Health Care
GBR,New Concept Energy Inc Common Stock,0.7171,3680110.0,119976,Energy
PW,Power REIT (MD) Common Stock,9.8971,3634482.0,8694,Real Estate
MKZR,MacKenzie Realty Capital Inc. Common Stock,1.78,3500192.0,19249,Real Estate
PGYWW,Pagaya Technologies Ltd. Warrants,0.0412,3497797.0,30248,Finance
GRI,GRI Bio Inc. Common Stock,1.84,3258342.0,92126,Health Care
BOXL,Boxlight Corporation Class A Common Stock,4.88,3254721.0,26861274,Real Estate
DCOY,Decoy Therapeutics Inc. Common Stock,6.11,3250324.0,3755,Health Care
BIVIW,BioVie Inc. Warrant,0.4279,3227153.0,7301,Health Care
VSTD,Vestand Inc. Class A Common Stock,0.2256,3209155.0,66749,Consumer Discretionary
SNYR,Synergy CHC Corp. Common Stock,0.2089,3112586.0,316563,Health Care
EVGOW,EVgo Inc. Warrants,0.0099,3107208.0,10075323,Technology
FCUV,Focus Universal Inc. Common Stock,4.42,3106425.0,1059151,Industrials
BJDX,Bluejay Diagnostics Inc. Common Stock,2.99,3093798.0,86052,Health Care
BNBX,BNB Plus Corp. Common Stock,0.4226,3041549.0,33166,Consumer Discretionary
NVVE,Nuvve Holding Corp. Common Stock,0.3161,2985163.0,140478,Industrials
BLUWW,Blue Water Acquisition Corp. III Warrant.,0.41,2970450.0,7006,Uncategorized
AEMD,Aethlon Medical Inc. Common Stock,1.22,2892083.0,208656,Health Care
VIVS,VivoSim Labs Inc. Common Stock,1.09,2842679.0,61685,Health Care
GWAV,Greenwave Technology Solutions Inc. Common Stock,3.37,2795856.0,9670,Industrials
FFAIW,Faraday Future Intelligent Electric Inc. Warrant,0.0091,2765528.0,55199,Industrials
VEEE,Twin Vee PowerCats Co. Common Stock,5.1,2699583.0,80808,Industrials
BCGWW,Binah Capital Group Inc. Warrants,0.16,2689621.0,10534,Finance
OGEN,Oragenics Inc. Common Stock,0.5865,2646263.0,31156,Health Care
LMFA,LM Funding America Inc. Common Stock,0.1525,2646223.0,54221622,Finance
BTOG,Bit Origin Limited Class A Ordinary Shares,1.77,2614010.0,64240,Finance
RMCOW,Royalty Management Holding Corporation Warrant,0.172,2607444.0,80,Miscellaneous
ZEOWW,Zeo Energy Corporation Warrants,0.0438,2539250.0,80,Miscellaneous
SGLY,Singularity Future Technology Ltd. Common Stock,0.3401,2480517.0,29787,Industrials
XXII,22nd Century Group Inc. Common Stock,4.78,2468048.0,33726,Health Care
BBLG,Bone Biologics Corp Common Stock,1.35,2423601.0,38477,Health Care
BFRGW,Bullfrog AI Holdings Inc. Warrants,0.1278,2369623.0,6105,Health Care
IVF,INVO Fertility Inc. Common Stock,1.32,2357566.0,25757,Health Care
EVLVW,Evolv Technologies Holdings Inc. Warrant,0.0131,2356315.0,12501,Technology
DAIC,CID HoldCo Inc. Common Stock,1.89,2287624.0,495565,Technology
FRGT,Freight Technologies Inc. Ordinary Shares,3.97,2271336.0,30278,Industrials
FUSEW,Fusemachines Inc. Warrants,0.0758,2193594.0,140,Technology
GCTK,GlucoTrack Inc. Common Stock,0.35,2190748.0,295398,Health Care
SHPH,Shuttle Pharmaceuticals Holdings Inc. Common Stock,3.69,2159126.0,66452,Health Care
VBNB,VanEck BNB ETF Common Shares of Beneficial Interest,21.5171,2149860.0,4587,Finance
IPST,IP Strategy Holdings Inc. Common Stock,2.92,2107008.0,30428,Consumer Staples
DRCT,Direct Digital Holdings Inc. Class A Common Stock,2.79,2074094.0,10145,Consumer Discretionary
SOBR,SOBR Safe Inc. Common Stock,0.737,2068449.0,131526,Consumer Discretionary
BZFDW,BuzzFeed Inc. Warrant,0.0249,2027023.0,2622,Consumer Discretionary
HOLOW,MicroCloud Hologram Inc. Warrant,0.085,1947551.0,22601,Technology
EZRA,Reliance Global Group Inc. Common Stock,3.455,1920165.0,68398,Finance
ONFO,Onfolio Holdings Inc. Common Stock,0.271,1907929.0,204617,Technology
MVSTW,Microvast Holdings Inc. Warrants,0.0055,1832366.0,38001,Miscellaneous
VIVK,Vivakor Inc. Common Stock,0.4218,1811904.0,488777,Uncategorized
BEATW,Heartbeam Inc. Warrant,0.0323,1792871.0,3499,Health Care
VBIO,Valion Bio Inc. Common Stock,0.54,1728445.0,76015,Health Care
PDYNW,Palladyne AI Corp Warrants,0.0362,1710241.0,74445,Technology
SDSTW,Stardust Power Inc. Warrant,0.1553,1643032.0,38,Industrials
LRHC,La Rosa Holdings Corp. Common Stock,1.01,1632242.0,2376651,Finance
JAGX,Jaguar Health Inc. Common Stock,2.68,1616399.0,94484,Health Care
IPW,iPower Inc. Common Stock,2.38,1573751.0,134797,Consumer Discretionary
VGASW,Verde Clean Fuels Inc. Warrant,0.0347,1545872.0,161766,Industrials
SHFS,SHF Holdings Inc. Class A Common Stock,0.2366,1527441.0,339689,Finance
MOBXW,Mobix Labs Inc Warrants,0.0999,1518348.0,27680,Technology
GNLN,Greenlane Holdings Inc. Class A Common Stock,2.4,1515502.0,23315,Consumer Discretionary
TRUG,TruGolf Holdings Inc. Class A Common Stock,1.35,1503476.0,149963,Consumer Discretionary
SCLXW,Scilex Holding Company Warrant,0.1712,1453705.0,15,Health Care
RKDA,Arcadia Biosciences Inc. Common Stock,0.6705,1379141.0,85809,Consumer Staples
UK,Ucommune International Ltd Class A Ordinary Shares,2.01,1362682.0,14987,Consumer Discretionary
SKYAW,SkyAI Inc. Warrant,0.0316,1337381.0,14581,Health Care
WHLR,Wheeler Real Estate Investment Trust Inc. Common Stock,2.43,1333069.0,527467,Real Estate
GDC,GD Culture Group Limited Common Stock,0.0216,1312410.0,1405901123,Industrials
TRNR,Interactive Strength Inc. Common Stock,0.5514,1285278.0,170468,Technology
GIPR,Generation Income Properties Inc. Common Stock,0.181,1187066.0,37733223,Real Estate
HUMAW,Humacyte Inc. Warrant,0.0052,1154499.0,22464,Health Care
NUWE,Nuwellis Inc. Common Stock,0.089,1134779.0,7743958,Health Care
KIDZ,KIDZ AI Inc. Class B Common Stock,0.9849,1109507.0,5657356,Real Estate
AIMDW,Ainos Inc. Warrants,0.1285,1095404.0,10301,Technology
EDBL,Edible Garden AG Incorporated Common Stock,0.19,1039170.0,843582,Consumer Staples
ZNB,Zeta Network Group Class A Ordinary Shares,0.6491,1026095.0,325354,Consumer Discretionary
BNAIW,Brand Engagement Network Inc. Warrant,0.1475,959884.0,260,Technology
KUST,Kustom Entertainment Inc. Common Stock,1.42,890141.0,212001,Technology
LIDRW,AEye Inc. Warrant,0.0185,856824.0,40458,Consumer Discretionary
NIXXW,Nixxy Inc. Warrant,0.0295,844815.0,148188,Technology
RCKTW,Rocket Pharmaceuticals Inc. Warrant,0.0077,840790.0,112,Health Care
BNCWZ,CEA Industries Inc. Warrant,0.0151,647727.0,12926,Industrials
PFSA,Profusa Inc. Common Stock,0.13,605835.0,90209783,Health Care
XBPEW,XBP Europe Holdings Inc. Warrant,0.0461,542507.0,8713,Technology
DFLIW,Dragonfly Energy Holdings Corp. Warrant,0.0386,494672.0,2641,Miscellaneous
ILLRW,Triller Group Inc. Warrant,0.0237,467997.0,73,Finance
SEATW,Vivid Seats Inc. Warrant,0.0424,465866.0,4957,Consumer Discretionary
FOXXW,Foxx Development Holdings Inc. Warrant,0.065,457677.0,1600,Telecommunications
IVDAW,Iveda Solutions Inc. Warrant,0.0399,444476.0,4210,Technology
MNTSW,Momentus Inc. Warrant,0.0201,378600.0,509479,Industrials
RMSGW,Real Messenger Corporation Warrants,0.0401,355738.0,2966,Technology
JSPRW,Japer Therapeutics Inc. Warrants,0.0126,352924.0,21074,Health Care
BTBDW,BT Brands Inc. Warrant,0.0545,337067.0,5015,Consumer Discretionary
NCPLW,Netcapital Inc. Warrants,0.0335,262905.0,59,Finance
NXGLW,NexGel Inc Warrant,0.027,249082.0,141589,Health Care
TVGNW,Tevogen Bio Holdings Inc. Warrant,0.0573,241768.0,43316,Health Care
KTTAW,Pasithea Therapeutics Corp. Warrant,0.0066,220535.0,100,Health Care
EDBLW,Edible Garden AG Incorporated Warrant,0.039,213303.0,2660,Consumer Staples
HSCSW,HeartSciences Inc. Warrant,0.0623,198407.0,1621,Health Care
WGSWW,GeneDx Holdings Corp. Warrant,0.0062,184066.0,79146,Technology
KITTW,Nauticus Robotics Inc. Warrant,0.0255,174424.0,10528,Industrials
LUCYW,Innovative Eyewear Inc. Series A Warrants 8/16/27,0.0251,160734.0,25049,Health Care
BENFW,Beneficient Warrant,0.0106,150666.0,6805,Finance
LNZAW,LanzaTech Global Inc. Warrant,0.0147,148311.0,300,Industrials
SHFSW,SHF Holdings Inc. Warrants,0.0219,141382.0,19447,Finance
CELUW,Celularity Inc. Warrant,0.0045,130257.0,72415,Health Care
LTRYW,Sports Entertainment Gaming Global Corporation Warrants,0.01,126434.0,6023,Technology
AMODW,Alpha Modus Holdings Inc. Warrant,0.0288,118717.0,11567,Miscellaneous
AERTW,Aeries Technology Inc. Warrant,0.02,114787.0,28781,Consumer Discretionary
ONFOW,Onfolio Holdings Inc. Warrant,0.015,105605.0,18520,Technology
SRZNW,Surrozen Inc. Warrant,0.0089,103332.0,30000,Health Care
TNONW,Tenon Medical Inc. Warrant,0.0077,91242.0,48901,Health Care
PIIIW,P3 Health Partners Inc. Warrant,0.0116,84042.0,18317,Health Care
SXTPW,60 Degrees Pharmaceuticals Inc. Warrant,0.0303,80576.0,300,Health Care
ERNAW,Ernexa Therapeutics Inc. Warrants,0.0657,76628.0,4159,Uncategorized
ICUCW,SeaStar Medical Holding Corporation Warrant,0.0176,70347.0,16492,Health Care
ACONW,Aclarion Inc. Warrant,0.0264,65003.0,29263,Health Care
MSAIW,MultiSensor AI Holdings Inc. Warrant,0.0289,58362.0,1416,Technology
CDIOW,Cardio Diagnostics Holdings Inc. Warrant,0.0184,54454.0,111,Health Care
DRMAW,Dermata Therapeutics Inc. Warrant,0.0126,50679.0,1842,Health Care
XOSWW,Xos Inc. Warrants,0.004,50270.0,651,Consumer Discretionary
REVBW,Revelation Biosciences Inc. Warrant,0.0096,37521.0,95,Health Care
APLMW,Apollomics Inc. Warrant,0.0128,28109.0,1690,Health Care
ASBPW,Aspire Biopharma Holdings Inc. Warrant,0.021,27200.0,1950,Health Care
SQFTW,Presidio Property Trust Inc. Series A Common Stock Purchase Warrants,0.0172,24717.0,11410,Real Estate
BNZIW,Banzai International Inc. Warrant,0.0088,18886.0,95729,Technology
KIDZW,KIDZ AI Inc. Warrants,0.0126,14194.0,6436,Real Estate
VFL,abrdn National Municipal Income Fund Common Stock,10.33,0.0,52909,Finance
KF,Korea Fund Inc. (The) New Common Stock,71.86,0.0,27162,Finance
KEYYW,Keystone Acquisition Corp. Warrants,0.375,0.0,20711,Finance
VGI,Virtus Global Multi-Sector Income Fund Common Shares of Beneficial Interest,7.33,0.0,72439,Finance
LTGRU,Long Table Growth Corp. Units,10.03,0.0,149,Finance
KFIIU,K&F Growth Acquisition Corp. II Unit,10.62,0.0,104,Finance
VHCP,Vine Hill Capital Investment Corp. II Class A Ordinary Shares,10.01,0.0,3,Uncategorized
LWACW,LightWave Acquisition Corp. Warrants,0.3099,0.0,715,Finance
LWAC,LightWave Acquisition Corp. Class A Ordinary Shares,10.21,0.0,2,Finance
PHK,Pimco High Income Fund,4.55,0.0,880769,Finance
KFII,K&F Growth Acquisition Corp. II Class A Ordinary shares,10.55,0.0,236600,Uncategorized
BBCQU,Bleichroeder Acquisition Corp. II Units,11.03,0.0,200,Uncategorized
BBCQ,Bleichroeder Acquisition Corp. II Class A Ordinary Shares,10.35,0.0,147012,Uncategorized
VNME,Vendome Acquisition Corporation I Class A Ordinary Shares,10.2,0.0,131142,Finance
BBCQW,Bleichroeder Acquisition Corp. II Warrants,2.23,0.0,23765,Uncategorized
BTT,BlackRock Municipal 2030 Target Term Trust,22.61,0.0,137739,Finance
BCARW,D. Boral ARC Acquisition I Corp. Warrant,1.67,0.0,61821,Finance
BCARU,D. Boral ARC Acquisition I Corp. Units,11.75,0.0,5302,Finance
BCAR,D. Boral ARC Acquisition I Corp. Class A Ordinary Shares,10.53,0.0,203355,Finance
BDCIW,BTC Development Corp. Warrant,0.4183,0.0,28,Finance
BDCIU,BTC Development Corp. Unit,10.25,0.0,100,Finance
BUI,BlackRock Utility Infrastructure & Power Opportunities Trust,28.4,0.0,67036,Finance
PGP,Pimco Global StocksPlus & Income Fund Common Shares of Beneficial Interest,8.46,0.0,36642,Finance
PGACU,Pantages Capital Acquisition Corporation Unit,10.68,0.0,3,Uncategorized
BBN,BlackRock Taxable Municipal Bond Trust Common Shares of Beneficial Interest,16.05,0.0,158152,Finance
PGAC,Pantages Capital Acquisition Corporation Class A Ordinary Shares,10.64,0.0,39,Uncategorized
MBAV,M3-Brigade Acquisition V Corp. Class A Ordinary shares,10.82,0.0,1211224,Uncategorized
BAYA,Bayview Acquisition Corp Ordinary Shares,12.09,0.0,850,Uncategorized
MACI,Melar Acquisition Corp. I Class A Ordinary Shares,10.88,0.0,1070,Uncategorized
MBAVW,M3-Brigade Acquisition V Corp. Warrant,0.395,0.0,67923,Finance
MBAVU,M3-Brigade Acquisition V Corp. Units,11.0,0.0,101,Finance
BDCI,BTC Development Corp. Class A Ordinary Shares,10.06,0.0,145066,Finance
BCV,Bancroft Fund Ltd.,25.63,0.0,13213,Finance
VLT,Invesco High Income Trust II,10.31,0.0,2739,Finance
KKRT,KKR & Co. Inc. 6.875% Subordinated Notes due 2065,24.59,0.0,58493,Finance
BAYAR,Bayview Acquisition Corp Right,0.08,0.0,857,Uncategorized
BAYAU,Bayview Acquisition Corp Unit,12.0,0.0,1922,Uncategorized
KEYY,Keystone Acquisition Corp. Class A Ordinary Shares,9.87,0.0,382119,Finance
KEYYU,Keystone Acquisition Corp. Unit,10.04,0.0,3406,Finance
BEAGU,Bold Eagle Acquisition Corp. Units,11.28,0.0,600,Uncategorized
BEAGR,Bold Eagle Acquisition Corp. Right,0.3,0.0,700,Uncategorized
BEAG,Bold Eagle Acquisition Corp. Class A Ordinary Shares,10.64,0.0,3005,Uncategorized
MACIW,Melar Acquisition Corp. I Warrant,0.131,0.0,3106,Finance
USA,Liberty All-Star Equity Fund Common Stock,5.65,0.0,1441323,Finance
BNCWW,CEA Industries Inc. Warrant,0.0271,0.0,371,Uncategorized
KTN,Structured Products Corp 8.205% CorTS 8.205% Corporate Backed Trust Securities (CorTS),26.34,0.0,129,Finance
PMTV,PennyMac Mortgage Investment Trust 9.00% Senior Notes due 2030,25.25,0.0,19022,Real Estate
PMTW,PennyMac Mortgage Investment Trust 9.00% Senior Notes due 2030,25.06,0.0,9338,Real Estate
PNI,Pimco New York Municipal Income Fund II Common Shares of Beneficial Interest,6.99,0.0,51593,Finance
POLE,Andretti Acquisition Corp. II Class A Ordinary Shares,10.75,0.0,13318,Uncategorized
KTH,Structures Products Cp 8% CorTS Issued by Peco Energy Cap Tr II Preferred Stock,28.35,0.0,225,Finance
MCN,XAI Madison Equity Premium Income Fund Common Shares,5.46,0.0,52605,Uncategorized
KIO,KKR Income Opportunities Fund Common Shares,11.17,0.0,137459,Finance
BOE,Blackrock Enhanced Global Dividend Trust Common Shares of Beneficial Interest,11.77,0.0,75590,Finance
BLZR,Trailblazer Acquisition Corp. Class A Ordinary Shares,10.11,0.0,285235,Finance
BLZRU,Trailblazer Acquisition Corp. Unit,10.22,0.0,5404,Uncategorized
BLZRW,Trailblazer Acquisition Corp. Warrant,0.4,0.0,132,Finance
UTF,Cohen & Steers Infrastructure Fund Inc Common Stock,27.29,0.0,288649,Finance
UTG,Reaves Utility Income Fund Common Shares of Beneficial Interest,41.1,0.0,711663,Finance
LKSP,Lake Superior Acquisition Corp. Class A Ordinary Shares,10.15,0.0,114,Uncategorized
LKSPU,Lake Superior Acquisition Corp. Units,10.26,0.0,30,Uncategorized
POLEW,Andretti Acquisition Corp. II Warrant,0.2,0.0,2737,Uncategorized
KVAC,Keen Vision Acquisition Corporation Ordinary Shares,12.2,0.0,3,Uncategorized
KVACW,Keen Vision Acquisition Corporation Warrant,0.02,0.0,700,Uncategorized
KOYN,CSLM Digital Asset Acquisition Corp III Class A Ordinary Shares,10.135,0.0,3594,Uncategorized
KOYNW,CSLM Digital Asset Acquisition Corp III Warrants,0.2199,0.0,2600,Uncategorized
BRW,Saba Capital Income & Opportunities Fund SBI,6.57,0.0,227488,Finance
BREZ,Breeze Acquisition Corp. II Ordinary Shares,9.93,0.0,30906,Finance
BREZR,Breeze Acquisition Corp. II Right,0.2519,0.0,44309,Finance
BRKHU,Burtech Acquisition Corp II Unit,10.01,0.0,25001,Finance
BPACU,Blueport Acquisition Ltd Units,10.26,0.0,200,Finance
LGI,Lazard Global Total Return and Income Fund Common Stock,18.11,0.0,25191,Uncategorized
LDP,Cohen & Steers Limited Duration Preferred and Income Fund Inc.,20.73,0.0,27504,Finance
LATA,Galata Acquisition Corp. II Class A Ordinary Shares,10.09,0.0,9068,Finance
LATAU,Galata Acquisition Corp. II Units,10.19,0.0,1650,Uncategorized
LATAW,Galata Acquisition Corp. II Warrant,0.3514,0.0,660,Finance
LCCC,Lakeshore Acquisition III Corp. Ordinary Shares,10.41,0.0,2439,Finance
LCCCR,Lakeshore Acquisition III Corp. Rights,0.1443,0.0,1896,Finance
LCCCU,Lakeshore Acquisition III Corp. Unit,10.59,0.0,1150,Finance
BPAC,Blueport Acquisition Ltd Class A Ordinary Shares,10.12,0.0,8766,Uncategorized
LFACW,Leapfrog Acquisition Corporation Warrants,0.35,0.0,11700,Finance
BHAVR,BHAV Acquisition Corp Rights,0.23,0.0,2000,Finance
KBONU,Karbon Capital Partners Corp. Units,10.25,0.0,2206,Finance
KBON,Karbon Capital Partners Corp. Class A Ordinary Shares,10.07,0.0,1000,Finance
LPAA,Launch One Acquisition Corp. Class A Ordinary shares,10.84,0.0,81415,Uncategorized
LPAAW,Launch One Acquisition Corp. Warrant,0.13,0.0,91963,Finance
LPBB,Launch Two Acquisition Corp. Class A Ordinary Shares,10.72,0.0,82009,Uncategorized
LPBBW,Launch Two Acquisition Corp. Warrant,0.24,0.0,4756,Uncategorized
LPCV,Launchpad Cadenza Acquisition Corp I Class A Ordinary Share,10.0,0.0,10000,Uncategorized
PML,Pimco Municipal Income Fund II Common Shares of Beneficial Interest,7.54,0.0,666307,Finance
PLMK,Plum Acquisition Corp. IV Class A Ordinary Shares,10.64,0.0,99410,Uncategorized
PLMKU,Plum Acquisition Corp. IV Unit,10.88,0.0,50,Uncategorized
PLMKW,Plum Acquisition Corp. IV Warrants,0.5701,0.0,30,Uncategorized
BHAVU,BHAV Acquisition Corp Units,10.1,0.0,4519,Uncategorized
PTACU,Patriot Acquisition Corp. Units,9.98,0.0,320128,Uncategorized
BHK,Blackrock Core Bond Trust,9.0,0.0,221866,Finance
BGB,Blackstone Strategic Credit 2027 Term Fund Common Shares of Beneficial Interest,11.285,0.0,68800,Finance
BGH,Barings Global Short Duration High Yield Fund Common Shares of Beneficial Interests,13.88,0.0,87005,Finance
BGMS,Bio Green Med Solution Inc. Common Stock,0.6368,0.0,107763,Uncategorized
LPCVW,Launchpad Cadenza Acquisition Corp I Warrant,0.35,0.0,301,Uncategorized
PMTR,Perimeter Acquisition Corp. I Class A Ordinary Shares,10.41,0.0,190348,Finance
BLRKW,Bluerock Acquisition Corp. Warrants,0.35,0.0,1749,Uncategorized
BKHA,Black Hawk Acquisition Corporation Class A Ordinary Shares,11.91,0.0,6,Health Care
UYSC,UY Scuti Acquisition Corp. Ordinary Shares,10.7,0.0,2,Finance
UYSCU,UY Scuti Acquisition Corp. Units,10.72,0.0,1,Uncategorized
VBF,Invesco Bond Fund Common Stock,15.02,0.0,26436,Finance
KRAQW,KRAKacquisition Corp Warrants,0.435,0.0,10054,Uncategorized
BHV,BlackRock Virginia Municipal Bond Trust,12.41,0.0,3369,Finance
BHAV,BHAV Acquisition Corp Class A Ordinary Shares,9.91,0.0,8132,Uncategorized
BIT,BlackRock Multi-Sector Income Trust Common Shares of Beneficial Interest,12.38,0.0,244799,Finance
KRAQ,KRAKacquisition Corp Class A Ordinary Shares,10.0,0.0,13456,Uncategorized
BIXI,Bitcoin Infrastructure Acquisition Corp Ltd. Class A Ordinary Shares,10.0,0.0,56142,Uncategorized
BIXIU,Bitcoin Infrastructure Acquisition Corp Ltd. Unit ,10.11,0.0,904,Finance
BIXIW,Bitcoin Infrastructure Acquisition Corp Ltd. Warrant,0.2713,0.0,7038,Uncategorized
BTO,John Hancock Financial Opportunities Fund Common Stock,38.45,0.0,59798,Finance
BGT,BlackRock Floating Rate Income Trust,10.59,0.0,86120,Finance
BSL,Blackstone Senior Floating Rate 2027 Term Fund Common Shares of Beneficial Interest,12.94,0.0,34389,Finance
BGY,Blackrock Enhanced International Dividend Trust,5.63,0.0,261694,Finance
KRAQU,KRAKacquisition Corp Unit,10.1,0.0,1500,Uncategorized
NCA,Nuveen California Municipal Value Fund,9.3,0.0,59417,Finance
NAC,Nuveen California Quality Municipal Income Fund,11.99,0.0,345303,Finance
NAD,Nuveen Quality Municipal Income Fund Common Stock,12.0,0.0,304712,Finance
