symbol,name,price,marketCap,volume,industry
OXLCL,Oxford Lane Capital Corp. 6.75% Notes due 2031,24.1991,4200963760.0,2395,Finance
GPI,Group 1 Automotive Inc. Common Stock,353.67,4198974308.0,202402,Consumer Discretionary
PVH,PVH Corp. Common Stock,91.64,4198168426.0,627236,Industrials
SLGN,Silgan Holdings Inc. Common Stock,39.72,4197599988.0,905075,Industrials
ALHC,Alignment Healthcare Inc. Common Stock,20.26,4188364448.0,13842497,Health Care
CNO,CNO Financial Group Inc. Common Stock,44.63,4183070241.0,1001123,Finance
IRDM,Iridium Communications Inc Common Stock,39.44,4169902223.0,1649345,Telecommunications
SMR,NuScale Power Corporation Class A Common Stock,12.14,4165349221.0,20447423,Industrials
SKT,Tanger Inc. Common Stock,36.35,4163311045.0,1347697,Real Estate
CC,Chemours Company (The) Common Stock,27.73,4162585323.0,2469382,Industrials
VVV,Valvoline Inc. Common Stock,32.61,4151769086.0,1810162,Industrials
SAIC,Science Applications International Corporation Common Stock,95.91,4133949937.0,414738,Technology
OXLCO,Oxford Lane Capital Corp. Preferred Stock Shares 6.00% Series 2029,23.7794,4128103840.0,1613,Finance
CRNX,Crinetics Pharmaceuticals Inc. Common Stock,39.02,4114250656.0,1062717,Health Care
THO,Thor Industries Inc. Common Stock,78.18,4111950042.0,494392,Industrials
FHI,Federated Hermes Inc. Common Stock,54.12,4111261844.0,1600862,Finance
WSC,WillScot Holdings Corporation Class A Common Stock,22.69,4106769267.0,3185934,Industrials
AMRX,Amneal Pharmaceuticals Inc. Class A Common Stock,12.83,4092757375.0,1398898,Health Care
GTLB,GitLab Inc. Class A Common Stock,24.05,4090905000.0,9889409,Technology
POWI,Power Integrations Inc. Common Stock,73.32,4084215814.0,747280,Technology
TVTX,Travere Therapeutics Inc. Common Stock,44.12,4075356105.0,2188354,Health Care
SOUN,SoundHound AI Inc Class A Common Stock,9.56,4074568126.0,68123611,Technology
REGCO,Regency Centers Corporation 5.875% Series B Cumulative Redeemable Preferred Stock,22.06,4038819120.0,850,Real Estate
CBT,Cabot Corporation Common Stock,77.33,4038296637.0,300803,Industrials
HP,Helmerich & Payne Inc. Common Stock,40.43,4036914800.0,994891,Energy
TREX,Trex Company Inc. Common Stock,38.79,4029855512.0,1812081,Basic Materials
NVTS,Navitas Semiconductor Corporation Common Stock,17.45,4027333749.0,30023116,Technology
VSH,Vishay Intertechnology Inc. Common Stock,29.58,4025992851.0,2660514,Technology
USAC,USA Compression Partners LP Common Units Representing Limited Partner Interests,27.75,4022982935.0,134348,Utilities
TNL,Travel   Leisure Co. Common  Stock,64.4,4019952070.0,789964,Consumer Discretionary
WAY,Waystar Holding Corp. Common Stock,20.95,4018480066.0,5102326,Technology
UCB,United Community Banks Inc. Common Stock,33.52,4011807445.0,565084,Finance
LASR,nLIGHT Inc. Common Stock,70.98,4003730460.0,721420,Technology
UNMA,Unum Group 6.250% Junior Subordinated Notes due 2058,23.48,3998954875.0,10415,Finance
TPH,Tri Pointe Homes Inc. Common Stock,46.86,3990779557.0,1692075,Consumer Discretionary
KTB,Kontoor Brands Inc. Common Stock ,72.2,3989348980.0,479342,Industrials
IRTC,iRhythm Holdings Inc. Common Stock,120.8,3968606281.0,1336191,Health Care
BATRA,Atlanta Braves Holdings Inc. Series A Common Stock,54.14,3966043350.0,53592,Consumer Discretionary
CVCO,Cavco Industries Inc. Common Stock When Issued,510.68,3963470721.0,99174,Consumer Discretionary
HRB,H&R Block Inc. Common Stock,31.25,3961241813.0,2063973,Consumer Discretionary
LRN,Stride Inc. Common Stock,93.08,3958212107.0,748645,Real Estate
CTRI,Centuri Holdings Inc. Common Stock,39.25,3958147214.0,1848419,Utilities
EE,Excelerate Energy Inc. Class A Common Stock,34.47,3932863922.0,246532,Utilities
DAN,Dana Incorporated Common Stock ,35.87,3929791870.0,1170871,Consumer Discretionary
CVSA,Covista Inc. Common Shares,113.86,3929140429.0,259750,Real Estate
ABG,Asbury Automotive Group Inc Common Stock,203.01,3917224320.0,220745,Consumer Discretionary
LEU,Centrus Energy Corp. Class A Common Stock,206.64,3916321250.0,480846,Industrials
MTRN,Materion Corporation,188.22,3915255507.0,309408,Industrials
KRC,Kilroy Realty Corporation Common Stock,33.64,3911619067.0,1328552,Real Estate
FULT,Fulton Financial Corporation Common Stock,21.62,3888585350.0,1563887,Finance
BRC,Brady Corporation Common Stock,82.16,3880255684.0,193047,Consumer Discretionary
FG,F&G Annuities & Life Inc. Common Stock,28.59,3877093274.0,475259,Finance
BBWI,Bath & Body Works Inc.,19.21,3868558171.0,4766109,Consumer Discretionary
BILL,BILL Holdings Inc. Common Stock,39.07,3866384391.0,1623087,Technology
IRT,Independence Realty Trust Inc. Common Stock,16.25,3829268771.0,1868594,Real Estate
COCO,The Vita Coco Company Inc. Common Stock,66.75,3812268920.0,1392206,Consumer Staples
OTTR,Otter Tail Corporation Common Stock,90.78,3808541000.0,302003,Utilities
RNG,RingCentral Inc. Class A Common Stock,45.08,3789991501.0,2835287,Technology
ITRI,Itron Inc. Common Stock,85.4,3786580234.0,557810,Industrials
ASBA,Associated Banc-Corp 6.625% Fixed-Rate Reset Subordinated Notes due 2033,25.08,3784592440.0,5183,Finance
ANF,Abercrombie & Fitch Company Common Stock,84.54,3782194904.0,768813,Consumer Discretionary
BANF,BancFirst Corporation Common Stock,112.61,3780990657.0,98882,Finance
PII,Polaris Inc. Common Stock,66.42,3778379212.0,932552,Consumer Discretionary
CATY,Cathay General Bancorp Common Stock,56.41,3777892720.0,530803,Finance
WSFS,WSFS Financial Corporation Common Stock,72.13,3769303253.0,400090,Finance
BNL,Broadstone Net Lease Inc. Common Stock,19.64,3762795508.0,2229842,Real Estate
INDB,Independent Bank Corp. Common Stock,77.45,3761919756.0,268830,Finance
ACAD,ACADIA Pharmaceuticals Inc. Common Stock,21.95,3758175001.0,1449025,Health Care
RNST,Renasant Corporation Common Stock,39.82,3748746665.0,451219,Finance
BULL,Webull Corporation Class A Ordinary Shares,7.03,3738685215.0,9861390,Finance
SYNA,Synaptics Incorporated Common Stock $0.001 Par Value,96.5,3737420007.0,780386,Technology
BETA,Beta Technologies Inc. Class A Common Stock,16.25,3734495684.0,1193015,Industrials
HGV,Hilton Grand Vacations Inc. Common Stock ,45.94,3733032396.0,962246,Consumer Discretionary
NHI,National Health Investors Inc. Common Stock,76.71,3717318196.0,273372,Real Estate
HHH,Howard Hughes Holdings Inc. Common Stock,62.32,3716536896.0,629963,Real Estate
TWST,Twist Bioscience Corporation Common Stock,60.4,3703226922.0,2719179,Health Care
MMSI,Merit Medical Systems Inc. Common Stock,62.01,3698790525.0,2526259,Health Care
OII,Oceaneering International Inc. Common Stock,37.07,3697556380.0,1251433,Energy
LIF,Life360 Inc. Common Stock,45.75,3691481627.0,803027,Technology
BATRK,Atlanta Braves Holdings Inc. Series C Common Stock,50.07,3667894173.0,333959,Consumer Discretionary
ADEA,Adeia Inc. Common Stock,33.0,3653223156.0,1949693,Technology
AB,AllianceBernstein Holding L.P.  Units,39.51,3646155340.0,261903,Finance
GBDC,Golub Capital BDC Inc. Common Stock,13.8,3632548898.0,1537590,Finance
BELFB,Bel Fuse Inc. Class B Common Stock,283.6,3618447862.0,229762,Uncategorized
CII,BlackRock Enhanced Large Cap Core Fund Inc. Common Stock,24.31,3616415670.0,79747,Finance
CALM,Cal-Maine Foods Inc. Common Stock,76.25,3612464835.0,572821,Consumer Staples
BHF,Brighthouse Financial Inc. Common Stock,62.65,3598674014.0,567970,Finance
FOUR,Shift4 Payments Inc. Class A Common Stock,45.21,3586459433.0,1299045,Real Estate
SMG,Scotts Miracle-Gro Company (The) Common Stock,61.72,3582213555.0,1408906,Industrials
MMS,Maximus Inc. Common Stock,65.58,3577295614.0,622179,Real Estate
DTG,DTE Energy Company 2021 Series E 4.375% Junior Subordinated Debentures,17.19,3576003331.0,5889,Utilities
ELF,e.l.f. Beauty Inc. Common Stock,60.49,3572069937.0,4065265,Consumer Discretionary
BLLN,BillionToOne Inc. Class A Common Stock,77.49,3564134262.0,317672,Health Care
CNS,Cohen & Steers Inc Common Stock,69.29,3561083955.0,386298,Finance
BMI,Badger Meter Inc. Common Stock,121.98,3560055829.0,608419,Industrials
DTB,DTE Energy Company 2020 Series G 4.375% Junior Subordinated Debentures due 2080,17.1099,3559340279.0,10184,Utilities
AAP,Advance Auto Parts Inc.,58.93,3555200227.0,901238,Consumer Discretionary
NTRSO,Northern Trust Corporation Depositary Shares Each Representing a 1/1000th Interest in a Share of Series E Non-Cumulative Perpetual Preferred Stock,19.1354,3546189952.0,13557,Finance
JOE,St. Joe Company (The) Common Stock,61.74,3544477718.0,551591,Real Estate
HGTY,Hagerty Inc. Class A Common Stock,10.34,3542677244.0,113764,Finance
HYMC,Hycroft Mining Holding Corporation Class A Common Stock,38.73,3538396077.0,2063780,Basic Materials
CDP,COPT Defense Properties Common Shares of Beneficial Interest,31.01,3515878387.0,989132,Real Estate
HNGE,Hinge Health Inc. Class A Common Stock,45.43,3515060342.0,636276,Technology
CPRX,Catalyst Pharmaceuticals Inc. Common Stock,28.74,3509840426.0,1417845,Health Care
COLD,Americold Realty Trust Inc. Common Stock,12.28,3503421053.0,4638478,Real Estate
HWKN,Hawkins Inc. Common Stock,167.49,3500891557.0,124589,Consumer Discretionary
NAN,Nuveen New York Quality Municipal Income Fund Common Stock,11.56,3494770648.0,107306,Finance
DAVE,Dave Inc. Class A Common Stock,272.65,3493564785.0,327247,Finance
PAY,Paymentus Holdings Inc. Class A Common Stock,27.76,3491911995.0,590566,Real Estate
OGN,Organon & Co. Common Stock ,13.29,3489965456.0,9978430,Health Care
VKTX,Viking Therapeutics Inc. Common Stock,30.0,3476818290.0,2873170,Health Care
ASO,Academy Sports and Outdoors Inc. Common Stock,53.83,3472472853.0,942486,Consumer Discretionary
BOX,Box Inc. Class A Common Stock,25.01,3462624021.0,2016168,Technology
IAC,IAC Inc. Common Stock,44.97,3458551141.0,1836346,Technology
FIBK,First Interstate BancSystem Inc. Common Stock (DE),35.45,3456949964.0,1385028,Finance
TMDX,TransMedics Group Inc. Common Stock,100.01,3454761242.0,847464,Health Care
ACMR,ACM Research Inc. Class A Common Stock,52.15,3453105575.0,869655,Technology
KFY,Korn Ferry Common Stock,66.52,3451529027.0,306969,Consumer Discretionary
BFH,Bread Financial Holdings Inc. Common Stock,85.34,3448338927.0,451619,Real Estate
BKU,BankUnited Inc. Common Stock,46.59,3434614847.0,487248,Finance
GPOR,Gulfport Energy Corporation Common Shares,189.9,3429790736.0,215351,Energy
BKV,BKV Corporation Common Stock,31.32,3425987059.0,723761,Energy
GNW,Genworth Financial Inc Common Stock,8.81,3414853324.0,2657047,Finance
MZTI,The Marzetti Company Common Stock,124.38,3410872740.0,675082,Consumer Staples
DORM,Dorman Products Inc. Common Stock,112.88,3405657441.0,243785,Consumer Discretionary
BKD,Brookdale Senior Living Inc. Common Stock,14.32,3405187354.0,2568624,Health Care
MMED,MiniMed Group Inc. Common Stock,12.11,3400730055.0,563544,Health Care
LQDA,Liquidia Corporation Common Stock,38.14,3390402705.0,770362,Health Care
KAI,Kadant Inc Common Stock,285.85,3375254485.0,287045,Industrials
AVNT,Avient Corporation Common Stock,36.76,3371265739.0,452702,Industrials
FHB,First Hawaiian Inc. Common Stock,27.47,3370273862.0,1440037,Finance
ARLP,Alliance Resource Partners L.P. Common Units representing Limited Partners Interests,26.15,3364427646.0,369441,Energy
AVA,Avista Corporation Common Stock,40.72,3360991012.0,472983,Utilities
CVI,CVR Energy Inc. Common Stock,33.28,3345658335.0,976573,Energy
UCTT,Ultra Clean Holdings Inc. Common Stock,74.61,3344643343.0,1275782,Technology
CBU,Community Financial System Inc. Common Stock,63.62,3342450319.0,201948,Finance
CARG,CarGurus Inc. Class A Common Stock ,37.04,3340520998.0,1673489,Technology
FULTP,Fulton Financial Corporation Depositary Shares Each Representing a 1/40th Interest in a Share of Fixed Rate Non-Cumulative Perpetual Preferred Stock Series A,18.55,3336413425.0,9314,Finance
OPLN,OPENLANE Inc. Common Stock,31.49,3335250628.0,509604,Consumer Discretionary
MHO,M/I Homes Inc. Common Stock,130.09,3329017280.0,155813,Consumer Discretionary
WSBC,WesBanco Inc. Common Stock,34.5,3315900536.0,768658,Finance
SKYW,SkyWest Inc. Common Stock,83.54,3313219875.0,422724,Consumer Discretionary
CWK,Cushman & Wakefield Ltd. Common Shares,14.11,3305794551.0,1338077,Finance
MCHB,Mechanics Bancorp Class A Common Stock,14.92,3303296803.0,411568,Finance
RWTO,Redwood Trust Inc. 9.00% Senior Notes Due 2029,25.48,3292613863.0,2444,Real Estate
EWTX,Edgewise Therapeutics Inc. Common Stock,30.61,3290009388.0,609626,Health Care
NATL,NCR Atleos Corporation Common Stock,44.52,3283424126.0,421473,Miscellaneous
RWTN,Redwood Trust Inc. 9.125% Senior Notes Due 2029,25.4001,3282288908.0,2730,Real Estate
NSA,National Storage Affiliates Trust Common Shares of Beneficial Interest,42.49,3276509063.0,752874,Real Estate
BELFA,Bel Fuse Inc. Class A Common Stock,256.12,3267830982.0,53660,Uncategorized
FUL,H. B. Fuller Company Common Stock,59.95,3266513275.0,341664,Industrials
HAYW,Hayward Holdings Inc. Common Stock,15.05,3265293030.0,3385980,Industrials
OLN,Olin Corporation Common Stock,28.61,3257449829.0,2034279,Industrials
FRMI,Fermi Inc. Common Stock,5.17,3256271714.0,11347995,Real Estate
KD,Kyndryl Holdings Inc. Common Stock,14.36,3237421677.0,4699526,Technology
FSK,FS KKR Capital Corp. Common Stock,11.55,3234767301.0,4908430,Finance
BSM,Black Stone Minerals L.P. Common units representing limited partner interests,14.24,3233120971.0,225431,Energy
PARR,Par Pacific Holdings Inc.  Common Stock,65.35,3232914427.0,802313,Energy
BTU,Peabody Energy Corporation Common Stock ,26.53,3232256789.0,4289597,Energy
RXO,RXO Inc. Common Stock,19.59,3226692839.0,2193730,Consumer Discretionary
RCUS,Arcus Biosciences Inc. Common Stock,25.68,3226144554.0,986425,Health Care
CNK,Cinemark Holdings Inc Cinemark Holdings Inc. Common Stock,27.62,3226084415.0,4793926,Consumer Discretionary
KBH,KB Home Common Stock,51.44,3222625774.0,998725,Consumer Discretionary
BXMT,Blackstone Mortgage Trust Inc. Common Stock,19.07,3216794726.0,1708658,Real Estate
CHEF,The Chefs' Warehouse Inc. Common Stock,78.83,3214500494.0,405878,Consumer Discretionary
PLMR,Palomar Holdings Inc. Common stock,120.97,3207291401.0,237463,Finance
QTWO,Q2 Holdings Inc. Common Stock,51.23,3207019670.0,1300293,Technology
ALMS,Alumis Inc. Common Stock,25.18,3202879205.0,799382,Health Care
FRPT,Freshpet Inc. Common Stock,65.15,3201634461.0,951809,Consumer Staples
MSGE,Madison Square Garden Entertainment Corp. Class A Common Stock,67.66,3198497878.0,533171,Consumer Discretionary
WHR,Whirlpool Corporation Common Stock,56.57,3198476286.0,1512316,Consumer Discretionary
RUM,Rumble Inc. Class A Common Stock,7.34,3194592648.0,3064336,Technology
FIZZ,National Beverage Corp. Common Stock,34.11,3193790999.0,160822,Consumer Staples
FFBC,First Financial Bancorp. Common Stock,30.41,3190685592.0,662430,Finance
COLM,Columbia Sportswear Company Common Stock,62.35,3188628381.0,1421935,Consumer Discretionary
BOH,Bank of Hawaii Corporation Common Stock,80.14,3175228302.0,420360,Finance
EXPO,Exponent Inc. Common Stock,65.28,3173567094.0,848648,Consumer Discretionary
APLE,Apple Hospitality REIT Inc. Common Shares,13.39,3160651829.0,5760951,Real Estate
BEAM,Beam Therapeutics Inc. Common Stock,30.7,3154292775.0,1458334,Health Care
BWIN,The Baldwin Insurance Group Inc. Class A Common Stock,22.03,3154240904.0,1634560,Finance
USLM,United States Lime & Minerals Inc. Common Stock,110.0,3153706160.0,210088,Industrials
FGN,F&G Annuities & Life Inc. 7.950% Senior Notes due 2053,24.95,3146158773.0,34868,Finance
OPCH,Option Care Health Inc. Common Stock,20.03,3144421768.0,6371902,Health Care
LBRDP,Liberty Broadband Corporation Series A Cumulative Redeemable Preferred Stock,21.9,3142600287.0,17111,Telecommunications
AMBA,Ambarella Inc. Ordinary Shares,71.56,3133532181.0,625413,Technology
UPST,Upstart Holdings Inc. Common stock,32.74,3133455692.0,3647844,Finance
PRK,Park National Corporation Common Stock,173.26,3130183251.0,45130,Finance
NIC,Nicolet Bankshares Inc. Common Stock,146.54,3129296343.0,126493,Finance
CSQ,Calamos Strategic Total Return Common Stock,19.68,3126908401.0,215520,Finance
QLYS,Qualys Inc. Common Stock,88.53,3124219185.0,722257,Technology
PRVA,Privia Health Group Inc. Common Stock,24.85,3121780778.0,1809017,Health Care
ERAS,Erasca Inc. Common Stock,10.03,3118988689.0,9783345,Health Care
UNFI,United Natural Foods Inc. Common Stock,51.24,3112930687.0,773685,Consumer Discretionary
CLSK,CleanSpark Inc. Common Stock,12.17,3112512951.0,16366034,Finance
CCC,CCC Intelligent Solutions Holdings Inc. Common Stock,5.29,3104555276.0,20540301,Technology
GBTG,Global Business Travel Group Inc. Class A Common Stock,5.93,3103423504.0,741792,Consumer Discretionary
TR,Tootsie Roll Industries Inc. Common Stock,42.5,3101931775.0,134023,Consumer Staples
ORKA,Oruka Therapeutics Inc. Common Stock,62.58,3100381603.0,3951377,Health Care
MPT,Medical Properties Trust Inc. common stock,5.05,3095321775.0,8452310,Real Estate
KLRA,Kailera Therapeutics Inc. Common Stock,25.15,3092161641.0,551212,Health Care
WK,Workiva Inc. Class A Common Stock,54.76,3086704616.0,2313330,Technology
GEF,Greif Inc. Class A Common Stock,66.83,3083289397.0,192606,Uncategorized
SFNC,Simmons First National Corporation Class A Common Stock,21.23,3079598642.0,925427,Finance
NIQ,NIQ Global Intelligence plc Ordinary Shares,10.4,3069198818.0,1487062,Technology
RUN,Sunrun Inc. Common Stock,13.06,3062470783.0,7561865,Miscellaneous
SBCF,Seacoast Banking Corporation of Florida Common Stock,31.31,3057653319.0,809723,Finance
LXP,LXP Industrial Trust Common Stock (Maryland REIT),51.84,3056098222.0,632018,Real Estate
YETI,YETI Holdings Inc. Common Stock,40.35,3054238455.0,1223499,Consumer Discretionary
HTGC,Hercules Capital Inc. Common Stock,16.3,3050270475.0,2318564,Finance
SLG,SL Green Realty Corp Common Stock,42.85,3047337140.0,827750,Real Estate
CPK,Chesapeake Utilities Corporation Common Stock,126.94,3045194506.0,90730,Utilities
APAM,Artisan Partners Asset Management Inc. Class A Common Stock,37.55,3043718963.0,1112858,Finance
VRNS,Varonis Systems Inc. Common Stock,26.5,3042574975.0,3580472,Technology
VECO,Veeco Instruments Inc. Common Stock,50.25,3034697548.0,634104,Technology
BHE,Benchmark Electronics Inc. Common Stock,84.5,3031609542.0,887925,Technology
TNGX,Tango Therapeutics Inc.,20.98,3026202846.0,3017417,Health Care
SXI,Standex International Corporation Common Stock,248.63,3013080586.0,634194,Industrials
GPCR,Structure Therapeutics Inc. American Depositary Shares,42.21,2999914845.0,1350065,Health Care
CAKE,Cheesecake Factory Incorporated (The) Common Stock,60.2,2998291100.0,1734796,Consumer Discretionary
EXTR,Extreme Networks Inc. Common Stock,22.29,2992868047.0,3567586,Telecommunications
AEHR,Aehr Test Systems Common Stock,93.07,2987924678.0,2137953,Industrials
ICUI,ICU Medical Inc. Common Stock,118.85,2970345314.0,242662,Health Care
MGEE,MGE Energy Inc,80.6,2962238523.0,170562,Energy
VC,Visteon Corporation Common Stock,110.85,2959032228.0,875280,Consumer Discretionary
NMRK,Newmark Group Inc. Class A Common Stock,16.04,2958379329.0,3037369,Finance
PLAB,Photronics Inc. Common Stock,50.16,2957754323.0,578392,Technology
AWR,American States Water Company Common Stock,75.21,2947671234.0,266769,Utilities
PATK,Patrick Industries Inc. Common Stock,88.94,2944909505.0,748697,Consumer Discretionary
CRVL,CorVel Corp. Common Stock,57.53,2942799701.0,142727,Finance
IPAR,Interparfums Inc. Common Stock,91.73,2941944838.0,236237,Consumer Discretionary
AMPX,Amprius Technologies Inc. Common Stock,20.87,2938643363.0,6098133,Miscellaneous
CLMT,Calumet Inc. Common Stock,33.68,2931525993.0,923458,Energy
KMT,Kennametal Inc. Common Stock,38.47,2931367528.0,1230194,Industrials
ARQT,Arcutis Biotherapeutics Inc. Common Stock,23.35,2920460364.0,1021071,Health Care
LFST,LifeStance Health Group Inc. Common Stock,7.53,2920342408.0,3562409,Health Care
DX,Dynex Capital Inc. Common Stock,13.57,2919597808.0,4317837,Real Estate
POWWP,Outdoor Holding Company 8.75% Series A Cumulative Redeemable Perpetual Preferred Stock,24.88,2918143403.0,3525,Industrials
PFS,Provident Financial Services Inc Common Stock,22.38,2916420248.0,1329930,Finance
BRZE,Braze Inc. Class A Common Stock,23.56,2907229362.0,2240897,Technology
DNLI,Denali Therapeutics Inc. Common Stock,18.3,2903761613.0,1505406,Health Care
CURB,Curbline Properties Corp. Common Stock,27.49,2901276567.0,534456,Finance
CON,Concentra Group Holdings Parent Inc. Common Stock,22.53,2895269221.0,532843,Health Care
TXG,10x Genomics Inc. Class A Common Stock,22.43,2893266650.0,2422404,Industrials
SEZL,Sezzle Inc. Common Stock,85.46,2888691146.0,503201,Finance
TRN,Trinity Industries Inc. Common Stock,36.22,2885014093.0,1206298,Industrials
WU,Western Union Company (The) Common Stock,9.21,2877527308.0,5362226,Real Estate
DYN,Dyne Therapeutics Inc. Common Stock,17.39,2873167122.0,1176645,Health Care
AKR,Acadia Realty Trust Common Stock,21.51,2871953703.0,1956635,Real Estate
GPK,Graphic Packaging Holding Company,9.7,2870077584.0,5972844,Consumer Discretionary
DKL,Delek Logistics Partners L.P. Common Units representing Limited Partner Interests,53.95,2868424606.0,106923,Energy
DK,Delek US Holdings Inc. Common Stock,46.73,2863966838.0,1204628,Energy
ITGR,Integer Holdings Corporation Common Stock,84.03,2862909915.0,1035662,Health Care
GRBK,Green Brick Partners Inc. Common Stock,66.27,2860033741.0,157080,Consumer Discretionary
BANC,Banc of California Inc. Common Stock,18.58,2857202059.0,2533848,Finance
UNIT,Uniti Group Inc. Common Stock,11.77,2856274746.0,2473939,Real Estate
BKE,Buckle Inc. (The) Common Stock,55.27,2847404613.0,204718,Consumer Discretionary
WDFC,WD-40 Company Common Stock,211.06,2839897146.0,115143,Industrials
KALU,Kaiser Aluminum Corporation Common Stock,173.72,2838690074.0,252956,Industrials
LCII,LCI Industries,116.79,2836184069.0,341322,Consumer Discretionary
DBRG,DigitalBridge Group Inc.,15.55,2835890540.0,3152700,Real Estate
NMIH,NMI Holdings Inc. Common Stock,37.21,2833778453.0,1335762,Finance
WRBY,Warby Parker Inc. Class A Common Stock,23.08,2832267647.0,1658807,Health Care
AEO,American Eagle Outfitters Inc. Common Stock,16.94,2823468808.0,5004492,Consumer Discretionary
XMTR,Xometry Inc. Class A Common Stock,53.67,2822977489.0,751290,Real Estate
ZIONP,Zions Bancorporation N.A. Depositary Shares (Each representing 1/40th Interest in a Share of Series A Floating-Rate Non-Cumulative Perpetual Preferred Stock),19.11,2810489278.0,763,Finance
EEFT,Euronet Worldwide Inc. Common Stock,74.01,2809871357.0,579910,Finance
FBK,FB Financial Corporation Common Stock,54.17,2808366674.0,239033,Finance
NOG,Northern Oil and Gas Inc. Common Stock,26.52,2805580582.0,1958235,Energy
ARCB,ArcBest Corporation Common Stock,125.82,2805257933.0,262254,Industrials
BCC,Boise Cascade L.L.C. Common Stock,78.13,2801453032.0,304902,Consumer Discretionary
FTAIM,FTAI Aviation Ltd. 9.500% Fixed-Rate Reset Series D Cumulative Perpetual Redeemable Preferred Shares,27.28,2798400405.0,2765,Industrials
FCPT,Four Corners Property Trust Inc. Common Stock,25.37,2784337128.0,685031,Real Estate
PHIN,PHINIA Inc. Common Stock,74.02,2783616698.0,380623,Consumer Discretionary
CVBF,CVB Financial Corporation Common Stock,20.45,2776800796.0,1654138,Finance
CALX,Calix Inc Common Stock,43.53,2776443475.0,850368,Consumer Discretionary
RHI,Robert Half Inc. Common Stock,27.02,2766718952.0,1877379,Consumer Discretionary
CALY,Callaway Golf Company Common Stock,15.16,2758757236.0,2560162,Consumer Discretionary
HAE,Haemonetics Corporation Common Stock,59.26,2753892201.0,717866,Health Care
UE,Urban Edge Properties Common Shares of Beneficial Interest,21.85,2753536869.0,799618,Finance
SUPN,Supernus Pharmaceuticals Inc. Common Stock,47.85,2749339557.0,622212,Health Care
SHOO,Steven Madden Ltd. Common Stock,37.5,2739012750.0,789731,Consumer Discretionary
TARS,Tarsus Pharmaceuticals Inc. Common Stock,63.62,2737184272.0,576725,Health Care
KOD,Kodiak Sciences Inc Common Stock,43.96,2732363913.0,527590,Health Care
SLNO,Soleno Therapeutics Inc. Common Stock,52.87,2729381182.0,1342968,Health Care
NHC,National HealthCare Corporation Common Stock,174.86,2727649184.0,98330,Health Care
HIW,Highwoods Properties Inc. Common Stock,24.71,2724838343.0,1494911,Real Estate
STUB,StubHub Holdings Inc. Class A Common Stock,7.63,2721805028.0,2772696,Consumer Discretionary
DBD,Diebold Nixdorf Incorporated Common stock,77.86,2710240341.0,460250,Miscellaneous
KN,Knowles Corporation Common Stock,31.65,2707994889.0,768337,Consumer Staples
HNI,HNI Corporation Common Stock,37.44,2695414476.0,629565,Consumer Discretionary
ANDE,Andersons Inc. (The) Common Stock,79.12,2694309360.0,293571,Industrials
WAFD,WaFd Inc. Common Stock,35.46,2690113824.0,423314,Finance
VISN,Vistance Networks Inc. Common Stock,11.93,2689771920.0,13988195,Technology
MGRC,McGrath RentCorp Common Stock,109.38,2686566403.0,176752,Consumer Discretionary
NMFCZ,New Mountain Finance Corporation 8.250% Notes due 2028,25.23,2683487046.0,24209,Uncategorized
UAA,Under Armour Inc. Class A Common Stock,6.29,2678848106.0,5895197,Consumer Discretionary
WOR,Worthington Enterprises Inc. Common Shares,54.38,2678377814.0,102849,Industrials
NGVT,Ingevity Corporation Common Stock ,75.92,2674095085.0,209350,Industrials
HOG,Harley-Davidson Inc. Common Stock,24.48,2670670570.0,2765183,Consumer Discretionary
TOWN,TowneBank Common Stock,35.73,2666077201.0,351123,Finance
GDV,Gabelli Dividend & Income Trust Common Shares of Beneficial Interest,29.41,2652443520.0,77363,Finance
TRMK,Trustmark Corporation Common Stock,44.91,2643936086.0,243625,Finance
TDC,Teradata Corporation Common Stock,27.96,2643070292.0,1944000,Technology
HUBG,Hub Group Inc. Class A Common Stock,43.18,2640608562.0,487280,Industrials
VCYT,Veracyte Inc. Common Stock,33.09,2640312515.0,477866,Health Care
NN,NextNav Inc. Common Stock,19.38,2636226380.0,1669893,Industrials
HE,Hawaiian Electric Industries Inc. Common Stock,15.27,2636145978.0,1961935,Utilities
DXPE,DXP Enterprises Inc. Common Stock,168.9,2621701776.0,286390,Industrials
