symbol,name,price,marketCap,volume,industry
ACXP,Acurx Pharmaceuticals Inc. Common Stock,1.93,8294634.0,101504,Health Care
CLRO,ClearOne Inc. Common Stock,3.1,8293777.0,16129,Utilities
YCBD,cbdMD Inc. Common Stock,0.788,8272360.0,70488,Consumer Discretionary
SQFTP,Presidio Property Trust Inc. 9.375% Series D Cumulative Redeemable Perpetual Preferred Stock $0.01 par value per share,5.748,8260048.0,5447,Real Estate
HWH,HWH International Inc. Common Stock,1.09,8149276.0,17227,Health Care
CWD,CaliberCos Inc. Class A Common Stock,0.921,8141846.0,122562,Finance
DTST,Data Storage Corporation Common Stock,3.74,8105096.0,25746,Technology
LIMN,Liminatus Pharma Inc. Class A Common Stock,0.1801,8082462.0,7641853,Uncategorized
ELAB,PMGC Holdings Inc. Common Stock,1.77,8042439.0,5720365,Health Care
GNPX,Genprex Inc. Common Stock,0.7501,7940860.0,404782,Health Care
BIAF,bioAffinity Technologies Inc. Common Stock,1.75,7872681.0,125870,Health Care
SCKT,Socket Mobile Inc. Common Stock,0.94,7746501.0,180839,Technology
ASBP,Aspire Biopharma Holdings Inc. Common Stock,5.96,7719595.0,183083,Health Care
ORGN,Origin Materials Inc. Common Stock,1.4,7703878.0,61757,Industrials
IQST,iQSTEL Inc. Common Stock,1.14,7678978.0,276006,Telecommunications
GDC,GD Culture Group Limited Common Stock,0.126,7655724.0,55097745,Industrials
TNON,Tenon Medical Inc. Common Stock,0.6714,7584388.0,185821,Health Care
XBIO,Xenetic Biosciences Inc. Common Stock,3.31,7583395.0,30976,Health Care
AUUD,Auddia Inc. Common Stock,1.4,7509670.0,622987,Technology
CYCU,Cycurion Inc. Common Stock,0.8714,7485344.0,832586,Technology
TGL,Treasure Global Inc. Common Stock,4.4,7373190.0,11961,Consumer Discretionary
IPDN,Professional Diversity Network Inc. Common Stock,0.6999,7365770.0,90938,Technology
POLA,Polar Power Inc. Common Stock,2.02,7353121.0,143108,Miscellaneous
CNSP,CNS Pharmaceuticals Inc. Common Stock,5.03,7351088.0,17612,Health Care
BMRA,Biomerica Inc. Common Stock,2.36,7293035.0,13071,Health Care
JCTC,Jewett-Cameron Trading Company Common Shares,2.05,7216232.0,55483,Consumer Discretionary
MGRX,Mangoceuticals Inc. Common Stock,0.4202,7213751.0,584713,Health Care
NVNO,enVVeno Medical Corporation Common Stock,10.6732,7126165.0,14286,Health Care
NCPL,Netcapital Inc. Common Stock,0.9,7063109.0,1813551,Finance
MTR,Mesa Royalty Trust Common Stock,3.79,7063006.0,17625,Energy
BTBD,BT Brands Inc. Common Stock,1.14,7050585.0,80138,Consumer Discretionary
SONM,DNA X Inc. Common Stock,4.73,7039508.0,38623,Utilities
OLB,The OLB Group Inc. Common Stock,0.4777,7005437.0,192031,Consumer Discretionary
PCSA,Processa Pharmaceuticals Inc. Common Stock,2.53,6957938.0,72531,Health Care
NDRA,ENDRA Life Sciences Inc. Common Stock,5.6,6948206.0,8171,Health Care
SMTK,SmartKem Inc. Common Stock,0.312,6691218.0,533663,Technology
APVO,Aptevo Therapeutics Inc. Common Stock,5.24,6529590.0,41037,Health Care
EXYNW,Exyn Technologies Inc. Warrant,0.85,6492229.0,12504,Uncategorized
HSCS,HeartSciences Inc. Common Stock,2.03,6464941.0,141087,Health Care
LUCY,Innovative Eyewear Inc. Common Stock,1.005,6435747.0,47160,Health Care
QSIAW,Quantum-Si Incorporated Warrant,0.0291,6336821.0,140688,Industrials
CDIO,Cardio Diagnostics Holdings Inc. Common stock,2.13,6303669.0,98756,Health Care
WALDW,Waldencast plc Warrant ,0.049,6284734.0,1031743,Consumer Discretionary
XAIR,Beyond Air Inc. Common Stock,0.4862,6171183.0,232973,Health Care
MITQ,Moving iMage Technologies Inc. Common Stock,0.616,6123700.0,50136,Consumer Discretionary
XPON,Expion360 Inc. Common Stock,0.532,6085175.0,93382,Miscellaneous
FBLG,FibroBiologics Inc. Common Stock,1.12,6047005.0,91160,Health Care
XHLD,TEN Holdings Inc. Common Stock,1.35,6044548.0,17302,Consumer Discretionary
INHD,Inno Holdings Inc. Common Stock,1.32,5967321.0,76771,Industrials
INBS,Intelligent Bio Solutions Inc. Common Stock,2.48,5931778.0,59199,Health Care
SLE,Super League Enterprise Inc. Common Stock,3.91,5875604.0,114742,Consumer Discretionary
BCAB,BioAtla Inc. Common Stock,3.53,5848949.0,34341,Health Care
ESLAW,Estrella Immunopharma Inc. Warrant,0.1349,5805317.0,90,Health Care
VIVK,Vivakor Inc. Common Stock,1.35,5799123.0,35899,Uncategorized
DFNSW,T3 Defense Inc. Warrants,0.0945,5695565.0,286179,Consumer Discretionary
RTB,RTB Digital Inc. Common Stock,4.37,5598009.0,18464,Consumer Discretionary
MSS,Maison Solutions Inc. Class A Common Stock,0.9501,5590484.0,75929,Consumer Staples
MTNB,Matinas Biopharma Holdings Inc. Common Stock,0.872,5586199.0,140861,Health Care
FEED,ENvue Medical Inc. Common Stock,0.9044,5509460.0,101564,Health Care
DAIC,CID HoldCo Inc. Common Stock,4.54,5495139.0,104556,Technology
NXGL,NexGel Inc Common Stock,0.5927,5411976.0,40189,Health Care
SILO,Silo Pharma Inc. Common Stock,0.3326,5410269.0,1335281,Consumer Discretionary
DRMA,Dermata Therapeutics Inc. Common Stock,1.34,5389672.0,96900,Health Care
CTNT,Cheetah Net Supply Chain Service Inc Class A Common Stock,1.82,5386092.0,6595768,Consumer Discretionary
SUNE,SUNation Energy Inc. Common Stock,1.29,5318807.0,78017,Utilities
AQB,AquaBounty Technologies Inc. Common Stock,1.03,5301620.0,22335,Consumer Staples
EEIQ,EpicQuest Education Group International Limited Common Stock,3.56,5266945.0,1529770,Real Estate
ADIL,Adial Pharmaceuticals Inc Common Stock,2.45,5251871.0,42471,Health Care
HCTI,Healthcare Triangle Inc. Common Stock,2.58,5231680.0,38228,Technology
MBIO,Mustang Bio Inc. Common Stock,0.769,5177000.0,176587,Health Care
RNAZ,TransCode Therapeutics Inc. Common Stock,5.4351,5164986.0,10377,Health Care
BNZI,Banzai International Inc. Class A Common Stock,3.52,5126465.0,253558,Technology
PGYWW,Pagaya Technologies Ltd. Warrants,0.06,5093879.0,222500,Finance
TWAV,TaoWeave Inc. Common Stock,1.47,5080539.0,123592,Technology
FLDDW,Fold Holdings Inc. Warrant,0.1,5078335.0,18300,Finance
PULM,Pulmatrix Inc. Common Stock,1.39,5076676.0,22745,Health Care
DSS,DSS Inc. Common Stock,0.505,5071472.0,50503,Consumer Discretionary
BNCWZ,CEA Industries Inc. Warrant,0.118,5061709.0,563,Industrials
LMFA,LM Funding America Inc. Common Stock,0.2883,5002663.0,298938,Finance
VSTD,Vestand Inc. Class A Common Stock,0.351,4992968.0,146454,Consumer Discretionary
ARTL,Artelo Biosciences Inc. Common Stock,1.43,4984322.0,554924,Health Care
TOIIW,The Oncology Institute Inc. Warrant,0.049,4899164.0,2211,Health Care
HYFM,Hydrofarm Holdings Group Inc. Common Stock,1.02,4859904.0,15439,Consumer Discretionary
ISPC,iSpecimen Inc. Common Stock,3.34,4800104.0,90271,Health Care
UGRO,urban-gro Inc. Common Stock,3.61,4755193.0,57501,Consumer Discretionary
AMIX,Autonomix Medical Inc. Common Stock,0.415,4734878.0,276280,Health Care
MKZR,MacKenzie Realty Capital Inc. Common Stock,2.39,4699696.0,16106,Real Estate
NWTG,Newton Golf Company Inc. Common Stock,1.02,4683904.0,34737,Consumer Discretionary
LABT,Lakewood-Amedex Biotherapeutics Inc. Common Stock,0.6499,4546355.0,502771,Health Care
ALZN,Alzamend Neuro Inc. Common Stock,1.17,4451547.0,127642,Health Care
DCOY,Decoy Therapeutics Inc. Common Stock,8.36,4447252.0,40250,Health Care
CJMB,Callan JMB Inc. Common Stock,0.7734,4366708.0,46525,Consumer Discretionary
ONFO,Onfolio Holdings Inc. Common Stock,0.6547,4361944.0,86665,Technology
CDT,CDT Equity Inc. Common Stock,0.895,4348223.0,1612491,Health Care
CAPS,Capstone Holding Corp. Common Stock,0.3441,4344574.0,908710,Health Care
RENX,RenX Enterprises Corp. Common Stock,1.64,4286758.0,128208,Finance
REVB,Revelation Biosciences Inc. Common Stock,1.09,4260178.0,32674,Health Care
IVDA,Iveda Solutions Inc. Common Stock,0.3819,4254267.0,616547,Technology
ALBT,Avalon GloboCare Corp. Common Stock,0.344,4144392.0,125558,Health Care
ENSC,Ensysce Biosciences Inc. Common Stock,0.28,4114458.0,996724,Health Care
GCTK,GlucoTrack Inc. Common Stock,0.6561,4106713.0,376763,Health Care
BNBX,BNB Plus Corp. Common Stock,0.549,3951278.0,1334624,Consumer Discretionary
SNYR,Synergy CHC Corp. Common Stock,0.262,3903769.0,1964088,Health Care
GBR,New Concept Energy Inc Common Stock,0.76,3900270.0,82689,Energy
SXTP,60 Degrees Pharmaceuticals Inc. Common Stock,1.46,3882560.0,30703,Health Care
CXAIW,CXApp Inc. Warrant,0.0553,3875937.0,16431,Technology
SQFT,Presidio Property Trust Inc. Class A Common Stock,2.61,3750648.0,13603,Real Estate
BOXL,Boxlight Corporation Class A Common Stock,0.93,3721588.0,45270,Real Estate
MVSTW,Microvast Holdings Inc. Warrants,0.0111,3698047.0,18219,Miscellaneous
GRI,GRI Bio Inc. Common Stock,2.07,3665635.0,48290,Health Care
VEEE,Twin Vee PowerCats Co. Common Stock,6.9,3652377.0,19279,Industrials
FFAIW,Faraday Future Intelligent Electric Inc. Warrant,0.0117,3555679.0,1028933,Industrials
MEHA,Functional Brands Inc. Common Stock,0.083,3547677.0,20854773,Health Care
COCHW,Envoy Medical Inc Warrant,0.0461,3544219.0,34,Health Care
NVVE,Nuvve Holding Corp. Common Stock,0.365,3446962.0,271770,Industrials
VIVS,VivoSim Labs Inc. Common Stock,1.29,3364271.0,63799,Health Care
SOBR,SOBR Safe Inc. Common Stock,1.19,3339829.0,115389,Consumer Discretionary
BEATW,Heartbeam Inc. Warrant,0.06,3330410.0,170,Health Care
AEMD,Aethlon Medical Inc. Common Stock,2.41,3169415.0,571774,Health Care
IPST,IP Strategy Holdings Inc. Common Stock,4.56,3128525.0,35760,Consumer Staples
SHPH,Shuttle Pharmaceuticals Holdings Inc. Common Stock,0.533,3118738.0,220638,Health Care
FLYE,Fly-E Group Inc. Common Stock,1.9,3101533.0,14044,Industrials
GWAV,Greenwave Technology Solutions Inc. Common Stock,3.73,3094524.0,7889,Industrials
KIDZ,Classover Holdings Inc. Class B Common Stock,0.385,3058463.0,11697629,Real Estate
EVGOW,EVgo Inc. Warrants,0.0096,3013050.0,27312,Technology
BFRGW,Bullfrog AI Holdings Inc. Warrants,0.1623,3009310.0,409,Health Care
BLUWW,Blue Water Acquisition Corp. III Warrant.,0.4,2898000.0,716,Uncategorized
SGLY,Singularity Future Technology Ltd. Common Stock,0.3901,2845191.0,66715,Industrials
BCGWW,Binah Capital Group Inc. Warrants,0.1687,2835869.0,200,Finance
PW,Power REIT (MD) Common Stock,0.7686,2822510.0,126247,Real Estate
ZNB,Zeta Network Group Class A Ordinary Shares,1.77,2798011.0,1039704,Consumer Discretionary
VEEAW,Veea Inc. Warrant,0.0551,2777457.0,8637,Finance
OGEN,Oragenics Inc. Common Stock,0.605,2729734.0,244362,Health Care
IPW,iPower Inc. Common Stock,4.11,2717696.0,369779,Consumer Discretionary
BIVIW,BioVie Inc. Warrant,0.35,2639644.0,16,Health Care
ZEOWW,Zeo Energy Corporation Warrants,0.0453,2626210.0,326,Miscellaneous
XXII,22nd Century Group Inc. Common Stock,0.58,2584276.0,327060,Health Care
BZFDW,BuzzFeed Inc. Warrant,0.0321,2536426.0,14189,Consumer Discretionary
BTOG,Bit Origin Limited Class A Ordinary Shares,1.71,2525400.0,69755,Finance
FRGT,Freight Technologies Inc. Ordinary Shares,4.18,2391483.0,1083096,Consumer Discretionary
SHFS,SHF Holdings Inc. Class A Common Stock,0.47,2365565.0,118587,Finance
BBLG,Bone Biologics Corp Common Stock,1.28,2297933.0,7906,Health Care
SDOT,Sadot Group Inc. Common Stock,3.1,2294000.0,1998543,Consumer Discretionary
HOLOW,MicroCloud Hologram Inc. Warrant,0.1,2291236.0,2530,Technology
EZRA,Reliance Global Group Inc. Common Stock,4.11,2284190.0,265619,Finance
BJDX,Bluejay Diagnostics Inc. Common Stock,2.17,2245332.0,74233,Health Care
FUSEW,Fusemachines Inc. Warrants,0.077,2228321.0,747,Technology
VBIO,Valion Bio Inc. Common Stock,0.6936,2220092.0,94320,Health Care
RMCOW,Royalty Management Holding Corporation Warrant,0.1449,2196620.0,4348,Miscellaneous
DRCT,Direct Digital Holdings Inc. Class A Common Stock,2.93,2178171.0,27504,Consumer Discretionary
SNOA,Sonoma Pharmaceuticals Inc. Common Stock,1.185,2160063.0,156584,Health Care
GNLN,Greenlane Holdings Inc. Class A Common Stock,3.4,2146961.0,10479,Consumer Discretionary
UK,Ucommune International Ltd Class A Ordinary Shares,3.12,2115207.0,112162,Consumer Discretionary
IVF,INVO Fertility Inc. Common Stock,1.47,2046562.0,775798,Health Care
OSRHW,OSR Holdings Inc. Warrant,0.0581,2039600.0,12680,Health Care
JAGX,Jaguar Health Inc. Common Stock,3.27,1972248.0,51371,Health Care
TRUG,TruGolf Holdings Inc. Class A Common Stock,1.74,1937814.0,51733,Consumer Discretionary
PDYNW,Palladyne AI Corp Warrants,0.0407,1922840.0,37287,Technology
RKDA,Arcadia Biosciences Inc. Common Stock,0.9164,1884928.0,81050,Consumer Staples
NUWE,Nuwellis Inc. Common Stock,0.7001,1845266.0,286513,Health Care
TRNR,Interactive Strength Inc. Common Stock,0.78,1818130.0,197492,Technology
WHLR,Wheeler Real Estate Investment Trust Inc. Common Stock,0.9783,1761393.0,222564,Real Estate
LIDRW,AEye Inc. Warrant,0.038,1759963.0,28180,Consumer Discretionary
KUST,Kustom Entertainment Inc. Common Stock,2.7599,1730071.0,84351,Technology
FCUV,Focus Universal Inc. Common Stock,0.8295,1716883.0,257749,Industrials
SKYAW,SkyAI Inc. Warrant,0.0399,1688655.0,12446,Finance
PFSA,Profusa Inc. Common Stock,0.3424,1595676.0,200021,Health Care
MOBXW,Mobix Labs Inc Warrants,0.1086,1459356.0,19563,Technology
GIPR,Generation Income Properties Inc. Common Stock,0.213,1396933.0,990402,Real Estate
SDSTW,Stardust Power Inc. Warrant,0.13,1375365.0,1046,Industrials
ONCO,Onconetix Inc. Common Stock,1.14,1306961.0,432770,Health Care
SABSW,SAB Biotherapeutics Inc. Warrant,0.017,1299890.0,68490,Health Care
EDBL,Edible Garden AG Incorporated Common Stock,0.2332,1275444.0,3037879,Consumer Staples
VGASW,Verde Clean Fuels Inc. Warrant,0.0279,1242934.0,46663,Industrials
SCLXW,Scilex Holding Company Warrant,0.1397,1186230.0,10125,Health Care
TALKW,Talkspace Inc. Warrant,0.0065,1088832.0,11700,Health Care
AERTW,Aeries Technology Inc. Warrant,0.0214,1074488.0,34023,Consumer Discretionary
RCKTW,Rocket Pharmaceuticals Inc. Warrant,0.0096,1048258.0,127990,Health Care
AIMDW,Ainos Inc. Warrants,0.1083,923208.0,1525,Technology
BIAFW,bioAffinity Technologies Inc. Warrant,0.2,899735.0,1602,Health Care
SWAGW,Stran & Company Inc. Warrant,0.0398,747052.0,20,Consumer Discretionary
BNAIW,Brand Engagement Network Inc. Warrant,0.1017,661832.0,22812,Technology
MYPSW,PLAYSTUDIOS Inc. Warrant,0.005,643610.0,173864,Technology
SEATW,Vivid Seats Inc. Warrant,0.0557,611999.0,5,Consumer Discretionary
MNTSW,Momentus Inc. Warrant,0.0575,606484.0,344266,Industrials
DFLIW,Dragonfly Energy Holdings Corp. Warrant,0.0451,577972.0,9280,Miscellaneous
CINGW,Cingulate Inc. Warrants,0.0399,537415.0,15519,Health Care
NXGLW,NexGel Inc Warrant,0.0538,491251.0,100,Health Care
FOXXW,Foxx Development Holdings Inc. Warrant,0.066,464719.0,3000,Telecommunications
ONFOW,Onfolio Holdings Inc. Warrant,0.0614,409078.0,108865,Technology
RMSGW,Real Messenger Corporation Warrants,0.0429,380578.0,3098,Technology
IVDAW,Iveda Solutions Inc. Warrant,0.0327,364269.0,5521,Technology
JSPRW,Japer Therapeutics Inc. Warrants,0.013,363959.0,3,Health Care
EDBLW,Edible Garden AG Incorporated Warrant,0.0643,351677.0,392,Consumer Staples
LUCYW,Innovative Eyewear Inc. Series A Warrants 8/16/27,0.0529,338757.0,16011,Health Care
NCPLW,Netcapital Inc. Warrants,0.0361,283309.0,8036,Finance
WGSWW,GeneDx Holdings Corp. Warrant,0.0087,258286.0,180895,Technology
KTTAW,Pasithea Therapeutics Corp. Warrant,0.0072,240584.0,29546,Health Care
CYCUW,Cycurion Inc. Warrant,0.0257,220764.0,6483,Technology
MYSEW,Myseum.AI Inc. Series A Warrant,0.0371,188258.0,352,Telecommunications
TVGNW,Tevogen Bio Holdings Inc. Warrant,0.0397,166244.0,3500,Health Care
GIPRW,Generation Income Properties Inc Warrant,0.0251,164615.0,18,Real Estate
HSCSW,HeartSciences Inc. Warrant,0.0507,161464.0,3294,Health Care
SHFSW,SHF Holdings Inc. Warrants,0.0305,153510.0,5010,Finance
LNZAW,LanzaTech Global Inc. Warrant,0.0146,147302.0,102,Industrials
BENFW,Beneficient Warrant,0.0103,146401.0,1,Finance
CELUW,Celularity Inc. Warrant,0.0049,141835.0,63482,Health Care
ERNAW,Ernexa Therapeutics Inc. Warrants,0.1165,135878.0,6497,Uncategorized
LTRYW,Sports Entertainment Gaming Global Corporation Warrants,0.0106,134021.0,209659,Technology
KITTW,Nauticus Robotics Inc. Warrant,0.0265,132578.0,132196,Industrials
NIXXW,Nixxy Inc. Warrant,0.0047,126394.0,36500,Technology
KIDZW,Classover Holdings Inc. Warrants,0.0138,109628.0,27829,Real Estate
PIIIW,P3 Health Partners Inc. Warrant,0.0133,96358.0,494300,Health Care
ADTX,Aditxt Inc. Common Stock,0.113,92199.0,32009970,Health Care
FGIWW,FGI Industries Ltd. Warrant,0.0401,77444.0,68,Industrials
ICUCW,SeaStar Medical Holding Corporation Warrant,0.0186,74344.0,2480,Health Care
ACONW,Aclarion Inc. Warrant,0.0291,71651.0,37288,Health Care
LRHC,La Rosa Holdings Corp. Common Stock,1.26,67410.0,73311,Finance
MSAIW,MultiSensor AI Holdings Inc. Warrant,0.0297,59977.0,5009,Technology
DRMAW,Dermata Therapeutics Inc. Warrant,0.0138,55506.0,2203,Health Care
CDTTW,CDT Equity Inc. Warrant,0.011,53442.0,41682,Health Care
REVBW,Revelation Biosciences Inc. Warrant,0.012,46901.0,12905,Health Care
CDIOW,Cardio Diagnostics Holdings Inc. Warrant,0.013,38473.0,600,Health Care
APLMW,Apollomics Inc. Warrant,0.0141,30964.0,200,Health Care
SQFTW,Presidio Property Trust Inc. Series A Common Stock Purchase Warrants,0.0188,27016.0,6690,Real Estate
XOSWW,Xos Inc. Warrants,0.002,24245.0,2118,Consumer Discretionary
DAICW,CID HoldCo Inc. Warrants,0.0174,21061.0,272,Technology
ASBPW,Aspire Biopharma Holdings Inc. Warrant,0.0142,18392.0,15146,Health Care
BNZIW,Banzai International Inc. Warrant,0.0083,12088.0,29728,Technology
NXPLW,NextPlat Corp Warrants,0.0039,10563.0,300,Telecommunications
KPLTW,Katapult Holdings Inc. Warrant,0.0013,6195.0,132707,Consumer Discretionary
ORGNW,Origin Materials Inc. Warrants,0.0006,3302.0,10450,Industrials
AEFC,Aegon Funding Company LLC 5.10% Subordinated Notes due 2049,19.11,0.0,17456,Uncategorized
ATIIW,Archimedes Tech SPAC Partners II Co. Warrant,2.32,0.0,73481,Finance
KOYN,CSLM Digital Asset Acquisition Corp III Class A Ordinary Shares,10.125,0.0,10833,Uncategorized
KOYNU,CSLM Digital Asset Acquisition Corp III Units,10.39,0.0,101,Uncategorized
RWTP,Redwood Trust Inc. 9.125% Senior Notes Due 2030,24.3325,0.0,12705,Real Estate
NUW,Nuveen AMT-Free Municipal Value Fund,14.12,0.0,28439,Finance
KOYNW,CSLM Digital Asset Acquisition Corp III Warrants,0.2,0.0,80,Uncategorized
RWAYI,Runway Growth Finance Corp. 7.25% Notes due 2031,24.7,0.0,1527,Finance
BEAGU,Bold Eagle Acquisition Corp. Units,10.9,0.0,50101,Uncategorized
BEAGR,Bold Eagle Acquisition Corp. Right,0.3,0.0,128371,Uncategorized
VACHW,Voyager Acquisition Corp Warrants,0.1757,0.0,2745,Finance
VACHU,Voyager Acquisition Corp Unit,12.0,0.0,160,Finance
VACH,Voyager Acquisition Corp Class A Ordinary Shares,9.61,0.0,562,Uncategorized
BIXIW,Bitcoin Infrastructure Acquisition Corp Ltd. Warrant,0.2514,0.0,630,Uncategorized
BIXIU,Bitcoin Infrastructure Acquisition Corp Ltd. Unit ,10.12,0.0,214,Finance
PGACU,Pantages Capital Acquisition Corporation Unit,11.0,0.0,52,Uncategorized
PGAC,Pantages Capital Acquisition Corporation Class A Ordinary Shares,10.57,0.0,1097,Uncategorized
ARCLW,ARC Group Acquisition I Corp Warrants,0.062,0.0,190312,Finance
ADX,Adams Diversified Equity Fund Inc.,25.56,0.0,328709,Finance
ARCL,ARC Group Acquisition I Corp Class A Ordinary Shares,9.87,0.0,155560,Finance
ARCIW,Archimedes Tech SPAC Partners III Co. Warrant,0.5551,0.0,1292,Uncategorized
ARCI,Archimedes Tech SPAC Partners III Co. Ordinary Share,9.98,0.0,36484,Uncategorized
FACTU,FACT II Acquisition Corp. Unit,10.99,0.0,3,Finance
FACT,FACT II Acquisition Corp. Class A Ordinary Shares,10.67,0.0,16296,Uncategorized
HTD,John Hancock Tax Advantaged Dividend Income Fund Common Shares of Beneficial Interest,25.33,0.0,45135,Finance
FIGX,FIGX Capital Acquisition Corp. Class A Ordinary Share,10.24,0.0,5170,Uncategorized
BRW,Saba Capital Income & Opportunities Fund SBI,6.9,0.0,287773,Finance
BRUNW,Boost Run Inc. Warrant,27.53,0.0,283686,Technology
NTWO,Newbury Street II Acquisition Corp Class A Ordinary Shares,10.67,0.0,4,Uncategorized
ARCLR,ARC Group Acquisition I Corp Right,0.23,0.0,317324,Finance
ADAMO,Adamas Trust Inc. 9.250% Senior Notes Due 2031,25.32,0.0,8805,Real Estate
ADAMH,Adamas Trust Inc. 9.875% Senior Notes Due 2030,25.72,0.0,13589,Real Estate
KIO,KKR Income Opportunities Fund Common Shares,11.36,0.0,152130,Finance
KFIIU,K&F Growth Acquisition Corp. II Unit,10.63,0.0,217,Finance
KFIIR,K&F Growth Acquisition Corp. II Rights,0.12,0.0,37093,Uncategorized
KFII,K&F Growth Acquisition Corp. II Class A Ordinary shares,10.53,0.0,91,Uncategorized
KF,Korea Fund Inc. (The) New Common Stock,78.6,0.0,19420,Finance
BGB,Blackstone Strategic Credit 2027 Term Fund Common Shares of Beneficial Interest,11.355,0.0,142911,Finance
KCHVR,Kochav Defense Acquisition Corp. Right,0.2449,0.0,10,Finance
KCHV,Kochav Defense Acquisition Corp. Class A Ordinary Shares,10.34,0.0,114,Uncategorized
VGI,Virtus Global Multi-Sector Income Fund Common Shares of Beneficial Interest,7.48,0.0,44166,Finance
NUV,Nuveen Municipal Value Fund Inc. Common Stock,9.07,0.0,654950,Finance
FSHPU,Flag Ship Acquisition Corp. Unit,11.0,0.0,500,Uncategorized
FSHPR,Flag Ship Acquisition Corp. Right,0.0802,0.0,356,Uncategorized
FSHP,Flag Ship Acquisition Corp. Ordinary Shares,11.01,0.0,5310,Uncategorized
NVG,Nuveen AMT-Free Municipal Credit Income Fund ,12.65,0.0,649731,Finance
ELLA,Ellington Credit Company 8.50% Notes due 2031,25.54,0.0,4551,Real Estate
EIM,Eaton Vance Municipal Bond Fund Common Shares of Beneficial Interest $.01 par value,9.8,0.0,183638,Finance
RTACW,Renatus Tactical Acquisition Corp I Warrant,0.82,0.0,25935,Finance
RTACU,Renatus Tactical Acquisition Corp I Unit,10.82,0.0,5772,Finance
RTAC,Renatus Tactical Acquisition Corp I Class A Ordinary Shares,10.45,0.0,91826,Finance
KBONU,Karbon Capital Partners Corp. Units,10.26,0.0,82363,Finance
KBONW,Karbon Capital Partners Corp. Warrant,0.68,0.0,13500,Finance
VBF,Invesco Bond Fund Common Stock,14.96,0.0,56195,Finance
VHCPW,Vine Hill Capital Investment Corp. II Warrants,0.351,0.0,492,Uncategorized
VHCPU,Vine Hill Capital Investment Corp. II Units,10.12,0.0,374,Finance
VHCP,Vine Hill Capital Investment Corp. II Class A Ordinary Shares,10.0,0.0,3,Uncategorized
HSPT,Horizon Space Acquisition II Corp. Ordinary share,10.76,0.0,2956,Finance
VFL,abrdn National Municipal Income Fund Common Stock,10.21,0.0,56068,Finance
BKHA,Black Hawk Acquisition Corporation Class A Ordinary Shares,11.85,0.0,5,Health Care
HVMC,Highview Merger Corp. Class A Ordinary Share,10.15,0.0,3,Uncategorized
HVIIU,Hennessy Capital Investment Corp. VII Unit,10.8,0.0,2,Finance
KKRT,KKR & Co. Inc. 6.875% Subordinated Notes due 2065,24.39,0.0,95132,Finance
VLT,Invesco High Income Trust II,10.475,0.0,16705,Finance
KRAQW,KRAKacquisition Corp Warrants,0.49,0.0,9495,Uncategorized
KRAQU,KRAKacquisition Corp Unit,10.05,0.0,100,Uncategorized
KRAQ,KRAKacquisition Corp Class A Ordinary Shares,9.94,0.0,202326,Uncategorized
RDAG,Republic Digital Acquisition Company Class A Ordinary Shares,10.34,0.0,15,Finance
RCS,PIMCO Strategic Income Fund Inc.,5.62,0.0,181267,Finance
BTT,BlackRock Municipal 2030 Target Term Trust,22.79,0.0,43641,Finance
IAF,abrdn Australia Equity Fund Inc. Common Stock,12.66,0.0,24159,Finance
IAE,Voya Asia Pacific High Dividend Equity Income Fund ING Asia Pacific High Dividend Equity Income Fund Common Shares of Beneficial Interest,8.74,0.0,96163,Finance
CMIIW,Columbus Circle Capital Corp II Warrant,0.52,0.0,161733,Finance
CMII,Columbus Circle Capital Corp II Class A Ordinary Shares,9.93,0.0,2284,Finance
CEE,The Central and Eastern Europe Fund Inc. (The) Common Stock,20.93,0.0,32457,Finance
VBNB,VanEck BNB ETF Common Shares of Beneficial Interest,27.0463,0.0,10256,Finance
SCD,LMP Capital and Income Fund Inc. Common Stock,15.5,0.0,48952,Finance
SBI,Western Asset Intermediate Muni Fund Inc Common Stock,7.82,0.0,26058,Finance
EFR,Eaton Vance Senior Floating-Rate Fund Common Shares of Beneficial Interest,10.47,0.0,188627,Finance
EEA,The European Equity Fund Inc. Common Stock,10.637,0.0,30186,Finance
SAV,Saratoga Investment Corp 7.50% Notes due 2031,25.13,0.0,10622,Finance
NPV,Nuveen Virginia Quality Municipal Income Fund Common Stock,11.53,0.0,42804,Finance
NPFD,Nuveen Variable Rate Preferred & Income Fund Common Shares,18.99,0.0,50618,Finance
LCCCU,Lakeshore Acquisition III Corp. Unit,10.63,0.0,129,Finance
LCCCR,Lakeshore Acquisition III Corp. Rights,0.22,0.0,14,Finance
EHI,Western Asset Global High Income Fund Inc Common Stock,5.98,0.0,93628,Finance
NRO,Neuberger Real Estate Securities Income Fund Inc. Common Stock,2.92,0.0,366427,Finance
KVACW,Keen Vision Acquisition Corporation Warrant,0.0199,0.0,34199,Uncategorized
PFL,PIMCO Income Strategy Fund Shares of Beneficial Interest,7.83,0.0,213872,Finance
PFD,Flaherty & Crumrine Preferred and Income Fund Incorporated,11.48,0.0,30320,Finance
PTACU,Patriot Acquisition Corp. Units,9.97,0.0,4330,Uncategorized
FCT,First Trust Senior Floating Rate Income Fund II Common Shares of Beneficial Interest,9.57,0.0,211949,Finance
PGP,Pimco Global StocksPlus & Income Fund Common Shares of Beneficial Interest,8.83,0.0,45782,Finance
KVAC,Keen Vision Acquisition Corporation Ordinary Shares,12.2,0.0,17483,Uncategorized
KTN,Structured Products Corp 8.205% CorTS 8.205% Corporate Backed Trust Securities (CorTS),26.15,0.0,308,Finance
KTH,Structures Products Cp 8% CorTS Issued by Peco Energy Cap Tr II Preferred Stock,28.22,0.0,2208,Finance
CCIXW,Churchill Capital Corp IX Warrant,0.35,0.0,2099,Technology
CCIX,Churchill Capital Corp IX Ordinary Shares,10.81,0.0,1995,Technology
FXACU,FortuneX Acquisition Corporation Units,10.005,0.0,15240,Finance
CRF,Cornerstone Total Return Fund Inc. (The) Common Stock,7.29,0.0,1181692,Finance
TWOD,Two Harbors Investments Corp 9.375% Senior Notes due 2030,25.39,0.0,44599,Real Estate
TWN,Taiwan Fund Inc. (The) Common Stock,101.53,0.0,28207,Finance
TWLVU,Twelve Seas Investment Company III Units,10.1,0.0,100001,Finance
LFACW,Leapfrog Acquisition Corporation Warrants,0.2601,0.0,300,Finance
LFAC,Leapfrog Acquisition Corporation Class A Ordinary Shares,9.98,0.0,365,Finance
HLXC,Helix Acquisition Corp. III Class A Ordinary Shares,10.21,0.0,238,Uncategorized
HIX,Western Asset High Income Fund II Inc. Common Stock,3.97,0.0,373389,Finance
