symbol,name,price,marketCap,volume,industry
NVDA,NVIDIA Corporation Common Stock,212.5,5142500000000.0,124468310,Technology
AAPL,Apple Inc. Common Stock,327.5,4810109090000.0,60881890,Technology
GOOGL,Alphabet Inc. Class A Common Stock,370.92,4494066720000.0,28269105,Technology
GOOG,Alphabet Inc. Class C Capital Stock,370.21,4485464360000.0,20229871,Technology
MSFT,Microsoft Corporation Common Stock,395.63,2938911621944.0,36199570,Technology
AMZN,Amazon.com Inc. Common Stock,254.96,2742632621803.0,45162815,Consumer Discretionary
AVGO,Broadcom Inc. Common Stock,394.28,1875818720467.0,16289515,Technology
SPCX,Space Exploration Technologies Corp. Class A Common Stock,135.27,1770799815846.0,57873511,Technology
META,Meta Platforms Inc. Class A Common Stock,681.31,1729453181248.0,18983198,Technology
TSLA,Tesla Inc. Common Stock,394.46,1481482838155.0,31471622,Industrials
LLY,Eli Lilly and Company Common Stock,1156.63,1089246362422.0,2550791,Health Care
BRK/A,Berkshire Hathaway Inc.,733180.0,1078415399320.0,240,Uncategorized
BRK/B,Berkshire Hathaway Inc.,488.35,1077452158028.0,5131059,Uncategorized
MU,Micron Technology Inc. Common Stock,904.28,1021287638586.0,54397367,Technology
JPM,JP Morgan Chase & Co. Common Stock,346.91,929549306018.0,10746679,Finance
WMT,Walmart Inc. Common Stock,112.53,895522647312.0,16457182,Consumer Discretionary
AMD,Advanced Micro Devices Inc. Common Stock,529.14,862816022120.0,27767728,Technology
V,Visa Inc.,355.14,672801350249.0,8849324,Consumer Discretionary
GOOGM,Alphabet Inc. Depositary Shares representing a 1/20th Interest in a Share of Series A Mandatory Convertible Preferred Stock,51.73,626760680000.0,641303,Technology
GOOGN,Alphabet Inc. Depositary Shares representing a 1/20th Interest in a Share of Series B Mandatory Convertible Preferred Stock,51.61,625306760000.0,1214477,Technology
XOM,ExxonMobil Holdings Corporation Common Stock,144.51,598986314381.0,13439405,Energy
JNJ,Johnson & Johnson Common Stock,247.02,594630736176.0,10543820,Health Care
INTC,Intel Corporation Common Stock,102.99,517627740000.0,120228757,Technology
MA,Mastercard Incorporated Common Stock,535.21,472902915035.0,3128494,Consumer Discretionary
AMAT,Applied Materials Inc. Common Stock,579.43,460043912525.0,8159656,Technology
CSCO,Cisco Systems Inc. Common Stock (DE),111.77,440534152507.0,23824823,Telecommunications
BAC,Bank of America Corporation Common Stock,61.59,437079018195.0,43357152,Finance
ABBV,AbbVie Inc. Common Stock,244.11,431291795534.0,6388113,Health Care
CAT,Caterpillar Inc. Common Stock,914.3,421160432872.0,2657935,Industrials
LRCX,Lam Research Corporation Common Stock,335.43,419479030530.0,10249246,Technology
COST,Costco Wholesale Corporation Common Stock,916.54,406466063018.0,2422167,Consumer Discretionary
ORCL,Oracle Corporation Common Stock,132.49,381633602790.0,48407832,Technology
UNH,UnitedHealth Group Incorporated Common Stock (DE),418.52,380076595962.0,6756734,Health Care
GE,GE Aerospace Common Stock,360.35,375966572632.0,5420239,Technology
CVX,Chevron Corporation Common Stock,181.6,361674148131.0,6663054,Energy
MS,Morgan Stanley Common Stock,228.55,360488444925.0,10864589,Finance
KO,Coca-Cola Company (The) Common Stock,82.45,354877404709.0,18377417,Consumer Staples
PG,Procter & Gamble Company (The) Common Stock,148.05,344749078693.0,6178955,Consumer Discretionary
HD,Home Depot Inc. (The) Common Stock,341.44,340455519902.0,3952165,Consumer Discretionary
GS,Goldman Sachs Group Inc. (The) Common Stock,1152.07,339869199511.0,2736736,Finance
PLTR,Palantir Technologies Inc. Class A Common Stock,133.76,320664450044.0,26025033,Technology
NFLX,Netflix Inc. Common Stock,73.68,310251635543.0,32734038,Consumer Discretionary
MRK,Merck & Company Inc. Common Stock (new),123.61,305294995938.0,9053168,Health Care
KLAC,KLA Corporation Common Stock,224.5,293258784645.0,10621480,Technology
PANW,Palo Alto Networks Inc. Common Stock,354.02,288526300000.0,6701323,Technology
GEV,GE Vernova Inc. Common Stock,1055.28,283574836324.0,2691623,Uncategorized
PM,Philip Morris International Inc Common Stock,180.88,281912124064.0,4178221,Health Care
TXN,Texas Instruments Incorporated Common Stock,301.19,274110847721.0,6391675,Technology
WFC,Wells Fargo & Company Common Stock,87.51,267797182620.0,28721866,Finance
DELL,Dell Technologies Inc. Class C Common Stock ,412.68,267461205726.0,12937904,Technology
RTX,RTX Corporation Common Stock,195.89,263801816711.0,3541850,Industrials
AXP,American Express Company Common Stock,358.44,244573090229.0,2525546,Finance
SNDK,Sandisk Corporation Common Stock,1615.0,239164959170.0,18902602,Technology
LIN,Linde plc Ordinary Shares,514.15,237845552977.0,1529475,Basic Materials
CCZ,Comcast Holdings ZONES,66.5,237659127755.0,4,Telecommunications
C,Citigroup Inc. Common Stock,134.89,230065275460.0,18081390,Finance
ANET,Arista Networks Inc. Common Stock,171.92,216482109789.0,8081573,Telecommunications
CRWD,CrowdStrike Holdings Inc. Class A Common Stock,206.77,210545471326.0,11993373,Technology
TMUS,T-Mobile US Inc. Common Stock,187.62,203043249004.0,2602446,Telecommunications
TMO,Thermo Fisher Scientific Inc Common Stock,535.29,198925254000.0,2108123,Industrials
IBM,International Business Machines Corporation Common Stock,211.2,198503771136.0,29433614,Technology
AMGN,Amgen Inc. Common Stock,358.32,193388268740.0,1837792,Health Care
APH,Amphenol Corporation Common Stock,157.04,193196017243.0,7403521,Technology
ADI,Analog Devices Inc. Common Stock,390.96,190431549158.0,3099865,Technology
MCD,McDonald's Corporation Common Stock,264.95,188248527342.0,6045941,Consumer Discretionary
QCOM,QUALCOMM Incorporated Common Stock,177.98,187590920000.0,9431671,Technology
NEE,NextEra Energy Inc. Common Stock,89.1,185803923730.0,10255616,Technology
PEP,PepsiCo Inc. Common Stock,135.4,184806316953.0,8075373,Consumer Staples
MRVL,Marvell Technology Inc. Common Stock,206.26,180635582408.0,26721948,Technology
VZ,Verizon Communications Inc. Common Stock,42.83,178839188115.0,23026131,Telecommunications
SCHW,Charles Schwab Corporation (The) Common Stock,102.79,178765738765.0,7971923,Finance
WDC,Western Digital Corporation Common Stock,513.84,177111466193.0,7885149,Technology
BA,Boeing Company (The) Common Stock,218.12,171944504438.0,3299433,Industrials
UNP,Union Pacific Corporation Common Stock,288.36,171203142101.0,2602331,Industrials
BLK,BlackRock Inc. Common Stock,1093.4,169732843573.0,1582792,Finance
DIS,Walt Disney Company (The) Common Stock,97.15,168702084842.0,10217623,Consumer Discretionary
TJX,TJX Companies Inc. (The) Common Stock,150.97,166777230213.0,6550059,Consumer Discretionary
IBKR,Interactive Brokers Group Inc. Class A Common Stock,97.41,165241818008.0,3481806,Finance
WELL,Welltower Inc. Common Stock,233.29,164682782041.0,2548165,Real Estate
GILD,Gilead Sciences Inc. Common Stock,131.7,163514752406.0,4467457,Health Care
DE,Deere & Company Common Stock,589.48,159122713289.0,1013692,Industrials
ABT,Abbott Laboratories Common Stock,89.27,155491595537.0,16398481,Health Care
APP,Applovin Corporation Class A Common Stock,452.73,152090116200.0,4629354,Technology
SCCO,Southern Copper Corporation Common Stock,181.54,151463996979.0,1372869,Basic Materials
GLW,Corning Incorporated Common Stock,174.41,150103843058.0,13339534,Industrials
T,AT&T Inc.,21.43,148902901234.0,75045836,Telecommunications
UBER,Uber Technologies Inc. Common Stock,72.67,147926980275.0,13867469,Consumer Discretionary
TBB,AT&T Inc. 5.350% Global Notes due 2066,20.68,147869971726.0,76037,Telecommunications
DHR,Danaher Corporation Common Stock,200.79,142113264195.0,4469269,Industrials
BKNG,Booking Holdings Inc. Common Stock,182.8,141647778101.0,6799633,Consumer Discretionary
PFE,Pfizer Inc. Common Stock,24.82,141460204275.0,44131124,Health Care
ISRG,Intuitive Surgical Inc. Common Stock,388.97,137758720653.0,4140429,Health Care
CRM,Salesforce Inc. Common Stock,167.0,136773000000.0,13321379,Technology
PLD,Prologis Inc. Common Stock,143.42,136532397920.0,4866702,Real Estate
COP,ConocoPhillips Common Stock,111.46,135791050020.0,5953897,Energy
CVS,CVS Health Corporation Common Stock,105.91,135133461084.0,6939362,Consumer Staples
SPGI,S&P Global Inc. Common Stock,444.48,131566080000.0,1522302,Finance
COF,Capital One Financial Corporation Common Stock,208.89,128680309386.0,4947029,Finance
SYK,Stryker Corporation Common Stock,316.44,121310679527.0,2722152,Health Care
VRTX,Vertex Pharmaceuticals Incorporated Common Stock,477.08,121085488342.0,1192039,Health Care
FTNT,Fortinet Inc. Common Stock,164.51,120527986803.0,5088187,Technology
PH,Parker-Hannifin Corporation Common Stock,952.95,120154024398.0,732080,Industrials
PGR,Progressive Corporation (The) Common Stock,205.22,119917529142.0,7222830,Finance
BMY,Bristol-Myers Squibb Company Common Stock,58.72,119910423624.0,12482078,Health Care
SBUX,Starbucks Corporation Common Stock,105.11,119793867000.0,4785014,Consumer Discretionary
LMT,Lockheed Martin Corporation Common Stock,514.46,118615753772.0,815938,Industrials
MO,Altria Group Inc.,70.52,117760729892.0,6853879,Health Care
LOW,Lowe's Companies Inc. Common Stock,209.66,117557838216.0,2993429,Consumer Discretionary
VRT,Vertiv Holdings LLC Class A Common Stock,304.57,116988022089.0,3869827,Technology
HWM,Howmet Aerospace Inc. Common Stock,279.24,111726013553.0,2010739,Industrials
BNY,The Bank of New York Mellon Corporation Common Stock,162.35,111433637956.0,8055758,Finance
NOW,ServiceNow Inc. Common Stock,104.73,107976630000.0,13741991,Technology
SO,Southern Company (The) Common Stock,94.6,106739055445.0,3303718,Utilities
HOOD,Robinhood Markets Inc. Class A Common Stock,115.54,104044354286.0,21059844,Finance
MDT,Medtronic plc. Ordinary Shares,80.47,103005236439.0,8785237,Health Care
CDNS,Cadence Design Systems Inc. Common Stock,371.5,102465644000.0,1622378,Technology
PNC,PNC Financial Services Group Inc. (The) Common Stock,254.15,102057651223.0,3046664,Finance
NEM,Newmont Corporation,95.21,101641698660.0,6968548,Basic Materials
EQIX,Equinix Inc. Common Stock REIT,1022.6,100853156005.0,561127,Real Estate
ADP,Automatic Data Processing Inc. Common Stock,247.47,99642400759.0,1872802,Industrials
GD,General Dynamics Corporation Common Stock,365.63,98877389273.0,1198901,Industrials
USB,U.S. Bancorp Common Stock,63.01,97736776471.0,8847413,Finance
PWR,Quanta Services Inc. Common Stock,648.84,97365027077.0,868672,Industrials
MAR,Marriott International Class A Common Stock,369.05,97314286318.0,1110928,Consumer Discretionary
DUK,Duke Energy Corporation (Holding Company) Common Stock,124.34,96934993622.0,3482228,Utilities
NET,Cloudflare Inc. Class A Common Stock,273.04,96510431999.0,2942006,Technology
UPS,United Parcel Service Inc. Common Stock,112.94,95999709150.0,4070814,Industrials
MCK,McKesson Corporation Common Stock,796.35,95724496014.0,664789,Health Care
MNST,Monster Beverage Corporation,97.57,95424251293.0,6207886,Consumer Staples
BX,Blackstone Inc. Common Stock,127.05,94382879479.0,5477680,Finance
SNOW,Snowflake Inc. Common Stock,271.87,94230142000.0,3789653,Technology
DDOG,Datadog Inc. Class A Common Stock,264.46,94137231583.0,3224988,Technology
WM,Waste Management Inc. Common Stock,232.8,93486835066.0,1607375,Utilities
CEG,Constellation Energy Corporation Common Stock ,258.115,93228573111.0,2118832,Utilities
CMI,Cummins Inc. Common Stock,666.13,91918657201.0,847697,Industrials
CSX,CSX Corporation Common Stock,49.43,91847803652.0,8881966,Industrials
WMB,Williams Companies Inc. (The) Common Stock,74.38,90966610951.0,6233635,Utilities
KKR,KKR & Co. Inc. Common Stock,100.95,90640273394.0,5929269,Finance
ABNB,Airbnb Inc. Class A Common Stock,148.38,89429356475.0,3728489,Consumer Discretionary
ADBE,Adobe Inc. Common Stock,224.56,89262600000.0,4769522,Technology
CME,CME Group Inc. Class A Common Stock,245.18,88843264697.0,2467260,Finance
MCO,Moody's Corporation Common Stock,504.46,88129162000.0,832914,Finance
FCX,Freeport-McMoRan Inc. Common Stock,60.97,87648024969.0,14260212,Basic Materials
MPC,Marathon Petroleum Corporation Common Stock,299.18,87341602459.0,2325166,Energy
VLO,Valero Energy Corporation Common Stock,292.66,86900347980.0,4637801,Energy
MRSH,Marsh Common Stock,176.22,84901826966.0,1784964,Finance
ELV,Elevance Health Inc. Common Stock,390.33,84764991785.0,3896778,Health Care
HCA,HCA Healthcare Inc. Common Stock,378.85,84044008230.0,2179706,Health Care
CMCSA,Comcast Corporation Class A Common Stock,23.49,83949066330.0,22868571,Telecommunications
MMM,3M Company Common Stock,160.53,83727192408.0,3285948,Health Care
DASH,DoorDash Inc. Class A Common Stock,190.16,82856272176.0,3900292,Technology
SHW,Sherwin-Williams Company (The) Common Stock,332.29,81954550502.0,2504674,Consumer Discretionary
SNPS,Synopsys Inc. Common Stock,425.275,81431369939.0,1419247,Technology
EPD,Enterprise Products Partners L.P. Common Stock,37.52,81175205528.0,1985392,Utilities
ICE,Intercontinental Exchange Inc. Common Stock,139.84,79081267301.0,3157831,Finance
CI,The Cigna Group Common Stock,297.81,78780395235.0,1655892,Health Care
PSX,Phillips 66 Common Stock,196.16,78647413523.0,2471147,Energy
AMT,American Tower Corporation (REIT) Common Stock,168.63,78563548225.0,2072268,Real Estate
RCL,Royal Caribbean Cruises Ltd. Common Stock,292.17,78358526722.0,2197177,Consumer Discretionary
ITW,Illinois Tool Works Inc. Common Stock,271.41,78084657000.0,918532,Industrials
CVNA,Carvana Co. Class A Common Stock,70.59,77425634887.0,5953482,Consumer Discretionary
CTAS,Cintas Corporation Common Stock,192.37,76974331798.0,4510639,Industrials
INTU,Intuit Inc. Common Stock,279.7,76508298900.0,3389761,Technology
EMR,Emerson Electric Company Common Stock,136.25,76313625000.0,2249936,Technology
ECL,Ecolab Inc. Common Stock,270.25,76058484916.0,1037626,Consumer Discretionary
AON,Aon plc Class A Ordinary Shares (Ireland),355.15,75851853437.0,1193567,Finance
MDLZ,Mondelez International Inc. Class A Common Stock,58.72,75375914260.0,8499120,Consumer Staples
FDX,FedEx Corporation Common Stock,313.42,74784129466.0,1468192,Consumer Discretionary
HLT,Hilton Worldwide Holdings Inc. Common Stock ,328.48,74777937235.0,1984222,Consumer Discretionary
NOC,Northrop Grumman Corporation Common Stock,525.22,74598822265.0,824528,Industrials
NSC,Norfolk Southern Corporation Common Stock,328.54,73788113089.0,1257496,Industrials
EOG,EOG Resources Inc. Common Stock,137.47,73220444019.0,3209433,Energy
CL,Colgate-Palmolive Company Common Stock,91.47,73193316186.0,3474603,Consumer Discretionary
ROST,Ross Stores Inc. Common Stock,225.81,72435574772.0,2169835,Consumer Discretionary
AEP,American Electric Power Company Inc. Common Stock,132.5,72093916740.0,3321714,Utilities
SPG,Simon Property Group Inc. Common Stock,222.01,71995603363.0,1490802,Real Estate
KMI,Kinder Morgan Inc. Common Stock,32.2,71639389375.0,8509668,Utilities
HON,Honeywell International Inc. Common Stock,222.84,70601630630.0,2515097,Industrials
APO,Apollo Global Management Inc. (New) Common Stock,121.83,70237128609.0,4597420,Finance
GM,General Motors Company Common Stock,77.64,70005285740.0,6293181,Industrials
TRV,The Travelers Companies Inc. Common Stock,329.19,70000506489.0,1764274,Finance
REGN,Regeneron Pharmaceuticals Inc. Common Stock,664.45,69660294812.0,555411,Health Care
TDG,Transdigm Group Incorporated Common Stock,1232.18,68920242301.0,351143,Industrials
ORLY,O'Reilly Automotive Inc. Common Stock,82.73,68559598486.0,13858435,Consumer Discretionary
ET,Energy Transfer LP Common Units ,19.91,68513481205.0,6952014,Utilities
WBD,Warner Bros. Discovery Inc. Series A Common Stock ,27.27,68369617864.0,26132419,Consumer Discretionary
SE,Sea Limited American Depositary Shares each representing one Class A Ordinary Share,111.36,68206276370.0,4263620,Consumer Discretionary
BE,Bloom Energy Corporation Class A Common Stock,239.38,68090173122.0,11178181,Energy
MSI,Motorola Solutions Inc. Common Stock,407.18,67590081079.0,634376,Technology
HONA,Honeywell Aerospace Inc. Common Stock ,212.55,67365543863.0,2107820,Industrials
BRKRP,Bruker Corporation 6.375% Mandatory Convertible Preferred Stock Series A,433.25,67147521598.0,2244,Industrials
RSG,Republic Services Inc. Common Stock,217.34,66867712669.0,1501553,Utilities
MPWR,Monolithic Power Systems Inc. Common Stock,1352.66,66456185800.0,754023,Technology
DLR,Digital Realty Trust Inc. Common Stock,176.07,66321168482.0,3134560,Real Estate
TFC,Truist Financial Corporation Common Stock,52.8,65782425720.0,6300300,Finance
URI,United Rentals Inc. Common Stock,1047.28,65608486215.0,476990,Consumer Discretionary
APD,Air Products and Chemicals Inc. Common Stock,293.69,65399090671.0,879551,Basic Materials
PCAR,PACCAR Inc. Common Stock,123.15,64812149101.0,1868267,Consumer Discretionary
GWW,W.W. Grainger Inc. Common Stock,1371.44,64749959921.0,218438,Industrials
BSX,Boston Scientific Corporation Common Stock,43.04,63972726904.0,14528435,Health Care
