symbol,name,price,marketCap,volume,industry
RCMT,RCM Technologies Inc. Common Stock,27.51,194980261.0,69123,Consumer Discretionary
III,Information Services Group Inc. Common Stock,4.07,194705845.0,316262,Consumer Discretionary
ONEW,OneWater Marine Inc. Class A Common Stock,11.64,193428177.0,142158,Consumer Discretionary
RDIB,Reading International Inc Class B Common Stock,8.51,193323883.0,62,Consumer Discretionary
COOK,Traeger Inc. Common Stock,69.21,192528862.0,63119,Consumer Discretionary
TONX,TON Strategy Company Common Stock,3.32,187681648.0,363812,Consumer Discretionary
TPVG,TriplePoint Venture Growth BDC Corp. Common Stock,4.61,187161302.0,289321,Consumer Discretionary
BSET,Bassett Furniture Industries Incorporated Common Stock,21.485,186022909.0,149441,Consumer Discretionary
AMWL,American Well Corporation Class A Common Stock,11.01,183960398.0,442101,Consumer Discretionary
THRY,Thryv Holdings Inc. Common Stock,4.11,182277620.0,380219,Consumer Discretionary
ACU,Acme United Corporation. Common Stock,47.46,180839638.0,4480,Consumer Discretionary
HQI,HireQuest Inc. Common Stock (DE),12.95,180005000.0,6798,Consumer Discretionary
CVGI,Commercial Vehicle Group Inc. Common Stock,4.91,179321518.0,362907,Consumer Discretionary
AOUT,American Outdoor Brands Inc. Common Stock ,14.21,177726175.0,143101,Consumer Discretionary
LEE,Lee Enterprises Incorporated Common Stock,7.87,174949596.0,42108,Consumer Discretionary
DHX,DHI Group Inc. Common Stock,3.9,168474177.0,172192,Consumer Discretionary
DIBS,1stdibs.com Inc. Common Stock,4.72,166774172.0,57086,Consumer Discretionary
HOFT,Hooker Furnishings Corporation Common Stock,14.96,160695084.0,83484,Consumer Discretionary
RGP,Resources Connection Inc. Common Stock,4.65,159631450.0,518020,Consumer Discretionary
SKYX,SKYX Platforms Corp. Common Stock,1.17,157346381.0,1595513,Consumer Discretionary
CHPT,ChargePoint Holdings Inc. Common Stock,6.07,157198620.0,501055,Consumer Discretionary
EML,Eastern Company (The) Common Stock,25.93,156381600.0,22488,Consumer Discretionary
DLTH,Duluth Holdings Inc. Class B Common Stock,4.05,153908388.0,78052,Consumer Discretionary
CURI,CuriosityStream Inc. Class A Common Stock,2.57,152369132.0,418052,Consumer Discretionary
VENU,Venu Holding Corporation Common Stock,2.65,152326094.0,640385,Consumer Discretionary
LVWR,LiveWire Group Inc. Common Stock,0.7127,145933756.0,325981,Consumer Discretionary
WW,WW International Inc.  Common Stock,14.58,145781921.0,124963,Consumer Discretionary
PLBY,Playboy Inc. Common Stock,1.17,135681461.0,424726,Consumer Discretionary
CLAR,Clarus Corporation Common Stock,3.38,129932223.0,182967,Consumer Discretionary
RRGB,Red Robin Gourmet Burgers Inc. Common Stock,6.91,127832588.0,175948,Consumer Discretionary
TLYS,Tilly's Inc. Common Stock,4.12,125612290.0,258623,Consumer Discretionary
GPRO,GoPro Inc. Class A Common Stock,0.711,123000942.0,5123827,Consumer Discretionary
OPRX,OptimizeRx Corporation Common Stock,6.55,122911241.0,226994,Consumer Discretionary
BRLT,Brilliant Earth Group Inc. Class A Common Stock,1.2,121441440.0,49675,Consumer Discretionary
TSQ,Townsquare Media Inc. Class A Common Stock,6.75,121188096.0,17875,Consumer Discretionary
HOVNP,Hovnanian Enterprises Inc Dep Shr Srs A Pfd,20.6,120707698.0,5399,Consumer Discretionary
BZFD,BuzzFeed Inc. Class A Common Stock,1.41,114783236.0,207746,Consumer Discretionary
TTEC,TTEC Holdings Inc. Common Stock,2.35,114347195.0,706708,Consumer Discretionary
TZOO,Travelzoo Common Stock,11.09,114001973.0,108072,Consumer Discretionary
AMCI,AMC Robotics Corporation Common Stock,4.98,112549808.0,308479,Consumer Discretionary
RENT,Rent the Runway Inc. Class A Common Stock,3.34,112178673.0,53235,Consumer Discretionary
UFI,Unifi Inc. New Common Stock,6.01,111709397.0,248641,Consumer Discretionary
SCOR,comScore Inc. Common Stock,7.34,110787729.0,7473,Consumer Discretionary
VRA,Vera Bradley Inc. Common Stock,3.8,108065358.0,150537,Consumer Discretionary
FLNT,Fluent Inc. Common Stock,3.51,104653149.0,15392,Consumer Discretionary
FLZH,Flash Sports & Media Holdings Inc. Common Stock,1.88,100653544.0,27554,Consumer Discretionary
VIRC,Virco Manufacturing Corporation Common Stock,6.16,96893985.0,28211,Consumer Discretionary
FLL,Full House Resorts Inc. Common Stock,2.58,93564172.0,158807,Consumer Discretionary
HODO,House of Doge Inc. Common Stock,1.22,92601642.0,127960,Consumer Discretionary
HFFG,HF Foods Group Inc. Common Stock,1.69,90373455.0,126536,Consumer Discretionary
SRFM,Surf Air Mobility Inc. Common Stock,0.85,90297786.0,3777731,Consumer Discretionary
MHH,Mastech Digital Inc Common Stock,7.41,88906558.0,13500,Consumer Discretionary
SEAT,Vivid Seats Inc. Class A Common Stock,8.02,88119036.0,128055,Consumer Discretionary
GRWG,GrowGeneration Corp. Common Stock,1.45,87131812.0,168267,Consumer Discretionary
MDIA,Mediaco Holding Inc. Class A Common Stock ,1.02,83970724.0,5401,Consumer Discretionary
BARK,BARK Inc. Class A Common Stock,9.46,83180919.0,50792,Consumer Discretionary
VNCE,Vince Holding Corp. Common Stock,6.44,82736573.0,144170,Consumer Discretionary
CPSH,CPS Technologies Corp. Common Stock,4.52,81669385.0,432307,Consumer Discretionary
CPHC,Canterbury Park Holding Corporation 'New' Common Stock,15.8,81375277.0,5107,Consumer Discretionary
BODI,The Beachbody Company Inc. Class A Common Stock,11.165,80854295.0,24981,Consumer Discretionary
DTI,Drilling Tools International Corporation Common Stock,2.27,79765743.0,280531,Consumer Discretionary
PUSA,Aureus Greenway Holdings Inc. Common Stock,3.64,78641042.0,184820,Consumer Discretionary
BLNK,Blink Charging Co. Common Stock,0.5428,77990730.0,1500929,Consumer Discretionary
AIRT,Air T Inc. Common Stock,28.4,76580856.0,2805,Consumer Discretionary
DLHC,DLH Holdings Corp.,5.22,75653643.0,32016,Consumer Discretionary
AUC,ATIF Holdings Limited Ordinary Shares,7.3056,75345378.0,2758,Consumer Discretionary
TISI,Team Inc. Common Stock,16.41,75016379.0,1748,Consumer Discretionary
BDL,Flanigan's Enterprises Inc. Common Stock,40.35,74996406.0,13363,Consumer Discretionary
NDLS,Noodles & Company Class A Common Stock,12.58,74121976.0,24050,Consumer Discretionary
HOUR,Hour Loop Inc. Common Stock,2.07,72847212.0,87219,Consumer Discretionary
JFB,JFB Construction Holdings Class A Common Stock,4.71,72207126.0,186151,Consumer Discretionary
LVO,LiveOne Inc. Common Stock,5.09,69029409.0,12608,Consumer Discretionary
DIT,AMCON Distributing Company Common Stock,70.5,68809974.0,73,Consumer Discretionary
RGS,Regis Corporation Common Stock,27.45,68591456.0,2124,Consumer Discretionary
PLCE,Children's Place Inc. (The) Common Stock,2.99,66488830.0,229453,Consumer Discretionary
CATO,Cato Corporation (The) Class A Common Stock,3.23,64467111.0,230801,Consumer Discretionary
IZEA,IZEA Worldwide Inc. Common Stock,3.57,62522663.0,35435,Consumer Discretionary
BGSF,BGSF Inc. Common Stock,5.56,62516457.0,15702,Consumer Discretionary
STKS,The ONE Group Hospitality Inc. Common Stock,1.95,61550387.0,15230,Consumer Discretionary
CNVS,Cineverse Corp. Class A Common Stock,2.61,61118425.0,151449,Consumer Discretionary
JRSH,Jerash Holdings (US) Inc. Common Stock,4.73,60070716.0,193823,Consumer Discretionary
LIDR,AEye Inc. Class A Common Stock,1.29,59746118.0,657815,Consumer Discretionary
GENK,GEN Restaurant Group Inc. Class A Common Stock,1.76,58017728.0,26012,Consumer Discretionary
SGA,Saga Communications Inc. Class A Common Stock (FL),9.07,57721190.0,12087,Consumer Discretionary
GAIA,Gaia Inc. Class A Common Stock,2.13,53919195.0,59933,Consumer Discretionary
LESL,Leslie's Inc. Common Stock,5.6,52412909.0,463057,Consumer Discretionary
AIRTP,Air T Inc. Air T Funding Alpha Income Trust Preferred Securities,19.205,51786455.0,5180,Consumer Discretionary
HCMAW,HCM III Acquisition Corp. Warrants,0.6501,51515792.0,2733,Consumer Discretionary
SLSN,Solesence Inc. Common Stock,0.679,47959430.0,109012,Consumer Discretionary
NXXT,NextNRG Inc. Common Stock,0.2993,47215403.0,2295432,Consumer Discretionary
SPWH,Sportsman's Warehouse Holdings Inc. Common Stock,1.21,47213952.0,766059,Consumer Discretionary
ACFN,Acorn Energy Inc. Common Stock,18.2999,45900871.0,34805,Consumer Discretionary
PRTS,CarParts.com Inc. Common Stock,5.66,45838931.0,21592,Consumer Discretionary
RAVE,Rave Restaurant Group Inc. Common Stock,3.2,45477011.0,12381,Consumer Discretionary
NOMA,NOMADAR Corp. Class A Common Stock,3.1001,44256718.0,1989,Consumer Discretionary
ELWT,Elauwit Connection Inc. Common Stock,6.67,44154039.0,9317,Consumer Discretionary
CULP,Culp Inc. Common Stock,3.46,43813233.0,47116,Consumer Discretionary
HGBL,Heritage Global Inc. Common Stock,1.24,43079526.0,19011,Consumer Discretionary
SPRU,Spruce Power Holding Corporation Class A Common Stock,2.33,42800469.0,16961,Consumer Discretionary
MAMO,Massimo Group Common Stock,1.01,42057360.0,174984,Consumer Discretionary
OESX,Orion Energy Systems Inc. Common Stock,10.28,41701108.0,156360,Consumer Discretionary
STRR,Star Equity Holdings Inc. Common Stock,11.2,41393968.0,1499,Consumer Discretionary
BBGI,Beasley Broadcast Group Inc. Class A Common Stock,22.0,39785174.0,79418,Consumer Discretionary
OMEX,Odyssey Marine Exploration Inc. Common Stock,0.6735,39449666.0,483630,Consumer Discretionary
SWAG,Stran & Company Inc. Common Stock,2.06,38666523.0,19677,Consumer Discretionary
VRM,Vroom Inc. Common Stock,7.24,37893523.0,6022,Consumer Discretionary
AERT,Aeries Technology Inc. Class A Ordinary Share,6.57,37707523.0,25427,Consumer Discretionary
STRRP,Star Equity Holdings Inc. 10% Series A Cumulative Perpetual Preferred Stock,9.925,36681708.0,139,Consumer Discretionary
PRPL,Purple Innovation Inc. Common Stock,0.3277,35715593.0,179524,Consumer Discretionary
CNTY,Century Casinos Inc. Common Stock,1.24,34885587.0,82001,Consumer Discretionary
TOON,Kartoon Studios Inc. Common Stock,0.5885,34805381.0,340790,Consumer Discretionary
VTSI,VirTra Inc. Common Stock,3.07,34712137.0,31307,Consumer Discretionary
DXLG,Destination XL Group Inc. Common Stock,0.6218,34368809.0,37192,Consumer Discretionary
KPLT,Katapult Holdings Inc. Common Stock,7.14,34022514.0,4217,Consumer Discretionary
LIVE,Live Ventures Incorporated Common Stock,11.04,33911082.0,28260,Consumer Discretionary
SCWO,374Water Inc. Common Stock,1.92,33591368.0,49130,Consumer Discretionary
UG,United-Guardian Inc. Common Stock,7.25,33308813.0,3381,Consumer Discretionary
XOS,Xos Inc. Common Stock,2.34,32102036.0,115031,Consumer Discretionary
CRWS,Crown Crafts Inc Common Stock,2.98,32065655.0,31827,Consumer Discretionary
GAME,GameSquare Holdings Inc. Common Stock,0.3383,31697601.0,1221306,Consumer Discretionary
AENTW,Alliance Entertainment Holding Corporation Warrant,0.613,31250513.0,99,Consumer Discretionary
GIFT,Giftify Inc. Common Stock,0.887,30255259.0,12909,Consumer Discretionary
NTRP,NextTrip Inc. Common Stock,2.08,30146413.0,21697,Consumer Discretionary
RDI,Reading International Inc Class A Common Stock,1.225,27828644.0,5282,Consumer Discretionary
ACCS,ACCESS Newswire Inc. Common Stock,6.85,26592686.0,18952,Consumer Discretionary
BIRD,Smartbird Inc. Class A Common Stock,3.0,26418153.0,325535,Consumer Discretionary
CRMT,America's Car-Mart Inc Common Stock,3.02,25073399.0,515579,Consumer Discretionary
SGRP,SPAR Group Inc. Common Stock,0.856,24783807.0,28154,Consumer Discretionary
XHLD,TEN Holdings Inc. Common Stock,2.0,23954886.0,31943,Consumer Discretionary
LVLU,Lulu's Fashion Lounge Holdings Inc. Common Stock,8.32,23831850.0,457383,Consumer Discretionary
JOB,GEE Group Inc. Common Stock,0.2101,23083831.0,130970,Consumer Discretionary
INUV,Inuvo Inc.,1.26,22369809.0,591570,Consumer Discretionary
UONE,Urban One Inc. Class A Common Stock,4.78,21593387.0,4622,Consumer Discretionary
ARKR,Ark Restaurants Corp. Common Stock,5.76,20771464.0,535,Consumer Discretionary
ARAI,Arrive AI Inc. Common Stock,0.394,20432583.0,203260,Consumer Discretionary
MWYN,Marwynn Holdings Inc. Common stock,1.01,20396752.0,29329,Consumer Discretionary
SMXT,Solarmax Technology Inc. Common Stock,0.3537,20127855.0,102661,Consumer Discretionary
UONEK,Urban One Inc. Class D Common Stock,4.44,20057456.0,972,Consumer Discretionary
TLF,Tandy Leather Factory Inc. Common Stock,2.41,19626001.0,18941,Consumer Discretionary
RTB,RTB Digital Inc. Common Stock,14.96,19163895.0,58231,Consumer Discretionary
EFOI,Energy Focus Inc. Common Stock,2.97,18721196.0,7931,Consumer Discretionary
HHS,Harte Hanks Inc. Common Stock,2.415,17918020.0,1326,Consumer Discretionary
FABC,Fabric.AI Inc. Common Stock,2.6,17300171.0,213290,Consumer Discretionary
MPU,Mega Matrix Inc. Class A Ordinary Shares,0.248,16861568.0,409525,Consumer Discretionary
DBGI,Digital Brands Group Inc. Common Stock,0.703,16158847.0,562901,Consumer Discretionary
NHTC,Natural Health Trends Corp. Common Stock,1.83,15697462.0,16814,Consumer Discretionary
GTIM,Good Times Restaurants Inc. Common Stock,1.44,15203370.0,5608,Consumer Discretionary
OBAI,Our Bond Inc. Common Stock,0.598,14628318.0,787543,Consumer Discretionary
DLPN,Dolphin Entertainment Inc. Common Stock,1.1,14318998.0,24912,Consumer Discretionary
BTOC,Armlogi Holding Corp. Common Stock,0.2941,13364810.0,74207,Consumer Discretionary
CABR,Caring Brands Inc. Common Stock,1.47,13364514.0,88103,Consumer Discretionary
SDOT,Sadot Group Inc. Common Stock,18.02,13334800.0,512701,Consumer Discretionary
ATER,Aterian Inc. Common Stock,1.19,12874503.0,123499,Consumer Discretionary
AIFA,All In FutureTech Alliance Inc. Common Stock,2.0,12755042.0,24196,Consumer Discretionary
EDUC,Educational Development Corporation Common Stock,1.48,12616947.0,516917,Consumer Discretionary
CISO,CISO Global Inc. Common Stock,0.27,12234601.0,199009,Consumer Discretionary
REBN,Reborn Coffee Inc. Common Stock,1.41,11580972.0,22550,Consumer Discretionary
DFNS,T3 Defense Inc. Common Stock,0.0938,10870702.0,28903223,Consumer Discretionary
CETY,Clean Energy Technologies Inc. Common Stock,0.884,10754838.0,24996,Consumer Discretionary
DFNSW,T3 Defense Inc. Warrants,0.0857,9931974.0,7674,Consumer Discretionary
BNKK,Bonk Inc. Common Stock,1.18,9441109.0,256264,Consumer Discretionary
JCTC,Jewett-Cameron Trading Company Common Shares,2.56,9011489.0,4814,Consumer Discretionary
YYAI,AiRWA Inc. Common Stock,7.81,8228311.0,11561,Consumer Discretionary
SURG,SurgePays Inc. Common Stock,0.3271,8217372.0,944793,Consumer Discretionary
JTAI,Jet.AI Inc. Common Stock,5.73,8146461.0,413742,Consumer Discretionary
XWEL,XWELL Inc. Common Stock,0.9399,7936766.0,61620,Consumer Discretionary
TGL,Treasure Global Inc. Common Stock,3.81,7447910.0,14018,Consumer Discretionary
YCBD,cbdMD Inc. Common Stock,0.682,7159581.0,919847,Consumer Discretionary
OLOX,Olenox Industries Inc. Common Stock,5.26,6851860.0,1009010,Consumer Discretionary
BTBD,BT Brands Inc. Common Stock,1.106,6840305.0,6315,Consumer Discretionary
MITQ,Moving iMage Technologies Inc. Common Stock,0.6253,6216152.0,407629,Consumer Discretionary
SILO,Silo Pharma Inc. Common Stock,5.28,5959061.0,145869,Consumer Discretionary
DSS,DSS Inc. Common Stock,0.5588,5611759.0,49983,Consumer Discretionary
OLB,The OLB Group Inc. Common Stock,0.3579,5248578.0,554103,Consumer Discretionary
WALDW,Waldencast plc Warrant ,0.04,5130395.0,1595,Consumer Discretionary
CTNT,Cheetah Net Supply Chain Service Inc Class A Common Stock,1.61,5086620.0,276918,Consumer Discretionary
SLE,Super League Enterprise Inc. Common Stock,2.86,4601594.0,13636,Consumer Discretionary
RSVRW,Reservoir Media Inc. Warrant,0.07,4596320.0,44,Consumer Discretionary
CJMB,Callan JMB Inc. Common Stock,0.7592,4286533.0,46389,Consumer Discretionary
NWTG,Newton Golf Company Inc. Common Stock,0.867,3981319.0,58287,Consumer Discretionary
HYFM,Hydrofarm Holdings Group Inc. Common Stock,0.75,3573459.0,40507,Consumer Discretionary
SOBR,SOBR Safe Inc. Common Stock,1.2,3367895.0,268080622,Consumer Discretionary
VSTD,Vestand Inc. Class A Common Stock,0.2247,3196353.0,48252,Consumer Discretionary
DRCT,Direct Digital Holdings Inc. Class A Common Stock,2.58,2016763.0,12412,Consumer Discretionary
BZFDW,BuzzFeed Inc. Warrant,0.0197,1603709.0,7566,Consumer Discretionary
GNLN,Greenlane Holdings Inc. Class A Common Stock,2.4301,1534509.0,7500,Consumer Discretionary
UK,Ucommune International Ltd Class A Ordinary Shares,2.14,1450815.0,29611,Consumer Discretionary
TRUG,TruGolf Holdings Inc. Class A Common Stock,1.22,1358697.0,110128,Consumer Discretionary
BNBX,BNB Plus Corp. Common Stock,0.163,1173148.0,5042665,Consumer Discretionary
IPW,iPower Inc. Common Stock,1.21,800100.0,486322,Consumer Discretionary
ZNB,Zeta Network Group Class A Ordinary Shares,0.428,676581.0,688203,Consumer Discretionary
LIDRW,AEye Inc. Warrant,0.0141,653039.0,9058,Consumer Discretionary
SEATW,Vivid Seats Inc. Warrant,0.0275,302154.0,2504,Consumer Discretionary
BTBDW,BT Brands Inc. Warrant,0.0445,275220.0,14,Consumer Discretionary
AERTW,Aeries Technology Inc. Warrant,0.0236,135449.0,33268,Consumer Discretionary
XOSWW,Xos Inc. Warrants,0.0035,48016.0,4491,Consumer Discretionary
EURKR,Eureka Acquisition Corp Right,0.35,0.0,10,Consumer Discretionary
