symbol,name,price,marketCap,volume,industry
UNFI,United Natural Foods Inc. Common Stock,48.98,2964227477.0,454125,Consumer Discretionary
DAN,Dana Incorporated Common Stock ,27.24,2948340441.0,1586076,Consumer Discretionary
ASO,Academy Sports and Outdoors Inc. Common Stock,46.49,2883234068.0,1506947,Consumer Discretionary
MGRC,McGrath RentCorp Common Stock,117.17,2877902591.0,114022,Consumer Discretionary
UAA,Under Armour Inc. Class A Common Stock,6.75,2877693021.0,6557216,Consumer Discretionary
SAH,Sonic Automotive Inc. Common Stock,90.51,2860487363.0,400096,Consumer Discretionary
HNI,HNI Corporation Common Stock,39.71,2858838377.0,438739,Consumer Discretionary
PHIN,PHINIA Inc. Common Stock,77.18,2857246666.0,236946,Consumer Discretionary
PK,Park Hotels & Resorts Inc. Common Stock ,14.18,2855310820.0,4257389,Consumer Discretionary
UA,Under Armour Inc. Class C Common Stock,6.61,2818007536.0,2336513,Consumer Discretionary
HWKN,Hawkins Inc. Common Stock,133.87,2798739768.0,130687,Consumer Discretionary
VC,Visteon Corporation Common Stock,103.54,2763898934.0,399419,Consumer Discretionary
PATK,Patrick Industries Inc. Common Stock,83.43,2744281595.0,472643,Consumer Discretionary
PENN,PENN Entertainment Inc. Common Stock,20.48,2741112238.0,2614636,Consumer Discretionary
CENT,Central Garden & Pet Company Common Stock,43.13,2698677698.0,89585,Consumer Discretionary
AEO,American Eagle Outfitters Inc. Common Stock,16.03,2686200528.0,5934470,Consumer Discretionary
HOG,Harley-Davidson Inc. Common Stock,25.39,2672762188.0,2177107,Consumer Discretionary
SHAK,Shake Shack Inc. Class A Common Stock,62.18,2660154976.0,2537495,Consumer Discretionary
ABM,ABM Industries Incorporated Common Stock,45.36,2657230667.0,342298,Consumer Discretionary
ASTH,Astrana Health Inc. Common Stock,47.64,2654320721.0,354674,Consumer Discretionary
TNET,TriNet Group Inc. Common Stock,57.56,2644573651.0,221059,Consumer Discretionary
PTON,Peloton Interactive Inc. Class A Common Stock,6.08,2632590904.0,9359493,Consumer Discretionary
BCC,Boise Cascade L.L.C. Common Stock,74.72,2629377074.0,326644,Consumer Discretionary
WLYB,John Wiley & Sons Inc. Common Stock,50.72,2574565206.0,72,Consumer Discretionary
CALX,Calix Inc Common Stock,39.73,2534070739.0,1520272,Consumer Discretionary
WLY,John Wiley & Sons Inc. Common Stock,49.8,2527865679.0,526070,Consumer Discretionary
DRVN,Driven Brands Holdings Inc. Common Stock,15.31,2525475809.0,574097,Consumer Discretionary
WHR,Whirlpool Corporation Common Stock,38.85,2518378251.0,2423250,Consumer Discretionary
LCII,LCI Industries,102.04,2478062012.0,409002,Consumer Discretionary
WU,Western Union Company (The) Common Stock,7.87,2458864268.0,4467699,Consumer Discretionary
BLBD,Blue Bird Corporation Common Stock,76.56,2422862854.0,260293,Consumer Discretionary
DNOW,DNOW Inc. Common Stock,13.05,2382225091.0,1673942,Consumer Discretionary
PAYO,Payoneer Global Inc. Common Stock,7.1,2376928514.0,1871708,Consumer Discretionary
CENTA,Central Garden & Pet Company Class A Common Stock Nonvoting,37.63,2354538414.0,273939,Consumer Discretionary
VVX,V2X Inc. Common Stock,74.76,2340751225.0,227802,Consumer Discretionary
MCRI,Monarch Casino & Resort Inc. Common Stock,124.19,2204312392.0,213010,Consumer Discretionary
BKE,Buckle Inc. (The) Common Stock,42.55,2192094559.0,543600,Consumer Discretionary
CBZ,CBIZ Inc. Common Stock,40.47,2171164184.0,873161,Consumer Discretionary
FLYW,Flywire Corporation Voting Common Stock,17.78,2161062277.0,1716866,Consumer Discretionary
SHO,Sunstone Hotel Investors Inc. Sunstone Hotel Investors Inc. Common Shares,11.3,2105091351.0,2358455,Consumer Discretionary
JBLU,JetBlue Airways Corporation Common Stock,5.6,2083305806.0,45517895,Consumer Discretionary
AIN,Albany International Corporation Common Stock,71.88,2041392000.0,142212,Consumer Discretionary
EZPW,EZCORP Inc. Class A Non Voting Common Stock,32.67,2010380401.0,518011,Consumer Discretionary
BRSL,Brightstar Lottery PLC Trading under the Legal Name to begin at the market open on July 21 2025. Ordinary Shares,10.82,1996290000.0,1249841,Consumer Discretionary
CNXN,PC Connection Inc. Common Stock,78.49,1979992429.0,106939,Consumer Discretionary
COTY,Coty Inc. Class A Common Stock,2.24,1972244821.0,7899137,Consumer Discretionary
ALGT,Allegiant Travel Company Common Stock,106.89,1970761928.0,521079,Consumer Discretionary
VSTS,Vestis Corporation Common Stock,14.74,1947228909.0,922977,Consumer Discretionary
FUN,Six Flags Entertainment Corporation Common Stock New,18.92,1933698583.0,1802494,Consumer Discretionary
GT,The Goodyear Tire & Rubber Company Common Stock,6.64,1908592510.0,6235051,Consumer Discretionary
MAN,ManpowerGroup Common Stock,40.62,1889128232.0,1247165,Consumer Discretionary
FLOC,Flowco Holdings Inc. Class A Common Stock,20.89,1887315740.0,355622,Consumer Discretionary
KSS,Kohl's Corporation Common Stock,16.55,1876769884.0,2924663,Consumer Discretionary
TILE,Interface Inc. Common Stock,32.3,1875215002.0,430859,Consumer Discretionary
CCS,Century Communities Inc. Common Stock,64.3,1849866376.0,171558,Consumer Discretionary
NSP,Insperity Inc. Common Stock,48.39,1847006717.0,1255019,Consumer Discretionary
XHR,Xenia Hotels & Resorts Inc. Common Stock,20.0,1844916700.0,412234,Consumer Discretionary
HURN,Huron Consulting Group Inc. Common Stock,111.23,1803241740.0,363677,Consumer Discretionary
PRG,PROG Holdings Inc. Common Stock,44.63,1788126121.0,322490,Consumer Discretionary
INVX,Innovex International Inc. Common Stock,25.5,1780419920.0,347941,Consumer Discretionary
LIND,Lindblad Expeditions Holdings Inc. Common Stock,26.49,1736984214.0,504258,Consumer Discretionary
RVLV,Revolve Group Inc. Class A Common Stock,24.22,1733075251.0,1116035,Consumer Discretionary
LPG,Dorian LPG Ltd. Common Stock,40.14,1717296815.0,446799,Consumer Discretionary
FIGS,FIGS Inc. Class A Common Stock,10.0,1670472530.0,2348932,Consumer Discretionary
AMC,AMC Entertainment Holdings Inc. Class A Common Stock,1.87,1669170673.0,24094414,Consumer Discretionary
TH,Target Hospitality Corp. Common Stock,16.74,1667060701.0,1028785,Consumer Discretionary
WLFC,Willis Lease Finance Corporation Common Stock,216.12,1657592637.0,87185,Consumer Discretionary
AMSC,American Superconductor Corporation Common Stock,34.18,1630196130.0,556944,Consumer Discretionary
WBTN,WEBTOON Entertainment Inc. Common stock,11.75,1589008078.0,315202,Consumer Discretionary
FBYD,Falcon's Beyond Global Inc. Class A Common Stock,13.07,1584635711.0,122172,Consumer Discretionary
TIC,TIC Solutions Inc. Common Stock,7.12,1573823340.0,1760690,Consumer Discretionary
TPB,Turning Point Brands Inc. Common Stock,80.92,1567220851.0,381542,Consumer Discretionary
OXSQG,Oxford Square Capital Corp. 5.50% Notes due 2028,24.32,1550591155.0,2072,Consumer Discretionary
LZB,La-Z-Boy Incorporated Common Stock,38.77,1546821345.0,417945,Consumer Discretionary
HLMN,Hillman Solutions Corp. Common Stock,7.86,1542207503.0,1673853,Consumer Discretionary
ODC,Oil-Dri Corporation Of America Common Stock,106.44,1542138377.0,129423,Consumer Discretionary
ULCC,Frontier Group Holdings Inc. Common Stock,6.57,1509715931.0,6124827,Consumer Discretionary
ADNT,Adient plc Ordinary Shares ,19.2,1505537030.0,878277,Consumer Discretionary
SVV,Savers Value Village Inc. Common Stock,9.68,1490586009.0,1078016,Consumer Discretionary
WWW,Wolverine World Wide Inc. Common Stock,18.04,1479091320.0,910696,Consumer Discretionary
OI,O-I Glass Inc. Common Stock,9.6,1471675805.0,2397318,Consumer Discretionary
CSWC,Capital Southwest Corporation Common Stock,23.65,1469628170.0,636993,Consumer Discretionary
LEG,Leggett & Platt Incorporated Common Stock,10.7,1459827279.0,1949782,Consumer Discretionary
GIII,G-III Apparel Group LTD. Common Stock,34.5,1455574769.0,373339,Consumer Discretionary
YELP,Yelp Inc. Common Stock,26.36,1449554957.0,1006743,Consumer Discretionary
PRSU,Pursuit Attractions and Hospitality Inc. Common Stock,52.96,1446787230.0,148333,Consumer Discretionary
ICFI,ICF International Inc. Common Stock,79.13,1432583763.0,401023,Consumer Discretionary
WEN,Wendy's Company (The) Common Stock,7.5,1428604800.0,12597148,Consumer Discretionary
DFH,Dream Finders Homes Inc. Class A Common Stock,15.54,1422460613.0,506626,Consumer Discretionary
CRI,Carter's Inc. Common Stock,38.58,1421677514.0,876679,Consumer Discretionary
SBH,Sally Beauty Holdings Inc. (Name to be changed from Sally Holdings Inc.) Common Stock,14.7,1402504744.0,1491801,Consumer Discretionary
MLKN,MillerKnoll Inc. Common Stock,20.27,1385955818.0,548338,Consumer Discretionary
WINA,Winmark Corporation Common Stock,386.74,1383628483.0,35124,Consumer Discretionary
LGIH,LGI Homes Inc. Common Stock,57.76,1341896435.0,268699,Consumer Discretionary
BV,BrightView Holdings Inc. Common Stock,14.33,1335556000.0,1342256,Consumer Discretionary
AMN,AMN Healthcare Services Inc,33.98,1317950047.0,1182563,Consumer Discretionary
BJRI,BJ's Restaurants Inc. Common Stock,62.39,1311245888.0,406418,Consumer Discretionary
GCT,GigaCloud Technology Inc Class A Ordinary Shares,35.4,1302277075.0,747247,Consumer Discretionary
VTOL,Bristow Group Inc. Common Stock,43.68,1293190080.0,187839,Consumer Discretionary
SCL,Stepan Company Common Stock,56.8,1290116746.0,108975,Consumer Discretionary
REAL,The RealReal Inc. Common Stock,10.68,1286808935.0,2694000,Consumer Discretionary
DSGR,Distribution Solutions Group Inc. Common Stock,27.73,1280991925.0,54627,Consumer Discretionary
TDAY,USA TODAY Co. Inc. Common Stock,8.59,1260171133.0,1010721,Consumer Discretionary
AMRC,Ameresco Inc. Class A Common Stock,23.75,1257596154.0,484870,Consumer Discretionary
EPC,Edgewell Personal Care Company Common Stock,27.23,1254794507.0,744176,Consumer Discretionary
UPBD,Upbound Group Inc. Common Stock,21.15,1232912305.0,740222,Consumer Discretionary
NUTX,Nutex Health Inc. Common Stock,179.15,1232791882.0,101654,Consumer Discretionary
CCO,Clear Channel Outdoor Holdings Inc. Common Stock,2.41,1226650249.0,4325490,Consumer Discretionary
SPH,Suburban Propane Partners L.P. Common Stock,18.48,1226019693.0,215253,Consumer Discretionary
DCH,Dauch Corporation Common Stock,5.12,1215317668.0,2644143,Consumer Discretionary
LQDT,Liquidity Services Inc. Common Stock,38.88,1212326261.0,141221,Consumer Discretionary
NPKI,NPK International Inc. Common Stock,14.33,1210126026.0,620480,Consumer Discretionary
ACVA,ACV Auctions Inc. Class A Common Stock,6.81,1188923128.0,2451749,Consumer Discretionary
AEVA,Aeva Technologies Inc. Common Stock,18.81,1185797843.0,1671781,Consumer Discretionary
CBRL,Cracker Barrel Old Country Store Inc Common Stock,52.35,1170098931.0,824551,Consumer Discretionary
DLX,Deluxe Corporation Common Stock,25.15,1151469134.0,316560,Consumer Discretionary
DFIN,Donnelley Financial Solutions Inc. Common Stock ,45.25,1130452469.0,181543,Consumer Discretionary
MBC,MasterBrand Inc. Common Stock,8.81,1127544238.0,1742468,Consumer Discretionary
THRM,Gentherm Inc Common Stock,36.12,1107702515.0,309074,Consumer Discretionary
GNK,Genco Shipping & Trading Limited Ordinary Shares New (Marshall Islands),25.35,1104678243.0,337025,Consumer Discretionary
ARHS,Arhaus Inc. Class A Common Stock,7.73,1094104695.0,998409,Consumer Discretionary
PZZA,Papa John's International Inc. Common Stock,33.25,1093991966.0,877621,Consumer Discretionary
CRAI,CRA International Inc. Common Stock,169.01,1092318052.0,225292,Consumer Discretionary
WLDN,Willdan Group Inc. Common Stock,71.31,1077537314.0,213225,Consumer Discretionary
FUBO,FuboTV Inc. Class A Common Stock,9.83,1065928593.0,2105186,Consumer Discretionary
ACEL,Accel Entertainment Inc. ,12.72,1035317688.0,337115,Consumer Discretionary
QNST,QuinStreet Inc. Common Stock,17.61,1011612966.0,636228,Consumer Discretionary
SCHL,Scholastic Corporation Common Stock,46.41,1009063670.0,198117,Consumer Discretionary
LUCK,Lucky Strike Entertainment Corporation Class A Common Stock,7.35,1004173082.0,144628,Consumer Discretionary
KFRC,Kforce Inc. Common Stock,56.03,999126960.0,349570,Consumer Discretionary
EEX,Emerald Holding Inc. Common Stock,5.04,997463694.0,220038,Consumer Discretionary
SG,Sweetgreen Inc. Class A Common Stock,8.27,982704723.0,2957775,Consumer Discretionary
DAKT,Daktronics Inc. Common Stock,20.21,975836697.0,769932,Consumer Discretionary
BBSI,Barrett Business Services Inc. Common Stock,38.97,957089522.0,247924,Consumer Discretionary
ARRY,Array Technologies Inc. Common Stock,6.12,941417433.0,5973663,Consumer Discretionary
BH,Biglari Holdings Inc. Class B Common Stock,390.14,895104444.0,59898,Consumer Discretionary
GRPN,Groupon Inc. Common Stock,23.54,894142889.0,2688018,Consumer Discretionary
HMH,HMH Holding Inc. Class A Common Stock,19.91,876088262.0,86654,Consumer Discretionary
LYTS,LSI Industries Inc. Common Stock,23.75,871919595.0,281939,Consumer Discretionary
LMB,Limbach Holdings Inc. Common Stock,73.14,871906840.0,246030,Consumer Discretionary
MAX,MediaAlpha Inc. Class A Common Stock,13.87,864800353.0,1452459,Consumer Discretionary
BZH,Beazer Homes USA Inc. Common Stock,31.49,860742149.0,447579,Consumer Discretionary
RJET,Republic Airways Holdings Inc. Common Stock,18.25,854637937.0,58708,Consumer Discretionary
MOV,Movado Group Inc. Common Stock,37.84,841078497.0,287439,Consumer Discretionary
SMP,Standard Motor Products Inc. Common Stock,37.64,837989822.0,84514,Consumer Discretionary
WOOF,Petco Health and Wellness Company Inc. Class A Common Stock,2.57,831025007.0,2299709,Consumer Discretionary
KELYB,Kelly Services Inc. Class B Common Stock,23.85,826860182.0,1310,Consumer Discretionary
HCMA,HCM III Acquisition Corp. Class A Ordinary Share,10.323,818024178.0,6,Consumer Discretionary
APOG,Apogee Enterprises Inc. Common Stock,39.0,813863466.0,222881,Consumer Discretionary
MNTN,MNTN Inc. Class A Common Stock,10.43,813729419.0,615468,Consumer Discretionary
DJCO,Daily Journal Corp. (S.C.) Common Stock,581.51,801159120.0,34713,Consumer Discretionary
KODK,Eastman Kodak Company Common New,8.15,797941039.0,391498,Consumer Discretionary
TDUP,ThredUp Inc. Class A Common Stock,6.18,797472428.0,1552279,Consumer Discretionary
SDHC,Smith Douglas Homes Corp. Class A Common Stock,15.46,785107561.0,104531,Consumer Discretionary
ANGX,Angel Studios Inc. Class A Common Stock,4.05,754970074.0,1292770,Consumer Discretionary
HZO,MarineMax Inc.  (FL) Common Stock,34.24,754243993.0,305598,Consumer Discretionary
EFOR,Everforth Inc. Common Stock,18.28,752308428.0,860404,Consumer Discretionary
FWRG,First Watch Restaurant Group Inc. Common Stock,12.2,752067597.0,793325,Consumer Discretionary
CODI,D/B/A Compass Diversified Holdings Shares of Beneficial Interest,9.93,747093142.0,1452623,Consumer Discretionary
HOV,Hovnanian Enterprises Inc. Class A Common Stock,125.3,734207504.0,73082,Consumer Discretionary
FOXF,Fox Factory Holding Corp. Common Stock,17.33,726753185.0,419211,Consumer Discretionary
ONT,Onterris Inc. Common Stock,20.03,723868717.0,612250,Consumer Discretionary
BLMN,Bloomin' Brands Inc. Common Stock,8.44,722584582.0,1569560,Consumer Discretionary
IBTA,Ibotta Inc. Class A Common Stock,30.93,719894791.0,206027,Consumer Discretionary
VRRM,Verra Mobility Corporation Class A Common Stock,4.52,686618072.0,10657490,Consumer Discretionary
HYLN,Hyliion Holdings Corp. Class A Common Stock,3.85,686559874.0,2676229,Consumer Discretionary
PHR,Phreesia Inc. Common Stock,11.03,681785136.0,1005294,Consumer Discretionary
CASS,Cass Information Systems Inc Common Stock,52.46,675220477.0,74359,Consumer Discretionary
MCS,Marcus Corporation (The) Common Stock,21.87,672028643.0,193083,Consumer Discretionary
EVH,Evolent Health Inc Class A Common Stock,5.92,665887917.0,1644691,Consumer Discretionary
RSVR,Reservoir Media Inc. Common Stock,10.12,664496546.0,46286,Consumer Discretionary
TRON,Tron Inc. Common Stock,1.39,659391069.0,240169,Consumer Discretionary
CNNE,Cannae Holdings Inc. Common Stock,14.89,654274134.0,515506,Consumer Discretionary
CCOI,Cogent Communications Holdings Inc.,12.93,647504183.0,1172839,Consumer Discretionary
BALY,Bally's Corporation Common Stock,13.2,646124094.0,50218,Consumer Discretionary
RRBI,Red River Bancshares Inc. Common Stock,97.35,641020156.0,87877,Consumer Discretionary
RMR,The RMR Group Inc. Class A Common Stock,20.44,635548708.0,199658,Consumer Discretionary
CWH,Camping World Holdings Inc. Class A Common Stock,6.14,632338639.0,2395422,Consumer Discretionary
CSV,Carriage Services Inc. Common Stock,39.41,625528446.0,139419,Consumer Discretionary
KRUS,Kura Sushi USA Inc. Class A Common Stock,51.15,621464111.0,471645,Consumer Discretionary
LEGH,Legacy Housing Corporation Common Stock (TX),25.78,613089674.0,95040,Consumer Discretionary
IHRT,iHeartMedia Inc. Class A Common Stock,4.02,607632636.0,764247,Consumer Discretionary
KLC,KinderCare Learning Companies Inc. Common Stock,5.11,605168608.0,985593,Consumer Discretionary
PACK,Ranpak Holdings Corp Class A Common Stock,6.95,594536881.0,379669,Consumer Discretionary
PRTH,Priority Technology Holdings Inc. Common Stock,7.13,587192362.0,435623,Consumer Discretionary
ELA,Envela Corporation Common Stock,22.39,581322228.0,267954,Consumer Discretionary
HTZ,Hertz Global Holdings Inc Common Stock,1.83,577849077.0,26502267,Consumer Discretionary
FET,Forum Energy Technologies Inc. Common Stock,50.58,571770786.0,90776,Consumer Discretionary
ETD,Ethan Allen Interiors Inc. Common Stock,22.13,563127482.0,448065,Consumer Discretionary
SPIR,Spire Global Inc. Class A Common Stock,13.99,562662047.0,1265594,Consumer Discretionary
ALIT,Alight Inc. Class A Common Stock,20.84,559806143.0,881457,Consumer Discretionary
MLR,Miller Industries Inc. Common Stock,48.8,556110941.0,51710,Consumer Discretionary
BBCP,Concrete Pumping Holdings Inc. Common Stock,10.9,549288278.0,171181,Consumer Discretionary
ADV,Advantage Solutions Inc. Class A Common Stock,41.18,547499630.0,235292,Consumer Discretionary
XMAX,XMAX Inc. Common Stock,8.54,543163864.0,2642534,Consumer Discretionary
EBF,Ennis Inc. Common Stock,21.3,538853194.0,187560,Consumer Discretionary
MNRO,Monro Inc. Common Stock,16.51,515885906.0,845481,Consumer Discretionary
MG,Mistras Group Inc Common Stock,16.19,515112065.0,120493,Consumer Discretionary
OIS,Oil States International Inc. Common Stock,8.47,509838225.0,516026,Consumer Discretionary
LOCO,El Pollo Loco Holdings Inc. Common Stock,16.74,509821689.0,287907,Consumer Discretionary
CTEV,Claritev Corporation Class A Common Stock,29.84,508706024.0,97068,Consumer Discretionary
KELYA,Kelly Services Inc. Class A Common Stock,14.31,496116109.0,305802,Consumer Discretionary
CTRN,Citi Trends Inc. Common Stock,59.2,493127002.0,143119,Consumer Discretionary
SFIX,Stitch Fix Inc. Class A Common Stock,3.62,483001599.0,1415428,Consumer Discretionary
CPS,Cooper-Standard Holdings Inc. Common Stock,27.02,479747774.0,103369,Consumer Discretionary
GOGO,Gogo Inc. Common Stock,3.54,478744371.0,1865278,Consumer Discretionary
BWMN,Bowman Consulting Group Ltd. Common Stock,27.07,473934359.0,112772,Consumer Discretionary
JOUT,Johnson Outdoors Inc. Class A Common Stock,44.25,463505121.0,42777,Consumer Discretionary
PANL,Pangaea Logistics Solutions Ltd. Common Shares,7.07,462483506.0,431045,Consumer Discretionary
STRZ,Starz Entertainment Corp. Common Shares,27.4,460020765.0,207831,Consumer Discretionary
DIN,Dine Brands Global Inc. Common Stock,35.99,456539448.0,258895,Consumer Discretionary
BLW,Blackrock Limited Duration Income Trust,12.74,454961363.0,202898,Consumer Discretionary
SERV,Serve Robotics Inc. Common Stock,5.79,447991384.0,2876413,Consumer Discretionary
GLAD,Gladstone Capital Corporation Common Stock,19.82,447794628.0,141521,Consumer Discretionary
RMNI,Rimini Street Inc. (DE) Common Stock,4.77,441511200.0,310647,Consumer Discretionary
BNED,Barnes & Noble Education Inc Common Stock,12.53,434081451.0,496611,Consumer Discretionary
SRTA,Strata Critical Medical Inc. Class A Common Stock,5.01,433498116.0,662163,Consumer Discretionary
QUAD,Quad Graphics Inc Class A Common Stock,8.38,432068803.0,149263,Consumer Discretionary
HNST,The Honest Company Inc. Common Stock,3.9,429306599.0,1167569,Consumer Discretionary
ASPN,Aspen Aerogels Inc. Common Stock,5.18,429305207.0,914014,Consumer Discretionary
SGU,Star Group L.P. Common Stock,13.04,428154486.0,15992,Consumer Discretionary
TITN,Titan Machinery Inc. Common Stock,18.36,427828025.0,91626,Consumer Discretionary
CCRN,Cross Country Healthcare Inc. Common Stock $0.0001 Par Value,13.22,427437778.0,354940,Consumer Discretionary
BXC,Bluelinx Holdings Inc. Common Stock,54.23,422039281.0,94806,Consumer Discretionary
BBW,Build-A-Bear Workshop Inc. Common Stock,33.62,421508834.0,430549,Consumer Discretionary
IMXI,International Money Express Inc. Common Stock,14.0,421322888.0,285759,Consumer Discretionary
SHOE,Shoe Station Group Inc. Common Stock,15.38,417587117.0,903669,Consumer Discretionary
DDT,Dillard's Capital Trust I,26.555,414775052.0,2408,Consumer Discretionary
BRCB,Black Rock Coffee Bar Inc. Class A Common Stock,8.25,412960408.0,299566,Consumer Discretionary
NATH,Nathan's Famous Inc. Common Stock,100.55,411692423.0,24327,Consumer Discretionary
BBBY,Bed Bath & Beyond Inc. Common Stock,5.02,407315245.0,2609700,Consumer Discretionary
HVT,Haverty Furniture Companies Inc. Common Stock,25.02,402705732.0,82573,Consumer Discretionary
CAL,Caleres Inc. Common Stock,11.84,397702569.0,393188,Consumer Discretionary
FLXS,Flexsteel Industries Inc. Common Stock,71.5,382920467.0,67464,Consumer Discretionary
GCO,Genesco Inc. Common Stock,34.42,382302011.0,132673,Consumer Discretionary
NCMI,National CineMedia Inc. Common Stock,3.99,374183353.0,238162,Consumer Discretionary
ACCO,Acco Brands Corporation Common Stock,3.94,363495708.0,596505,Consumer Discretionary
PTLO,Portillo's Inc. Class A Common Stock,4.75,360076144.0,1208978,Consumer Discretionary
LE,Lands' End Inc. Common Stock,11.43,351368110.0,463955,Consumer Discretionary
PLAY,Dave & Buster's Entertainment Inc. Common Stock,10.05,349626375.0,1434009,Consumer Discretionary
RPAY,Repay Holdings Corporation Class A Common Stock,3.88,347931543.0,407520,Consumer Discretionary
MTRX,Matrix Service Company Common Stock,12.29,345765017.0,143538,Consumer Discretionary
STRT,STRATTEC SECURITY CORPORATION Common Stock,81.11,338942387.0,109546,Consumer Discretionary
XPOF,Xponential Fitness Inc. Class A Common Stock,6.74,331439500.0,516152,Consumer Discretionary
SEG,Seaport Entertainment Group Inc. Common Stock,25.62,327984934.0,68244,Consumer Discretionary
CIX,CompX International Inc. Common Stock,26.0,320399482.0,1890,Consumer Discretionary
FNKO,Funko Inc. Class A Common Stock,5.69,318246593.0,533413,Consumer Discretionary
TSSI,TSS Inc. Common Stock,11.21,314709047.0,668053,Consumer Discretionary
HLLY,Holley Inc. Common Stock,2.53,307302903.0,997424,Consumer Discretionary
ZUMZ,Zumiez Inc. Common Stock,18.17,306568147.0,201042,Consumer Discretionary
AENT,Alliance Entertainment Holding Corporation Class A Common Stock,5.98,304858187.0,11049,Consumer Discretionary
RCKY,Rocky Brands Inc. Common Stock,40.2,303162793.0,48816,Consumer Discretionary
FBYDW,Falcon's Beyond Global Inc. Warrants,2.5,303105530.0,15,Consumer Discretionary
GETY,Getty Images Holdings Inc. Class A Common Stock,0.7034,294695932.0,3114220,Consumer Discretionary
HBB,Hamilton Beach Brands Holding Company Class A Common Stock ,21.72,294213256.0,50236,Consumer Discretionary
JACK,Jack In The Box Inc. Common Stock,15.12,288393074.0,594771,Consumer Discretionary
ASLE,AerSale Corporation Common Stock,6.03,284934559.0,575319,Consumer Discretionary
DBI,Designer Brands Inc. Class A Common Stock,5.36,272165143.0,616881,Consumer Discretionary
HTZWW,Hertz Global Holdings Inc Warrant,0.861,271873254.0,252863,Consumer Discretionary
MPAA,Motorcar Parts  of America Inc. Common Stock,14.36,271760386.0,154337,Consumer Discretionary
LTBR,Lightbridge Corporation Common Stock,7.7,270632370.0,755710,Consumer Discretionary
HCKT,Hackett Group Inc (The). Common Stock,10.61,267254091.0,514925,Consumer Discretionary
TBI,TrueBlue Inc. Common Stock,8.6,261475183.0,422759,Consumer Discretionary
HDSN,Hudson Technologies Inc. Common Stock,6.2,260826486.0,705389,Consumer Discretionary
SPCE,Virgin Galactic Holdings Inc. Common Stock,2.42,259952523.0,14191893,Consumer Discretionary
JAKK,JAKKS Pacific Inc. Common Stock,22.64,259101465.0,69894,Consumer Discretionary
ESCA,Escalade Incorporated Common Stock,18.48,255117102.0,31289,Consumer Discretionary
LOVE,The Lovesac Company Common Stock,17.16,251195253.0,208382,Consumer Discretionary
ANGI,Angi Inc. Class A Common Stock,6.17,250026583.0,864445,Consumer Discretionary
FLWS,1-800-FLOWERS.COM Inc. Common Stock,3.88,248702114.0,244725,Consumer Discretionary
FOSL,Fossil Group Inc. Common Stock,4.12,243498584.0,495852,Consumer Discretionary
JILL,J. Jill Inc. Common Stock,15.96,238624583.0,91926,Consumer Discretionary
CNDT,Conduent Incorporated Common Stock ,1.53,237298125.0,948085,Consumer Discretionary
FJET,Starfighters Space Inc. Common Stock,4.73,234732640.0,940156,Consumer Discretionary
FC,Franklin Covey Company Common Stock,20.51,231637335.0,78388,Consumer Discretionary
PMTS,CPI Card Group Inc. Common Stock,19.24,220790698.0,34500,Consumer Discretionary
WALD,Waldencast plc Class A Ordinary Share,1.67,214193986.0,290210,Consumer Discretionary
SMHI,SEACOR Marine Holdings Inc. Common Stock ,7.86,212709497.0,97544,Consumer Discretionary
SRI,Stoneridge Inc. Common Stock,7.34,207246698.0,248090,Consumer Discretionary
EVI,EVI Industries Inc.  Common Stock,15.97,205519735.0,168197,Consumer Discretionary
SGC,Superior Group of Companies Inc. Common Stock,13.13,205275063.0,46161,Consumer Discretionary
RICK,RCI Hospitality Holdings Inc. Common Stock,26.5,202579250.0,41284,Consumer Discretionary
LCUT,Lifetime Brands Inc. Common Stock,8.77,200438420.0,177754,Consumer Discretionary
CURV,Torrid Holdings Inc. Common Stock,2.0,199040762.0,166960,Consumer Discretionary
PAL,Proficient Auto Logistics Inc. Common Stock,7.13,198000628.0,295841,Consumer Discretionary
