symbol,name,price,marketCap,volume,industry
BOC,Boston Omaha Corporation Class A Common Stock,13.16,400121996.0,210643,Finance
LEO,BNY Mellon Strategic Municipals Inc. Common Stock,6.39,398038557.0,165359,Finance
SAY,Saratoga Investment Corp 8.125% Notes due 2027,25.36,397343802.0,3800,Finance
AVBC,Avidia Bancorp Inc. Common Stock,19.76,396706700.0,72234,Finance
NEWT,NewtekOne Inc. Common Stock,13.74,396521575.0,264049,Finance
FMAO,Farmers & Merchants Bancorp Inc. Common Stock,28.66,394596268.0,78498,Finance
SAT,Saratoga Investment Corp 6.00% Notes due 2027,24.98,391389912.0,5262,Finance
PLBC,Plumas Bancorp,55.8,388821989.0,65113,Finance
ATLCZ,Atlanticus Holdings Corporation 9.25% Senior Notes due 2029,25.61,387362749.0,16641,Finance
CZNC,Citizens & Northern Corp Common Stock,21.55,386102428.0,63664,Finance
FRST,Primis Financial Corp. Common Stock,15.48,383471675.0,149086,Finance
ATLCL,Atlanticus Holdings Corporation 6.125% Senior Notes due 2026,25.21,381312569.0,6068,Finance
PCB,PCB Bancorp Common Stock,26.68,379782410.0,34597,Finance
TACO,Berto Acquisition Corp. Ordinary Shares,10.39,378634790.0,27695,Finance
RILY,BRC Group Holdings Inc. Common Stock,9.33,375016514.0,821421,Finance
LDI,loanDepot Inc. Class A Common Stock,1.11,374984528.0,2294179,Finance
PKBK,Parke Bancorp Inc. Common Stock,31.89,374099996.0,45832,Finance
FNLC,First Bancorp Inc  (ME) Common Stock,33.12,373453105.0,119880,Finance
SOR,Source Capital Inc. Cmn Shs of BI,44.61,372247387.0,15397,Finance
LPRO,Open Lending Corporation Common Stock,3.13,370019467.0,2962224,Finance
GBLI,Global Indemnity Group LLC Class A Common Stock ,25.23,368588274.0,8061,Finance
ATLCP,Atlanticus Holdings Corporation 7.625% Series B Cumulative Perpetual Preferred Stock no par value per share,24.11,364494908.0,4162,Finance
MLP,Maui Land & Pineapple Company Inc. Common Stock,18.32,363919582.0,17355,Finance
PMO,Putnam Municipal Opportunities Trust Common Stock,10.7,363602767.0,146078,Finance
KTF,DWS Municipal Income Trust,9.19,363013620.0,93532,Finance
SAR,Saratoga Investment Corp New,22.1,359517231.0,89032,Finance
NECB,NorthEast Community Bancorp Inc. Common Stock,25.95,358509812.0,36457,Finance
MVBF,MVB Financial Corp. Common Stock,27.76,356713252.0,40449,Finance
USCB,USCB Financial Holdings Inc. Class A Common Stock,19.42,354684938.0,127552,Finance
CMTG,Claros Mortgage Trust Inc. Common Stock,2.51,351949098.0,584754,Finance
MCI,Barings Corporate Investors Common Stock,17.36,351743442.0,24692,Finance
AVBH,Avidbank Holdings Inc. Common stock,32.05,351113102.0,81521,Finance
GREEL,Greenidge Generation Holdings Inc. 8.50% Senior Notes due 2026,22.2,347949857.0,12380,Finance
WSBF,Waterstone Financial Inc. Common Stock (MD),19.14,345535989.0,46774,Finance
BCML,BayCom Corp Common Stock,31.58,344516231.0,47644,Finance
CHMG,Chemung Financial Corp Common Stock,71.45,344376139.0,39073,Finance
RM,Regional Management Corp. Common Stock,37.35,343924216.0,50209,Finance
PPT,Putnam Premier Income Trust Common Stock,3.45,343372507.0,71059,Finance
CUB,Lionheart Holdings Class A Ordinary Shares,10.8,343100621.0,3723892,Finance
AII,American Integrity Insurance Group Inc. Common Stock,17.29,338725226.0,109051,Finance
NWFL,Norwood Financial Corp. Common Stock,30.815,335596890.0,36591,Finance
TSBK,Timberland Bancorp Inc. Common Stock,42.49,332609723.0,22093,Finance
SSSS,SuRo Capital Corp. Common Stock,12.67,330309535.0,288654,Finance
FGBIP,First Guaranty Bancshares Inc. 6.75% Series A Fixed-Rate Non-Cumulative Perpetual Preferred Stock,20.0001,329286606.0,3096,Finance
VALU,Value Line Inc. Common Stock,34.59,324704562.0,724,Finance
CZFS,Citizens Financial Services Inc. Common Stock,67.44,324044884.0,6537,Finance
COSO,CoastalSouth Bancshares Inc. Common Stock,26.86,323274363.0,149139,Finance
NODK,NI Holdings Inc. Common Stock,15.735,322275411.0,15405,Finance
GBAB,Guggenheim Taxable Municipal Bond & Investment Grade Debt Trust Common Shares of Beneficial Interest,14.09,315572391.0,87041,Finance
CION,CION Investment Corporation Common Stock,6.33,315165699.0,815648,Finance
EFT,Eaton Vance Floating Rate Income Trust Common Shares of Beneficial Interest,10.67,310394728.0,45234,Finance
PMM,Putnam Managed Municipal Income Trust Common Stock,6.35,309491437.0,100912,Finance
BRBS,Blue Ridge Bankshares Inc. Common Stock,3.4,305699817.0,366441,Finance
MBI,MBIA Inc. Common Stock,6.0,305604234.0,324822,Finance
JMSB,John Marshall Bancorp Inc. Common Stock,21.51,303553917.0,55838,Finance
FVCB,FVCBankcorp Inc. Common Stock,16.86,303425913.0,348374,Finance
FCCO,First Community Corporation Common Stock,31.87,299512985.0,56682,Finance
CIA,Citizens Inc. Class A Common Stock ($1.00 Par),5.88,297254956.0,114394,Finance
MYFW,First Western Financial Inc. Common Stock,30.41,295857917.0,37804,Finance
FNRN,First Northern Community Bancorp Common stock,17.83,292536917.0,486972,Finance
ISBA,Isabella Bank Corporation Common stock,39.7,291102672.0,58347,Finance
FCNCN,First Citizens BancShares Inc. Depositary Shares each representing a 1/40th interest in a share of 6.625% Non-Cumulative Perpetual Preferred Stock Series E,25.12,291064787.0,27453,Finance
ACV,Virtus Diversified Income & Convertible Fund Common Shares of Beneficial Interest,28.075,290939934.0,19884,Finance
ONIT,Onity Group Inc. Common Stock,34.41,290149834.0,73491,Finance
OIA,Invesco Municipal Income Opportunities Trust Common Stock,6.08,289441981.0,164892,Finance
OCCIN,OFS Credit Company Inc. 5.25% Series E Term Preferred Stock Due 2026,24.85,288670274.0,294,Finance
ARDC,Ares Dynamic Credit Allocation Fund Inc. Common Shares,12.58,288269933.0,60475,Finance
FUND,Sprott Focus Trust Inc. Common Stock,9.61,284778483.0,10867,Finance
HRZN,Horizon Technology Finance Corporation Common Stock,4.16,283966222.0,683044,Finance
FDBC,Fidelity D & D Bancorp Inc. Common Stock,48.6,282131748.0,10410,Finance
MIN,MFS Intermediate Income Trust Common Stock,2.43,279201584.0,121096,Finance
FRAF,Franklin Financial Services Corporation Common Stock,62.04,278747705.0,16312,Finance
OVLY,Oak Valley Bancorp (CA) Common Stock,33.13,278737864.0,34510,Finance
TCPC,BlackRock TCP Capital Corp. Common Stock,3.3,276879158.0,1213299,Finance
WNEB,Western New England Bancorp Inc. Common Stock,13.61,273904013.0,34455,Finance
FUNC,First United Corporation Common Stock,42.25,272373793.0,12606,Finance
EOT,Eaton Vance Municipal Income Trust EATON VANCE NATIONAL MUNICIPAL OPPORTUNITIES TRUST,17.38,271561127.0,32074,Finance
MMT,Aberdeen Multi-Market Income Fund Common Shares of Beneficial Interest,4.49,267371889.0,98586,Finance
VPV,Invesco Pennsylvania Value Municipal Income Trust Common Stock (DE),11.17,266176006.0,96412,Finance
FXNC,First National Corporation Common Stock,29.35,265352381.0,58522,Finance
ATLO,Ames National Corporation Common Stock,29.8,263945156.0,107710,Finance
HWBK,Hawthorn Bancshares Inc. Common Stock,38.18,263311615.0,8572,Finance
OSG,Octave Specialty Group Inc. Common Stock,5.68,255677203.0,506176,Finance
CPZ,Calamos Long/Short Equity & Dynamic Income Trust Common Stock,12.82,251684727.0,58008,Finance
BPRN,Princeton Bancorp Inc. Common Stock (PA),36.94,251603881.0,11119,Finance
OPRT,Oportun Financial Corporation Common Stock,5.4,246988132.0,642140,Finance
CFFI,C&F Financial Corporation Common Stock,75.73,246452834.0,5363,Finance
SNFCA,Security National Financial Corporation Class A Common Stock,9.44,245797644.0,23752,Finance
KINS,Kingstone Companies Inc. Common Stock,16.76,242765935.0,99832,Finance
LCNB,LCNB Corporation Common Stock,17.02,242467039.0,11182,Finance
SCM,Stellus Capital Investment Corporation Common Stock,8.24,238525373.0,350077,Finance
FCNCO,First Citizens BancShares Inc. 5.625% Non-Cumulative Perpetual Preferred Stock Series C,20.57,238344055.0,7900,Finance
OPENL,Opendoor Technologies Inc  Series A Warrants each whole warrant exercisable to purchase one share of Common Stock at an exercise price of $13.00 per warrant,0.245,236360475.0,157902,Finance
FTF,Franklin Limited Duration Income Trust Common Shares of Beneficial Interest,5.84,235967384.0,375473,Finance
VABK,Virginia National Bankshares Corporation Common Stock,43.51,235933541.0,5286,Finance
FBLA,FB Bancorp Inc. Common Stock,14.53,234826435.0,109922,Finance
FCNCP,First Citizens BancShares Inc. Depositary Shares,20.25,234636224.0,6948,Finance
PEBK,Peoples Bancorp of North Carolina Inc. Common Stock,42.9,234297921.0,20605,Finance
PRHIZ,Presurance Holdings Inc. 9.75% Senior Unsecured Notes due 2028,19.13,233823714.0,19,Finance
BZAI,Blaize Holdings Inc. Common Stock,1.63,231948121.0,8463045,Finance
LIEN,Chicago Atlantic BDC Inc. Common Stock,10.15,231628989.0,146575,Finance
MRBK,Meridian Corporation Common Stock,19.18,228055532.0,83967,Finance
MFM,Aberdeen Municipal Income Fund Common Shares of Beneficial Interest,5.53,227767599.0,186379,Finance
RWAY,Runway Growth Finance Corp. Common Stock,5.36,227609967.0,496945,Finance
NKSH,National Bankshares Inc. Common Stock,35.72,227479605.0,16982,Finance
EFSI,Eagle Financial Services Inc Common Stock,42.01,227373916.0,32729,Finance
FSBW,FS Bancorp Inc. Common Stock,41.8,226327856.0,17566,Finance
CMTV,Community Bancorp. Common Stock,40.26,225103846.0,29237,Finance
OVBC,Ohio Valley Banc Corp. Common Stock,47.59,224196538.0,24672,Finance
INBK,First Internet Bancorp Common Stock,25.53,222536381.0,26245,Finance
EICA,Eagle Point Income Company Inc. 5.00% Series A Term Preferred Stock due 2026,24.94,222168214.0,1386,Finance
OPENZ,Opendoor Technologies Inc  Series Z Warrants each whole warrant exercisable to purchase one share of Common Stock at an exercise price of $17.00 per warrant,0.23,221889425.0,497621,Finance
INBKZ,First Internet Bancorp 6.0% Fixed-to-Floating Rate Subordinated Notes Due 2029,25.0601,218351007.0,441,Finance
PNNT,PennantPark Investment Corporation Common Stock,3.34,218088954.0,1254831,Finance
VTN,Invesco Trust for Investment Grade New York Municipals Common Stock,11.17,217658385.0,10637,Finance
MFIN,Medallion Financial Corp. Common Stock,9.38,216796788.0,35727,Finance
AOMR,Angel Oak Mortgage REIT Inc. Common Stock,8.67,216009989.0,232306,Finance
ECC,Eagle Point Credit Company Common Share of Beneficial Interest,3.55,215351960.0,1823023,Finance
OPBK,OP Bancorp Common Stock,14.41,214625984.0,57701,Finance
CZWI,Citizens Community Bancorp Inc. Common Stock,22.13,213424199.0,198625,Finance
FCAP,First Capital Inc. Common Stock,63.0,210768453.0,6597,Finance
CPSS,Consumer Portfolio Services Inc. Common Stock,9.53,206787324.0,14237,Finance
RMAX,RE/MAX Holdings Inc. Class A Common Stock,9.6,203835034.0,374523,Finance
FT,Franklin Universal Trust Common Stock,8.01,201306471.0,28727,Finance
BMEZ,BlackRock Health Sciences Term Trust Common Shares of Beneficial Interest,14.6,194662063.0,337232,Finance
HNNAZ,Hennessy Advisors Inc. 4.875% Notes due 2026,24.92,194065995.0,128,Finance
CFBK,CF Bankshares Inc. Common Stock,30.1,193284561.0,63001,Finance
FINW,FinWise Bancorp Common Stock,14.06,192706908.0,8327,Finance
RBKB,Rhinebeck Bancorp Inc. Common Stock,16.7,186538683.0,45516,Finance
EBMT,Eagle Bancorp Montana Inc. Common Stock,23.2,184797999.0,125999,Finance
EXOD,Exodus Movement Inc. Class A Common Stock,6.13,183978397.0,91431,Finance
MPV,Barings Participation Investors Common Stock,17.22,182561274.0,15171,Finance
BCBP,BCB Bancorp Inc. (NJ) Common Stock,10.38,180229570.0,658178,Finance
CBFV,CB Financial Services Inc. Common Stock,35.35,179316799.0,6437,Finance
FOA,Finance of America Companies Inc. Class A Common Stock,20.12,178902775.0,58977,Finance
LARK,Landmark Bancorp Inc. Common Stock,29.32,178802860.0,2924,Finance
MNSBP,MainStreet Bancshares Inc. Depositary Shares,25.1,178647694.0,1137,Finance
BVFL,BV Financial Inc. Common Stock,20.48,176935547.0,25570,Finance
ECBK,ECB Bancorp Inc. Common Stock,20.01,175166940.0,17977,Finance
WHG,Westwood Holdings Group Inc Common Stock,18.18,172491440.0,52945,Finance
MNSB,MainStreet Bancshares Inc. Common Stock,24.11,171601430.0,33132,Finance
FGBI,First Guaranty Bancshares Inc. Common Stock,10.39,171063537.0,29244,Finance
SLQT,SelectQuote Inc. Common Stock,0.9451,166666281.0,1724178,Finance
HNVR,Hanover Bancorp Inc. Common Stock,22.9,163887537.0,32995,Finance
SRBK,SR Bancorp Inc. Common stock,19.13,159457503.0,33945,Finance
PIM,Putnam Master Intermediate Income Trust Common Stock,3.17,159303259.0,33027,Finance
RMBI,Richmond Mutual Bancorporation Inc. Common Stock,14.72,154578547.0,29611,Finance
CHCI,Comstock Holding Companies Inc. Class A Common Stock,15.0,153888420.0,24011,Finance
GRX,The Gabelli Healthcare & Wellness Trust Common Shares of Beneficial Interest,8.97,153323968.0,32972,Finance
DOUG,Douglas Elliman Inc. Common Stock,1.68,152722218.0,293776,Finance
GNT,GAMCO Natural Resources Gold & Income Trust,8.25,152422372.0,125382,Finance
FNWD,Finward Bancorp Common Stock,34.44,149124201.0,25867,Finance
SRG,Seritage Growth Properties Class A Common Stock,2.59,145880732.0,142464,Finance
SBFG,SB Financial Group Inc. Common Stock,23.03,144515945.0,62474,Finance
FGNXP,FG Nexus Inc. 8.00% Cumulative Preferred Stock,25.1,143984117.0,715,Finance
RFL,Rafael Holdings Inc. Class B Common Stock,2.75,142999989.0,285384,Finance
WHF,WhiteHorse Finance Inc. Common Stock,6.55,140670885.0,64850,Finance
BANX,ArrowMark Financial Corp. Common Stock,19.49,138430181.0,14713,Finance
AFBI,Affinity Bancshares Inc. Common Stock (MD),22.515,137226336.0,2614,Finance
BRR,ProCap Financial Inc. Common Stock,1.48,134048816.0,1085021,Finance
LSBK,Lake Shore Bancorp Inc. Common Stock,17.03,133903314.0,8680,Finance
GHI,Greystone Housing Impact Investors LP Beneficial Unit Certificates representing assignments of limited partnership interests,5.66,133363807.0,183291,Finance
HYNE,Hoyne Bancorp Inc. Common Stock,16.36,132465906.0,8630,Finance
JHS,John Hancock Income Securities Trust Common Stock,10.92,127180708.0,13977,Finance
PNBK,Patriot National Bancorp Inc. Common Stock,1.07,125906528.0,349842,Finance
SAMG,Silvercrest Asset Management Group Inc. Class A Common Stock,10.3,122032000.0,35429,Finance
RDZN,Roadzen Inc. Ordinary Shares,1.5,119543508.0,996857,Finance
BSBK,Bogota Financial Corp. Common Stock,9.13,117360672.0,5631,Finance
GGT,Gabelli Multi-Media Trust Inc. (The) Common Stock,4.2,115650154.0,505728,Finance
MGYR,Magyar Bancorp Inc. Common Stock,17.76,114778067.0,902,Finance
JHI,John Hancock Investors Trust Common Stock,13.12,114728457.0,13487,Finance
RVSB,Riverview Bancorp Inc Common Stock,5.58,113189999.0,81587,Finance
GLU,Gabelli Global Utility Common Shares of Beneficial Ownership,18.85,112513972.0,7853,Finance
OXSQ,Oxford Square Capital Corp. Common Stock,1.19,111297234.0,3942455,Finance
BOTJ,Bank of the James Financial Group Inc. Common Stock,24.4,110857447.0,20723,Finance
UNB,Union Bankshares Inc. Common Stock,23.92,110368124.0,8124,Finance
SFBC,Sound Financial Bancorp Inc. Common Stock,42.99,110315306.0,6691,Finance
PROV,Provident Financial Holdings Inc. Common Stock,16.92,105812452.0,4447,Finance
SUIG,Sui Group Holdings Limited Common Stock,1.33,102147820.0,352660,Finance
FNWB,First Northwest Bancorp Common Stock,10.16,96512888.0,34651,Finance
AIFC,AI Financial Corporation Common Stock,0.6686,93494691.0,2366950,Finance
MGF,MFS Government Markets Income Trust Common Stock,2.85,92902570.0,79235,Finance
UBCP,United Bancorp Inc. Common Stock,16.0,92496480.0,18829,Finance
SSBI,Summit State Bank Common Stock,13.55,90420912.0,5513,Finance
FUSB,First US Bancshares Inc. Common Stock,16.202,90200860.0,877,Finance
CLSKW,CleanSpark Inc. Warrant,0.35,89813012.0,95510,Finance
BYFC,Broadway Financial Corporation Class A Common Stock,9.58,89083931.0,45664,Finance
DFDV,DeFi Development Corp. Common Stock,2.94,88547523.0,844629,Finance
EIC,Eagle Point Income Company Inc. Common Stock,9.88,88012107.0,183345,Finance
GCV,Gabelli Convertible and Income Securities Fund Inc. (The) Common Stock,4.61,87774534.0,85556,Finance
AUBN,Auburn National Bancorporation Inc. Common Stock,25.05,87506063.0,2129,Finance
BCIC,BCP Investment Corporation Common Stock,7.05,87261241.0,133269,Finance
EVF,Eaton Vance Senior Income Trust Common Stock,4.97,87168124.0,45383,Finance
PFX,PhenixFIN Corporation Common Stock,43.4,83874840.0,361,Finance
FDSB,Fifth District Bancorp Inc. Common Stock,15.9,83711210.0,7502,Finance
GLV,Clough Global Dividend and Income Fund Common Shares of beneficial interest,6.5,82612290.0,77247,Finance
DTF,DTF Tax-Free Income 2028 Term Fund Inc. Common Stock,11.44,80418246.0,3906,Finance
HNNA,Hennessy Advisors Inc. Common Stock,10.04,79340036.0,4008,Finance
FSEA,First Seacoast Bancorp Inc. Common Stock,16.85,79054707.0,3383,Finance
PBHC,Pathfinder Bancorp Inc. Common Stock (MD),16.2,78994651.0,10923,Finance
CPBI,Central Plains Bancshares Inc. Common Stock,18.69,78176102.0,2476,Finance
BEEP,Mobile Infrastructure Corporation Common Stock,1.83,75396000.0,30671,Finance
SIEB,Siebert Financial Corp. Common Stock,1.84,75331322.0,26433,Finance
GECC,Great Elm Capital Corp. Common Stock,5.38,74739202.0,162115,Finance
AFCG,Advanced Flower Capital Inc. Common Stock,3.17,74586435.0,279246,Finance
CEV,Eaton Vance California Municipal Income Trust Shares of Beneficial Interest,10.35,72797501.0,23449,Finance
NSTS,NSTS Bancorp Inc. Common Stock,13.74,72293463.0,24118,Finance
OPHC,OptimumBank Holdings Inc. Common Stock,5.76,70665771.0,45175,Finance
CLST,Catalyst Bancorp Inc. Common Stock,16.47,66734727.0,3723,Finance
PROP,Prairie Operating Co. Common Stock,0.6726,65734660.0,2482158,Finance
HIT,Health In Tech Inc. Class A Common Stock,0.9796,64205050.0,105697,Finance
ASRV,AmeriServ Financial Inc. Common Stock,3.76,63785644.0,3995,Finance
HFBL,Home Federal Bancorp Inc. of Louisiana Common Stock,20.2,61688558.0,924,Finance
BZAIW,Blaize Holdings Inc. Warrants,0.4104,58399699.0,30580,Finance
BTCS,BTCS Inc. Common Stock,1.11,55250662.0,996766,Finance
AEI,Alset Inc. Common Stock (TX),1.34,52120412.0,116197,Finance
BENF,Beneficient Class A Common Stock,3.51,49890192.0,14090,Finance
TCBS,Texas Community Bancshares Inc. Common Stock,17.27,49830720.0,929,Finance
EHTH,eHealth Inc. Common Stock,1.56,49515988.0,463945,Finance
USIO,Usio Inc. Common Stock,1.79,49396829.0,84484,Finance
PFXNZ,PhenixFIN Corporation  5.25% Notes due 2028,23.89,47872430.0,156,Finance
MBBC,Marathon Bancorp Inc. Common Stock,15.22,44910354.0,1896,Finance
OFS,OFS Capital Corporation Common Stock,3.32,44481619.0,157720,Finance
KFFB,Kentucky First Federal Bancorp Common Stock,5.0,40433575.0,5110,Finance
BLNE,Beeline Holdings Inc. Common Stock,1.23,40121113.0,912199,Finance
GROW,U.S. Global Investors Inc. Class A Common Stock,3.19,39569385.0,72303,Finance
AAME,Atlantic American Corporation Common Stock,1.82,37122955.0,15962,Finance
FTHM,Fathom Holdings Inc. Common Stock,1.03,33765835.0,2222143,Finance
MLCI,Mount Logan Capital Inc. Common Stock,2.81,31440438.0,54112,Finance
RAND,Rand Capital Corporation Common Stock,10.4899,31153052.0,3289,Finance
COHN,Cohen & Company Inc.,12.3,30881057.0,27587,Finance
FGNX,FG Nexus Inc. Common Stock ,5.34,30632477.0,157359,Finance
FLD,Fold Holdings Inc. Class A Common Stock,0.5783,29368011.0,744638,Finance
ILLR,Triller Group Inc. Common Stock,0.1475,29329545.0,1528476,Finance
OCCI,OFS Credit Company Inc. Common Stock,2.46,28576615.0,265472,Finance
GREE,Greenidge Generation Holdings Inc. Class A Common Stock,1.68,26804425.0,640773,Finance
BCG,Binah Capital Group Inc. Common Stock,1.53,25719500.0,27274,Finance
MBNKO,Medallion Bank Fixed-Rate Reset Non-Cumulative Perpetual Preferred Stock Series G par value $1.00 per share,25.32,25320000.0,9550,Finance
OPAD,Offerpad Solutions Inc. Class A Common Stock,4.58,21671575.0,85287,Finance
BAFN,BayFirst Financial Corp. Common Stock,4.92,20205973.0,6874,Finance
BRRWW,ProCap Financial Inc. Warrant,0.2006,18169049.0,1,Finance
PRHI,Presurance Holdings Inc. Common Stock,4.82,18056327.0,17277,Finance
DAVEW,Dave Inc. Warrants,1.3899,17809300.0,67276,Finance
ICMB,Investcorp Credit Management BDC Inc. Common Stock,1.2,17318966.0,1364011,Finance
EQS,Equus Total Return Inc. Common Stock,1.22,17039369.0,15554,Finance
VEEA,Veea Inc. Common Stock,0.3326,16765557.0,200845,Finance
MDBH,MDB Capital Holdings LLC Class A common,2.7751,15092748.0,7142,Finance
IHT,InnSuites Hospitality Trust Shares of Beneficial Interest,1.53,14386336.0,502660,Finance
RDZNW,Roadzen Inc. Warrants,0.175,13946743.0,10588,Finance
LHAI,Linkhome Holdings Inc. Common stock,0.7626,12376998.0,13808,Finance
AIRE,reAlpha Tech Corp. Common Stock,2.14,11480569.0,35681,Finance
CELZ,Creative Medical Technology Holdings Inc. Common Stock,1.93,7134569.0,186484,Finance
CWD,CaliberCos Inc. Class A Common Stock,0.7356,6502869.0,29710,Finance
NCPL,Netcapital Inc. Common Stock,0.625,4904937.0,191360,Finance
RENX,RenX Enterprises Corp. Common Stock,1.72,4495868.0,110548,Finance
PGYWW,Pagaya Technologies Ltd. Warrants,0.05,4244899.0,130757,Finance
VEEAW,Veea Inc. Warrant,0.0798,4022524.0,1335,Finance
LMFA,LM Funding America Inc. Common Stock,0.1955,3392371.0,369810,Finance
BTOG,Bit Origin Limited Class A Ordinary Shares,1.96,2894610.0,81210,Finance
VBNB,VanEck BNB ETF Common Shares of Beneficial Interest,22.9493,2292956.0,535,Finance
ILLRW,Triller Group Inc. Warrant,0.0111,2207173.0,65887,Finance
EZRA,Reliance Global Group Inc. Common Stock,3.76,2089673.0,670969,Finance
LRHC,La Rosa Holdings Corp. Common Stock,1.18,1906976.0,132159,Finance
SHFS,SHF Holdings Inc. Class A Common Stock,0.25,1613949.0,412357,Finance
NCPLW,Netcapital Inc. Warrants,0.03,235437.0,107,Finance
SHFSW,SHF Holdings Inc. Warrants,0.0247,159458.0,950,Finance
BENFW,Beneficient Warrant,0.0106,150666.0,49876,Finance
ECF,Ellsworth Growth and Income Fund Ltd.,13.33,0.0,35721,Finance
EDD,Morgan Stanley Emerging Markets Domestic Debt Fund Inc. Common Stock,5.72,0.0,488217,Finance
EVOX,Evolution Global Acquisition Corp Class A Ordinary Shares,10.02,0.0,41727,Finance
EVOXU,Evolution Global Acquisition Corp Units,10.19,0.0,616,Finance
EDF,Virtus Stone Harbor Emerging Markets Income Fund Common Shares of Beneficial Interest,5.62,0.0,175945,Finance
EAD,Allspring Income Opportunities Fund Common Shares,6.41,0.0,238257,Finance
EFR,Eaton Vance Senior Floating-Rate Fund Common Shares of Beneficial Interest,10.51,0.0,66723,Finance
DHF,BNY Mellon High Yield Strategies Fund Common Stock,2.4,0.0,166935,Finance
EVG,Eaton Vance Short Diversified Income Fund Eaton Vance Short Duration Diversified Income Fund Common Shares of Beneficial Interest,10.7,0.0,51222,Finance
DNP,DNP Select Income Fund Inc. Common Stock,10.74,0.0,516927,Finance
ETJ,Eaton Vance Risk-Managed Diversified Equity Income Fund Common Shares of Beneficial Interest,8.22,0.0,105227,Finance
ETY,Eaton Vance Tax-Managed Diversified Equity Income Fund Common Shares of Beneficial Interest,14.39,0.0,228023,Finance
DNMXW,Dynamix Corporation III Warrants,0.29,0.0,26507,Finance
DNMX,Dynamix Corporation III Class A Ordinary Shares,10.02,0.0,4439,Finance
DMO,Western Asset Mortgage Opportunity Fund Inc. Common Stock,10.67,0.0,43654,Finance
DMII,Drugs Made In America Acquisition II Corp. Ordinary Shares,10.09,0.0,53814,Finance
DMAAR,Drugs Made In America Acquisition Corp. Rights,0.112,0.0,1001,Finance
DSU,Blackrock Debt Strategies Fund Inc. Common Stock,9.7,0.0,250347,Finance
ETG,Eaton Vance Tax-Advantaged Global Dividend Income Fund Common Shares of Beneficial Interest,23.12,0.0,122793,Finance
EMO,ClearBridge Energy Midstream Opportunity Fund Inc. Common Stock,49.48,0.0,71674,Finance
EMF,Templeton Emerging Markets Fund Common Stock,24.68,0.0,53180,Finance
EOI,Eaton Vance Enhance Equity Income Fund Eaton Vance Enhanced Equity Income Fund Shares of Beneficial Interest,19.3,0.0,49174,Finance
EOD,Allspring Global Dividend Opportunity Fund Common Shares of Beneficial Interest,6.49,0.0,43712,Finance
EMD,Western Asset Emerging Markets Debt Fund Inc Common Stock,10.64,0.0,168242,Finance
EHI,Western Asset Global High Income Fund Inc Common Stock,5.97,0.0,55074,Finance
EIM,Eaton Vance Municipal Bond Fund Common Shares of Beneficial Interest $.01 par value,9.73,0.0,170648,Finance
ERC,Allspring Multi-Sector Income Fund Common Stock,8.99,0.0,35252,Finance
VLT,Invesco High Income Trust II,10.31,0.0,20268,Finance
EEA,The European Equity Fund Inc. Common Stock,10.86,0.0,12507,Finance
FACTW,FACT II Acquisition Corp. Warrant,0.67,0.0,8422,Finance
DYORU,Insight Digital Partners II Units,10.13,0.0,10,Finance
FAX,abrdn Asia-Pacific Income Fund Inc. Common Stock,14.49,0.0,231160,Finance
EVT,Eaton Vance Tax Advantaged Dividend Income Fund Common Shares of Beneficial Interest,26.65,0.0,85036,Finance
DYOR,Insight Digital Partners II Class A Ordinary Shares,10.05,0.0,68297,Finance
EVV,Eaton Vance Limited Duration Income Fund Common Shares of Beneficial Interest,9.21,0.0,315329,Finance
EXG,Eaton Vance Tax-Managed Global Diversified Equity Income Fund Common Shares of Beneficial Interest,9.55,0.0,446624,Finance
HACQW,HCM IV Acquisition Corp. Warrants,0.471,0.0,165,Finance
HACQ,HCM IV Acquisition Corp. Class A Ordinary Share,10.0,0.0,2000,Finance
DPG,Duff & Phelps Utility and Infrastructure Fund Inc.,14.09,0.0,59499,Finance
UTG,Reaves Utility Income Fund Common Shares of Beneficial Interest,42.56,0.0,202198,Finance
UTF,Cohen & Steers Infrastructure Fund Inc Common Stock,27.04,0.0,417072,Finance
GLQ,Clough Global Equity Fund Clough Global Equity Fund Common Shares of Beneficial Interest,8.54,0.0,72907,Finance
GLO,Clough Global Opportunities Fund Common Stock,5.99,0.0,68685,Finance
GJP,Synthetic Fixed-Income Securities Inc. on behalf of STRATS (SM) Trust for Dominion Resources Inc. Securities Series 2005-6 Floating Rate Structured Repackaged Asset-Backed Trust Securities (STRATS) Certificates,24.24,0.0,10,Finance
GJO,Synthetic Fixed-Income Securities Inc. on behalf of STRATS(SM) Trust for Wal-Mart Stores Inc. Securities Series 2004-5,24.95,0.0,341,Finance
GOF,Guggenheim Strategic Opportunities Fund Common Shares of Beneficial Interest,10.74,0.0,1435996,Finance
GHY,PGIM Global High Yield Fund Inc.,11.8,0.0,155169,Finance
