symbol,name,price,marketCap,volume,industry
HYT,Blackrock Corporate High Yield Fund Inc. Common Stock,8.48,0.0,498238,Finance
HFRO,Highland Opportunities and Income Fund Common Shares of Beneficial Interest,7.38,0.0,142205,Finance
HERZ,Herzfeld Credit Income Fund Inc. Common Stock,16.61,0.0,8632,Finance
HEQ,John Hancock Diversified Income Fund Common Shares of Beneficial Interest,11.35,0.0,43279,Finance
HIX,Western Asset High Income Fund II Inc. Common Stock,3.99,0.0,210734,Finance
HIO,Western Asset High Income Opportunity Fund Inc. Common Stock,3.64,0.0,264546,Finance
HPI,John Hancock Preferred Income Fund Common Shares of Beneficial Interest,16.07,0.0,45997,Finance
HPF,John Hancock Pfd Income Fund II Pfd Income Fund II,15.76,0.0,24265,Finance
GUG,Guggenheim Active Allocation Fund Common Shares of Beneficial Interest,15.69,0.0,35901,Finance
HPS,John Hancock Preferred Income Fund III Preferred Income Fund III,14.27,0.0,54253,Finance
HTD,John Hancock Tax Advantaged Dividend Income Fund Common Shares of Beneficial Interest,25.15,0.0,81002,Finance
HVMCU,Highview Merger Corp. Units,10.27,0.0,474,Finance
GSHRW,Gesher Acquisition Corp. II Warrants,0.2401,0.0,1800,Finance
USA,Liberty All-Star Equity Fund Common Stock,5.72,0.0,1328719,Finance
GAINI,Gladstone Investment Corporation 7.875% Notes due 2030,25.5701,0.0,18014,Finance
GAING,Gladstone Investment Corporation 7.125% Notes due 2031,24.98,0.0,14608,Finance
FXACU,FortuneX Acquisition Corporation Units,10.06,0.0,54626,Finance
GDO,Western Asset Global Corporate Opportunity Fund Inc. Common Stock,10.66,0.0,27982,Finance
VGI,Virtus Global Multi-Sector Income Fund Common Shares of Beneficial Interest,7.4,0.0,14207,Finance
GRF,Eagle Capital Growth Fund Inc. Common Stock,9.97,0.0,2435,Finance
FCT,First Trust Senior Floating Rate Income Fund II Common Shares of Beneficial Interest,9.6,0.0,53430,Finance
FGII,FG Imperii Acquisition Corp. Class A Ordinary Shares,9.94,0.0,3489,Finance
FFC,Flaherty & Crumrine Preferred and Income Securities Fund Incorporated,15.95,0.0,77043,Finance
FFA,First Trust Enhanced Equity Income Fund Common Shares of Beneficial Interest,22.05,0.0,29034,Finance
FGSN,F&G Annuities & Life Inc. 7.300% Junior Subordinated Notes due 2065,21.23,0.0,39910,Finance
FGIIW,FG Imperii Acquisition Corp. Warrants,0.25,0.0,500,Finance
FIGXU,FIGX Capital Acquisition Corp. Units,10.34,0.0,100,Finance
VFL,abrdn National Municipal Income Fund Common Stock,10.3,0.0,67006,Finance
GDL,GDL Fund The Common Shares of Beneficial Interest,8.45,0.0,10009,Finance
VBF,Invesco Bond Fund Common Stock,14.91,0.0,36432,Finance
GECCI,Great Elm Capital Corp. 8.50% NOTES DUE 2029,25.1499,0.0,38,Finance
GECCG,Great Elm Capital Corp. 7.75% Notes Due 2030,24.96,0.0,7674,Finance
GGN,GAMCO Global Gold Natural Resources & Income Trust,4.95,0.0,562974,Finance
GF,New Germany Fund Inc. (The) Common Stock,11.8,0.0,5384,Finance
GJH,Synthetic Fixed-Income Securities Inc 6.375% (STRATS) Cl A-1,9.51,0.0,6,Finance
GIXXR,GigCapital9 Corp. Rights,0.3042,0.0,300,Finance
GIX,GigCapital9 Corp. Class A Ordinary Share,9.94,0.0,14388,Finance
FLC,Flaherty & Crumrine Total Return Fund Inc Common Stock,16.68,0.0,35772,Finance
FMY,First Trust Mortgage Income Fund Common Shares of Beneficial Interest,11.68,0.0,3916,Finance
FMACU,Future Money Acquisition Corporation Units,10.16,0.0,711,Finance
FMACR,Future Money Acquisition Corporation Rights,0.1801,0.0,16,Finance
FMAC,Future Money Acquisition Corporation Ordinary Shares,9.99,0.0,6632,Finance
FPF,First Trust Intermediate Duration Preferred & Income Fund Common Shares of Beneficial Interest,17.9,0.0,84312,Finance
GIXXU,GigCapital9 Corp. Units,10.22,0.0,1200,Finance
AVAT,Avalanche Treasury Corporation Class A Common Stock,0.849,0.0,688942,Finance
AVK,Advent Convertible and Income Fund,12.92,0.0,111455,Finance
AWP,abrdn Global Premier Properties Fund Common Shares of Beneficial Interest,11.6,0.0,156984,Finance
AWF,Alliancebernstein Global High Income Fund,10.14,0.0,240489,Finance
BACCU,Blue Acquisition Corp. Unit,11.06,0.0,2402,Finance
BACCR,Blue Acquisition Corp. Right ,0.42,0.0,90213,Finance
BACC,Blue Acquisition Corp. Class A Ordinary Shares,10.42,0.0,38567,Finance
BBN,BlackRock Taxable Municipal Bond Trust Common Shares of Beneficial Interest,15.95,0.0,122196,Finance
APXTW,Apex Treasury Corporation Warrants,0.3,0.0,178847,Finance
APURR,Aperture AC Rights,0.21,0.0,214,Finance
APUR,Aperture AC Class A Ordinary Shares,9.9,0.0,132,Finance
ARCLW,ARC Group Acquisition I Corp Warrants,0.1115,0.0,14627,Finance
ARCLU,ARC Group Acquisition I Corp Unit,10.2,0.0,2800,Finance
ARCLR,ARC Group Acquisition I Corp Right,0.23,0.0,101808,Finance
ARCL,ARC Group Acquisition I Corp Class A Ordinary Shares,9.91,0.0,11,Finance
BIDWU,Tribeca Strategic Acquisition Corp. Unit,9.9897,0.0,1,Finance
BCARW,D. Boral ARC Acquisition I Corp. Warrant,1.8,0.0,81968,Finance
BCARU,D. Boral ARC Acquisition I Corp. Units,11.62,0.0,4196,Finance
BDCIU,BTC Development Corp. Unit,10.14,0.0,201,Finance
BDCI,BTC Development Corp. Class A Ordinary Shares,10.06,0.0,752410,Finance
BCV,Bancroft Fund Ltd.,26.11,0.0,7169,Finance
BGT,BlackRock Floating Rate Income Trust,10.64,0.0,96020,Finance
BGH,Barings Global Short Duration High Yield Fund Common Shares of Beneficial Interests,13.92,0.0,214916,Finance
BGB,Blackstone Strategic Credit 2027 Term Fund Common Shares of Beneficial Interest,11.34,0.0,82516,Finance
BHV,BlackRock Virginia Municipal Bond Trust,12.25,0.0,1676,Finance
BCAR,D. Boral ARC Acquisition I Corp. Class A Ordinary Shares,10.58,0.0,231939,Finance
SPE,Special Opportunities Fund Inc Common Stock,13.37,0.0,55122,Finance
SIMAW,SIM Acquisition Corp. I Warrant,0.2501,0.0,3569,Finance
SORNU,Soren Acquisition Corp. Unit,10.0,0.0,500,Finance
XSLLU,Xsolla SPAC 1 Units,10.03,0.0,4700,Finance
AFB,AllianceBernstein National Municipal Income Fund Inc,11.32,0.0,108539,Finance
AGD,abrdn Global Dynamic Dividend Fund Common Shares of Beneficial Interest,12.41,0.0,94486,Finance
ALISR,Calisa Acquisition Corp Right,0.75,0.0,11476,Finance
ALFUW,Centurion Acquisition Corp. Warrant,0.28,0.0,23700,Finance
ALOVU,Aldabra 4 Liquidity Opportunity Vehicle Inc. Units,10.155,0.0,1088,Finance
XSLLW,Xsolla SPAC 1 Warrants,0.2401,0.0,878,Finance
ARTC,Art Technology Acquisition Corp. Class A Ordinary Shares,9.92,0.0,276252,Finance
ASGI,abrdn Global Infrastructure Income Fund Common Shares of Beneficial Interest,22.45,0.0,163675,Finance
ASG,Liberty All-Star Growth Fund Inc.,5.39,0.0,134372,Finance
ATIIW,Archimedes Tech SPAC Partners II Co. Warrant,2.05,0.0,33888,Finance
AMAN,Amanat Acquisition Corp Class A Ordinary Shares,10.08,0.0,18101,Finance
XSLL,Xsolla SPAC 1 Class A Ordinary Shares,9.93,0.0,127218,Finance
XRPNW,Armada Acquisition Corp. II Warrant,0.875,0.0,60940,Finance
XRPN,Armada Acquisition Corp. II Class A Ordinary Shares,10.41,0.0,62790,Finance
AOMN,Angel Oak Mortgage REIT Inc. 9.500% Senior Notes due 2029,25.095,0.0,3784,Finance
AOMD,Angel Oak Mortgage REIT Inc. 9.750% Senior Notes due 2030,24.88,0.0,2846,Finance
AOD,abrdn Total Dynamic Dividend Fund Common Shares of Beneficial Interest,10.39,0.0,357669,Finance
APMCU,AmperCap Acquisition Company Unit,10.0,0.0,12390,Finance
XRPNU,Armada Acquisition Corp. II Units,10.95,0.0,227,Finance
CMII,Columbus Circle Capital Corp II Class A Ordinary Shares,9.98,0.0,10539,Finance
CRBD,Corebridge Financial Inc. 6.375% Junior Subordinated Notes due 2064,22.95,0.0,101835,Finance
CRAQ,Cal Redwood Acquisition Corp. Class A Ordinary Shares,10.29,0.0,36808,Finance
CRANR,Crane Harbor Acquisition Corp. II Rights,0.1902,0.0,369,Finance
CRAN,Crane Harbor Acquisition Corp. II Class A Ordinary Shares,10.1,0.0,5204,Finance
CRF,Cornerstone Total Return Fund Inc. (The) Common Stock,7.12,0.0,770942,Finance
WENNW,Wen Acquisition Corp Warrant,0.3898,0.0,154,Finance
WEA,Western Asset Bond Fund Share of Beneficial Interest,10.58,0.0,11634,Finance
WDI,Western Asset Diversified Income Fund Common Shares of Beneficial Interest,13.48,0.0,137500,Finance
BIT,BlackRock Multi-Sector Income Trust Common Shares of Beneficial Interest,12.36,0.0,350191,Finance
CEPT,Cantor Equity Partners II Inc. Class A Ordinary Share,10.64,0.0,2059342,Finance
CEPS,Cantor Equity Partners VI Inc. Class A Ordinary Shares,10.3,0.0,24312,Finance
CEPO,Cantor Equity Partners I Inc. Class A Ordinary Shares,10.63,0.0,694173,Finance
CEPF,Cantor Equity Partners IV Inc. Class A Ordinary Shares,10.34,0.0,965,Finance
CGO,Calamos Global Total Return Fund Common Stock,13.98,0.0,25547,Finance
CHI,Calamos Convertible Opportunities and Income Fund Common Stock,13.18,0.0,313493,Finance
CCAQW,Collective Acquisition Corp. Warrants,0.454,0.0,201,Finance
DSM,BNY Mellon Strategic Municipal Bond Fund Inc. Common Stock,6.1,0.0,102323,Finance
CTAA,ClearThink 1 Acquisition Corp. Class A Ordinary Shares,9.93,0.0,17516,Finance
VVR,Invesco Senior Income Trust Common Stock (DE),2.98,0.0,369457,Finance
CUBWW,Lionheart Holdings Warrant,0.34,0.0,11257,Finance
CUBWU,Lionheart Holdings Unit,11.05,0.0,1200,Finance
CXIIW,Churchill Capital Corp XII Warrants,1.22,0.0,19034,Finance
CXIIU,Churchill Capital Corp XII Units,10.2,0.0,105,Finance
CXII,Churchill Capital Corp XII Class A Ordinary Shares,10.09,0.0,2535,Finance
DAAQW,Digital Asset Acquisition Corp. Warrant,0.44,0.0,3,Finance
DAAQ,Digital Asset Acquisition Corp. Class A Ordinary shares,10.39,0.0,166857,Finance
CMIIW,Columbus Circle Capital Corp II Warrant,0.6,0.0,8,Finance
DBCAW,D. Boral Acquisition I Corp. Warrants,0.4197,0.0,11450,Finance
DBCA,D. Boral Acquisition I Corp. Class A Ordinary Shares,9.96,0.0,10449,Finance
DHY,Credit Suisse High Yield Credit Fund Common Stock,1.75,0.0,856672,Finance
CICC,CION Investment Corporation 7.50% Notes due 2031,24.73,0.0,5498,Finance
CICB,CION Investment Corporation 7.50% Notes due 2029,24.9,0.0,5293,Finance
CHY,Calamos Convertible and High Income Fund Common Stock,13.46,0.0,181971,Finance
CHW,Calamos Global Dynamic Income Fund Common Stock,8.99,0.0,207031,Finance
CIK,Credit Suisse Asset Management Income Fund Inc. Common Stock,2.47,0.0,688298,Finance
CLM,Cornerstone Strategic Investment Fund Inc. Common Shares,7.45,0.0,1330132,Finance
CAPNR,Cayson Acquisition Corp Right,0.3099,0.0,415,Finance
BLZR,Trailblazer Acquisition Corp. Class A Ordinary Shares,10.115,0.0,52233,Finance
WLIIW,Willow Lane Acquisition Corp. II Warrants,1.1,0.0,51,Finance
BOE,Blackrock Enhanced Global Dividend Trust Common Shares of Beneficial Interest,11.81,0.0,98576,Finance
BRKHU,Burtech Acquisition Corp II Unit,10.02,0.0,13186,Finance
CCAQU,Collective Acquisition Corp. Units,10.7,0.0,12,Finance
BREZ,Breeze Acquisition Corp. II Ordinary Shares,9.92,0.0,51154,Finance
BRW,Saba Capital Income & Opportunities Fund SBI,6.47,0.0,304580,Finance
BTO,John Hancock Financial Opportunities Fund Common Stock,37.58,0.0,31264,Finance
BSL,Blackstone Senior Floating Rate 2027 Term Fund Common Shares of Beneficial Interest,12.99,0.0,32732,Finance
BHK,Blackrock Core Bond Trust,8.96,0.0,148397,Finance
BGY,Blackrock Enhanced International Dividend Trust,5.73,0.0,309357,Finance
BIXIU,Bitcoin Infrastructure Acquisition Corp Ltd. Unit ,10.11,0.0,3103,Finance
BREZR,Breeze Acquisition Corp. II Right,0.26,0.0,10588,Finance
CCAQ,Collective Acquisition Corp. Class A Ordinary Shares,10.43,0.0,205,Finance
CCD,Calamos Dynamic Convertible & Income Fund Common Stock,25.56,0.0,118759,Finance
CCXIU,Churchill Capital Corp XI Units,10.56,0.0,13500,Finance
CAES,Cantor Equity Partners VII Inc. Class A Ordinary Shares,10.09,0.0,267780,Finance
BUI,BlackRock Utility Infrastructure & Power Opportunities Trust,28.08,0.0,83812,Finance
BTT,BlackRock Municipal 2030 Target Term Trust,22.61,0.0,106411,Finance
WLII,Willow Lane Acquisition Corp. II Class A Ordinary Shares,10.18,0.0,350121,Finance
WIW,Western Asset Inflation-Linked Opportunities & Income Fund,8.37,0.0,477123,Finance
WIA,Western Asset Inflation-Linked Income Fund,8.09,0.0,24629,Finance
BWG,BrandywineGLOBAL Global Income Opportunities Fund Inc.,7.98,0.0,68329,Finance
CAIIW,Collective Acquisition Corp. II Warrants,0.26,0.0,83010,Finance
CAIIU,Collective Acquisition Corp. II Units,10.04,0.0,206030,Finance
CAII,Collective Acquisition Corp. II Class A Ordinary Shares,9.93,0.0,51430,Finance
CAF,Morgan Stanley China A Share Fund Inc. Common Stock,20.33,0.0,31939,Finance
CEE,The Central and Eastern Europe Fund Inc. (The) Common Stock,21.68,0.0,15458,Finance
PCQ,PIMCO California Municipal Income Fund Common Stock,8.86,0.0,81832,Finance
SVIVW,Spring Valley Acquisition Corp. IV Warrants,0.9101,0.0,543,Finance
SVIV,Spring Valley Acquisition Corp. IV Class A Ordinary Shares,10.2,0.0,5067,Finance
SVCCW,Stellar V Capital Corp. Warrant,0.1705,0.0,27,Finance
SVCCU,Stellar V Capital Corp. Unit,10.82,0.0,400,Finance
PECEW,Peace Acquisition Corp Warrant,0.1,0.0,210,Finance
PECEU,Peace Acquisition Corp Units,10.48,0.0,2801,Finance
PECER,Peace Acquisition Corp Right,0.5,0.0,1820,Finance
PECE,Peace Acquisition Corp Ordinary Shares,9.92,0.0,19257,Finance
IHD,Voya Emerging Markets High Income Dividend Equity Fund Common Shares,7.94,0.0,90711,Finance
PFD,Flaherty & Crumrine Preferred and Income Fund Incorporated,11.55,0.0,18202,Finance
PEO,Adams Natural Resources Fund Inc. Common Stock,24.57,0.0,85011,Finance
PGP,Pimco Global StocksPlus & Income Fund Common Shares of Beneficial Interest,8.57,0.0,91749,Finance
OXLCG,Oxford Lane Capital Corp. 7.95% Notes due 2032,25.08,0.0,8346,Finance
SZZL,Sizzle Acquisition Corp. II Class A ordinary shares,10.37,0.0,3844,Finance
SWZ,Total Return Securities Fund Common Stock,5.91,0.0,28088,Finance
PALOW,Paloma Acquisition Corp I Warrants,0.38,0.0,8,Finance
PALO,Paloma Acquisition Corp I Class A Ordinary Shares,9.9,0.0,25739,Finance
PAI,Western Asset Investment Grade Income Fund Inc.,12.11,0.0,11895,Finance
PAXS,PIMCO Access Income Fund Common Shares of Beneficial Interest,14.05,0.0,168615,Finance
PDT,John Hancock Premium Dividend Fund,12.61,0.0,174534,Finance
PTY,Pimco Corporate & Income Opportunity Fund,11.69,0.0,2533266,Finance
PTOR,Praetorian Acquisition Corp. Class A Ordinary Shares,9.94,0.0,4321,Finance
PYT,PPlus Tr GSC-2 Tr Ctf Fltg Rate,23.25,0.0,3200,Finance
QETAU,Quetta Acquisition Corporation Unit,11.7,0.0,35,Finance
QETA,Quetta Acquisition Corporation Common Stock,11.71,0.0,342,Finance
QADRW,QDRO Acquisition Corp. Warrant,0.26,0.0,8,Finance
PML,Pimco Municipal Income Fund II Common Shares of Beneficial Interest,7.5,0.0,617125,Finance
PFN,PIMCO Income Strategy Fund II,6.78,0.0,282127,Finance
PFLA,PennantPark Floating Rate Capital Ltd. 7.375% Notes Due 2031,25.25,0.0,32937,Finance
PFL,PIMCO Income Strategy Fund Shares of Beneficial Interest,7.57,0.0,255449,Finance
SVAQW,Silicon Valley Acquisition Corp. Warrants,0.9,0.0,262014,Finance
SVAQU,Silicon Valley Acquisition Corp. Units,10.58,0.0,30,Finance
SVAQ,Silicon Valley Acquisition Corp. Class A Ordinary Shares,10.07,0.0,41427,Finance
SVACW,Spring Valley Acquisition Corp. III Warrant,1.86,0.0,38039,Finance
SVACU,Spring Valley Acquisition Corp. III Unit,10.82,0.0,2246,Finance
SVAC,Spring Valley Acquisition Corp. III Class A Ordinary Shares,10.28,0.0,702984,Finance
PHK,Pimco High Income Fund,4.53,0.0,534400,Finance
PFO,Flaherty & Crumrine Preferred and Income Opportunity Fund Incorporated,9.19,0.0,28287,Finance
TAVIR,Tavia Acquisition Corp. Right,0.105,0.0,615,Finance
OACCW,Oaktree Acquisition Corp. III Life Sciences Warrant,0.82,0.0,6,Finance
NZF,Nuveen Municipal Credit Income Fund ,12.63,0.0,535663,Finance
PCN,Pimco Corporate & Income Strategy Fund Common Stock,11.71,0.0,229106,Finance
NNY,Nuveen New York Municipal Value Fund Common Stock,8.69,0.0,9453,Finance
TDWDR,Tailwind 2.0 Acquisition Corp. Rights,0.17,0.0,25,Finance
TDWD,Tailwind 2.0 Acquisition Corp. Class A Ordinary Shares,10.05,0.0,65000,Finance
TDF,Templeton Dragon Fund Inc. Common Stock,10.85,0.0,45833,Finance
NPV,Nuveen Virginia Quality Municipal Income Fund Common Stock,11.38,0.0,41055,Finance
NPFD,Nuveen Variable Rate Preferred & Income Fund Common Shares,18.45,0.0,40428,Finance
NPCT,Nuveen Core Plus Impact Fund Common Shares of Beneficial Interest,9.81,0.0,75778,Finance
NRUC,National Rural Utilities Cooperative Finance Corporation 5.500% Subordinated Notes due 2064 (Subordinated Deferrable Interest Notes),23.49,0.0,17751,Finance
PCM,PCM Fund Inc. Common Stock,5.5,0.0,76272,Finance
PCF,High Income Securities Fund Common Stock,5.45,0.0,99246,Finance
PCAPW,ProCap Acquisition Corp Warrant,0.3201,0.0,700,Finance
PCAP,ProCap Acquisition Corp Class A Ordinary Shares,10.28,0.0,80567,Finance
OPP,RiverNorth/DoubleLine Strategic Opportunity Fund Inc. Common Stock,7.5,0.0,81801,Finance
TAVI,Tavia Acquisition Corp. Ordinary Shares,10.65,0.0,606,Finance
TACOW,Berto Acquisition Corp. Warrant,0.63,0.0,3,Finance
TACHW,Titan Acquisition Corp. Warrants,0.68,0.0,52403,Finance
TAVIU,Tavia Acquisition Corp. Unit,10.73,0.0,1,Finance
TACH,Titan Acquisition Corp. Class A Ordinary Shares,10.42,0.0,89961,Finance
SZZLU,Sizzle Acquisition Corp. II Unit,10.46,0.0,2,Finance
SZZLR,Sizzle Acquisition Corp. II Right,0.18,0.0,46500,Finance
OTGAW,OTG Acquisition Corp. I Warrants,0.39,0.0,482,Finance
OTGAU,OTG Acquisition Corp. I Unit,10.3399,0.0,3503,Finance
OTGA,OTG Acquisition Corp. I Class A Ordinary Share ,10.16,0.0,700,Finance
OYSE,Oyster Enterprises II Acquisition Corp Class A Ordinary Shares,10.29,0.0,2502,Finance
OXSQH,Oxford Square Capital Corp. 7.75% Notes due 2030,25.18,0.0,530,Finance
NUW,Nuveen AMT-Free Municipal Value Fund,14.27,0.0,31938,Finance
NUV,Nuveen Municipal Value Fund Inc. Common Stock,9.12,0.0,430793,Finance
TACHU,Titan Acquisition Corp. Units,10.76,0.0,1,Finance
ADACU,American Drive Acquisition Company Units,10.21,0.0,1569,Finance
ZTR,Virtus Total Return Fund Inc.,6.72,0.0,81065,Finance
SAAQW,Space Asset Acquisition Corp. Warrants,1.02,0.0,2055,Finance
SAAQU,Space Asset Acquisition Corp. Units,10.62,0.0,1558,Finance
SAAQ,Space Asset Acquisition Corp. Class A Ordinary Shares,10.3,0.0,13155,Finance
SAV,Saratoga Investment Corp 7.50% Notes due 2031,24.76,0.0,8114,Finance
SCD,LMP Capital and Income Fund Inc. Common Stock,15.61,0.0,59665,Finance
SBI,Western Asset Intermediate Muni Fund Inc Common Stock,7.87,0.0,109773,Finance
SDHI,Siddhi Acquisition Corp Class A Common stock,10.42,0.0,25006,Finance
RREVW,RRE Ventures Acquisition Corp. Warrants,0.4999,0.0,5008,Finance
RREVU,RRE Ventures Acquisition Corp. Units,10.03,0.0,2301,Finance
RREV,RRE Ventures Acquisition Corp. Class A Ordinary Shares,9.88,0.0,10420,Finance
SSACU,SPACSphere Acquisition Corp. Unit,10.28,0.0,300,Finance
SPXX,Nuveen S&P 500 Dynamic Overwrite Fund,18.06,0.0,158942,Finance
AACBU,Artius II Acquisition Inc. Units,10.68,0.0,1,Finance
AACI,Armada Acquisition Corp. III Class A Ordinary Share,9.98,0.0,507,Finance
AACIU,Armada Acquisition Corp. III Units,10.08,0.0,1784,Finance
AACIW,Armada Acquisition Corp. III Warrant,0.3,0.0,8,Finance
AACP,Apogee Acquisition Corp Class A Ordinary Shares,9.98,0.0,4260,Finance
AACPU,Apogee Acquisition Corp Units,10.27,0.0,205,Finance
AACPW,Apogee Acquisition Corp Warrant,0.11,0.0,2700,Finance
ZKP,Lafayette Digital Acquisition Corp. I Class A Ordinary Shares,9.93,0.0,1,Finance
ZKPW,Lafayette Digital Acquisition Corp. I Warrant,0.33,0.0,3682,Finance
ADX,Adams Diversified Equity Fund Inc.,25.0,0.0,433968,Finance
ACGCW,ACP Holdings Acquisition Corp. Warrants,0.32,0.0,1950,Finance
ACGCU,ACP Holdings Acquisition Corp. Units,10.07,0.0,2344,Finance
ACGC,ACP Holdings Acquisition Corp. Class A Ordinary Shares,9.95,0.0,90765,Finance
ACP,abrdn Income Credit Strategies Fund Common Shares,5.24,0.0,381761,Finance
AACPR,Apogee Acquisition Corp Rights,0.2,0.0,18,Finance
QADRU,QDRO Acquisition Corp. Units,10.02,0.0,420,Finance
QADR,QDRO Acquisition Corp. Class A Ordinary Shares,9.9,0.0,40,Finance
STK,Columbia Seligman Premium Technology Growth Fund Inc,54.39,0.0,72505,Finance
STEW,SRH Total Return Fund Inc. Common Stock,17.7,0.0,75791,Finance
QSEAU,Quartzsea Acquisition Corporation Units,10.71,0.0,4,Finance
QSEA,Quartzsea Acquisition Corporation Ordinary Shares,10.52,0.0,13427,Finance
QQQX,Nuveen NASDAQ 100 Dynamic Overwrite Fund Shares of Beneficial Interest,29.875,0.0,92405,Finance
RAAQW,Real Asset Acquisition Corp. Warrants,3.4,0.0,186868,Finance
RAAQU,Real Asset Acquisition Corp. Unit,12.1,0.0,120,Finance
SSACR,SPACSphere Acquisition Corp. Rights,0.1799,0.0,15,Finance
RA,Brookfield Real Assets Income Fund Inc. Common Stock,12.71,0.0,236470,Finance
PNI,Pimco New York Municipal Income Fund II Common Shares of Beneficial Interest,7.01,0.0,100247,Finance
PMTRW,Perimeter Acquisition Corp. I Warrant,0.88,0.0,168,Finance
PMTR,Perimeter Acquisition Corp. I Class A Ordinary Shares,10.43,0.0,788,Finance
RAAQ,Real Asset Acquisition Corp. Class A Ordinary Share,10.45,0.0,2430881,Finance
SSAC,SPACSphere Acquisition Corp. Class A Ordinary Shares,9.995,0.0,62178,Finance
SRV,NXG Cushing Midstream Energy Fund Common Shares of Beneficial Interest,48.27,0.0,38724,Finance
RTACW,Renatus Tactical Acquisition Corp I Warrant,0.67,0.0,21422,Finance
RTACU,Renatus Tactical Acquisition Corp I Unit,10.755,0.0,1534,Finance
RTAC,Renatus Tactical Acquisition Corp I Class A Ordinary Shares,10.4,0.0,160233,Finance
RWAYI,Runway Growth Finance Corp. 7.25% Notes due 2031,24.48,0.0,2137,Finance
RNGT,Range Capital Acquisition Corp II Class A Ordinary Shares,10.09,0.0,574355,Finance
RANGR,Range Capital Acquisition Corp. Rights,0.28,0.0,300,Finance
RANG,Range Capital Acquisition Corp. Ordinary Shares,10.62,0.0,52,Finance
SSEA,Starry Sea Acquisition Corp	Ordinary Shares,10.23,0.0,123,Finance
SSACW,SPACSphere Acquisition Corp. Warrant,0.1353,0.0,5193,Finance
RDAGW,Republic Digital Acquisition Company Warrants,0.3799,0.0,4711,Finance
RDAG,Republic Digital Acquisition Company Class A Ordinary Shares,10.35,0.0,159,Finance
RCS,PIMCO Strategic Income Fund Inc.,5.38,0.0,93517,Finance
RCG,RENN Fund Inc Common Stock,2.73,0.0,8362,Finance
RIV,RiverNorth Opportunities Fund Inc. Common Stock,11.48,0.0,86492,Finance
RNGTW,Range Capital Acquisition Corp II Warrants,0.3221,0.0,11400,Finance
RNGTU,Range Capital Acquisition Corp II Units,10.2001,0.0,79,Finance
JGH,Nuveen Global High Income Fund Common Shares of Beneficial Interest,12.61,0.0,236412,Finance
TSI,TCW Strategic Income Fund Inc. Common Stock,4.47,0.0,74842,Finance
JRS,Nuveen Real Estate Income Fund Common Shares of Beneficial Interest,8.16,0.0,53784,Finance
JRI,Nuveen Real Asset Income and Growth Fund Common Shares of Beneficial Interest,12.65,0.0,142176,Finance
JQC,Nuveen Credit Strategies Income Fund Shares of Beneficial Interest,4.79,0.0,379667,Finance
JPC,Nuveen Preferred & Income Opportunities Fund,7.74,0.0,1097986,Finance
KCHVR,Kochav Defense Acquisition Corp. Right,0.2147,0.0,11351,Finance
KBONW,Karbon Capital Partners Corp. Warrant,0.5738,0.0,598,Finance
KBONU,Karbon Capital Partners Corp. Units,10.26,0.0,7800,Finance
KBON,Karbon Capital Partners Corp. Class A Ordinary Shares,10.12,0.0,52421,Finance
NRO,Neuberger Real Estate Securities Income Fund Inc. Common Stock,2.93,0.0,279564,Finance
KF,Korea Fund Inc. (The) New Common Stock,79.76,0.0,20652,Finance
ISNRU,Snow Rothschild Acquisition Corp. Units,10.0,0.0,25075,Finance
ISD,PGIM High Yield Bond Fund Inc.,12.76,0.0,82392,Finance
KFIIU,K&F Growth Acquisition Corp. II Unit,10.6,0.0,150,Finance
TRGS,TRG Latin America Acquisitions Corp. Class A Ordinary Shares,9.89,0.0,9914,Finance
LATA,Galata Acquisition Corp. II Class A Ordinary Shares,10.11,0.0,648629,Finance
LCCCR,Lakeshore Acquisition III Corp. Rights,0.1599,0.0,15908,Finance
LCCC,Lakeshore Acquisition III Corp. Ordinary Shares,10.42,0.0,487,Finance
LFAC,Leapfrog Acquisition Corporation Class A Ordinary Shares,10.01,0.0,29780,Finance
LDP,Cohen & Steers Limited Duration Preferred and Income Fund Inc.,20.83,0.0,35277,Finance
LFACW,Leapfrog Acquisition Corporation Warrants,0.32,0.0,59,Finance
KEYYW,Keystone Acquisition Corp. Warrants,0.35,0.0,106372,Finance
JLS,Nuveen Mortgage and Income Fund,17.35,0.0,20802,Finance
KEYY,Keystone Acquisition Corp. Class A Ordinary Shares,9.92,0.0,24073,Finance
KKRT,KKR & Co. Inc. 6.875% Subordinated Notes due 2065,24.77,0.0,85355,Finance
KIO,KKR Income Opportunities Fund Common Shares,11.18,0.0,156381,Finance
KTH,Structures Products Cp 8% CorTS Issued by Peco Energy Cap Tr II Preferred Stock,28.23,0.0,6139,Finance
JMM,Nuveen Multi-Market Income Fund (MA),5.82,0.0,3966,Finance
KEYYU,Keystone Acquisition Corp. Unit,10.0771,0.0,43588,Finance
IDE,Voya Infrastructure Industrials and Materials Fund Common Shares of Beneficial Interest,13.8,0.0,28498,Finance
IIF,Morgan Stanley India Investment Fund Inc. Common Stock,22.46,0.0,23955,Finance
IGR,CBRE Global Real Estate Income Fund Common Shares of Beneficial Interest,4.45,0.0,695893,Finance
IGI,Western Asset Investment Grade Opportunity Trust Inc. Common Stock,16.05,0.0,16627,Finance
IGD,Voya Global Equity Dividend and Premium Opportunity Fund,6.16,0.0,286928,Finance
IGACU,Invest Green Acquisition Corporation Units,10.18,0.0,1834,Finance
JFR,Nuveen Floating Rate Income Fund Common Stock,7.6,0.0,367152,Finance
IBACR,IB Acquisition Corp. Right,0.115,0.0,100,Finance
IBAC,IB Acquisition Corp. Common Stock,10.7,0.0,1953,Finance
IAF,abrdn Australia Equity Fund Inc. Common Stock,12.35,0.0,18905,Finance
IAE,Voya Asia Pacific High Dividend Equity Income Fund ING Asia Pacific High Dividend Equity Income Fund Common Shares of Beneficial Interest,9.18,0.0,85614,Finance
IACQW,Irenic Acquisition Corp. Warrants,0.69,0.0,6200,Finance
IACQU,Irenic Acquisition Corp. Unit,10.23,0.0,7847,Finance
IACQ,Irenic Acquisition Corp. Class A Ordinary Shares,9.97,0.0,1144210,Finance
IACOW,Idea Acquisition Corp. Warrants,0.39,0.0,8,Finance
IACOU,Idea Acquisition Corp. Units,10.0101,0.0,4,Finance
IACO,Idea Acquisition Corp. Class A Ordinary Shares,9.92,0.0,13302,Finance
HVIIR,Hennessy Capital Investment Corp. VII Rights,0.37,0.0,1203,Finance
JCE,Nuveen Core Equity Alpha Fund Common Shares of Beneficial Interest,16.08,0.0,48623,Finance
