symbol,name,price,marketCap,volume,industry
CELU,Celularity Inc. Class A Common Stock,0.78,22577850.0,23381,Health Care
TXMD,TherapeuticsMD Inc. Common Stock,1.94,22454262.0,16614,Health Care
RMTI,Rockwell Medical Inc. Common Stock,5.64,22261249.0,7681,Health Care
GRML,Greenland Mines Ltd. Common Stock,0.1818,22041188.0,3557153,Health Care
NMTC,NeuroOne Medical Technologies Corporation Common Stock,2.51,21635889.0,20256,Health Care
RVP,Retractable Technologies Inc. Common Stock,0.72,21554754.0,19431,Health Care
SKYE,Skye Bioscience Inc. Common Stock,0.6061,21300610.0,134309,Health Care
ATOS,Atossa Therapeutics Inc. Common Stock,2.44,21011721.0,95164,Health Care
CLRB,Cellectar Biosciences Inc.  Common Stock,2.61,20858629.0,787510,Health Care
TVGN,Tevogen Bio Holdings Inc. Common Stock,4.78,20168460.0,25477,Health Care
CVM,Cel-Sci Corporation Common Stock,1.15,20098716.0,302425,Health Care
RKTO,Rocket One Inc. Common Stock,0.9,20090093.0,1658778,Health Care
LGVN,Longeveron Inc. Class A Common Stock,0.6353,20074179.0,138919,Health Care
AIXC,AIxCrypto Holdings Inc. Common Stock,0.9797,19824223.0,30613,Health Care
LPCN,Lipocine Inc. Common Stock,2.36,19456437.0,23738,Health Care
JSPR,Jasper Therapeutics Inc. Common Stock,0.692,19382783.0,619935,Health Care
KALA,KALA BIO Inc. Common Stock,1.03,19147481.0,324249,Health Care
NEUP,Neuphoria Therapeutics Inc. Common Stock,3.52,19024020.0,14633,Health Care
ICU,SeaStar Medical Holding Corporation Common Stock,4.62,18466149.0,42802,Health Care
YDESW,YD Bio Limited Warrants,0.26,18416150.0,4333,Health Care
IRIX,IRIDEX Corporation Common Stock,1.05,18276844.0,21441,Health Care
ALLR,Allarity Therapeutics Inc. Common Stock,1.18,18243654.0,81213,Health Care
QNCX,Quince Therapeutics Inc. Common Stock,18.58,18170553.0,39635,Health Care
SNTI,Senti Biosciences Holdings Inc. Common Stock,0.5833,18166735.0,2640649,Health Care
MDAIW,Spectral AI Inc. Warrants,0.55,17503192.0,3,Health Care
COSM,Cosmos Health Inc. Common Stock,0.2785,17288834.0,5523185,Health Care
TPST,Tempest Therapeutics Inc. Common Stock,1.07,17097970.0,267300,Health Care
SCNX,Scienture Holdings Inc. Common Stock,0.408,16577373.0,1196535,Health Care
HOWL,Werewolf Therapeutics Inc. Common Stock,0.3395,16498619.0,400159,Health Care
CYCN,Cyclerion Therapeutics Inc. Common Stock,3.71,16065465.0,23101,Health Care
KTTA,Pasithea Therapeutics Corp. Common Stock,0.478,15972106.0,398102,Health Care
HIND,Vyome Holdings Inc. Common Stock,2.27,15932059.0,29000,Health Care
PTN,Palatin Technologies Inc. Common Stock,8.9,15835548.0,24830,Health Care
PASG,Passage Bio Inc. Common Stock,4.91,15750347.0,57783,Health Care
GTBP,GT Biopharma Inc. Common Stock,0.3504,15536236.0,1092360,Health Care
OSRH,OSR Health Inc. Common Stock,0.4204,14763898.0,2172611,Health Care
CTXR,Citius Pharmaceuticals Inc. Common Stock,0.5311,14580060.0,116310,Health Care
NAII,Natural Alternatives International Inc. Common Stock,2.26,14182018.0,4169,Health Care
INAB,IN8bio Inc. Common Stock,1.44,14179808.0,75318,Health Care
BFRI,Biofrontera Inc. Common Stock,1.09,13955645.0,155895,Health Care
LNAI,Lunai Bioworks Inc. Common Stock,2.98,13510992.0,26554,Health Care
BIVI,BioVie Inc. Class A Common Stock,1.77,13349055.0,285850,Health Care
COCP,Cocrystal Pharma Inc. Common Stock,0.96,13235955.0,32402,Health Care
CODX,Co-Diagnostics Inc. Common Stock,2.49,13144603.0,158882,Health Care
INTS,Intensity Therapeutics Inc. Common stock,4.84,13081649.0,27539,Health Care
BFRG,Bullfrog AI Holdings Inc. Common Stock,0.69,12793739.0,74491,Health Care
MBRX,Moleculin Biotech Inc. Common Stock,2.31,12326969.0,115577,Health Care
ADGM,Adagio Medical Holdings Inc Common Stock,0.551,12237963.0,18407,Health Care
OABIW,OmniAb Inc. Warrant,0.0809,11728282.0,40,Health Care
TOVX,Theriva Biologics Inc. Common Stock,0.2429,11147329.0,560962,Health Care
KPRX,Kiora Pharmaceuticals Inc.  Common Stock,2.48,10991211.0,13763,Health Care
FEMY,Femasys Inc. Common Stock,3.57,10779736.0,10826,Health Care
PHIO,Phio Pharmaceuticals Corp. Common Stock,0.8901,10340514.0,26029430,Health Care
XCUR,Exicure Inc. Common Stock,1.62,10325778.0,9297898,Health Care
NXL,Nexalin Technology Inc. Common Stock,0.469,10323301.0,428530,Health Care
VTGN,Vistagen Therapeutics Inc. Common Stock,0.2489,10212978.0,375240,Health Care
SINT,SiNtx Technologies Inc. Common Stock,1.57,9981479.0,20830,Health Care
BCDA,BioCardia Inc. Common Stock,0.8762,9966533.0,186970,Health Care
TRAW,Traws Pharma Inc. Common Stock,0.6544,9965418.0,171938,Health Care
AMS,American Shared Hospital Services Common Stock,1.45,9606250.0,39265,Health Care
MTVA,MetaVia Inc. Common Stock,1.85,9554085.0,139524,Health Care
JAGX,Jaguar Health Inc. Common Stock,1.95,9471561.0,41049,Health Care
HWH,HWH International Inc. Common Stock,1.22,9426208.0,13036,Health Care
CRIS,Curis Inc. Common Stock,4.73,9218463.0,46539,Health Care
MTEX,Mannatech Incorporated Common Stock,4.71,9088746.0,4593,Health Care
BRTX,BioRestorative Therapies Inc. Common Stock (NV),0.34,8662578.0,54778,Health Care
APRE,Aprea Therapeutics Inc. Common stock,0.6978,8640701.0,35909,Health Care
JUNS,Jupiter Neurosciences Inc. Common Stock,0.1785,8608004.0,393977,Health Care
RNAZ,TransCode Therapeutics Inc. Common Stock,8.695,8262876.0,17676,Health Care
HSCS,HeartSciences Inc. Common Stock,2.56,8152832.0,29135,Health Care
IMNN,Imunon Inc. Common Stock,1.93,8110088.0,19758,Health Care
BOLT,Bolt Biotherapeutics Inc. Common Stock,4.21,8089797.0,21884,Health Care
SNGX,Soligenix Inc. Common Stock,0.372,8043265.0,427721,Health Care
AEON,AEON Biopharma Inc. Class A Common Stock,0.2997,7884271.0,2031348,Health Care
ERNA,Ernexa Therapeutics Inc. Common Stock,6.73,7849421.0,26059173,Health Care
ASBP,Aspire Biopharma Holdings Inc. Common Stock,6.04,7823213.0,87927,Health Care
LIMN,Liminatus Pharma Inc. Class A Common Stock,0.1145,7689861.0,105483985,Health Care
PMCB,PharmaCyte  Biotech Inc. Common Stock,0.7054,7572927.0,89794,Health Care
WGRX,Wellgistics Health Inc. Common Stock,2.8417,7522543.0,14542,Health Care
ACXP,Acurx Pharmaceuticals Inc. Common Stock,1.75,7521042.0,213796,Health Care
NTRBW,Nutriband Inc. Warrant,0.5999,7292374.0,108,Health Care
CVKD,Cadrenal Therapeutics Inc. Common Stock,2.35,7281691.0,55677,Health Care
NVNO,enVVeno Medical Corporation Common Stock,10.76,7184118.0,6238,Health Care
BCAB,BioAtla Inc. Common Stock,4.26,7069700.0,39148,Health Care
TOIIW,The Oncology Institute Inc. Warrant,0.0697,6968810.0,42752,Health Care
NDRA,ENDRA Life Sciences Inc. Common Stock,5.61,6960613.0,18008,Health Care
HCWB,HCW Biologics Inc. Common Stock,4.3,6866451.0,43205,Health Care
CNSP,CNS Pharmaceuticals Inc. Common Stock,4.68,6839581.0,4173,Health Care
AIDX,20/20 Biolabs Inc. Common Stock,0.5519,6761436.0,59861,Health Care
XBIO,Xenetic Biosciences Inc. Common Stock,2.9,6644062.0,20189,Health Care
PCSA,Processa Pharmaceuticals Inc. Common Stock,2.39,6615596.0,38916,Health Care
ACON,Aclarion Inc. Common Stock,2.66,6549585.0,24996,Health Care
MGRX,Mangoceuticals Inc. Common Stock,0.3746,6430916.0,226152,Health Care
CURX,Curanex Pharmaceuticals Inc Common Stock,0.2153,6106944.0,86872,Health Care
VSEE,VSee Health Inc. Common Stock,0.1055,5874220.0,7203428,Health Care
SNOA,Sonoma Pharmaceuticals Inc. Common Stock,1.22,5838677.0,25161,Health Care
ADIL,Adial Pharmaceuticals Inc Common Stock,2.72,5830649.0,5910,Health Care
VVOS,Vivos Therapeutics Inc. Common Stock,0.4129,5737080.0,88322,Health Care
PULM,Pulmatrix Inc. Common Stock,1.57,5734087.0,11384,Health Care
APVO,Aptevo Therapeutics Inc. Common Stock,4.57,5694700.0,42674,Health Care
LUCY,Innovative Eyewear Inc. Common Stock,0.8727,5588533.0,824231,Health Care
INBS,Intelligent Bio Solutions Inc. Common Stock,2.29,5477327.0,166953,Health Care
GNPX,Genprex Inc. Common Stock,0.4909,5364169.0,378461,Health Care
ENVB,Enveric Biosciences Inc. Common Stock,1.32,5317590.0,44298,Health Care
CDIO,Cardio Diagnostics Holdings Inc. Common stock,1.79,5297450.0,14652,Health Care
DRMA,Dermata Therapeutics Inc. Common Stock,1.3,5228786.0,49174,Health Care
BMRA,Biomerica Inc. Common Stock,1.665,5145298.0,11537,Health Care
FBLG,FibroBiologics Inc. Common Stock,0.8428,5124696.0,26688,Health Care
BGMS,Bio Green Med Solution Inc. Common Stock,0.9054,4997315.0,42764,Health Care
ELAB,PMGC Holdings Inc. Common Stock,1.08,4907251.0,3754657,Health Care
ALZN,Alzamend Neuro Inc. Common Stock,1.23,4679831.0,35400,Health Care
ENSC,Ensysce Biosciences Inc. Common Stock,0.2914,4477515.0,512789,Health Care
REVB,Revelation Biosciences Inc. Common Stock,1.09,4260178.0,106928,Health Care
MBIO,Mustang Bio Inc. Common Stock,0.632,4254700.0,47722,Health Care
LABT,Lakewood-Amedex Biotherapeutics Inc. Common Stock,2.43,4254417.0,976489,Health Care
NXGL,NexGel Inc Common Stock,0.4596,4239921.0,177728,Health Care
SXTP,60 Degrees Pharmaceuticals Inc. Common Stock,1.55,4121896.0,26742,Health Care
XAIR,Beyond Air Inc. Common Stock,5.61,4042179.0,35273,Health Care
ARTL,Artelo Biosciences Inc. Common Stock,1.15,4008371.0,398132,Health Care
ALBT,Avalon GloboCare Corp. Common Stock,0.2727,3961601.0,3185229,Health Care
BIVIW,BioVie Inc. Warrant,0.5,3770920.0,100,Health Care
ESLAW,Estrella Immunopharma Inc. Warrant,0.08,3442738.0,605,Health Care
BIAF,bioAffinity Technologies Inc. Common Stock,0.7224,3426387.0,93716,Health Care
ISPC,iSpecimen Inc. Common Stock,2.23,3394861.0,738415,Health Care
LIMNW,Liminatus Pharma Inc. Warrants,0.05,3358018.0,10474,Health Care
GCTK,GlucoTrack Inc. Common Stock,0.529,3311159.0,63311492,Health Care
DCOY,Decoy Therapeutics Inc. Common Stock,6.18,3287562.0,13080,Health Care
SNYR,Synergy CHC Corp. Common Stock,0.1986,2959117.0,212961,Health Care
GOVX,GeoVax Labs Inc. Common Stock,1.01,2921496.0,335968,Health Care
GRI,GRI Bio Inc. Common Stock,1.62,2868758.0,33890,Health Care
ONCO,Onconetix Inc. Common Stock,0.7737,2856107.0,338059,Health Care
AMIX,Autonomix Medical Inc. Common Stock,5.13,2787139.0,51058,Health Care
FEED,ENvue Medical Inc. Common Stock,0.4245,2585986.0,217052,Health Care
OGEN,Oragenics Inc. Common Stock,0.56,2526696.0,20145,Health Care
TNON,Tenon Medical Inc. Common Stock,0.2018,2391264.0,651172,Health Care
COCHW,Envoy Medical Inc Warrant,0.03,2306433.0,391,Health Care
XXII,22nd Century Group Inc. Common Stock,4.34,2240864.0,5823,Health Care
BBLG,Bone Biologics Corp Common Stock,1.24,2226122.0,32101,Health Care
VIVS,VivoSim Labs Inc. Common Stock,0.8529,2224331.0,114828584,Health Care
MTNB,Matinas Biopharma Holdings Inc. Common Stock,0.3407,2182589.0,2165775,Health Care
SHPH,Shuttle Pharmaceuticals Holdings Inc. Common Stock,3.65,2135721.0,938927,Health Care
BFRGW,Bullfrog AI Holdings Inc. Warrants,0.1147,2126727.0,421,Health Care
HUMAW,Humacyte Inc. Warrant,0.0091,2020374.0,3130,Health Care
IVF,INVO Fertility Inc. Common Stock,1.13,2018220.0,101309,Health Care
VBIO,Valion Bio Inc. Common Stock,0.451,1872218.0,117438,Health Care
BEATW,Heartbeam Inc. Warrant,0.0327,1815074.0,5190,Health Care
AEMD,Aethlon Medical Inc. Common Stock,0.6875,1810573.0,95404,Health Care
OSRHW,OSR Health Inc. Warrant,0.0499,1752423.0,808,Health Care
CDT,CDT Equity Inc. Common Stock,0.351,1705281.0,191433,Health Care
SCLXW,Scilex Holding Company Warrant,0.2,1698253.0,1591,Health Care
BJDX,Bluejay Diagnostics Inc. Common Stock,1.35,1396865.0,4262298,Health Care
SABSW,SAB Biotherapeutics Inc. Warrant,0.0179,1368707.0,48217,Health Care
NUWE,Nuwellis Inc. Common Stock,3.12,1136600.0,392756,Health Care
VSEEW,VSee Health Inc. Warrant,0.0201,1119164.0,13210,Health Care
SKYAW,SkyAI Inc. Warrant,0.024,1015732.0,41713,Health Care
PFSA,Profusa Inc. Common Stock,1.89,1001700.0,170457,Health Care
LUCYW,Innovative Eyewear Inc. Series A Warrants 8/16/27,0.06,384224.0,1885,Health Care
BIAFW,bioAffinity Technologies Inc. Warrant,0.081,384188.0,103,Health Care
BFRIW,Biofrontera Inc. Warrants,0.0294,376418.0,6,Health Care
RCKTW,Rocket Pharmaceuticals Inc. Warrant,0.0029,316661.0,8257,Health Care
NXGLW,NexGel Inc Warrant,0.0319,294285.0,847,Health Care
CINGW,Cingulate Inc. Warrants,0.0201,270728.0,23230,Health Care
KTTAW,Pasithea Therapeutics Corp. Warrant,0.0071,237243.0,183,Health Care
HSCSW,HeartSciences Inc. Warrant,0.0733,233439.0,1201,Health Care
TVGNW,Tevogen Bio Holdings Inc. Warrant,0.0547,230798.0,263091,Health Care
TNONW,Tenon Medical Inc. Warrant,0.01,118497.0,600,Health Care
ERNAW,Ernexa Therapeutics Inc. Warrants,0.0851,99255.0,50314,Health Care
PIIIW,P3 Health Partners Inc. Warrant,0.0116,84042.0,38618,Health Care
SXTPW,60 Degrees Pharmaceuticals Inc. Warrant,0.0298,79247.0,2009,Health Care
SRZNW,Surrozen Inc. Warrant,0.006,69662.0,148042,Health Care
DRMAW,Dermata Therapeutics Inc. Warrant,0.0118,47461.0,5200,Health Care
CDIOW,Cardio Diagnostics Holdings Inc. Warrant,0.0152,44984.0,28457,Health Care
REVBW,Revelation Biosciences Inc. Warrant,0.0096,37521.0,4546,Health Care
APLMW,Apollomics Inc. Warrant,0.0168,36894.0,200280,Health Care
ASBPW,Aspire Biopharma Holdings Inc. Warrant,0.0243,31474.0,2101,Health Care
CELUW,Celularity Inc. Warrant,0.0003,8684.0,662558,Health Care
BKHAR,Black Hawk Acquisition Corporation Rights,1.64,0.0,3838,Health Care
BKHA,Black Hawk Acquisition Corporation Class A Ordinary Shares,11.96,0.0,164,Health Care
BLUWU,Blue Water Acquisition Corp. III Unit.,10.5,0.0,12,Health Care
EMIS,Emmis Acquisition Corp. Class A Ordinary Shares,10.18,0.0,6,Health Care
IPEX,Inflection Point Acquisition Corp. V Class A Ordinary Shares,10.54,,1051,Health Care
