symbol,name,price,marketCap,volume,industry
NNVC,NanoViricides Inc. Common Stock,1.42,30664900.0,191302,Health Care
IGC,IGC Pharma Inc. Common Stock,0.3191,30575531.0,298671,Health Care
HOWL,Werewolf Therapeutics Inc. Common Stock,0.62,30130027.0,617689,Health Care
QCLS,Q/C Technologies Inc. Common Stock,3.76,29528893.0,278725,Health Care
LSTA,Lisata Therapeutics Inc. Common Stock,3.23,29174300.0,52707,Health Care
CCEL,Cryo-Cell International Inc. Common Stock,3.58,28837437.0,7144,Health Care
NEUP,Neuphoria Therapeutics Inc. Common Stock,5.34,28787379.0,22222,Health Care
KYNB,Kyntra Bio Inc. Common Stock,7.1,28741595.0,11880,Health Care
TPST,Tempest Therapeutics Inc. Common Stock,1.97,28257747.0,81367,Health Care
ABVC,ABVC BioPharma Inc. Common Stock,1.1,27984448.0,73590,Health Care
AIXC,AIxCrypto Holdings Inc. Common Stock,1.38,27924290.0,25376,Health Care
GRMLW,Greenland Mines Ltd Warrant,0.23,27884892.0,43276,Health Care
MOVE,Corvex Inc. Common Stock,13.85,27437501.0,52412,Health Care
DYAI,Dyadic International Inc. Common Stock,0.745,27146834.0,9731,Health Care
FEMY,Femasys Inc. Common Stock,0.4491,27121457.0,266407,Health Care
MDAIW,Spectral AI Inc. Warrants,0.8497,27040840.0,13688,Health Care
AYTU,Aytu BioPharma Inc.  Common Stock,2.47,26511024.0,94589,Health Care
CELU,Celularity Inc. Class A Common Stock,0.9075,26268460.0,67515,Health Care
PIII,P3 Health Partners Inc. Class A Common Stock,3.58,25909942.0,74935,Health Care
JSPR,Jasper Therapeutics Inc. Common Stock,0.9084,25432310.0,154751,Health Care
MRKR,Marker Therapeutics Inc. Common Stock,1.44,24009303.0,60827,Health Care
AEON,AEON Biopharma Inc. Class A Common Stock,0.91,23939562.0,23961,Health Care
TXMD,TherapeuticsMD Inc. Common Stock,2.01,23264468.0,12552,Health Care
VTGN,Vistagen Therapeutics Inc. Common Stock,0.5868,23249202.0,317577,Health Care
ALLR,Allarity Therapeutics Inc. Common Stock,1.5,23191086.0,246557,Health Care
CRIS,Curis Inc. Common Stock,0.577,23067706.0,117703,Health Care
LTRN,Lantern Pharma Inc. Common Stock,2.04,22959582.0,104268,Health Care
OSRH,OSR Holdings Inc. Common Stock,0.6911,22892518.0,8288067,Health Care
OTLK,Outlook Therapeutics Inc. Common Stock,0.2157,22565287.0,7298575,Health Care
VYNE,VYNE Therapeutics Inc. Common Stock,0.6735,22463150.0,229643,Health Care
MODD,Modular Medical Inc. Common Stock,3.95,21374149.0,11637,Health Care
XCUR,Exicure Inc. Common Stock,3.35,21352615.0,6112,Health Care
QNCX,Quince Therapeutics Inc. Common Stock,1.3,21191032.0,921237,Health Care
ADGM,Adagio Medical Holdings Inc Common Stock,0.953,21166567.0,35243,Health Care
RVP,Retractable Technologies Inc. Common Stock,0.7049,21102703.0,122488,Health Care
KTTA,Pasithea Therapeutics Corp. Common Stock,0.84,20949556.0,124806,Health Care
LGVN,Longeveron Inc. Class A Common Stock,0.8518,19819473.0,206673,Health Care
ICU,SeaStar Medical Holding Corporation Common Stock,4.86,19425430.0,80533,Health Care
COCP,Cocrystal Pharma Inc. Common Stock,1.39,19162205.0,103467,Health Care
NTRBW,Nutriband Inc. Warrant,1.525,18537874.0,1,Health Care
CVKD,Cadrenal Therapeutics Inc. Common Stock,6.02,18531047.0,55440,Health Care
COSM,Cosmos Health Inc. Common Stock,0.35,18415987.0,293657,Health Care
IRIX,IRIDEX Corporation Common Stock,1.03,17917211.0,7013,Health Care
LPCN,Lipocine Inc. Common Stock,2.39,17865525.0,71228,Health Care
GRDX,GridAI Technologies Corp. Common Stock,2.85,17670145.0,248476,Health Care
TRAW,Traws Pharma Inc. Common Stock,1.7,17267337.0,139119,Health Care
SCNX,Scienture Holdings Inc. Common Stock,0.4249,17264033.0,2087313,Health Care
NAII,Natural Alternatives International Inc. Common Stock,2.74,16924372.0,5228,Health Care
TOVX,Theriva Biologics Inc. Common Stock,0.36,16521360.0,2226098,Health Care
INAB,IN8bio Inc. Common Stock,1.6,15755342.0,45655,Health Care
HUMAW,Humacyte Inc. Warrant,0.07,15541338.0,13208,Health Care
HIND,Vyome Holdings Inc. Common Stock,2.1,14738909.0,6123,Health Care
AIDX,20/20 Biolabs Inc. Common Stock,1.38,14462523.0,46759,Health Care
CTXR,Citius Pharmaceuticals Inc. Common Stock,0.6541,14314024.0,630134,Health Care
CLRB,Cellectar Biosciences Inc.  Common Stock,3.3,13992426.0,606263,Health Care
GTBP,GT Biopharma Inc. Common Stock,0.3895,13874915.0,594691,Health Care
BFRI,Biofrontera Inc. Common Stock,1.14,13688616.0,148539,Health Care
CYCN,Cyclerion Therapeutics Inc. Common Stock,3.15,13640489.0,86868,Health Care
CVM,Cel-Sci Corporation Common Stock,1.6,13588443.0,748691,Health Care
INTS,Intensity Therapeutics Inc. Common stock,5.11,13321652.0,28505,Health Care
MBRX,Moleculin Biotech Inc. Common Stock,2.49,13287512.0,70399,Health Care
HOTH,Hoth Therapeutics Inc. Common Stock,0.694,13274584.0,173527,Health Care
AMS,American Shared Hospital Services Common Stock,2.01,13270020.0,604789,Health Care
PHIO,Phio Pharmaceuticals Corp. Common Stock,1.14,13243665.0,99563,Health Care
PASG,Passage Bio Inc. Common Stock,4.08,13087865.0,57270,Health Care
AIMD,Ainos Inc. Common Stock,1.745,12679189.0,5186,Health Care
JUNS,Jupiter Neurosciences Inc. Common Stock,0.344,12480751.0,60332,Health Care
LNAI,Lunai Bioworks Inc. Common Stock,0.333,12078283.0,2331139,Health Care
BFRG,Bullfrog AI Holdings Inc. Common Stock,0.6497,12039503.0,297404,Health Care
BCDA,BioCardia Inc. Common Stock,1.09,11925005.0,84174,Health Care
BIVI,BioVie Inc. Class A Common Stock,1.54,11617099.0,169689,Health Care
WGRX,Wellgistics Health Inc. Common Stock,0.0883,11183493.0,2031186,Health Care
RVPH,Reviva Pharmaceuticals Holdings Inc. Common Stock ,0.8624,11047669.0,206125,Health Care
APRE,Aprea Therapeutics Inc. Common stock,0.8807,10905511.0,313867,Health Care
IMNN,Imunon Inc. Common Stock,2.73,10874524.0,37145,Health Care
OABIW,OmniAb Inc. Warrant,0.075,10872943.0,1020,Health Care
KPRX,Kiora Pharmaceuticals Inc.  Common Stock,2.45,10859478.0,151917,Health Care
NOTV,Inotiv Inc. Common Stock,0.2942,10119000.0,285001,Health Care
CDT,CDT Equity Inc. Common Stock,2.08,10105368.0,50263,Health Care
CALC,CalciMedica Inc. Common Stock,0.6354,10003684.0,266881,Health Care
SINT,SiNtx Technologies Inc. Common Stock,2.39,9850928.0,10492,Health Care
ELAB,PMGC Holdings Inc. Common Stock,2.16,9613182.0,641682,Health Care
BIAF,bioAffinity Technologies Inc. Common Stock,2.12,9537191.0,285612,Health Care
ERNA,Ernexa Therapeutics Inc. Common Stock,7.82,9119504.0,10200039,Health Care
ACXP,Acurx Pharmaceuticals Inc. Common Stock,2.12,9070403.0,76081,Health Care
VVOS,Vivos Therapeutics Inc. Common Stock,0.6636,9034469.0,176793,Health Care
MTEX,Mannatech Incorporated Common Stock,4.67,9011559.0,4458,Health Care
GNPX,Genprex Inc. Common Stock,0.865,9011051.0,360592,Health Care
CURX,Curanex Pharmaceuticals Inc Common Stock,0.3156,8951935.0,144766,Health Care
BOLT,Bolt Biotherapeutics Inc. Common Stock,4.59,8819993.0,24597,Health Care
PMCB,PharmaCyte  Biotech Inc. Common Stock,0.8,8588519.0,92947,Health Care
TNON,Tenon Medical Inc. Common Stock,0.7501,8473413.0,30720,Health Care
VSEE,VSee Health Inc. Common Stock,0.1731,8187530.0,794040,Health Care
HWH,HWH International Inc. Common Stock,1.09,8149276.0,26308,Health Care
ACON,Aclarion Inc. Common Stock,3.16,7780710.0,45945,Health Care
PCSA,Processa Pharmaceuticals Inc. Common Stock,2.87,7634312.0,25702,Health Care
BCAB,BioAtla Inc. Common Stock,4.35,7207628.0,10339,Health Care
XBIO,Xenetic Biosciences Inc. Common Stock,3.12,7148095.0,11335,Health Care
NXL,Nexalin Technology Inc. Common Stock,0.344,7080086.0,71736,Health Care
RNAZ,TransCode Therapeutics Inc. Common Stock,7.65,7014805.0,10765,Health Care
CODX,Co-Diagnostics Inc. Common Stock,1.93,6952757.0,363486,Health Care
MTVA,MetaVia Inc. Common Stock,1.33,6868612.0,126864,Health Care
BMRA,Biomerica Inc. Common Stock,2.195,6783140.0,13070,Health Care
NVNO,enVVeno Medical Corporation Common Stock,10.22,6699425.0,4141,Health Care
LUCY,Innovative Eyewear Inc. Common Stock,1.05,6615694.0,52564,Health Care
FBLG,FibroBiologics Inc. Common Stock,1.24,6459055.0,130086,Health Care
TCRT,Alaunos Therapeutics Inc. Common Stock,2.6669,6342563.0,3459,Health Care
XAIR,Beyond Air Inc. Common Stock,0.4972,6310802.0,355756,Health Care
ENVB,Enveric Biosciences Inc. Common Stock,3.17,6294146.0,367036,Health Care
HSCS,HeartSciences Inc. Common Stock,1.94,6178318.0,14691,Health Care
NDRA,ENDRA Life Sciences Inc. Common Stock,4.95,6141717.0,8425,Health Care
SNYR,Synergy CHC Corp. Common Stock,0.3956,5894394.0,2215767,Health Care
ESLAW,Estrella Immunopharma Inc. Warrant,0.1375,5866469.0,3576,Health Care
ARTL,Artelo Biosciences Inc. Common Stock,2.68,5849207.0,104607,Health Care
MGRX,Mangoceuticals Inc. Common Stock,0.3401,5770620.0,275594,Health Care
CNSP,CNS Pharmaceuticals Inc. Common Stock,7.1,5761288.0,249590,Health Care
APVO,Aptevo Therapeutics Inc. Common Stock,4.86,5743184.0,28723,Health Care
BRTX,BioRestorative Therapies Inc. Common Stock (NV),0.225,5732588.0,1310405,Health Care
CAPS,Capstone Holding Corp. Common Stock,0.38,5485644.0,204022,Health Care
CDIO,Cardio Diagnostics Holdings Inc. Common stock,1.81,5356639.0,44811,Health Care
DRMA,Dermata Therapeutics Inc. Common Stock,1.3,5228786.0,33940,Health Care
NXGL,NexGel Inc Common Stock,0.615,5212551.0,230828,Health Care
GOVX,GeoVax Labs Inc. Common Stock,1.76,5090923.0,903910,Health Care
COCHW,Envoy Medical Inc Warrant,0.065,4997272.0,12890,Health Care
MBIO,Mustang Bio Inc. Common Stock,0.727,4894251.0,21153,Health Care
FEED,ENvue Medical Inc. Common Stock,1.32,4885199.0,2593483,Health Care
PULM,Pulmatrix Inc. Common Stock,1.3,4747971.0,11413,Health Care
BEATW,Heartbeam Inc. Warrant,0.1152,4733323.0,1637,Health Care
ONCO,Onconetix Inc. Common Stock,0.404,4631687.0,1295902,Health Care
INBS,Intelligent Bio Solutions Inc. Common Stock,2.29,4582686.0,48113,Health Care
INDP,Indaptus Therapeutics Inc. Common Stock,2.03,4551918.0,93356,Health Care
AMIX,Autonomix Medical Inc. Common Stock,0.3824,4362933.0,152384,Health Care
SXTP,60 Degrees Pharmaceuticals Inc. Common Stock,1.58,4166125.0,54749,Health Care
MTNB,Matinas Biopharma Holdings Inc. Common Stock,0.645,4131993.0,16735,Health Care
ALZN,Alzamend Neuro Inc. Common Stock,1.06,4033025.0,37854,Health Care
SHPH,Shuttle Pharmaceuticals Holdings Inc. Common Stock,0.7059,3946892.0,548506,Health Care
ISPC,iSpecimen Inc. Common Stock,5.29,3922831.0,280222,Health Care
REVB,Revelation Biosciences Inc. Common Stock,1.02,3794828.0,55080,Health Care
TOIIW,The Oncology Institute Inc. Warrant,0.0375,3749360.0,681,Health Care
BFRGW,Bullfrog AI Holdings Inc. Warrants,0.2,3706173.0,38,Health Care
VIVS,VivoSim Labs Inc. Common Stock,1.41,3677226.0,50505,Health Care
ENSC,Ensysce Biosciences Inc. Common Stock,0.37,3432793.0,226194,Health Care
ALBT,Avalon GloboCare Corp. Common Stock,0.405,3371062.0,113023,Health Care
VBIO,Valion Bio Inc. Common Stock,1.04,3264659.0,47790,Health Care
GRI,GRI Bio Inc. Common Stock,2.25,3251315.0,13367,Health Care
SNGX,Soligenix Inc. Common Stock,0.3082,3176334.0,688250,Health Care
XXII,22nd Century Group Inc. Common Stock,0.7117,3171085.0,1553289,Health Care
DCOY,Decoy Therapeutics Inc. Common Stock,5.74,3053496.0,2187,Health Care
AEMD,Aethlon Medical Inc. Common Stock,2.3,3024753.0,44163,Health Care
NUWE,Nuwellis Inc. Common Stock,1.1,2899290.0,30270,Health Care
OGEN,Oragenics Inc. Common Stock,0.613,2657986.0,56615,Health Care
IVF,INVO Fertility Inc. Common Stock,1.82,2533839.0,19242,Health Care
VSEEW,VSee Health Inc. Warrant,0.0525,2483220.0,97,Health Care
OSRHW,OSR Holdings Inc. Warrant,0.0746,2471107.0,36463,Health Care
BBLG,Bone Biologics Corp Common Stock,1.29,2315885.0,15922,Health Care
BIVIW,BioVie Inc. Warrant,0.3,2263071.0,7374,Health Care
PFSA,Profusa Inc. Common Stock,0.49,2161031.0,127014,Health Care
HCWB,HCW Biologics Inc. Common Stock,0.3203,2156934.0,458544,Health Care
SNOA,Sonoma Pharmaceuticals Inc. Common Stock,1.18,2150949.0,91941,Health Care
MEHA,Functional Brands Inc. Common Stock,0.0945,2070766.0,1573107,Health Care
ADIL,Adial Pharmaceuticals Inc Common Stock,1.42,2027717.0,201478,Health Care
BJDX,Bluejay Diagnostics Inc. Common Stock,1.82,1883181.0,25689,Health Care
GCTK,GlucoTrack Inc. Common Stock,0.86,1672080.0,3669108,Health Care
SABSW,SAB Biotherapeutics Inc. Warrant,0.0307,1564197.0,101808,Health Care
SCLXW,Scilex Holding Company Warrant,0.18,1528428.0,4143,Health Care
BIAFW,bioAffinity Technologies Inc. Warrant,0.2782,1251531.0,340,Health Care
RCKTW,Rocket Pharmaceuticals Inc. Warrant,0.01,1091228.0,1000,Health Care
ASBP,Aspire Biopharma Holdings Inc. Common Stock,0.155,778742.0,161049599,Health Care
AIMDW,Ainos Inc. Warrants,0.0681,494815.0,1312,Health Care
TALKW,Talkspace Inc. Warrant,0.0029,484520.0,60,Health Care
BFRIW,Biofrontera Inc. Warrants,0.0398,477901.0,111393,Health Care
JSPRW,Japer Therapeutics Inc. Warrants,0.015,419952.0,9489,Health Care
NRXPW,NRX Pharmaceuticals Inc. Warrant,0.0091,300915.0,24591,Health Care
LUCYW,Innovative Eyewear Inc. Series A Warrants 8/16/27,0.0448,282270.0,24,Health Care
CELUW,Celularity Inc. Warrant,0.0078,225778.0,66500,Health Care
CINGW,Cingulate Inc. Warrants,0.017,208260.0,10000,Health Care
HSCSW,HeartSciences Inc. Warrant,0.0606,192993.0,101,Health Care
TVGNW,Tevogen Bio Holdings Inc. Warrant,0.0347,144498.0,20734,Health Care
SXTPW,60 Degrees Pharmaceuticals Inc. Warrant,0.046,121292.0,499,Health Care
ADTX,Aditxt Inc. Common Stock,0.1166,105461.0,2678490,Health Care
ACONW,Aclarion Inc. Warrant,0.0333,81993.0,600,Health Care
ICUCW,SeaStar Medical Holding Corporation Warrant,0.0199,79540.0,34061,Health Care
ASBPW,Aspire Biopharma Holdings Inc. Warrant,0.0152,76367.0,6214,Health Care
CDTTW,CDT Equity Inc. Warrant,0.0124,60244.0,20235,Health Care
DRMAW,Dermata Therapeutics Inc. Warrant,0.0143,57517.0,10658,Health Care
CDIOW,Cardio Diagnostics Holdings Inc. Warrant,0.0137,40545.0,32266,Health Care
APLMW,Apollomics Inc. Warrant,0.0175,38431.0,83686,Health Care
PIIIW,P3 Health Partners Inc. Warrant,0.005,36187.0,27257,Health Care
REVBW,Revelation Biosciences Inc. Warrant,0.0089,33112.0,4423,Health Care
BKHAR,Black Hawk Acquisition Corporation Rights,1.4,0.0,6627,Health Care
BKHA,Black Hawk Acquisition Corporation Class A Ordinary Shares,11.86,0.0,1823,Health Care
CMIIU,Columbus Circle Capital Corp II Unit,9.99,0.0,297,Health Care
EMIS,Emmis Acquisition Corp. Class A Ordinary Shares,10.1,0.0,4,Health Care
IPEX,Inflection Point Acquisition Corp. V Class A Ordinary Shares,10.45,,145,Health Care
