symbol,name,price,marketCap,volume,industry
PACB,Pacific Biosciences of California Inc. Common Stock,1.58,490750667.0,8207805,Industrials
TWI,Titan International Inc. (DE) Common Stock,7.3,469915308.0,577632,Industrials
PKOH,Park-Ohio Holdings Corp. Common Stock,32.5,467940493.0,55289,Industrials
LAB,Standard BioTools Inc. Common Stock,1.15,448923337.0,2375621,Industrials
GEVO,Gevo Inc. Common Stock,1.84,447876845.0,3752976,Industrials
CMCO,Columbus McKinnon Corporation Common Stock,15.57,447471929.0,277790,Industrials
ALTO,Alto Ingredients Inc. Common Stock,5.71,442440224.0,3810502,Industrials
FSTR,L.B. Foster Company Common Stock,41.35,432466418.0,107733,Industrials
ULH,Universal Logistics Holdings Inc. Common Stock,16.2,427188994.0,58447,Industrials
GTN,Gray Media Inc. Common Stock,4.07,418145512.0,1259904,Industrials
MTW,Manitowoc Company Inc. (The) Common Stock,11.6,416551174.0,316660,Industrials
RLGT,Radiant Logistics Inc. Common Stock,8.55,400410744.0,282670,Industrials
MCFT,MasterCraft Boat Holdings Inc. Common Stock,23.22,378019046.0,116846,Industrials
AIRJ,AirJoule Technologies Corporation Class A Common Stock,5.2,356058248.0,3955806,Industrials
NAUT,Nautilus Biotechnology Inc. Common Stock,2.77,352008428.0,484382,Industrials
FWDI,Forward Industries Inc. Common Stock,4.66,348007397.0,870517,Industrials
CHSCP,CHS Inc. 8%  Cumulative Redeemable Preferred Stock,27.7,339934483.0,6849,Industrials
MSB,Mesabi Trust Common Stock,25.83,338889858.0,39004,Industrials
FWRD,Forward Air Corporation Common Stock,10.46,330797981.0,801882,Industrials
MASS,908 Devices Inc. Common Stock,8.63,326331549.0,384604,Industrials
CHSCO,CHS Inc. Class B Cumulative Redeemable Preferred Stock,26.24,322017359.0,14493,Industrials
CHSCL,CHS Inc Class B Cumulative Redeemable Preferred Stock Series 4,25.87,317476718.0,13882,Industrials
SSP,E.W. Scripps Company (The) Class A Common Stock,3.44,314900435.0,409190,Industrials
WNC,Wabash National Corporation Common Stock,7.64,310749108.0,550734,Industrials
LODE,Comstock Inc. Common Stock,4.09,310484514.0,1475985,Industrials
CHSCN,CHS Inc Preferred Class B Series 2 Reset Rate,25.12,308272715.0,26297,Industrials
CHSCM,CHS Inc Class B Reset Rate Cumulative Redeemable Preferred Stock Series 3,24.99,306677355.0,15277,Industrials
OFLX,Omega Flex Inc. Common Stock,29.9,301820228.0,23477,Industrials
AIRO,AIRO Group Holdings Inc. Common Stock,9.23,290243294.0,840956,Industrials
PAMT,PAMT CORP Common Stock,13.71,287131779.0,24122,Industrials
ESOA,Energy Services of America Corporation Common Stock,15.11,281947750.0,240329,Industrials
TG,Tredegar Corporation Common Stock,7.75,271380347.0,166645,Industrials
QSI,Quantum-Si Incorporated Class A Common Stock,1.18,256956992.0,7407321,Industrials
PPIH,Perma-Pipe International Holdings Inc. Common Stock,31.07,252390092.0,77511,Industrials
POWW,Outdoor Holding Company Common Stock,2.1,246306316.0,379508,Industrials
TWIN,Twin Disc Incorporated Common Stock,16.89,243601548.0,67576,Industrials
CDXS,Codexis Inc. Common Stock,2.67,242693834.0,482001,Industrials
AP,Ampco-Pittsburgh Corporation Common Stock,11.22,228062085.0,78956,Industrials
VATE,INNOVATE Corp. Common Stock,15.89,216769251.0,89321,Industrials
GENC,Gencor Industries Inc. Common Stock,14.32,209898293.0,114675,Industrials
ALTG,Alta Equipment Group Inc. Class A Common Stock,6.44,209528878.0,273809,Industrials
CMT,Core Molding Technologies Inc Common Stock,23.35,207808672.0,31402,Industrials
INTT,inTest Corporation Common Stock,16.37,205683435.0,296025,Industrials
TGEN,Tecogen Inc. Common Stock,6.86,205237151.0,516921,Industrials
SND,Smart Sand Inc. Common Stock,4.77,205041698.0,488413,Industrials
AMTX,Aemetis Inc. (DE) Common Stock,2.64,185767499.0,1419669,Industrials
FF,FutureFuel Corp.  Common shares,4.18,183349459.0,220563,Industrials
PESI,Perma-Fix Environmental Services Inc. Common Stock,9.81,182118540.0,268408,Industrials
MNTS,Momentus Inc. Class A Common Stock,16.71,176249611.0,5637189,Industrials
SMID,Smith-Midland Corporation Common Stock,32.43,172091546.0,6234,Industrials
TAYD,Taylor Devices Inc. Common Stock,53.08,170870465.0,17448,Industrials
FRD,Friedman Industries Inc. Common Stock,23.77,169056566.0,26175,Industrials
NNBR,NN Inc. Common Stock,3.13,165181093.0,865530,Industrials
QTRX,Quanterix Corporation Common Stock,3.5,164870934.0,2037787,Industrials
SAFX,XCF Global Inc. Class A Common Stock,0.49,162956108.0,4601656,Industrials
OWLT,Owlet Inc. Class A Common Stock,5.49,159216412.0,291635,Industrials
CODA,Coda Octopus Group Inc. Common stock,13.18,148619683.0,222322,Industrials
RAIL,FreightCar America Inc. Common Stock,7.64,146208269.0,165590,Industrials
HOVR,New Horizon Aircraft Ltd. Class A Ordinary Share,2.53,142634534.0,6860688,Industrials
BNC,CEA Industries Inc. Common Stock,3.27,140269400.0,416033,Industrials
FORR,Forrester Research Inc. Common Stock,7.22,140154640.0,53271,Industrials
BOOM,DMC Global Inc. Common Stock,6.78,138778511.0,212337,Industrials
SHIM,Shimmick Corporation Common Stock,3.68,135043709.0,119552,Industrials
ATLX,Atlas Lithium Corporation Common Stock,4.4,129759903.0,815428,Industrials
BAER,Bridger Aerospace Group Holdings Inc. Common Stock,2.22,127955563.0,811159,Industrials
SIF,SIFCO Industries Inc. Common Stock,20.14,125958138.0,103482,Industrials
FFAI,Faraday Future Intelligent Electric Inc. Class A Common Stock,0.4023,122260638.0,48979254,Industrials
ACNT,Ascent Industries Co. Common Stock,13.42,121292845.0,88641,Industrials
OCC,Optical Cable Corporation Common Stock,13.64,120462997.0,334296,Industrials
ARQ,Arq Inc. Common Stock,2.79,119764260.0,404204,Industrials
KEQU,Kewaunee Scientific Corporation Common Stock,40.75,116805148.0,2938,Industrials
CBUS,Cibus Inc. Class A Common Stock,1.47,112207502.0,275677,Industrials
ATLN,Atlantic International Corp. Common Stock,1.46,111291141.0,191956,Industrials
HURC,Hurco Companies Inc. Common Stock,17.22,111007938.0,51491,Industrials
GEOS,Geospace Technologies Corporation Common Stock (Texas),8.43,109047133.0,105967,Industrials
SEER,Seer Inc. Class A Common Stock,1.88,103365316.0,115733,Industrials
RPID,Rapid Micro Biosystems Inc. Class A Common Stock,1.97,90953328.0,80168,Industrials
AVD,American Vanguard Corporation Common Stock ($0.10 Par Value),2.6,89035908.0,305046,Industrials
SEV,Aptera Motors Corp. Class B Common Stock,2.31,85224676.0,217642,Industrials
AIRJW,AirJoule Technologies Corporation Warrant,1.2,82167288.0,1244969,Industrials
SYPR,Sypris Solutions Inc. Common Stock,3.39,78007731.0,151058,Industrials
NTIC,Northern Technologies International Corporation Common Stock,8.06,76505528.0,9244,Industrials
WRAP,Wrap Technologies Inc. Common Stock,1.35,75246638.0,107802,Industrials
FEAM,5E Advanced Materials Inc. Common Stock,1.79,74312249.0,161743,Industrials
VGAS,Verde Clean Fuels Inc. Class A Common Stock,1.58,70388401.0,5558,Industrials
SLND,Southland Holdings Inc. Common Stock,1.28,69400169.0,62911,Industrials
UAVS,AgEagle Aerial Systems Inc. Common Stock,1.16,67972659.0,4069346,Industrials
CVU,CPI Aerostructures Inc. Common Stock,5.11,67501409.0,137945,Industrials
ASTC,Astrotech Corporation (DE) Common Stock,35.4,62266936.0,6167480,Industrials
LNZA,LanzaTech Global Inc. Common Stock,6.06,61140328.0,67021,Industrials
CHRN,ChronoScale Corporation Common Stock,16.97,60470576.0,261520,Industrials
MIND,MIND Technology Inc. Common Stock (DE),6.47,58806186.0,127428,Industrials
PPSI,Pioneer Power Solutions Inc. Common Stock,4.68,51930525.0,574065,Industrials
FTEK,Fuel Tech Inc. Common Stock,1.48,46124569.0,206087,Industrials
WKHS,Workhorse Group Inc. Common Stock,3.75,40850250.0,148223,Industrials
PRPO,Precipio Inc.  Common Stock,22.53,40269491.0,23944,Industrials
DAIO,Data I/O Corporation Common Stock,4.26,40020238.0,344151,Industrials
TPCS,TechPrecision Corporation Common stock,3.95,39544761.0,7979,Industrials
HBIO,Harvard Bioscience Inc. Common Stock,6.4,28865165.0,75139,Industrials
HOVRW,New Horizon Aircraft Ltd. Warrant,0.495,27906757.0,155566,Industrials
ELSE,Electro-Sensors Inc. Common Stock,7.67,27093684.0,1850,Industrials
TOMZ,TOMI Environmental Solutions Inc. Common Stock,1.06,24486493.0,775787,Industrials
CLIR,ClearSign Technologies Corporation Common Stock (DE),4.47,24194470.0,7948,Industrials
SDST,Stardust Power Inc. Common Stock,2.22,23486994.0,127732,Industrials
BAERW,Bridger Aerospace Group Holdings Inc. Warrant,0.3601,20755315.0,2348,Industrials
AIRI,Air Industries Group Common Stock,3.02,14648987.0,38345,Industrials
BNGO,Bionano Genomics Inc. Common Stock,1.25,14343750.0,122132,Industrials
AQMS,Aqua Metals Inc. Common Stock,4.05,13616124.0,59242,Industrials
ARTW,Art's-Way Manufacturing Co. Inc. Common Stock,2.57,13316162.0,11898,Industrials
SKYQ,Sky Quarry Inc. Common Stock,2.41,11555097.0,685418,Industrials
FGI,FGI Industries Ltd. Ordinary Shares,5.83,11259310.0,31693,Industrials
KITT,Nauticus Robotics Inc. Common stock,2.0,10005850.0,972835,Industrials
YHGJ,Yunhong Green CTI Ltd. Common Stock,3.68,9602018.0,6632,Industrials
CVR,Chicago Rivet & Machine Co. Common Stock,9.75,9419787.0,6409,Industrials
SNES,SenesTech Inc. Common Stock,1.69,8962790.0,37546,Industrials
ETS,Elite Express Holding Inc. Class A Common Stock,0.534,8926703.0,43227,Industrials
ORGN,Origin Materials Inc. Common Stock,1.4,7703878.0,61757,Industrials
GDC,GD Culture Group Limited Common Stock,0.126,7655724.0,55097745,Industrials
QSIAW,Quantum-Si Incorporated Warrant,0.0291,6336821.0,140688,Industrials
INHD,Inno Holdings Inc. Common Stock,1.32,5967321.0,76771,Industrials
BNCWZ,CEA Industries Inc. Warrant,0.118,5061709.0,563,Industrials
VEEE,Twin Vee PowerCats Co. Common Stock,6.9,3652377.0,19279,Industrials
FFAIW,Faraday Future Intelligent Electric Inc. Warrant,0.0117,3555679.0,1028933,Industrials
NVVE,Nuvve Holding Corp. Common Stock,0.365,3446962.0,271770,Industrials
FLYE,Fly-E Group Inc. Common Stock,1.9,3101533.0,14044,Industrials
GWAV,Greenwave Technology Solutions Inc. Common Stock,3.73,3094524.0,7889,Industrials
SGLY,Singularity Future Technology Ltd. Common Stock,0.3901,2845191.0,66715,Industrials
FCUV,Focus Universal Inc. Common Stock,0.8295,1716883.0,257749,Industrials
SDSTW,Stardust Power Inc. Warrant,0.13,1375365.0,1046,Industrials
VGASW,Verde Clean Fuels Inc. Warrant,0.0279,1242934.0,46663,Industrials
MNTSW,Momentus Inc. Warrant,0.0575,606484.0,344266,Industrials
LNZAW,LanzaTech Global Inc. Warrant,0.0146,147302.0,102,Industrials
KITTW,Nauticus Robotics Inc. Warrant,0.0265,132578.0,132196,Industrials
FGIWW,FGI Industries Ltd. Warrant,0.0401,77444.0,68,Industrials
ORGNW,Origin Materials Inc. Warrants,0.0006,3302.0,10450,Industrials
MLAC,Mountain Lake Acquisition Corp. Class A Ordinary Shares,10.62,0.0,29749,Industrials
