symbol,name,price,marketCap,volume,industry
TSLA,Tesla Inc. Common Stock,415.88,1561930443471.0,44939937,Industrials
CAT,Caterpillar Inc. Common Stock,865.36,398616856819.0,2675040,Industrials
RTX,RTX Corporation Common Stock,174.41,234875056677.0,5481982,Industrials
TMO,Thermo Fisher Scientific Inc Common Stock,494.04,183595868569.0,3194697,Industrials
BA,Boeing Company (The) Common Stock,224.3,176816212843.0,6400915,Industrials
UNP,Union Pacific Corporation Common Stock,263.5,156443431626.0,2578710,Industrials
GLW,Corning Incorporated Common Stock,176.7,152074703678.0,10897020,Industrials
HON,Honeywell International Inc. Common Stock,236.54,149884308768.0,5015748,Industrials
DE,Deere & Company Common Stock,542.43,146422157443.0,2214323,Industrials
DHR,Danaher Corporation Common Stock,179.87,127306702678.0,3652710,Industrials
LMT,Lockheed Martin Corporation Common Stock,516.5,119086103532.0,1374648,Industrials
PH,Parker-Hannifin Corporation Common Stock,823.3,103806924064.0,1638618,Industrials
PWR,Quanta Services Inc. Common Stock,687.48,103163351235.0,1193265,Industrials
HWM,Howmet Aerospace Inc. Common Stock,255.52,102235464056.0,2928389,Industrials
ADP,Automatic Data Processing Inc. Common Stock,233.74,94114093641.0,3970307,Industrials
UPS,United Parcel Service Inc. Common Stock,109.02,92667684537.0,6088489,Industrials
GD,General Dynamics Corporation Common Stock,339.2,91729919430.0,854598,Industrials
CMI,Cummins Inc. Common Stock,643.5,88795964615.0,907290,Industrials
CSX,CSX Corporation Common Stock,45.86,85214247936.0,15185125,Industrials
NOC,Northrop Grumman Corporation Common Stock,539.22,76587290929.0,1321750,Industrials
GM,General Motors Company Common Stock,82.68,74549678323.0,7510593,Industrials
RKLB,Rocket Lab Corporation Common Stock,122.39,70847590265.0,37294715,Industrials
ITW,Illinois Tool Works Inc. Common Stock,245.81,70719537000.0,1339072,Industrials
TDG,Transdigm Group Incorporated Common Stock,1238.41,69268708523.0,434045,Industrials
CTAS,Cintas Corporation Common Stock,172.9,69183666725.0,1904438,Industrials
NSC,Norfolk Southern Corporation Common Stock,305.16,68537105345.0,931571,Industrials
BRKRP,Bruker Corporation 6.375% Mandatory Convertible Preferred Stock Series A,434.68,67369151040.0,67290,Industrials
F,Ford Motor Company Common Stock,16.63,66265438437.0,97586548,Industrials
FIX,Comfort Systems USA Inc. Common Stock,1787.88,62937709821.0,479142,Industrials
GWW,W.W. Grainger Inc. Common Stock,1243.03,58687323311.0,227589,Industrials
TER,Teradyne Inc. Common Stock,369.47,57837632594.0,2523399,Industrials
LHX,L3Harris Technologies Inc. Common Stock,309.59,57675053880.0,1060520,Industrials
NUE,Nucor Corporation Common Stock,251.49,57274571516.0,1164836,Industrials
KEYS,Keysight Technologies Inc. Common Stock,330.0,56595823350.0,2397098,Industrials
CARR,Carrier Global Corporation Common Stock ,65.11,54421795157.0,8101688,Industrials
AME,AMETEK Inc.,223.36,51194782527.0,1186259,Industrials
ROK,Rockwell Automation Inc. Common Stock,456.71,50819927075.0,815993,Industrials
ODFL,Old Dominion Freight Line Inc. Common Stock,228.53,47526991714.0,2004441,Industrials
HEI,Heico Corporation Common Stock,333.25,46541454060.0,778052,Industrials
WAB,Westinghouse Air Brake Technologies Corporation Common Stock,256.01,43439097349.0,864501,Industrials
PYPL,PayPal Holdings Inc. Common Stock,45.19,39862347229.0,16237176,Industrials
AXON,Axon Enterprise Inc. Common Stock,476.88,38437518480.0,1477251,Industrials
A,Agilent Technologies Inc. Common Stock,135.98,38428263066.0,2678075,Industrials
STLD,Steel Dynamics Inc.,261.59,37724621382.0,902012,Industrials
WAT,Waters Corporation Common Stock,378.16,37129962927.0,1529476,Industrials
EME,EMCOR Group Inc. Common Stock,830.95,36927649004.0,456723,Industrials
PAYX,Paychex Inc. Common Stock,102.44,36703317850.0,4136347,Industrials
VMC,Vulcan Materials Company (Holding Company) Common Stock,281.56,36533785421.0,1415521,Industrials
MLM,Martin Marietta Materials Inc. Common Stock,570.96,34403884520.0,635945,Industrials
SYM,Symbotic Inc. Class A Common Stock,48.4,29171009846.0,3694885,Industrials
MTZ,MasTec Inc. Common Stock,362.09,28611828942.0,1459418,Industrials
TDY,Teledyne Technologies Incorporated Common Stock,609.47,28236219737.0,372012,Industrials
FOXA,Fox Corporation Class A Common Stock,66.81,28072647705.0,3109778,Industrials
DOV,Dover Corporation Common Stock,207.54,27947629862.0,673628,Industrials
IR,Ingersoll Rand Inc. Common Stock,70.96,27769261741.0,3493603,Industrials
JBHT,J.B. Hunt Transport Services Inc. Common Stock,279.46,26352855270.0,899764,Industrials
STRL,Sterling Infrastructure Inc. Common Stock,845.39,25941598652.0,505523,Industrials
XYL,Xylem Inc. Common Stock New,108.33,25749336097.0,2285479,Industrials
FTAI,FTAI Aviation Ltd. Common Stock,247.82,25422112121.0,790357,Industrials
FOX,Fox Corporation Class B Common Stock,59.84,25143949090.0,924621,Industrials
DOW,Dow Inc. Common Stock ,34.69,25002520484.0,10533943,Industrials
ATI,ATI Inc. Common Stock,178.98,24425477024.0,1788837,Industrials
CRS,Carpenter Technology Corporation Common Stock,486.93,24193415051.0,814785,Industrials
VRSK,Verisk Analytics Inc. Common Stock,183.97,24104087905.0,1949216,Industrials
FWONK,Liberty Media Corporation Series C Liberty Formula One Common Stock,91.08,22825167885.0,1118610,Industrials
RL,Ralph Lauren Corporation Common Stock,366.31,21801432703.0,674914,Industrials
NXT,Nextpower Inc. Class A Common Stock,145.02,21792803929.0,2507640,Industrials
MKSI,MKS Inc. Common Stock,317.62,21453366253.0,1037103,Industrials
RIVN,Rivian Automotive Inc. Class A Common Stock,16.95,21364081608.0,43483612,Industrials
CHRW,C.H. Robinson Worldwide Inc. Common Stock,179.89,21204181525.0,1473748,Industrials
FWONA,Liberty Media Corporation Series A Liberty Formula One Common Stock,84.18,21095988499.0,109632,Industrials
EXPD,Expeditors International of Washington Inc. Common Stock,160.03,20930505014.0,1315542,Industrials
ENTG,Entegris Inc. Common Stock,135.73,20698825000.0,2027965,Industrials
VLTO,Veralto Corp Common Stock ,83.6,20532098638.0,2842723,Industrials
AA,Alcoa Corporation Common Stock ,77.76,20520076680.0,3697862,Industrials
ALB,Albemarle Corporation Common Stock,171.13,20182156826.0,2177490,Industrials
RS,Reliance Inc. Common Stock,382.82,19542395192.0,234095,Industrials
DD,DuPont de Nemours Inc. Common Stock,47.59,19508154953.0,3376318,Industrials
IFF,International Flavors & Fragrances Inc. Common Stock,74.26,18958835905.0,2376476,Industrials
RGLD,Royal Gold Inc. Common Stock,217.86,18489037912.0,533588,Industrials
RBC,RBC Bearings Incorporated Common Stock,566.14,17910042144.0,231473,Industrials
FTV,Fortive Corporation Common Stock ,58.72,17901439153.0,5553687,Industrials
ARXS,Arxis Inc. Class A Common Stock,43.1,17685426992.0,705412,Industrials
CF,CF Industries Holdings Inc. Common Stock,113.3,17406196744.0,2953361,Industrials
LII,Lennox International Inc. Common Stock,496.77,17287580103.0,266077,Industrials
BWXT,BWX Technologies Inc. Common Stock,188.39,17259283725.0,1423565,Industrials
ITT,ITT Inc. Common Stock ,189.55,16945770000.0,611571,Industrials
NDSN,Nordson Corporation Common Stock,281.31,15674015952.0,339663,Industrials
TXT,Textron Inc. Common Stock,89.59,15578713808.0,1415456,Industrials
IEX,IDEX Corporation Common Stock,207.59,15364784645.0,441588,Industrials
NIO,NIO Inc. American depositary shares each  representing one Class A ordinary share,5.98,14983888792.0,65234931,Industrials
CLH,Clean Harbors Inc. Common Stock,281.0,14849734992.0,443747,Industrials
DY,Dycom Industries Inc. Common Stock,493.89,14832235310.0,461720,Industrials
J,Jacobs Solutions Inc. Common Stock,123.02,14526309735.0,1319149,Industrials
BALL,Ball Corporation Common Stock,53.7,14297437641.0,2862613,Industrials
MLI,Mueller Industries Inc. Common Stock,126.31,13966174128.0,629697,Industrials
MAS,Masco Corporation Common Stock,68.98,13915641464.0,2362848,Industrials
LECO,Lincoln Electric Holdings Inc. Common Shares,252.17,13815665529.0,276606,Industrials
CSL,Carlisle Companies Incorporated Common Stock,338.75,13707544495.0,273570,Industrials
TRMB,Trimble Inc. Common Stock,58.15,13555434830.0,3780890,Industrials
IESC,IES Holdings Inc. Common Stock,677.43,13497038770.0,201489,Industrials
SOLS,Solstice Advanced Materials Inc. Common Stock ,83.78,13304621992.0,1484451,Industrials
SAIA,Saia Inc. Common Stock,482.22,12861392815.0,295794,Industrials
ONTO,Onto Innovation Inc. Common Stock,255.71,12719927518.0,926252,Industrials
KNX,Knight-Swift Transportation Holdings Inc.,77.92,12661532480.0,3663607,Industrials
PSKY,Paramount Skydance Corporation Class B Common Stock,10.98,12288520177.0,7128413,Industrials
GGG,Graco Inc. Common Stock,73.96,12275006371.0,1056897,Industrials
ZBRA,Zebra Technologies Corporation Class A Common Stock,249.96,11906442664.0,1138373,Industrials
KTOS,Kratos Defense & Security Solutions Inc. Common Stock,63.49,11905643784.0,6337695,Industrials
JOBY,Joby Aviation Inc. Common Stock,11.97,11774204938.0,23005465,Industrials
HL,Hecla Mining Company Common Stock,17.54,11764295549.0,17578515,Industrials
HII,Huntington Ingalls Industries Inc. Common Stock,296.41,11679748236.0,895298,Industrials
AAON,AAON Inc. Common Stock,138.66,11357877709.0,1133787,Industrials
RVTY,Revvity Inc. Common Stock,100.52,11213988382.0,2165924,Industrials
SPXC,SPX Technologies Inc. Common Stock,220.92,11085052028.0,836765,Industrials
WLK,Westlake Corporation Common Stock,86.38,11067259903.0,916712,Industrials
CGNX,Cognex Corporation Common Stock,64.64,10757353313.0,1492079,Industrials
CCK,Crown Holdings Inc.,94.54,10564525171.0,1282440,Industrials
CR,Crane Company Common Stock,182.05,10512602136.0,437460,Industrials
XE,X-Energy Inc. Class A Common Stock,26.44,10450374253.0,2628754,Industrials
VMI,Valmont Industries Inc. Common Stock,528.74,10264773830.0,274641,Industrials
WTS,Watts Water Technologies Inc. Class A Common Stock,306.98,10250335412.0,322873,Industrials
AVAV,AeroVironment Inc. Common Stock,204.09,10191028631.0,1374809,Industrials
ESI,Element Solutions Inc. Common Stock,41.69,10155984085.0,2341423,Industrials
GTLS,Chart Industries Inc. Common Stock,207.81,9947672684.0,668737,Industrials
OC,Owens Corning Inc Common Stock New,122.62,9874382476.0,999544,Industrials
FLS,Flowserve Corporation Common Stock,75.08,9595751137.0,2098228,Industrials
DCI,Donaldson Company Inc. Common Stock,81.79,9472446935.0,1659581,Industrials
SARO,StandardAero Inc. Common Stock,27.36,9096433154.0,3947310,Industrials
BRKR,Bruker Corporation Common Stock,58.44,9057359867.0,4137002,Industrials
TKR,Timken Company (The) Common Stock,126.54,8793835295.0,1156815,Industrials
EMN,Eastman Chemical Company Common Stock,75.49,8632278480.0,1349380,Industrials
CMC,Commercial Metals Company Common Stock,75.75,8399719338.0,1217282,Industrials
LUNR,Intuitive Machines Inc. Class A Common Stock,38.21,8292370461.0,16080023,Industrials
BIO,Bio-Rad Laboratories Inc. Class A Common Stock,305.46,8174597725.0,442312,Industrials
AGCO,AGCO Corporation Common Stock,112.03,8111927280.0,626628,Industrials
OSK,Oshkosh Corporation (Holding Company)Common Stock,126.15,7865617630.0,551028,Industrials
ZWS,Zurn Elkay Water Solutions Corporation Common Stock,46.72,7796255775.0,939455,Industrials
MOS,Mosaic Company (The) Common Stock,23.33,7415362205.0,7063470,Industrials
NEU,NewMarket Corp Common Stock,797.47,7335144212.0,144042,Industrials
LSTR,Landstar System Inc. Common Stock,213.4,7240280014.0,473778,Industrials
ATR,AptarGroup Inc. Common Stock,112.38,7172127112.0,706910,Industrials
KRMN,Karman Holdings Inc. Common Stock,53.65,7110035941.0,6022225,Industrials
FLY,Firefly Aerospace Inc. Common Stock,44.24,7088806000.0,16246519,Industrials
MIDD,Middleby Corporation (The) Common Stock,156.46,7074260044.0,575183,Industrials
MWH,SOLV Energy Inc. Class A Common Stock,34.63,7008957308.0,3196569,Industrials
MYRG,MYR Group Inc. Common Stock,449.85,7004630545.0,219219,Industrials
RAL,Ralliant Corporation Common Stock,61.46,6879411276.0,1453503,Industrials
EXP,Eagle Materials Inc Common Stock,221.01,6839849968.0,384165,Industrials
JBTM,JBT Marel Corporation Common Stock,129.84,6760484710.0,335731,Industrials
HXL,Hexcel Corporation Common Stock,88.61,6683602774.0,1072920,Industrials
TEX,Terex Corporation Common Stock,58.22,6648724000.0,988439,Industrials
AWI,Armstrong World Industries Inc Common Stock,155.17,6612136936.0,387655,Industrials
PRIM,Primoris Services Corporation Common Stock,121.44,6588719306.0,1312760,Industrials
VFC,V.F. Corporation Common Stock,16.7,6542554074.0,5914957,Industrials
FLR,Fluor Corporation Common Stock,46.55,6501633659.0,2203598,Industrials
ROAD,Construction Partners Inc. Class A Common Stock,114.74,6486796297.0,594937,Industrials
NPO,Enpro Inc. Common Stock,305.54,6455040919.0,131704,Industrials
FSS,Federal Signal Corporation Common Stock,105.49,6435127985.0,680728,Industrials
SNDR,Schneider National Inc. Common Stock,36.37,6369271082.0,916804,Industrials
CENX,Century Aluminum Company Common Stock,63.91,6325431344.0,1946901,Industrials
AVTR,Avantor Inc. Common Stock,9.19,6274522144.0,13033160,Industrials
MSM,MSC Industrial Direct Company Inc. Common Stock,111.88,6246742715.0,892637,Industrials
ACA,Arcosa Inc. Common Stock ,124.64,6119370809.0,248614,Industrials
CE,Celanese Corporation Common Stock,55.28,6062145156.0,3134277,Industrials
VSNT,Versant Media Group Inc. Class A Common Stock ,42.61,6029230419.0,2304270,Industrials
GVA,Granite Construction Incorporated Common Stock,136.53,5972736814.0,1548711,Industrials
LOAR,Loar Holdings Inc. Common Stock,62.6,5860891885.0,689709,Industrials
NXST,Nexstar Media Group Inc. Common Stock,184.4,5631385146.0,414837,Industrials
ESAB,ESAB Corporation Common Stock,90.43,5505533216.0,393337,Industrials
BC,Brunswick Corporation Common Stock,82.47,5358441902.0,407580,Industrials
ACHR,Archer Aviation Inc. Class A Common Stock,6.84,5195650382.0,62986768,Industrials
ALH,Alliance Laundry Holdings Inc. Common Stock,25.34,5032743242.0,619792,Industrials
BCPC,Balchem Corporation Common Stock,156.3,5021893367.0,235606,Industrials
SEB,Seaboard Corporation Common Stock,5195.22,4975950545.0,11697,Industrials
SXT,Sensient Technologies Corporation Common Stock,111.76,4757506970.0,411886,Industrials
SMR,NuScale Power Corporation Class A Common Stock,12.89,4711052101.0,41564825,Industrials
REZI,Resideo Technologies Inc. Common Stock ,30.65,4641214869.0,1322758,Industrials
MTRN,Materion Corporation,223.07,4640187259.0,303775,Industrials
WSC,WillScot Holdings Corporation Class A Common Stock,25.18,4557446017.0,1921958,Industrials
KBR,KBR Inc. Common Stock,35.65,4520061967.0,2129562,Industrials
CBT,Cabot Corporation Common Stock,86.72,4476609282.0,401700,Industrials
MIR,Mirion Technologies Inc. Class A Common Stock,17.81,4459985062.0,4425645,Industrials
KNF,Knife Riv Holding Co. Common Stock,78.54,4457447772.0,480823,Industrials
CSW,CSW Industrials Inc. Common Stock,268.29,4378354094.0,129816,Industrials
AIR,AAR Corp. Common Stock,109.99,4373671837.0,347234,Industrials
HRI,Herc Holdings Inc. Common Stock ,129.75,4332748367.0,623251,Industrials
MDU,MDU Resources Group Inc. Common Stock (Holding Company),20.72,4330604817.0,2187310,Industrials
PVH,PVH Corp. Common Stock,93.39,4302855249.0,792569,Industrials
VVV,Valvoline Inc. Common Stock,33.43,4263531121.0,1391121,Industrials
BCO,Brinks Company (The) Common Stock,103.02,4242425824.0,413523,Industrials
BETA,Beta Technologies Inc. Class A Common Stock,18.03,4160531023.0,1149635,Industrials
RDW,Redwire Corporation Common Stock,20.68,4113639295.0,57167515,Industrials
THO,Thor Industries Inc. Common Stock,77.75,4089333791.0,888098,Industrials
AZZ,AZZ Inc.,134.24,4029042310.0,326943,Industrials
BDC,Belden Inc Common Stock,103.25,4020972130.0,439270,Industrials
VNT,Vontier Corporation Common Stock ,28.46,4007168000.0,2478974,Industrials
KTB,Kontoor Brands Inc. Common Stock ,71.55,3954737286.0,785421,Industrials
GFF,Griffon Corporation Common Stock,85.18,3906919629.0,396669,Industrials
MWA,MUELLER WATER PRODUCTS Common Stock,24.67,3860141519.0,1773186,Industrials
SLGN,Silgan Holdings Inc. Common Stock,36.5,3857311167.0,964855,Industrials
ITRI,Itron Inc. Common Stock,84.79,3759533232.0,619200,Industrials
TXG,10x Genomics Inc. Class A Common Stock,29.59,3756633633.0,3026551,Industrials
KAI,Kadant Inc Common Stock,315.67,3727577200.0,94809,Industrials
LEU,Centrus Energy Corp. Class A Common Stock,189.0,3718158066.0,1194034,Industrials
BMI,Badger Meter Inc. Common Stock,122.54,3576399748.0,370997,Industrials
SXI,Standex International Corporation Common Stock,282.39,3421132824.0,191469,Industrials
SMG,Scotts Miracle-Gro Company (The) Common Stock,58.73,3417025160.0,1532349,Industrials
FUL,H. B. Fuller Company Common Stock,61.83,3368949388.0,725162,Industrials
CC,Chemours Company (The) Common Stock,22.32,3356430465.0,2355918,Industrials
USLM,United States Lime & Minerals Inc. Common Stock,111.22,3190018268.0,133633,Industrials
AVNT,Avient Corporation Common Stock,34.61,3174088880.0,825688,Industrials
ARCB,ArcBest Corporation Common Stock,140.8,3134740224.0,256711,Industrials
ATRO,Astronics Corporation Common Stock,85.1,3050014211.0,436868,Industrials
HAYW,Hayward Holdings Inc. Common Stock,14.01,3039651518.0,2031573,Industrials
AEHR,Aehr Test Systems Common Stock,93.62,3005581910.0,1528308,Industrials
KALU,Kaiser Aluminum Corporation Common Stock,183.41,2997030546.0,207162,Industrials
OLN,Olin Corporation Common Stock,25.74,2931728574.0,2516112,Industrials
OUST,Ouster Inc. Common Stock,44.93,2851306819.0,3727810,Industrials
POWWP,Outdoor Holding Company 8.75% Series A Cumulative Redeemable Perpetual Preferred Stock,24.28,2847770170.0,4945,Industrials
CECO,CECO Environmental Corp. Common Stock,79.03,2835045640.0,1621041,Industrials
VOYG,Voyager Technologies Inc. Class A Common Stock,47.49,2814359361.0,2645977,Industrials
WOR,Worthington Enterprises Inc. Common Shares,56.98,2806435598.0,191161,Industrials
PCTTU,PureCycle Technologies Inc. Unit,15.49,2801576390.0,1578,Industrials
HLIO,Helios Technologies Inc. Common Stock,83.05,2744500032.0,226784,Industrials
FTAIM,FTAI Aviation Ltd. 9.500% Fixed-Rate Reset Series D Cumulative Perpetual Redeemable Preferred Shares,26.71,2739991182.0,4957,Industrials
NN,NextNav Inc. Common Stock,19.93,2719188194.0,2198561,Industrials
HUBG,Hub Group Inc. Class A Common Stock,43.59,2665681501.0,984173,Industrials
WDFC,WD-40 Company Common Stock,196.85,2648695884.0,130487,Industrials
HUN,Huntsman Corporation Common Stock,15.0,2630236680.0,3545869,Industrials
ROG,Rogers Corporation Common Stock,147.02,2624091616.0,301921,Industrials
LCID,Lucid Group Inc. Common Stock,6.65,2595207773.0,13155866,Industrials
COHU,Cohu Inc. Common Stock,54.5,2571056412.0,1632748,Industrials
FTAIN,FTAI Aviation Ltd. 8.25% Fixed - Rate Reset Series C Cumulative Perpetual Redeemable Preferred Shares,24.97,2561496811.0,18725,Industrials
WERN,Werner Enterprises Inc. Common Stock,42.52,2549078890.0,977967,Industrials
TRN,Trinity Industries Inc. Common Stock,31.92,2537815656.0,767446,Industrials
BWNB,Babcock & Wilcox Enterprises Inc. 6.50% Senior Notes due 2026,25.06,2533504403.0,6101,Industrials
BW,Babcock & Wilcox Enterprises Inc. Common Stock,17.01,2531760422.0,4117064,Industrials
KWR,Quaker Houghton Common Stock,142.51,2474891934.0,117770,Industrials
ANDE,Andersons Inc. (The) Common Stock,72.66,2474367709.0,247863,Industrials
KMT,Kennametal Inc. Common Stock,31.74,2418908669.0,1806976,Industrials
CDNL,Cardinal Infrastructure Group Inc. Class A Common Stock,54.24,2325098432.0,456469,Industrials
NGVT,Ingevity Corporation Common Stock ,66.55,2314055970.0,260345,Industrials
DXPE,DXP Enterprises Inc. Common Stock,144.66,2242998434.0,117214,Industrials
DCO,Ducommun Incorporated Common Stock,148.62,2242015779.0,247170,Industrials
PCT,PureCycle Technologies Inc. Common stock,12.23,2211961217.0,2765453,Industrials
WS,Worthington Steel Inc. Common Shares,42.67,2167906442.0,192167,Industrials
AESI,Atlas Energy Solutions Inc. Common Stock,17.11,2137134542.0,2778127,Industrials
CXT,Crane NXT Co. Common Stock,36.42,2095693006.0,1173220,Industrials
IOSP,Innospec Inc. Common Stock,81.93,2018021681.0,155570,Industrials
GRC,Gorman-Rupp Company (The) Common Stock,73.71,1946699012.0,80144,Industrials
PLPC,Preformed Line Products Company Common Stock,376.25,1839114515.0,67186,Industrials
ALG,Alamo Group Inc. Common Stock,149.86,1823547882.0,194168,Industrials
PRLB,Proto Labs Inc. Common stock,75.84,1804540373.0,182877,Industrials
LWLG,Lightwave Logic Inc. Common Stock,11.02,1697957545.0,6368150,Industrials
FMC,FMC Corporation Common Stock,13.34,1668104315.0,2407880,Industrials
REX,REX American Resources Corporation,49.39,1626793892.0,182023,Industrials
TNC,Tennant Company Common Stock,85.68,1459893209.0,129613,Industrials
RYZ,Ryerson Holding Corporation Common Stock,27.74,1439393204.0,368471,Industrials
TRS,TriMas Corporation Common Stock,39.99,1432749123.0,231407,Industrials
MRTN,Marten Transport Ltd. Common Stock,17.55,1431889319.0,984741,Industrials
ECVT,Ecovyst Inc. Common Stock,13.03,1426178897.0,1719492,Industrials
GBX,Greenbrier Companies Inc. (The) Common Stock,46.08,1425650412.0,392161,Industrials
ALMR,Alamar Biosciences Inc. Common Stock,20.51,1421572425.0,136327,Industrials
NWL,Newell Brands Inc. Common Stock,3.33,1415009481.0,10894294,Industrials
ALNT,Allient Inc. Common Stock,83.08,1412070217.0,451071,Industrials
CMP,Compass Minerals Intl Inc Common Stock,33.51,1406024241.0,1191723,Industrials
UAMY,United States Antimony Corporation Common Stock,9.26,1372198860.0,9850628,Industrials
UVV,Universal Corporation Common Stock,54.13,1349108838.0,406163,Industrials
RMIX,Suncrete Inc. Class A Common Stock,18.68,1337518859.0,286211,Industrials
TROX,Tronox Holdings plc Ordinary Shares (UK),8.04,1282573716.0,2699592,Industrials
UAN,CVR Partners LP Common Units representing Limited Partner Interests,119.99,1268250744.0,62852,Industrials
XPEL,XPEL Inc. Common Stock,44.6,1229219931.0,448948,Industrials
HTLD,Heartland Express Inc. Common Stock,15.52,1202640082.0,747481,Industrials
EVEX,Eve Holding Inc. Common Stock,3.42,1191201677.0,992666,Industrials
GIC,Global Industrial Company Common Stock,30.49,1166580909.0,85994,Industrials
GHM,Graham Corporation Common Stock,99.41,1160395334.0,222486,Industrials
NNAVW,NextNav Inc. Warrant,8.43,1150163396.0,208864,Industrials
GOLD,Gold.com Inc. Common Stock,39.58,1147993123.0,593769,Industrials
ASA,ASA  Gold and Precious Metals Limited,62.33,1144180341.0,94866,Industrials
LNN,Lindsay Corporation Common Stock,110.05,1144041833.0,238483,Industrials
ASTE,Astec Industries Inc. Common Stock,49.75,1143883343.0,201786,Industrials
NWPX,NWPX Infrastructure Inc. Common Stock,118.33,1140347157.0,209424,Industrials
GPRE,Green Plains Inc. Common Stock,16.15,1130987310.0,1086869,Industrials
NMAX,Newsmax Inc. Class B Common Stock,8.7,1123697612.0,1405459,Industrials
ROCK,Gibraltar Industries Inc. Common Stock,37.74,1119440823.0,439973,Industrials
EYPT,EyePoint Inc. Common Stock,13.15,1102513069.0,1308133,Industrials
CVLG,Covenant Logistics Group Inc. Class A Common Stock,41.09,1034275938.0,243076,Industrials
SBGI,Sinclair Inc. Class A Common Stock,14.14,1020421315.0,355802,Industrials
PLOW,Douglas Dynamics Inc. Common Stock,43.92,1015658433.0,219508,Industrials
ASPI,ASP Isotopes Inc. Common Stock,8.01,1008486610.0,7555992,Industrials
NPK,National Presto Industries Inc. Common Stock,127.84,915786570.0,149720,Industrials
PSIX,Power Solutions International Inc. Common Stock,39.38,907726721.0,773623,Industrials
EVC,Entravision Communications Corporation Common Stock,9.28,854123590.0,2240283,Industrials
MYE,Myers Industries Inc. Common Stock,22.69,852175636.0,193530,Industrials
NX,Quanex Building Products Corporation Common Stock,18.17,834617400.0,299428,Industrials
TRNS,Transcat Inc. Common Stock,88.09,822822087.0,361932,Industrials
WGO,Winnebago Industries Inc. Common Stock,29.04,820838454.0,601672,Industrials
WLKP,Westlake Chemical Partners LP Common Units representing limited partner interests,23.18,816999475.0,47781,Industrials
MTUS,Metallus Inc. Common Shares,19.56,814239885.0,248310,Industrials
SXC,SunCoke Energy Inc. Common Stock,9.4,797620061.0,1148545,Industrials
FTK,Flotek Industries Inc. Common Stock,20.35,736211779.0,341233,Industrials
PCTTW,PureCycle Technologies Inc. Warrant,3.98,719836929.0,1,Industrials
JBI,Janus International Group Inc. Common Stock,5.25,716060410.0,1379914,Industrials
FEIM,Frequency Electronics Inc. Common Stock,72.57,714228642.0,168222,Industrials
PKE,Park Aerospace Corp. Common Stock,33.38,696902933.0,378891,Industrials
RR,Richtech Robotics Inc. Class B Common Stock,3.1,693147516.0,15534584,Industrials
SWBI,Smith & Wesson Brands Inc. Common Stock,15.14,673635299.0,445836,Industrials
OXM,Oxford Industries Inc. Common Stock,44.67,665619585.0,268433,Industrials
MEC,Mayville Engineering Company Inc. Common Stock,30.88,632854905.0,956982,Industrials
SWIM,Latham Group Inc. Common Stock,5.32,624629653.0,584770,Industrials
HY,Hyster-Yale Inc. Class A common stock,34.77,622935913.0,70589,Industrials
RGR,Sturm Ruger & Company Inc. Common Stock,38.94,620869212.0,90266,Industrials
ASIX,AdvanSix Inc. Common Stock ,22.29,600916912.0,136760,Industrials
MLAB,Mesa Laboratories Inc. Common Stock,105.26,581541816.0,230883,Industrials
ELMT,The Elmet Group Co. Common Stock,18.95,568118404.0,5068805,Industrials
ORN,Orion Group Holdings Inc. Common,13.83,559828415.0,529099,Industrials
MBUU,Malibu Boats Inc. Class A Common Stock,28.01,550033855.0,249359,Industrials
KRT,Karat Packaging Inc. Common Stock,27.49,548802965.0,94692,Industrials
CTKB,Cytek Biosciences Inc. Common Stock,4.24,547564569.0,774612,Industrials
IIIN,Insteel Industries Inc. Common Stock,27.46,533636963.0,220565,Industrials
IPI,Intrepid Potash Inc Common Stock,38.19,513007416.0,334940,Industrials
