symbol,name,price,marketCap,volume,industry
TASK,TaskUs Inc. Class A Common Stock,5.74,525658897.0,415311,Technology
OSPN,OneSpan Inc. Common Stock,14.15,524580828.0,572174,Technology
NRDS,NerdWallet Inc. Class A Common Stock,7.97,524416301.0,875426,Technology
CARS,Cars.com Inc. Common Stock ,9.21,514866879.0,681677,Technology
RPD,Rapid7 Inc. Common Stock,7.51,501897941.0,1624214,Technology
RBBN,Ribbon Communications Inc. Common Stock,2.83,498473560.0,902401,Technology
NVEC,NVE Corporation Common Stock,102.11,493923020.0,210914,Technology
CRNC,Cerence Inc. Common Stock,10.61,479442653.0,1519853,Technology
SSTK,Shutterstock Inc. Common Stock,12.96,476124661.0,393413,Technology
VELO,Velo3D Inc. Common stock,15.85,472345882.0,3599977,Technology
OOMA,Ooma Inc. Common Stock,17.13,471243011.0,229926,Technology
BLZE,Backblaze Inc. Class A Common Stock,7.76,465600000.0,1413397,Technology
OPTX,Syntec Optics Holdings Inc. Class A Common Stock,11.35,457176615.0,764236,Technology
WEAV,Weave Communications Inc. Common Stock,5.69,452728463.0,657991,Technology
CLMB,Climb Global Solutions Inc. Common Stock,23.82,442985304.0,147803,Technology
SPT,Sprout Social Inc Class A Common Stock,7.23,434563040.0,1228992,Technology
GLOO,Gloo Holdings Inc. Class A Common Stock,5.27,434286587.0,39523,Technology
XRX,Xerox Holdings Corporation Common Stock,3.32,434177160.0,7713987,Technology
DDD,3D Systems Corporation Common Stock,2.91,427615924.0,9099288,Technology
VREX,Varex Imaging Corporation Common Stock,10.09,424789000.0,336788,Technology
OSS,One Stop Systems Inc. Common Stock,16.89,418348697.0,2233417,Technology
ALMU,Aeluma Inc. Common Stock,22.59,413517518.0,1379763,Technology
ERII,Energy Recovery Inc. Common Stock,8.01,412877525.0,584590,Technology
MEI,Methode Electronics Inc. Common Stock,11.37,402843887.0,743750,Technology
BLND,Blend Labs Inc. Class A Common Stock,1.62,392228983.0,2270285,Technology
TBRG,TruBridge Inc. Common Stock,26.05,390727493.0,413735,Technology
YEXT,Yext Inc. Common Stock,3.89,389965171.0,1443714,Technology
MPTI,M-tron Industries Inc. Common Stock,88.38,381929132.0,120970,Technology
PAYS,Paysign Inc. Common Stock,6.79,379600199.0,553562,Technology
BMBL,Bumble Inc. Class A Common Stock,2.84,370424517.0,3341074,Technology
SVCO,Silvaco Group Inc. Common Stock,11.3,369380694.0,1303030,Technology
DVLT,Datavault AI Inc. Common Stock,0.4294,367378321.0,46383306,Technology
QUIK,QuickLogic Corporation Common Stock,20.0,364496120.0,808065,Technology
XPER,Xperi Inc. Common Stock ,7.42,358174204.0,458677,Technology
DUOT,Duos Technologies Group Inc. Common Stock,11.76,344843995.0,720595,Technology
PDYN,Palladyne AI Corp. Common Stock,6.87,324567826.0,2178673,Technology
SLP,Simulations Plus Inc. Common Stock,15.88,320863054.0,204264,Technology
ATOM,Atomera Incorporated Common Stock,8.26,319798290.0,2006377,Technology
ISSC,Innovative Solutions and Support Inc. Common Stock,17.3,309544523.0,282922,Technology
TLS,Telos Corporation Common Stock,4.1,306758618.0,721679,Technology
DMRC,Digimarc Corporation Common Stock,13.63,303158119.0,293485,Technology
VUZI,Vuzix Corporation Common Stock,3.645,303111850.0,1723462,Technology
BKTI,BK Technologies Corporation Common Stock,80.0,299535840.0,25370,Technology
UIS,Unisys Corporation New Common Stock,4.07,296724042.0,755316,Technology
GSIT,GSI Technology Common Stock,8.01,289851486.0,1562290,Technology
RDNW,RideNow Group Inc. Class B Common Stock,7.3,281686385.0,105819,Technology
ASYS,Amtech Systems Inc. Common Stock,18.49,269163959.0,459322,Technology
ZIP,ZipRecruiter Inc. Class A Common Stock,3.18,259241709.0,525973,Technology
MKTW,MarketWise Inc. Class A Common Stock,16.505,257899769.0,14254,Technology
ASUR,Asure Software Inc Common Stock,8.86,254119268.0,38046,Technology
TYGO,Tigo Energy Inc. Common Stock,3.29,249746512.0,902305,Technology
LAW,CS Disco Inc. Common Stock,3.77,241786711.0,207136,Technology
RELL,Richardson Electronics Ltd. Common Stock,16.2,235822136.0,442133,Technology
AVNW,Aviat Networks Inc. Common Stock,18.04,233427913.0,176434,Technology
CMRC,Commerce.com Inc. Series 1 Common Stock,2.82,232684528.0,719908,Technology
GCTS,GCT Semiconductor Holding Inc. Common Stock,2.72,225981204.0,8145356,Technology
SMRT,SmartRent Inc. Class A Common Stock,1.1,212121876.0,1637636,Technology
IMMR,Immersion Corporation Common Stock,6.37,210849879.0,894220,Technology
KLTR,Kaltura Inc. Common Stock,1.39,209020891.0,240434,Technology
INSE,Inspired Entertainment Inc. Common Stock,7.47,199264902.0,117748,Technology
EGAN,eGain Corporation Common Stock,7.2,197640583.0,300744,Technology
KDKRW,Kodiak AI Inc. Warrants,0.98,195412649.0,227065,Technology
SLNH,Soluna Holdings Inc. Common Stock,1.34,189405054.0,22692469,Technology
QMCO,Quantum Corporation Common Stock,12.7,185902968.0,2645899,Technology
TRAK,ReposiTrak Inc. Common Stock,10.06,182826064.0,64387,Technology
KULR,KULR Technology Group Inc. Common Stock,3.81,176239799.0,3380690,Technology
RFIL,RF Industries Ltd. Common Stock,16.04,173460843.0,211884,Technology
ESP,Espey Mfg. & Electronics Corp. Common Stock,55.28,165614568.0,31536,Technology
VERI,Veritone Inc. Common Stock,1.71,158959830.0,3047916,Technology
MRDN,Meridian Holdings Inc. Common Stock,12.25,155201118.0,31187,Technology
DOMO,Domo Inc. Class B Common Stock,3.41,153963420.0,528298,Technology
KVHI,KVH Industries Inc. Common Stock,7.52,146623088.0,167411,Technology
BNAI,Brand Engagement Network Inc. Common Stock,22.17,144275421.0,9368258,Technology
HCAT,Health Catalyst Inc Common Stock,1.93,142615459.0,4627988,Technology
CMTL,Comtech Telecommunications Corp. Common Stock,4.72,140345042.0,365327,Technology
WATT,Energous Corporation Common Stock,25.49,140223064.0,212299,Technology
VHUB,VenHub Global Inc. Common Stock,1.64,139494885.0,375550,Technology
SPWR,SunPower Inc. Common Stock,0.9507,139084538.0,6638042,Technology
VWAV,VisionWave Holdings Inc. Common Stock,5.24,133031689.0,390147,Technology
SKLZ,Skillz Inc. Class A Common Stock,8.43,131571706.0,370484,Technology
MVIS,MicroVision Inc. Common Stock,0.3905,129495769.0,7498584,Technology
DH,Definitive Healthcare Corp. Class A Common Stock,0.897,128943365.0,320840,Technology
TEAD,Teads Holding Co. Common Stock,1.22,118329545.0,212140,Technology
PODC,PodcastOne Inc. Common Stock,4.22,115999208.0,170832,Technology
ALOT,AstroNova Inc. Common Stock,14.49,111469252.0,52880,Technology
EXFY,Expensify Inc. Class A Common Stock,1.15,110903837.0,1717197,Technology
VTIX,Virtuix Holdings Inc. Class A Common Stock,3.38,110900142.0,210109,Technology
GOAI,Eva Live Inc. Common Stock,3.0,109606167.0,101042,Technology
WYY,WidePoint Corporation Common Stock,10.97,108462376.0,246533,Technology
TRT,Trio-Tech International Common Stock,10.45,105676660.0,841283,Technology
CCLD,CareCloud Inc. Common Stock,2.35,99858430.0,219599,Technology
SSTI,SoundThinking Inc. Common Stock,7.58,98190842.0,136936,Technology
INVE,Identiv Inc. Common Stock,4.01,96264910.0,107978,Technology
AISP,Airship AI Holdings Inc. Class A Common Stock,2.76,94977297.0,1015237,Technology
CSPI,CSP Inc. Common Stock,8.9,89639438.0,14780,Technology
ROC,Rank One Computing Corporation Common stock,4.69,89485796.0,20585,Technology
DTCX,Datacentrex Inc. Common Stock,2.22,86299450.0,104119,Technology
AIRG,Airgain Inc. Common Stock,6.79,86068546.0,127215,Technology
FATN,FatPipe Inc. Common Stock,6.13,85969989.0,526541,Technology
OPXS,Optex Systems Holdings Inc. Common Stock,12.17,84701654.0,49363,Technology
AEYE,AudioEye Inc. Common Stock,6.69,83580946.0,107129,Technology
IDN,Intellicheck Inc. Common Stock,4.12,83435031.0,328349,Technology
OPTXW,Syntec Optics Holdings Inc. Warrant,2.05,82573750.0,91574,Technology
SOTK,Sono-Tek Corporation Common Stock,5.11,80297247.0,49804,Technology
MYPS,PLAYSTUDIOS Inc.  Class A Common Stock,0.61,78520436.0,2328183,Technology
LINK,Interlink Electronics Inc. Common Stock,4.91,77332534.0,36659,Technology
IPWR,Ideal Power Inc. Common Stock,6.03,77106171.0,929632,Technology
FTCI,FTC Solar Inc. Common Stock,4.75,76025147.0,101429,Technology
RSSS,Research Solutions Inc Common Stock,2.25,74037321.0,72425,Technology
GEG,Great Elm Group Inc. Common Stock,2.28,71493978.0,21539,Technology
GPUS,Hyperscale Data Inc. Common Stock,0.151,69680062.0,37333565,Technology
XTIA,XTI Aerospace Inc. Common Stock,1.81,69644798.0,1847676,Technology
MCHX,Marchex Inc. Class B Common Stock,1.52,67340254.0,21565,Technology
SKIL,Skillsoft Corp. Class A Common Stock,7.05,63133293.0,33345,Technology
AREN,The Arena Group Holdings Inc. Common Stock,1.32,62835683.0,64247,Technology
ASTI,Ascent Solar Technologies Inc. Common Stock,6.45,61029171.0,1991799,Technology
MLGO,MicroAlgo Inc. Class A Ordinary Shares,4.69,58331692.0,127155,Technology
XRXDW,Xerox Holdings Corporation Warrants,0.42,54926026.0,494090,Technology
NTWK,NetSol Technologies Inc. Common  Stock,4.32,51306108.0,76632,Technology
WFCF,Where Food Comes From Inc. Common Stock,10.15,51148651.0,14908,Technology
TACT,TransAct Technologies Incorporated Common Stock,4.8,49326139.0,64957,Technology
FNGR,FingerMotion Inc. Common Stock,0.751,46022262.0,805560,Technology
LGL,LGL Group Inc. (The) Common Stock,7.01,45848449.0,18921,Technology
NSYS,Nortech Systems Incorporated Common Stock,15.83,44237473.0,21436,Technology
CREX,Creative Realities Inc. Common Stock,4.02,42480417.0,16983,Technology
PXLW,Pixelworks Inc.  Common Stock,6.39,40661219.0,57746,Technology
KTCC,Key Tronic Corporation Common Stock,3.73,40505073.0,52677,Technology
HOLO,MicroCloud Hologram Inc. Ordinary Shares,1.73,39638383.0,745148,Technology
CVV,CVD Equipment Corporation Common Stock,5.55,38519825.0,96475,Technology
ATHR,Aether Holdings Inc. Common Stock,3.11,37770110.0,11107,Technology
FUSE,Fusemachines Inc. Common stock,1.28,37042227.0,68350,Technology
CDLX,Cardlytics Inc. Common Stock,0.5984,34471237.0,1420501,Technology
SNAL,Snail Inc. Class A Common Stock,0.7574,33073776.0,485869,Technology
SST,System1 Inc. Class A Common Stock,3.05,30314658.0,87786,Technology
AISPW,Airship AI Holdings Inc. Warrants,0.86,29594375.0,38855,Technology
AWRE,Aware Inc. Common Stock,1.35,29222204.0,48936,Technology
MOBX,Mobix Labs Inc. Class A Common Stock,2.16,29025858.0,2933679,Technology
XBP,XBP Global Holdings Inc. Common Stock,2.39,28125640.0,4330,Technology
CAST,FreeCast Inc. Class A Common Stock,0.6775,28009079.0,154455,Technology
BEEM,Beam Global Common Stock,1.31,27689448.0,818887,Technology
VWAVW,VisionWave Holdings Inc. Warrant,1.07,27164868.0,25737,Technology
LPSN,LivePerson Inc. Common Stock,2.1,25569657.0,88854,Technology
AIFF,Firefly Neuroscience Inc. Common Stock,1.58,24603412.0,304496,Technology
SPWRW,SunPower Inc. Warrants,0.1575,23041774.0,1800,Technology
NIXX,Nixxy Inc. Common Stock,0.8445,22710656.0,561130,Technology
SEGG,Sports Entertainment Gaming Global Corporation Common Stock,1.65,20861688.0,2042151,Technology
UPLD,Upland Software Inc. Common Stock,0.7074,20771528.0,501236,Technology
UUU,Universal Safety Products Inc. Common Stock,6.66,20168891.0,32168,Technology
AUID,authID Inc. Common Stock,1.25,20165609.0,171289,Technology
SMSI,Smith Micro Software Inc. Common Stock,3.65,18656909.0,120013,Technology
CYN,Cyngn Inc. Common Stock,1.29,18606032.0,395164,Technology
RAIN,Rain Enhancement Technologies Holdco Inc. Class A Common Stock,2.2,18015433.0,10365,Technology
MSGM,Motorsport Games Inc. Class A Common Stock,4.18,17447550.0,55007,Technology
CXAI,CXApp Inc. Class A Common Stock,0.2468,17298034.0,83515807,Technology
IPM,Intelligent Protection Management Corp. Common Stock ,1.85,16716099.0,41089,Technology
AIMD,Ainos Inc. Common Stock,1.95,16622857.0,100906,Technology
GGRP,The Glimpse Group Inc. Common Stock,0.785,16545057.0,130568,Technology
RMSG,Real Messenger Corporation Ordinary Shares,1.83,16234444.0,199975780,Technology
PRSO,Peraso Inc. Common Stock,0.9961,14629340.0,1015997,Technology
BLIN,Bridgeline Digital Inc. Common Stock,1.06,13355872.0,87521,Technology
IDAI,T Stamp Inc. Class A Common Stock,2.18,12207922.0,20463,Technology
GXAI,Gaxos.ai Inc. Common Stock,1.38,9830365.0,1540124,Technology
MSAI,MultiSensor AI Holdings Inc. Common Stock,4.71,9511534.0,264089,Technology
VRME,VerifyMe Inc. Common Stock,0.6763,8872424.0,261102,Technology
SMTK,SmartKem Inc. Common Stock,0.4087,8765067.0,232201169,Technology
CSAI,Cloudastructure Inc. Class A Common Stock,0.331,8272229.0,523103,Technology
AMST,Amesite Inc. Common Stock,1.35,7901530.0,129223,Technology
CYCU,Cycurion Inc. Common Stock,0.8429,7240529.0,455939,Technology
DTST,Data Storage Corporation Common Stock,3.33,7216570.0,15356,Technology
SCKT,Socket Mobile Inc. Common Stock,0.8751,7211662.0,209762,Technology
AUUD,Auddia Inc. Common Stock,1.31,7026906.0,1280527,Technology
IPDN,Professional Diversity Network Inc. Common Stock,0.65,6840621.0,263975,Technology
CETX,Cemtrex Inc. Common Stock,5.52,6139250.0,688473,Technology
TWAV,TaoWeave Inc. Common Stock,1.68,5806330.0,2211342,Technology
HCTI,Healthcare Triangle Inc. Common Stock,2.26,4582790.0,52912,Technology
CXAIW,CXApp Inc. Warrant,0.0647,4534776.0,114468,Technology
BNZI,Banzai International Inc. Class A Common Stock,3.01,4383710.0,191666,Technology
IVDA,Iveda Solutions Inc. Common Stock,0.3004,3346378.0,370228,Technology
EVGOW,EVgo Inc. Warrants,0.01,3138594.0,377819,Technology
ONFO,Onfolio Holdings Inc. Common Stock,0.442,2944829.0,249135,Technology
DAIC,CID HoldCo Inc. Common Stock,2.42,2929127.0,8689514,Technology
FUSEW,Fusemachines Inc. Warrants,0.0701,2028641.0,6658,Technology
PDYNW,Palladyne AI Corp Warrants,0.0391,1847249.0,94428,Technology
HOLOW,MicroCloud Hologram Inc. Warrant,0.0802,1837571.0,1011,Technology
TRNR,Interactive Strength Inc. Common Stock,0.7412,1727690.0,224235,Technology
RAINW,Rain Enhancement Technologies Holdco Inc. Warrants,0.1926,1577169.0,72,Technology
MOBXW,Mobix Labs Inc Warrants,0.1063,1428448.0,9484,Technology
KUST,Kustom Entertainment Inc. Common Stock,1.88,1178497.0,69285,Technology
BNAIW,Brand Engagement Network Inc. Warrant,0.1764,1147956.0,177400,Technology
AIMDW,Ainos Inc. Warrants,0.13,1108190.0,4244,Technology
XBPEW,XBP Europe Holdings Inc. Warrant,0.064,753155.0,5878,Technology
RMSGW,Real Messenger Corporation Warrants,0.0721,639619.0,198874,Technology
IVDAW,Iveda Solutions Inc. Warrant,0.0263,292975.0,5499,Technology
ONFOW,Onfolio Holdings Inc. Warrant,0.0375,249844.0,10604,Technology
MYPSW,PLAYSTUDIOS Inc. Warrant,0.0015,193083.0,48281,Technology
WGSWW,GeneDx Holdings Corp. Warrant,0.006,178128.0,134085,Technology
LTRYW,Sports Entertainment Gaming Global Corporation Warrants,0.0134,169422.0,166263,Technology
NIXXW,Nixxy Inc. Warrant,0.0031,83367.0,6481,Technology
DAICW,CID HoldCo Inc. Warrants,0.0155,18761.0,58919,Technology
BNZIW,Banzai International Inc. Warrant,0.0099,14418.0,111663,Technology
APXT,Apex Treasury Corporation Class A Ordinary Share,10.04,0.0,601,Technology
CCIX,Churchill Capital Corp IX Ordinary Shares,10.8,0.0,26131,Technology
CCIXW,Churchill Capital Corp IX Warrant,0.34,0.0,430,Technology
