symbol,name,price,marketCap,volume,industry
BAC^L,Bank of America Corporation Non Cumulative Perpetual Conv Pfd Ser L,1227.25,,18306,Uncategorized
BAC^M,Bank of America Corporation Depositary Shares each representing a 1/1000th interest in a share of 5.375% Non-Cumulative Preferred Stock Series KK,21.95,,51891,Uncategorized
BAC^N,Bank of America Corporation Depositary shares each representing 1/1000th interest in a share of 5.000% Non-Cumulative Preferred Stock Series LL,20.47,,46871,Uncategorized
BAC^O,Bank of America Corporation Depositary shares each representing 1/1000th interest in a share of 4.375% Non-Cumulative Preferred Stock Series NN,17.53,,50770,Uncategorized
BAC^P,Bank of America Corporation Depositary Shares each representing a 1/1000th interest in a share of 4.125% Non-Cumulative Preferred Stock Series PP,16.69,,46136,Uncategorized
BAC^Q,Bank of America Corporation Depositary shares each representing 1/1000th interest in a share of 4.250% Non-Cumulative Preferred Stock Series QQ,17.26,,84793,Uncategorized
BAC^S,Bank of America Corporation Depositary shares each representing 1/1000th interest in a share of 4.750% Non-Cumulative Preferred Stock Series SS,19.4,,53282,Uncategorized
BANC^F,Banc of California Inc. Depositary Shares each representing a 1/40th interest in a share of 7.75% non-cumulative perpetual preferred stock Series F,25.41,,30945,Uncategorized
BC^C,Brunswick Corporation 6.375% Notes due 2049,24.04,,10900,Uncategorized
BCV^A,Bancroft Fund Limited 5.375% Series A Cumulative Preferred Shares,21.3588,,19,Uncategorized
BF/A,Brown Forman Corporation,25.4,,251708,Uncategorized
BF/B,Brown Forman Corporation,24.87,,12127642,Uncategorized
BFH^A,Bread Financial Holdings Inc. Depositary Shares each representing a 1/40th interest in a share of 8.625% Non-Cumulative Perpetual Preferred Stock Series A,25.15,,770,Uncategorized
BFS^D,Saul Centers Inc. Depositary Shares each representing 1/100th of a share of 6.125% Series D Cumulative Redeemable Preferred Stock,20.38,,3135,Uncategorized
BFS^E,Saul Centers Inc. Depositary shares each representing a 1/100th fractional interest in a share of 6.000% Series E Cumulative Redeemable Preferred Stock,21.6,,3418,Uncategorized
BHR^B,Braemar Hotels & Resorts Inc. 5.50% Series B Cumulative Convertible Preferred Stock par value $0.01 per share,14.98,,6955,Uncategorized
BHR^D,Braemar Hotels & Resorts Inc. 8.25% Series D Cumulative Preferred Stock  par value $0.01 per share,16.32,,1469,Uncategorized
BIO/B,Bio-Rad Laboratories Inc.,299.45,,7,Uncategorized
BK^K,The Bank Of New York Mellon Corporation  Depositary Shares each representing a 1/4000th interest in a share of Series K Noncumulative Perpetual Preferred Stock,25.4,,14656,Uncategorized
BML^G,Bank of America Corporation Depositary Shares (Each representing a 1/1200th interest in a share of Floating Rate Non-Cumulative Preferred Stock  Series 1),19.29,,3811,Uncategorized
BML^H,Bank of America Corporation Depositary Shares (Each representing a 1/1200th interest in a Share of Floating Rate Non-Cumulative Preferred Stock Series 2),19.15,,12753,Uncategorized
BML^J,Bank of America Corporation Depositary Shares (Each representing a 1/1200th interest in a Share of Floating Rate Non-Cumulative Preferred Stock Series 4),19.88,,22569,Uncategorized
BML^L,Bank of America Corporation Depositary Shares (Each representing a 1/1200th Interest in a Share of Floating Rate Non-Cumulative Preferred Stock Series 5),19.48,,14520,Uncategorized
BOH^A,Bank of Hawaii Corporation Depositary Shares Each Representing a 1/40th Interest in a Share of 4.375% Fixed Rate Non-Cumulative Perpetual Preferred Stock Series A,16.08,,3809,Uncategorized
BOH^B,Bank of Hawaii Corporation Depositary Shares Each Representing a 1/40th Interest in a Share of 8.000% Fixed Rate Non-Cumulative Perpetual Preferred Stock Series B,26.27,,25035,Uncategorized
BW^A,Babcock & Wilcox Enterprises Inc. 7.75% Series A Cumulative Perpetual Preferred Stock,21.39,,18275,Uncategorized
C^N,Citigroup Capital XIII 7.875% Fixed rate Floating Rate trust Preferred Securities (TruPS),29.39,,67299,Uncategorized
C^R,Citigroup Inc. Depositary Shares Each Representing a 1/1000th Interest in a Share of 6.250% Noncumulative Preferred Stock Series II,25.32,,56563,Uncategorized
CDR^B,Cedar Realty Trust Inc. 7.25% Series B Cumulative Redeemable Preferred Stock,20.875,,15,Uncategorized
CDR^C,Cedar Realty Trust Inc. 6.50% Series C Cumulative Redeemable Preferred Stock,21.11,,628,Uncategorized
CFG^E,Citizens Financial Group Inc. Depositary Shares Each Representing 1/40th Interest in a Share of 5.000% Fixed-Rate Non-Cumulative Perpetual Preferred Stock Series E,19.19,,20011,Uncategorized
CFG^H,Citizens Financial Group Inc. Depositary Shares Each Representing a 1/40th Interest in a Share of 7.375% Fixed-Rate Non-Cumulative Perpetual Preferred Stock Series H,25.775,,12158,Uncategorized
CFG^I,Citizens Financial Group Inc. Depositary Shares Each Representing a 1/40th Interest in a Share of 6.500% Fixed-Rate Reset Non-Cumulative Perpetual Preferred Stock Series I,25.15,,39112,Uncategorized
CFR^B,Cullen/Frost Bankers Inc. Depositary Shares each representing a 1/40th ownership interest in a share of 4.450% non-cumulative perpetual preferred stock Series B,17.02,,10301,Uncategorized
CIM^A,Chimera Investment Corporation 8.00% Series A Cumulative Redeemable Preferred Stock,21.6144,,9333,Uncategorized
CIM^B,Chimera Investment Corporation 8.00% Series B Fixed-to-Floating Rate Cumulative Redeemable Preferred Stock,24.37,,19430,Uncategorized
CIM^C,Chimera Investment Corporation 7.75% Series C Fixed-to-Floating Rate  Cumulative Redeemable  Preferred Stock,22.77,,20576,Uncategorized
CIM^D,Chimera Investment Corporation 8.00% Series D Fixed-to-Floating Rate Cumulative Redeemable Preferred Stock,24.17,,5422,Uncategorized
CLDT^A,Chatham Lodging Trust (REIT) 6.625% Series A Cumulative Redeemable Preferred Shares of Beneficial Interest,20.2501,,4143,Uncategorized
CMS^B,CMS Energy Corporation Preferred Stock,79.63,,443,Uncategorized
CMS^C,CMS Energy Corporation Depositary Shares each representing a 1/1000th interest in a share of 4.200% Cumulative Redeemable Perpetual Preferred Stock Series C,16.97,,10930,Uncategorized
CNO^A,CNO Financial Group Inc. 5.125% Subordinated Debentures due 2060,17.85,,3670,Uncategorized
CODI^A,Compass Diversified Holdings 7.250% Series A Preferred Shares representing beneficial interest in Compass Diversified Holdings,20.4,,19406,Uncategorized
CODI^B,Compass Diversified Holdings 7.875% Series B Fixed-to-Floating Rate Cumulative Preferred Shares representing beneficial interests in Compass Diversified Holdings,22.01,,8859,Uncategorized
CODI^C,Compass Diversified Holdings 7.875% Series C Cumulative Preferred Shares,21.39,,62950,Uncategorized
COF^I,Capital One Financial Corporation Depositary shares each representing a 1/40th interest in a share of Fixed Rate Non-Cumulative Perpetual Preferred Stock Series I of the Issuer,18.91,,118083,Uncategorized
COF^J,Capital One Financial Corporation Depositary Shares Each Representing a 1/40th Interest in a Share of Fixed Rate Non- Cumulative Perpetual Preferred Stock Series J,18.13,,132402,Uncategorized
COF^K,Capital One Financial Corporation Depositary Shares Each Representing a 1/40th Ownership Interest in a Share of Fixed Rate Non-Cumulative Perpetual Preferred Stock Series K,17.53,,5006,Uncategorized
COF^L,Capital One Financial Corporation Depositary Shares Each Representing a 1/40th Interest in a Share of Fixed Rate Non-Cumulative Perpetual Preferred Stock Series L,16.51,,48053,Uncategorized
COF^N,Capital One Financial Corporation Depositary Shares Each Representing a 1/40th Ownership Interest in a Share of Fixed Rate Non-Cumulative Perpetual Preferred Stock Series N,16.09,,18508,Uncategorized
CRD/A,Crawford & Company,10.83,,43168,Uncategorized
CRD/B,Crawford & Company,10.35,,2432,Uncategorized
CTA^A,EIDP Inc. Preferred Stock $3.50 Series,54.41,,1046,Uncategorized
CTA^B,EIDP Inc. Preferred Stock $4.50 Series,68.45,,1368,Uncategorized
CTO^A,CTO Realty Growth Inc. 6.375% Series A Cumulative Redeemable Preferred Stock,20.82,,239,Uncategorized
DBRG^H,DigitalBridge Group Inc. 7.125% Series H ,16.7401,,5925,Uncategorized
DBRG^I,DigitalBridge Group Inc. 7.15% Series I ,16.8094,,7148,Uncategorized
DBRG^J,DigitalBridge Group Inc. 7.125% Series J ,17.09,,10201,Uncategorized
DCOM^,Dime Community Bancshares Inc. Fixed-Rate Non-Cumulative Perpetual Preferred Stock Series A,19.31,,1322,Uncategorized
DLR^J,Digital Realty Trust Inc. 5.250% Series J Cumulative Redeemable Preferred Stock,20.18,,7035,Uncategorized
DLR^K,Digital Realty Trust Inc. 5.850% Series K Cumulative Redeemable Preferred Stock par value $0.01 per share,22.69,,7453,Uncategorized
DLR^L,Digital Realty Trust Inc. 5.200% Series L Cumulative Redeemable Preferred Stock,19.88,,8014,Uncategorized
DUK^A,Duke Energy Corporation Depositary Shares each representing a 1/1000th interest in a share of 5.75% Series A Cumulative Redeemable Perpetual Preferred Stock,24.8518,,41491,Uncategorized
DX^C,Dynex Capital Inc. 6.900% Series C Fixed-to-Floating Rate Cumulative Redeemable Preferred Stock,25.715,,8303,Uncategorized
ECC^D,Eagle Point Credit Company Inc. 6.75% Series D Preferred Stock,18.7,,4627,Uncategorized
ECF^A,Ellsworth Growth and Income Fund Ltd. 5.25% Series A Cumulative Preferred Shares (Liquidation Preference $25.00 per share),21.19,,3220,Uncategorized
EFC^B,Ellington Financial Inc. 6.250% Series B Fixed-Rate Reset Cumulative Redeemable Preferred Stock,24.33,,20529,Uncategorized
EFC^C,Ellington Financial Inc. 8.625% Series C Fixed-Rate Reset Cumulative Redeemable Preferred Stock,25.45,,1908,Uncategorized
EFC^D,Ellington Financial Inc. 7.00% Series D Cumulative Perpetual Redeemable Preferred Stock,23.18,,447,Uncategorized
EP^C,El Paso Corporation Preferred Stock,50.26,,341,Uncategorized
EPR^C,EPR Properties 5.75% Series C Cumulative Convertible Preferred Shares,25.15,,3222,Uncategorized
EPR^E,EPR Properties Series E Cumulative Conv Pfd Shs Ser E,32.28,,1192,Uncategorized
EPR^G,EPR Properties 5.750% Series G Cumulative Redeemable Preferred Shares,19.5101,,7591,Uncategorized
EQH^A,Equitable Holdings Inc. Depositary Shares,19.72,,31927,Uncategorized
EQH^C,Equitable Holdings Inc. Depositary Shares each representing a 1/1000th interest in a share of Fixed Rate Noncumulative Perpetual Preferred Stock Series C,16.33,,8442,Uncategorized
ET^I,Energy Transfer L.P. Series I Fixed Rate Perpetual Preferred Units,12.01,,40160,Uncategorized
ETI^,Entergy Texas Inc 5.375% Series A Preferred Stock Cumulative No Par Value,24.05,,1993,Uncategorized
F^B,Ford Motor Company 6.20% Notes due June 1 2059,21.1,,25724,Uncategorized
F^C,Ford Motor Company 6% Notes due December 1 2059,20.57,,36667,Uncategorized
F^D,Ford Motor Company 6.500% Notes due August 15 2062,22.33,,41325,Uncategorized
FBRT^E,Franklin BSP Realty Trust Inc. 7.50% Series E Cumulative Redeemable Preferred Stock,19.58,,35181,Uncategorized
FHN^C,First Horizon Corporation Depositary Shares each representing a 1/400th interest in a share of Non-Cumulative Perpetual Preferred Stock Series C,24.99,,13039,Uncategorized
FHN^E,First Horizon Corporation Depositary Shares each representing a 1/4000th interest in a share of Non-Cumulative Perpetual Preferred Stock Series E,24.96,,4283,Uncategorized
FHN^F,First Horizon Corporation Depositary Shares each representing 1/4000th Interest in a Share of Non-Cumulative Perpetual Preferred Stock Series F,17.6,,6692,Uncategorized
FHN^H,First Horizon Corporation Depositary Shares each representing a 1/4000th interest in a share of Non-Cumulative Perpetual Preferred Stock Series H,25.0294,,231422,Uncategorized
FLG^A,Flagstar Bank N.A. Depositary shares each representing a 1/40th interest in a share of Fixed-to-Floating Rate Series A Noncumulative Perpetual Preferred Stock,22.835,,11750,Uncategorized
FLG^U,Flagstar Bank N.A. Bifurcated Option Note Unit SecuritiES,40.69,,12005,Uncategorized
FOUR^A,Shift4 Payments Inc. 6.00% Series A Mandatory Convertible Preferred Stock,55.81,,7126,Uncategorized
FRT^C,Federal Realty Investment Trust Depositary Shares each representing a 1/1000th interest in a 5.000% Series C Cumulative Redeemable Preferred Share,19.3,,6325,Uncategorized
GAB^G,Gabelli Equity Trust Inc. (The) Series G Cumulative Preferred Stock,20.3,,3196,Uncategorized
GAB^H,Gabelli Equity Trust Inc. (The) Pfd Ser H,20.27,,16884,Uncategorized
GAB^K,Gabelli Equity Trust Inc. (The) 5.00% Series K Cumulative Preferred Stock,20.64,,1752,Uncategorized
GAM^B,General American Investors Company Inc. Cumulative Preferred Stock,24.77,,8979,Uncategorized
GDV^H,The Gabelli Dividend & Income Trust 5.375% Series H Cumulative Preferred Shares,22.23,,2065,Uncategorized
GDV^K,The Gabelli Dividend & Income Trust 4.250% Series K Cumulative Preferred Shares,17.865,,4462,Uncategorized
GGN^B,GAMCO Global Gold Natural Reources & Income Trust 5.00% Series B Cumulative 25.00 Liquidation Preference,20.02,,4826,Uncategorized
GGT^E,Gabelli Multi-Media Trust Inc. (The) 5.125% Series E Cumulative Preferred Stock,20.47,,245,Uncategorized
GGT^G,Gabelli Multi-Media Trust Inc. (The) 5.125% Series G Cumulative Preferred Shares,20.7,,1177,Uncategorized
GL^D,Globe Life Inc. 4.25% Junior Subordinated Debentures due 2061,15.75,,12136,Uncategorized
GLP^B,Global Partners LP 9.50% Series B Fixed Rate Cumulative Redeemable Perpetual Preferred Units representing limited partner interests,25.9101,,6670,Uncategorized
GLU^A,The Gabelli Global Utility and Income Trust Series A Cumulative Puttable and Callable Preferred Shares,52.0,,1287,Uncategorized
GLU^B,The Gabelli Global Utility and Income Trust Series B Cumulative Puttable and Callable Preferred Shares,50.44,,462,Uncategorized
GNL^A,Global Net Lease Inc. 7.25% Series A Cumulative Redeemable Preferred Stock $0.01 par value per share,22.662,,1080,Uncategorized
GNL^B,Global Net Lease Inc. 6.875% Series B Cumulative Redeemable Perpetual Preferred Stock,21.515,,5112,Uncategorized
GNL^D,Global Net Lease Inc. 7.50% Series D Cumulative Redeemable Perpetual Preferred Stock,23.35,,7449,Uncategorized
GNL^E,Global Net Lease Inc. 7.375% Series E Cumulative Redeemable Perpetual Preferred Stock,22.9,,2020,Uncategorized
GNT^A,GAMCO Natural Resources Gold & Income Tust  5.20% Series A Cumulative Preferred Shares (Liquidation Preference $25.00 per share),20.7294,,45,Uncategorized
GPMT^A,Granite Point Mortgage Trust Inc. 7.00% Series A Fixed-to-Floating Rate Cumulative Redeemable Preferred Stock,20.03,,481,Uncategorized
GPUS^D,Hyperscale Data Inc. 13.00% Series D Cumulative Redeemable Perpetual Preferred Stock,22.0,,720,Uncategorized
GRBK^A,Green Brick Partners Inc. Depositary Shares (each representing a 1/1000th fractional interest in a share of 5.75% Series A Cumulative Perpetual Preferred Stock),22.95,,2513,Uncategorized
GS^A,Goldman Sachs Group Inc. (The) Depositary Shares each representing 1/1000th Interest in a Share of Floating Rate Non-Cumulative Preferred Stock Series A,19.175,,34504,Uncategorized
GS^C,Goldman Sachs Group Inc. (The) Depositary Share repstg 1/1000th Preferred Series C,19.3,,16354,Uncategorized
GS^D,Goldman Sachs Group Inc. (The) Dep Shs repstg 1/1000 Pfd Ser D Fltg,18.94,,100993,Uncategorized
GUT^C,Gabelli Utility Trust (The) 5.375% Series C Cumulative Preferred Shares,22.31,,2109,Uncategorized
HEI/A,Heico Corporation,201.28,,264149,Uncategorized
HFRO^A,Highland Opportunities and Income Fund 5.375% Series A Cumulative Preferred Shares,16.5001,,6220,Uncategorized
HFRO^B,Highland Opportunities and Income Fund 5.375% Series B Cumulative Preferred Shares,16.3402,,3529,Uncategorized
HIG^G,The Hartford Insurance Group Inc. Depositary Shares each representing a 1/1000th interest in a share of 6.000% Non-Cumulative Preferred Stock Series G,25.068,,17499,Uncategorized
HL^B,Hecla Mining Company Preferred Stock,64.9,,111,Uncategorized
HPE^C,Hewlett Packard Enterprise Company 7.625% Series C Mandatory Convertible Preferred Stock,76.14,,11131,Uncategorized
HPP^C,Hudson Pacific Properties Inc. 4.750% Series C Cumulative Redeemable Preferred Stock,14.06,,9068,Uncategorized
HVII,Hennessy Capital Investment Corp. VII Ordinary Shares,10.39,,97619,Uncategorized
HVT/A,Haverty Furniture Companies Inc.,23.055,,116,Uncategorized
IIPR^A,Innovative Industrial Properties Inc. 9.00% Series A Cumulative Redeemable Preferred Stock,22.35,,109926,Uncategorized
INN^E,Summit Hotel Properties Inc. 6.250% Series E Cumulative Redeemable Preferred Stock,18.39,,1039,Uncategorized
INN^F,Summit Hotel Properties Inc. 5.875% Series F Cumulative Redeemable Preferred Stock $0.01 par value per share,17.4,,10989,Uncategorized
IVR^C,INVESCO MORTGAGE CAPITAL INC 7.5% Fixed-to-Floating Series C Cumulative Redeemable Preferred Stock Liquation Preference $25.00 per Share,23.5,,23374,Uncategorized
JPM^C,J P Morgan Chase & Co Depositary Shares each representing a 1/400th interest in a share of 6.00% Non-Cumulative  Preferred Stock Series EE,25.28,,51791,Uncategorized
JPM^D,J P Morgan Chase & Co Depositary Shares each representing a 1/400th  interest in a share of 5.75% Non-Cumulative  Preferred Stock Series DD,24.7,,88863,Uncategorized
JPM^J,J P Morgan Chase & Co Depositary Shares each representing a 1/400th interest in a share of JPMorgan Chase & Co. 4.75% Non-Cumulative Preferred Stock Series GG,19.93,,55404,Uncategorized
JPM^K,J P Morgan Chase & Co Depositary Shares each representing a 1/400th interest in a share of 4.55% Non-Cumulative Preferred Stock Series JJ,19.1,,105147,Uncategorized
JPM^L,J P Morgan Chase & Co Depositary Shares each representing a 1/400th interest in a share of 4.625% Non-Cumulative Preferred Stock Series LL,19.39,,91936,Uncategorized
JPM^M,J P Morgan Chase & Co Depositary Shares each representing a 1/400th interest in a share of 4.20% Non-Cumulative Preferred Stock Series MM,17.87,,105228,Uncategorized
JXN^A,Jackson Financial Inc. Depositary Shares each representing a 1/1000th interest in a share of Fixed-Rate Reset Noncumulative Perpetual Preferred Stock Series A,26.14,,11043,Uncategorized
KEY^I,KeyCorp Depositary Shares Each Representing a 1/40th Ownership Interest in a Share of Fixed-to-Floating Rate Perpetual Non-Cumulative Preferred Stock Series E,25.02,,35487,Uncategorized
KEY^J,KeyCorp Depositary Shares each representing a 1/40th ownership interest in a share of Fixed Rate Perpetual Non-Cumulative Preferred Stock Series F,21.445,,6662,Uncategorized
KEY^K,KeyCorp Depositary Shares each representing a 1/40th ownership interest in a share of Fixed Rate Perpetual Non-Cumulative Preferred Stock Series G,21.25,,19844,Uncategorized
KEY^L,KeyCorp Depositary Shares each representing a 1/40th ownership interest in a share of Fixed Rate Perpetual Non-Cumulative Preferred Stock Series H,24.85,,28438,Uncategorized
KIM^L,Kimco Realty Corporation Class L Depositary Shares each of which represents a one-one thousandth fractional interest in a share of 5.125% Class L Cumulative Redeemable Preferred Stock liquidation preference $25000.00 per share,19.585,,15907,Uncategorized
KIM^M,Kimco Realty Corporation Class M Depositary Shares each of which represents a one-one thousandth fractional interest in a share of 5.25% Class M Cumulative Redeemable Preferred Stock liquidation preference $25000.00 per share,20.1,,17791,Uncategorized
KIM^N,Kimco Realty Corporation Depositary Shares each representing 1/1000th interest in a share of 7.25% Class N Cumulative Convertible Perpetual Preferred Stock,60.28,,221,Uncategorized
KKR^D,KKR & Co. Inc. 6.25% Series D Mandatory Convertible Preferred Stock,43.05,,94834,Uncategorized
KREF^A,KKR Real Estate Finance Trust Inc. 6.50% Series A Cumulative Redeemable Preferred Stock,18.03,,14678,Uncategorized
LFT^A,Lument Finance Trust Inc. 7.875% Series A Cumulative Redeemable Preferred Stock,19.75,,1032,Uncategorized
LNC^D,Lincoln National Corporation Depositary Shares Each Representing a 1/1000th Interest in a Share of 9.000% Non-Cumulative Preferred Stock Series D,26.38,,15850,Uncategorized
LOB^A,Live Oak Bancshares Inc. Depositary Shares Each Representing a 1/40th Interest in a Share of 8.375% Fixed Rate Series A Non-Cumulative Perpetual Preferred Stock,25.353,,2014,Uncategorized
LXP^C,LXP Industrial Trust 6.5% Series C Cumulative Convertible Preferred Stock,46.6072,,2988,Uncategorized
MAA^I,Mid-America Apartment Communities Inc. 8.50% Series I Cumulative Redeemable Preferred Stock,54.53,,85,Uncategorized
MDV^A,Modiv Industrial Inc. 7.375% Series A Cumulative Redeemable Perpetual Preferred Stock,25.0,,1344,Uncategorized
MER^K,Bank of America Corporation Income Capital Obligation Notes initially due December 15 2066,25.68,,16190,Uncategorized
MET^A,MetLife Inc. Preferred Series A Floating Rate,20.94,,69969,Uncategorized
MET^E,MetLife Inc. Depositary Shares ,22.65,,74583,Uncategorized
MET^F,MetLife Inc. Depositary Shares each representing a 1/1000th interest in a share of 4.75% Non-Cumulative Preferred Stock Series F,19.06,,43038,Uncategorized
MFA^B,MFA Financial Inc. Preferred Series B,20.865,,5216,Uncategorized
MFA^C,MFA Financial Inc. 6.50% Series C Fixed-to-Floating Rate Cumulative Redeemable Preferred Stock,23.73,,6964,Uncategorized
MITT^A,TPG Mortgage Investment Trust Inc. 8.25% Series A Cumulative Redeemable Preferred Stock,22.895,,345,Uncategorized
MITT^B,TPG Mortgage Investment Trust Inc. 8.00% Series B Cumulative Redeemable Preferred Stock,22.33,,3093,Uncategorized
MITT^C,TPG Mortgage Investment Trust Inc. 8.00% Series C Fixed-to-Floating Rate Cumulative Redeemable Preferred Stock $0.01 par value per share,25.13,,6094,Uncategorized
MS^A,Morgan Stanley Dep Shs repstg 1/1000 Pfd Ser A,19.32,,44770,Uncategorized
MS^E,Morgan Stanley DEPOSITARY SHARES REP 1/1000TH SHARES FIXED/FLTG PREFERRED STOCK SERIES E,25.34,,22366,Uncategorized
MS^F,Morgan Stanley Dep Shs Rpstg 1/1000th Int Prd Ser F Fxd to Flag,25.2215,,22483,Uncategorized
MS^I,Morgan Stanley Depository Shares Representing 1/1000th Preferred Series 1 Fixed to Floating Non (Cum),25.0699,,50991,Uncategorized
MS^K,Morgan Stanley Depositary Shares each representing 1/1000th of a share of Fixed-to-Floating Rate Non-Cumulative Preferred Stock  Series K,24.18,,43469,Uncategorized
MS^L,Morgan Stanley Depositary Shares each representing 1/1000th of a share of 4.875% Non-Cumulative Preferred Stock Series L,20.33,,22004,Uncategorized
MS^O,Morgan Stanley Depositary Shares each representing 1/1000th of a share of 4.250% Non-Cumulative Preferred Stock Series O,17.34,,43677,Uncategorized
MS^P,Morgan Stanley Depositary Shares each representing 1/1000th of a share of 6.500% Non-Cumulative Preferred Stock Series P,25.225,,69405,Uncategorized
MS^Q,Morgan Stanley Depositary Shares each representing 1/1000th of a share of 6.625% Non-Cumulative Preferred Stock Series Q,25.5,,55907,Uncategorized
MTB^H,M&T Bank Corporation Perpetual Fixed-to-Floating Rate Non-Cumulative Preferred Stock Series H,25.055,,11669,Uncategorized
MTB^J,M&T Bank Corporation Depositary Shares each representing a 1/400th ownership interest in a share of Perpetual 7.500% Non-Cumulative Preferred Stock Series J,26.37,,29985,Uncategorized
MTB^K,M&T Bank Corporation Depositary Shares each representing a 1/400th interest in a share of Perpetual 6.350% Non-Cumulative Preferred Stock Series K,25.01,,71530,Uncategorized
NCV^A,Virtus Convertible & Income Fund 5.625% Series A Cumulative Preferred Shares,20.79,,4930,Uncategorized
NCZ^A,Virtus Convertible & Income Fund II 5.50% Series A Cumulative Preferred Shares,20.34,,7453,Uncategorized
NEE^N,NextEra Energy Capital Holdings Inc. Series N Junior Subordinated Debentures due March 1 2079,23.83,,29493,Uncategorized
NEE^S,NextEra Energy Inc. 7.299% Corporate Units,57.15,,65491,Uncategorized
NEE^T,NextEra Energy Inc. 7.234% Corporate Units,52.98,,985221,Uncategorized
NEE^U,NextEra Energy Inc. Series U Junior Subordinated Debentures due June 1 2085,25.36,,46021,Uncategorized
NEE^V,NextEra Energy Inc. 7.375% Corporate Units,50.95,,143447,Uncategorized
NEE^W,NextEra Energy Capital Holdings Inc. Series Z Junior Subordinated Debentures due April 15 2086,25.13,,51611,Uncategorized
NGL^B,NGL ENERGY PARTNERS LP 9.00% Class B Fixed-to-Floating Rate Cumulative Redeemable Perpetual Preferred Units representing limited partnership interests,25.25,,15031,Uncategorized
NGL^C,NGL ENERGY PARTNERS LP 9.625% Class C Fixed-to-Floating Rate Cumulative  Redeemable Perpetual Preferred Units representing  limited partner interests,25.51,,1618,Uncategorized
NLY^F,Annaly Capital Management Inc 6.95% Series F,25.8769,,56785,Uncategorized
NLY^G,Annaly Capital Management Inc 6.50% Series G Fixed-to-Floating Rate Cumulative Redeemable Preferred Stock,25.07,,14962,Uncategorized
NLY^I,Annaly Capital Management Inc 6.750% Series I Fixed-to-Floating Rate Cumulative Redeemable Preferred Stock,25.625,,17188,Uncategorized
NLY^J,Annaly Capital Management Inc. 8.875% Series J Fixed-Rate Cumulative Redeemable Preferred Stock,25.9942,,52657,Uncategorized
NREF^A,NexPoint Real Estate Finance Inc. 8.50% Series A Cumulative Redeemable Preferred Stock,22.8302,,329,Uncategorized
NSA^A,National Storage Affiliates Trust 6.000% Series A Cumulative Redeemable Preferred Shares of Beneficial Interest (Liquidation Preference $25.00 per share),23.0,,3033,Uncategorized
NSA^B,National Storage Affiliates Trust 6.000% Series B Cumulative Redeemable Preferred Shares of Beneficial Interest,32.5,,2757,Uncategorized
NXDT^A,NexPoint Diversified Real Estate Trust 5.50% Series A Cumulative Preferred Shares ($25.00 liquidation preference per share),13.29,,643,Uncategorized
OAK^A,Brookfield Oaktree Holdings LLC 6.625% Series A Preferred Units,20.8749,,7042,Uncategorized
OAK^B,Brookfield Oaktree Holdings LLC 6.550% Series B Preferred Units,20.5,,6498,Uncategorized
OPP^A,RiverNorth/DoubleLine Strategic Opportunity Fund Inc. 4.375% Series A Cumulative Preferred Stock,16.78,,2718,Uncategorized
