symbol,name,price,marketCap,volume,industry
BML^L,Bank of America Corporation Depositary Shares (Each representing a 1/1200th Interest in a Share of Floating Rate Non-Cumulative Preferred Stock Series 5),19.75,,5424,Uncategorized
BOH^A,Bank of Hawaii Corporation Depositary Shares Each Representing a 1/40th Interest in a Share of 4.375% Fixed Rate Non-Cumulative Perpetual Preferred Stock Series A,16.22,,23747,Uncategorized
BOH^B,Bank of Hawaii Corporation Depositary Shares Each Representing a 1/40th Interest in a Share of 8.000% Fixed Rate Non-Cumulative Perpetual Preferred Stock Series B,26.57,,5590,Uncategorized
BW^A,Babcock & Wilcox Enterprises Inc. 7.75% Series A Cumulative Perpetual Preferred Stock,21.81,,22192,Uncategorized
C^N,Citigroup Capital XIII 7.875% Fixed rate Floating Rate trust Preferred Securities (TruPS),29.37,,113318,Uncategorized
C^R,Citigroup Inc. Depositary Shares Each Representing a 1/1000th Interest in a Share of 6.250% Noncumulative Preferred Stock Series II,24.98,,111185,Uncategorized
CDR^B,Cedar Realty Trust Inc. 7.25% Series B Cumulative Redeemable Preferred Stock,21.61,,3281,Uncategorized
CDR^C,Cedar Realty Trust Inc. 6.50% Series C Cumulative Redeemable Preferred Stock,20.95,,4938,Uncategorized
CFG^E,Citizens Financial Group Inc. Depositary Shares Each Representing 1/40th Interest in a Share of 5.000% Fixed-Rate Non-Cumulative Perpetual Preferred Stock Series E,19.24,,26629,Uncategorized
CFG^H,Citizens Financial Group Inc. Depositary Shares Each Representing a 1/40th Interest in a Share of 7.375% Fixed-Rate Non-Cumulative Perpetual Preferred Stock Series H,26.19,,22956,Uncategorized
CFG^I,Citizens Financial Group Inc. Depositary Shares Each Representing a 1/40th Interest in a Share of 6.500% Fixed-Rate Reset Non-Cumulative Perpetual Preferred Stock Series I,25.24,,8941,Uncategorized
CFR^B,Cullen/Frost Bankers Inc. Depositary Shares each representing a 1/40th ownership interest in a share of 4.450% non-cumulative perpetual preferred stock Series B,17.1999,,8565,Uncategorized
CIM^A,Chimera Investment Corporation 8.00% Series A Cumulative Redeemable Preferred Stock,21.57,,5800,Uncategorized
CIM^B,Chimera Investment Corporation 8.00% Series B Fixed-to-Floating Rate Cumulative Redeemable Preferred Stock,24.62,,63369,Uncategorized
CIM^C,Chimera Investment Corporation 7.75% Series C Fixed-to-Floating Rate  Cumulative Redeemable  Preferred Stock,23.35,,23123,Uncategorized
CIM^D,Chimera Investment Corporation 8.00% Series D Fixed-to-Floating Rate Cumulative Redeemable Preferred Stock,24.54,,7257,Uncategorized
CLDT^A,Chatham Lodging Trust (REIT) 6.625% Series A Cumulative Redeemable Preferred Shares of Beneficial Interest,20.44,,11668,Uncategorized
CMS^B,CMS Energy Corporation Preferred Stock,78.8001,,510,Uncategorized
CMS^C,CMS Energy Corporation Depositary Shares each representing a 1/1000th interest in a share of 4.200% Cumulative Redeemable Perpetual Preferred Stock Series C,17.29,,13661,Uncategorized
CNO^A,CNO Financial Group Inc. 5.125% Subordinated Debentures due 2060,18.17,,625,Uncategorized
CODI^A,Compass Diversified Holdings 7.250% Series A Preferred Shares representing beneficial interest in Compass Diversified Holdings,20.54,,5698,Uncategorized
CODI^B,Compass Diversified Holdings 7.875% Series B Fixed-to-Floating Rate Cumulative Preferred Shares representing beneficial interests in Compass Diversified Holdings,22.465,,7291,Uncategorized
CODI^C,Compass Diversified Holdings 7.875% Series C Cumulative Preferred Shares,21.96,,20299,Uncategorized
COF^I,Capital One Financial Corporation Depositary shares each representing a 1/40th interest in a share of Fixed Rate Non-Cumulative Perpetual Preferred Stock Series I of the Issuer,19.21,,81280,Uncategorized
COF^J,Capital One Financial Corporation Depositary Shares Each Representing a 1/40th Interest in a Share of Fixed Rate Non- Cumulative Perpetual Preferred Stock Series J,18.37,,64751,Uncategorized
COF^K,Capital One Financial Corporation Depositary Shares Each Representing a 1/40th Ownership Interest in a Share of Fixed Rate Non-Cumulative Perpetual Preferred Stock Series K,17.75,,7142,Uncategorized
COF^L,Capital One Financial Corporation Depositary Shares Each Representing a 1/40th Interest in a Share of Fixed Rate Non-Cumulative Perpetual Preferred Stock Series L,16.75,,36823,Uncategorized
COF^N,Capital One Financial Corporation Depositary Shares Each Representing a 1/40th Ownership Interest in a Share of Fixed Rate Non-Cumulative Perpetual Preferred Stock Series N,16.305,,12483,Uncategorized
CRD/A,Crawford & Company,9.99,,45769,Uncategorized
CRD/B,Crawford & Company,9.36,,2498,Uncategorized
CTA^A,EIDP Inc. Preferred Stock $3.50 Series,54.25,,755,Uncategorized
CTA^B,EIDP Inc. Preferred Stock $4.50 Series,68.2301,,1623,Uncategorized
CTO^A,CTO Realty Growth Inc. 6.375% Series A Cumulative Redeemable Preferred Stock,21.8501,,8673,Uncategorized
DBRG^H,DigitalBridge Group Inc. 7.125% Series H ,16.4,,9592,Uncategorized
DBRG^I,DigitalBridge Group Inc. 7.15% Series I ,16.28,,34067,Uncategorized
DBRG^J,DigitalBridge Group Inc. 7.125% Series J ,16.04,,13548,Uncategorized
DCOM^,Dime Community Bancshares Inc. Fixed-Rate Non-Cumulative Perpetual Preferred Stock Series A,19.25,,2282,Uncategorized
DLR^J,Digital Realty Trust Inc. 5.250% Series J Cumulative Redeemable Preferred Stock,20.56,,5611,Uncategorized
DLR^K,Digital Realty Trust Inc. 5.850% Series K Cumulative Redeemable Preferred Stock par value $0.01 per share,22.94,,15057,Uncategorized
DLR^L,Digital Realty Trust Inc. 5.200% Series L Cumulative Redeemable Preferred Stock,20.37,,18667,Uncategorized
DUK^A,Duke Energy Corporation Depositary Shares each representing a 1/1000th interest in a share of 5.75% Series A Cumulative Redeemable Perpetual Preferred Stock,25.17,,61621,Uncategorized
DX^C,Dynex Capital Inc. 6.900% Series C Fixed-to-Floating Rate Cumulative Redeemable Preferred Stock,25.8,,3816,Uncategorized
ECC^D,Eagle Point Credit Company Inc. 6.75% Series D Preferred Stock,19.18,,12639,Uncategorized
ECF^A,Ellsworth Growth and Income Fund Ltd. 5.25% Series A Cumulative Preferred Shares (Liquidation Preference $25.00 per share),21.4817,,498,Uncategorized
EFC^B,Ellington Financial Inc. 6.250% Series B Fixed-Rate Reset Cumulative Redeemable Preferred Stock,24.69,,1796,Uncategorized
EFC^C,Ellington Financial Inc. 8.625% Series C Fixed-Rate Reset Cumulative Redeemable Preferred Stock,25.59,,1912,Uncategorized
EFC^D,Ellington Financial Inc. 7.00% Series D Cumulative Perpetual Redeemable Preferred Stock,23.24,,133,Uncategorized
EP^C,El Paso Corporation Preferred Stock,50.5,,1311,Uncategorized
EPR^C,EPR Properties 5.75% Series C Cumulative Convertible Preferred Shares,25.9099,,1892,Uncategorized
EPR^E,EPR Properties Series E Cumulative Conv Pfd Shs Ser E,32.84,,4484,Uncategorized
EPR^G,EPR Properties 5.750% Series G Cumulative Redeemable Preferred Shares,20.26,,4155,Uncategorized
EQH^A,Equitable Holdings Inc. Depositary Shares,19.99,,53837,Uncategorized
EQH^C,Equitable Holdings Inc. Depositary Shares each representing a 1/1000th interest in a share of Fixed Rate Noncumulative Perpetual Preferred Stock Series C,16.42,,13860,Uncategorized
ET^I,Energy Transfer L.P. Series I Fixed Rate Perpetual Preferred Units,11.58,,53249,Uncategorized
ETI^,Entergy Texas Inc 5.375% Series A Preferred Stock Cumulative No Par Value,24.1,,1473,Uncategorized
F^B,Ford Motor Company 6.20% Notes due June 1 2059,21.63,,45648,Uncategorized
F^C,Ford Motor Company 6% Notes due December 1 2059,21.04,,46992,Uncategorized
F^D,Ford Motor Company 6.500% Notes due August 15 2062,22.375,,48806,Uncategorized
FBRT^E,Franklin BSP Realty Trust Inc. 7.50% Series E Cumulative Redeemable Preferred Stock,20.03,,28567,Uncategorized
FHN^E,First Horizon Corporation Depositary Shares each representing a 1/4000th interest in a share of Non-Cumulative Perpetual Preferred Stock Series E,24.8893,,1151,Uncategorized
FHN^F,First Horizon Corporation Depositary Shares each representing 1/4000th Interest in a Share of Non-Cumulative Perpetual Preferred Stock Series F,17.98,,11853,Uncategorized
FHN^H,First Horizon Corporation Depositary Shares each representing a 1/4000th interest in a share of Non-Cumulative Perpetual Preferred Stock Series H,25.14,,17431,Uncategorized
FLG^A,Flagstar Bank N.A. Depositary shares each representing a 1/40th interest in a share of Fixed-to-Floating Rate Series A Noncumulative Perpetual Preferred Stock,23.06,,24098,Uncategorized
FLG^U,Flagstar Bank N.A. Bifurcated Option Note Unit SecuritiES,41.65,,5652,Uncategorized
FOUR^A,Shift4 Payments Inc. 6.00% Series A Mandatory Convertible Preferred Stock,54.56,,7488,Uncategorized
FRT^C,Federal Realty Investment Trust Depositary Shares each representing a 1/1000th interest in a 5.000% Series C Cumulative Redeemable Preferred Share,19.61,,3235,Uncategorized
GAB^G,Gabelli Equity Trust Inc. (The) Series G Cumulative Preferred Stock,20.3,,1154,Uncategorized
GAB^H,Gabelli Equity Trust Inc. (The) Pfd Ser H,20.315,,5759,Uncategorized
GAB^K,Gabelli Equity Trust Inc. (The) 5.00% Series K Cumulative Preferred Stock,20.5401,,1537,Uncategorized
GAM^B,General American Investors Company Inc. Cumulative Preferred Stock,24.98,,2879,Uncategorized
GDV^H,The Gabelli Dividend & Income Trust 5.375% Series H Cumulative Preferred Shares,22.21,,7058,Uncategorized
GDV^K,The Gabelli Dividend & Income Trust 4.250% Series K Cumulative Preferred Shares,17.99,,3872,Uncategorized
GGN^B,GAMCO Global Gold Natural Reources & Income Trust 5.00% Series B Cumulative 25.00 Liquidation Preference,20.16,,2287,Uncategorized
GGT^E,Gabelli Multi-Media Trust Inc. (The) 5.125% Series E Cumulative Preferred Stock,20.24,,244,Uncategorized
GGT^G,Gabelli Multi-Media Trust Inc. (The) 5.125% Series G Cumulative Preferred Shares,20.542,,493,Uncategorized
GL^D,Globe Life Inc. 4.25% Junior Subordinated Debentures due 2061,15.98,,6257,Uncategorized
GLP^B,Global Partners LP 9.50% Series B Fixed Rate Cumulative Redeemable Perpetual Preferred Units representing limited partner interests,25.3865,,7499,Uncategorized
GLU^A,The Gabelli Global Utility and Income Trust Series A Cumulative Puttable and Callable Preferred Shares,55.5,,540,Uncategorized
GNL^A,Global Net Lease Inc. 7.25% Series A Cumulative Redeemable Preferred Stock $0.01 par value per share,22.86,,10734,Uncategorized
GNL^B,Global Net Lease Inc. 6.875% Series B Cumulative Redeemable Perpetual Preferred Stock,21.63,,2013,Uncategorized
GNL^D,Global Net Lease Inc. 7.50% Series D Cumulative Redeemable Perpetual Preferred Stock,23.76,,8138,Uncategorized
GNL^E,Global Net Lease Inc. 7.375% Series E Cumulative Redeemable Perpetual Preferred Stock,23.16,,5711,Uncategorized
GNT^A,GAMCO Natural Resources Gold & Income Tust  5.20% Series A Cumulative Preferred Shares (Liquidation Preference $25.00 per share),20.6,,306,Uncategorized
GPMT^A,Granite Point Mortgage Trust Inc. 7.00% Series A Fixed-to-Floating Rate Cumulative Redeemable Preferred Stock,19.95,,5752,Uncategorized
GPUS^D,Hyperscale Data Inc. 13.00% Series D Cumulative Redeemable Perpetual Preferred Stock,19.675,,255,Uncategorized
GRBK^A,Green Brick Partners Inc. Depositary Shares (each representing a 1/1000th fractional interest in a share of 5.75% Series A Cumulative Perpetual Preferred Stock),23.45,,1055,Uncategorized
GS^A,Goldman Sachs Group Inc. (The) Depositary Shares each representing 1/1000th Interest in a Share of Floating Rate Non-Cumulative Preferred Stock Series A,19.44,,43100,Uncategorized
GS^C,Goldman Sachs Group Inc. (The) Depositary Share repstg 1/1000th Preferred Series C,19.5599,,11153,Uncategorized
GS^D,Goldman Sachs Group Inc. (The) Dep Shs repstg 1/1000 Pfd Ser D Fltg,19.15,,89397,Uncategorized
GUT^C,Gabelli Utility Trust (The) 5.375% Series C Cumulative Preferred Shares,22.465,,991,Uncategorized
HEI/A,Heico Corporation,221.64,,234359,Uncategorized
HFRO^A,Highland Opportunities and Income Fund 5.375% Series A Cumulative Preferred Shares,16.605,,10469,Uncategorized
HFRO^B,Highland Opportunities and Income Fund 5.375% Series B Cumulative Preferred Shares,16.42,,3309,Uncategorized
HIG^G,The Hartford Insurance Group Inc. Depositary Shares each representing a 1/1000th interest in a share of 6.000% Non-Cumulative Preferred Stock Series G,25.0,,13734,Uncategorized
HL^B,Hecla Mining Company Preferred Stock,69.0,,603,Uncategorized
HPE^C,Hewlett Packard Enterprise Company 7.625% Series C Mandatory Convertible Preferred Stock,83.22,,24186,Uncategorized
HPP^C,Hudson Pacific Properties Inc. 4.750% Series C Cumulative Redeemable Preferred Stock,15.69,,7469,Uncategorized
HVII,Hennessy Capital Investment Corp. VII Ordinary Shares,10.425,,360,Uncategorized
HVT/A,Haverty Furniture Companies Inc.,23.055,,51,Uncategorized
IIPR^A,Innovative Industrial Properties Inc. 9.00% Series A Cumulative Redeemable Preferred Stock,23.9,,309475,Uncategorized
INN^E,Summit Hotel Properties Inc. 6.250% Series E Cumulative Redeemable Preferred Stock,18.74,,14035,Uncategorized
INN^F,Summit Hotel Properties Inc. 5.875% Series F Cumulative Redeemable Preferred Stock $0.01 par value per share,17.67,,16992,Uncategorized
IVR^C,INVESCO MORTGAGE CAPITAL INC 7.5% Fixed-to-Floating Series C Cumulative Redeemable Preferred Stock Liquation Preference $25.00 per Share,23.87,,23776,Uncategorized
JPM^C,J P Morgan Chase & Co Depositary Shares each representing a 1/400th interest in a share of 6.00% Non-Cumulative  Preferred Stock Series EE,25.1,,60851,Uncategorized
JPM^D,J P Morgan Chase & Co Depositary Shares each representing a 1/400th  interest in a share of 5.75% Non-Cumulative  Preferred Stock Series DD,24.32,,109088,Uncategorized
JPM^J,J P Morgan Chase & Co Depositary Shares each representing a 1/400th interest in a share of JPMorgan Chase & Co. 4.75% Non-Cumulative Preferred Stock Series GG,19.75,,61110,Uncategorized
JPM^K,J P Morgan Chase & Co Depositary Shares each representing a 1/400th interest in a share of 4.55% Non-Cumulative Preferred Stock Series JJ,18.94,,81909,Uncategorized
JPM^L,J P Morgan Chase & Co Depositary Shares each representing a 1/400th interest in a share of 4.625% Non-Cumulative Preferred Stock Series LL,19.2,,80531,Uncategorized
JPM^M,J P Morgan Chase & Co Depositary Shares each representing a 1/400th interest in a share of 4.20% Non-Cumulative Preferred Stock Series MM,17.81,,108289,Uncategorized
JXN^A,Jackson Financial Inc. Depositary Shares each representing a 1/1000th interest in a share of Fixed-Rate Reset Noncumulative Perpetual Preferred Stock Series A,26.14,,26786,Uncategorized
KEY^I,KeyCorp Depositary Shares Each Representing a 1/40th Ownership Interest in a Share of Fixed-to-Floating Rate Perpetual Non-Cumulative Preferred Stock Series E,25.14,,156025,Uncategorized
KEY^J,KeyCorp Depositary Shares each representing a 1/40th ownership interest in a share of Fixed Rate Perpetual Non-Cumulative Preferred Stock Series F,21.4,,20799,Uncategorized
KEY^K,KeyCorp Depositary Shares each representing a 1/40th ownership interest in a share of Fixed Rate Perpetual Non-Cumulative Preferred Stock Series G,21.41,,23869,Uncategorized
KEY^L,KeyCorp Depositary Shares each representing a 1/40th ownership interest in a share of Fixed Rate Perpetual Non-Cumulative Preferred Stock Series H,24.98,,25317,Uncategorized
KIM^L,Kimco Realty Corporation Class L Depositary Shares each of which represents a one-one thousandth fractional interest in a share of 5.125% Class L Cumulative Redeemable Preferred Stock liquidation preference $25000.00 per share,19.93,,8703,Uncategorized
KIM^M,Kimco Realty Corporation Class M Depositary Shares each of which represents a one-one thousandth fractional interest in a share of 5.25% Class M Cumulative Redeemable Preferred Stock liquidation preference $25000.00 per share,20.52,,19319,Uncategorized
KIM^N,Kimco Realty Corporation Depositary Shares each representing 1/1000th interest in a share of 7.25% Class N Cumulative Convertible Perpetual Preferred Stock,60.7,,9,Uncategorized
KKR^D,KKR & Co. Inc. 6.25% Series D Mandatory Convertible Preferred Stock,44.14,,149054,Uncategorized
KREF^A,KKR Real Estate Finance Trust Inc. 6.50% Series A Cumulative Redeemable Preferred Stock,18.39,,17925,Uncategorized
LFT^A,Lument Finance Trust Inc. 7.875% Series A Cumulative Redeemable Preferred Stock,19.76,,9,Uncategorized
LNC^D,Lincoln National Corporation Depositary Shares Each Representing a 1/1000th Interest in a Share of 9.000% Non-Cumulative Preferred Stock Series D,26.61,,72957,Uncategorized
LOB^A,Live Oak Bancshares Inc. Depositary Shares Each Representing a 1/40th Interest in a Share of 8.375% Fixed Rate Series A Non-Cumulative Perpetual Preferred Stock,25.37,,2954,Uncategorized
LXP^C,LXP Industrial Trust 6.5% Series C Cumulative Convertible Preferred Stock,46.35,,1447,Uncategorized
MAA^I,Mid-America Apartment Communities Inc. 8.50% Series I Cumulative Redeemable Preferred Stock,53.7717,,109,Uncategorized
MDV^A,Modiv Industrial Inc. 7.375% Series A Cumulative Redeemable Perpetual Preferred Stock,24.9001,,1583,Uncategorized
MER^K,Bank of America Corporation Income Capital Obligation Notes initially due December 15 2066,25.55,,16328,Uncategorized
MET^A,MetLife Inc. Preferred Series A Floating Rate,21.81,,17175,Uncategorized
MET^E,MetLife Inc. Depositary Shares ,23.05,,49534,Uncategorized
MET^F,MetLife Inc. Depositary Shares each representing a 1/1000th interest in a share of 4.75% Non-Cumulative Preferred Stock Series F,19.28,,61848,Uncategorized
MFA^B,MFA Financial Inc. Preferred Series B,21.0,,8002,Uncategorized
MFA^C,MFA Financial Inc. 6.50% Series C Fixed-to-Floating Rate Cumulative Redeemable Preferred Stock,23.85,,23046,Uncategorized
MITT^A,TPG Mortgage Investment Trust Inc. 8.25% Series A Cumulative Redeemable Preferred Stock,23.1055,,2652,Uncategorized
MITT^B,TPG Mortgage Investment Trust Inc. 8.00% Series B Cumulative Redeemable Preferred Stock,22.79,,10370,Uncategorized
MITT^C,TPG Mortgage Investment Trust Inc. 8.00% Series C Fixed-to-Floating Rate Cumulative Redeemable Preferred Stock $0.01 par value per share,25.375,,24216,Uncategorized
MS^A,Morgan Stanley Dep Shs repstg 1/1000 Pfd Ser A,19.54,,67698,Uncategorized
MS^E,Morgan Stanley DEPOSITARY SHARES REP 1/1000TH SHARES FIXED/FLTG PREFERRED STOCK SERIES E,25.42,,41199,Uncategorized
MS^F,Morgan Stanley Dep Shs Rpstg 1/1000th Int Prd Ser F Fxd to Flag,25.25,,33491,Uncategorized
MS^I,Morgan Stanley Depository Shares Representing 1/1000th Preferred Series 1 Fixed to Floating Non (Cum),25.1,,43387,Uncategorized
MS^K,Morgan Stanley Depositary Shares each representing 1/1000th of a share of Fixed-to-Floating Rate Non-Cumulative Preferred Stock  Series K,24.2,,54490,Uncategorized
MS^L,Morgan Stanley Depositary Shares each representing 1/1000th of a share of 4.875% Non-Cumulative Preferred Stock Series L,20.535,,23170,Uncategorized
MS^O,Morgan Stanley Depositary Shares each representing 1/1000th of a share of 4.250% Non-Cumulative Preferred Stock Series O,17.405,,26148,Uncategorized
MS^P,Morgan Stanley Depositary Shares each representing 1/1000th of a share of 6.500% Non-Cumulative Preferred Stock Series P,25.3,,32620,Uncategorized
MS^Q,Morgan Stanley Depositary Shares each representing 1/1000th of a share of 6.625% Non-Cumulative Preferred Stock Series Q,25.58,,36458,Uncategorized
MTB^H,M&T Bank Corporation Perpetual Fixed-to-Floating Rate Non-Cumulative Preferred Stock Series H,25.2199,,9783,Uncategorized
MTB^J,M&T Bank Corporation Depositary Shares each representing a 1/400th ownership interest in a share of Perpetual 7.500% Non-Cumulative Preferred Stock Series J,26.77,,16022,Uncategorized
MTB^K,M&T Bank Corporation Depositary Shares each representing a 1/400th interest in a share of Perpetual 6.350% Non-Cumulative Preferred Stock Series K,25.06,,17166,Uncategorized
NCV^A,Virtus Convertible & Income Fund 5.625% Series A Cumulative Preferred Shares,20.94,,5632,Uncategorized
NCZ^A,Virtus Convertible & Income Fund II 5.50% Series A Cumulative Preferred Shares,20.21,,2587,Uncategorized
NEE^N,NextEra Energy Capital Holdings Inc. Series N Junior Subordinated Debentures due March 1 2079,23.96,,28648,Uncategorized
NEE^S,NextEra Energy Inc. 7.299% Corporate Units,56.81,,54471,Uncategorized
NEE^T,NextEra Energy Inc. 7.234% Corporate Units,52.04,,58908,Uncategorized
NEE^U,NextEra Energy Inc. Series U Junior Subordinated Debentures due June 1 2085,25.335,,35323,Uncategorized
NEE^V,NextEra Energy Inc. 7.375% Corporate Units,50.53,,24221,Uncategorized
NEE^W,NextEra Energy Capital Holdings Inc. Series Z Junior Subordinated Debentures due April 15 2086,25.27,,23961,Uncategorized
NGL^B,NGL ENERGY PARTNERS LP 9.00% Class B Fixed-to-Floating Rate Cumulative Redeemable Perpetual Preferred Units representing limited partnership interests,25.39,,9772,Uncategorized
NGL^C,NGL ENERGY PARTNERS LP 9.625% Class C Fixed-to-Floating Rate Cumulative  Redeemable Perpetual Preferred Units representing  limited partner interests,25.4,,2100,Uncategorized
NLY^F,Annaly Capital Management Inc 6.95% Series F,26.06,,21824,Uncategorized
NLY^G,Annaly Capital Management Inc 6.50% Series G Fixed-to-Floating Rate Cumulative Redeemable Preferred Stock,25.36,,27541,Uncategorized
NLY^I,Annaly Capital Management Inc 6.750% Series I Fixed-to-Floating Rate Cumulative Redeemable Preferred Stock,25.68,,46369,Uncategorized
NLY^J,Annaly Capital Management Inc. 8.875% Series J Fixed-Rate Cumulative Redeemable Preferred Stock,26.06,,441820,Uncategorized
NREF^A,NexPoint Real Estate Finance Inc. 8.50% Series A Cumulative Redeemable Preferred Stock,22.86,,5833,Uncategorized
NSA^A,National Storage Affiliates Trust 6.000% Series A Cumulative Redeemable Preferred Shares of Beneficial Interest (Liquidation Preference $25.00 per share),23.26,,6813,Uncategorized
NSA^B,National Storage Affiliates Trust 6.000% Series B Cumulative Redeemable Preferred Shares of Beneficial Interest,31.34,,1196,Uncategorized
NXDT^A,NexPoint Diversified Real Estate Trust 5.50% Series A Cumulative Preferred Shares ($25.00 liquidation preference per share),13.2812,,3737,Uncategorized
OAK^A,Brookfield Oaktree Holdings LLC 6.625% Series A Preferred Units,21.15,,12176,Uncategorized
OAK^B,Brookfield Oaktree Holdings LLC 6.550% Series B Preferred Units,21.1,,8079,Uncategorized
OPP^A,RiverNorth/DoubleLine Strategic Opportunity Fund Inc. 4.375% Series A Cumulative Preferred Stock,16.6608,,1134,Uncategorized
OPP^B,RiverNorth/DoubleLine Strategic Opportunity Fund Inc. 4.75% Series B Cumulative Preferred Stock,18.45,,3953,Uncategorized
ORCL^D,Oracle Corporation Depositary Shares each representing a 1/2000th interest in a sh of 6.50% Series D Mandatory Convertible Preferred Stock,57.82,,277366,Uncategorized
PBI^B,Pitney Bowes Inc 6.70% Notes Due 2043,21.29,,15046,Uncategorized
PCG^A,Pacific Gas & Electric Co. 6% Preferred Stock,22.785,,1914,Uncategorized
PCG^B,Pacific Gas & Electric Co. 5 1/2% Preferred Stock,20.32,,5634,Uncategorized
PCG^C,Pacific Gas & Electric Co. 5% 1st Preferred Stock,19.0,,217,Uncategorized
PCG^D,Pacific Gas & Electric Co. 5% 1st  Red. Preferred Stock,18.3,,694,Uncategorized
PCG^E,Pacific Gas & Electric Co. 5% 1st A Preferred Stock,19.15,,1151,Uncategorized
PCG^G,Pacific Gas & Electric Co. 4.80% 1st Preferred Stock,18.01,,106,Uncategorized
PCG^H,Pacific Gas & Electric Co. 4.50% 1st Preferred Stock,17.0,,1849,Uncategorized
PCG^I,Pacific Gas & Electric Co. 4.36% 1st Preferred Stock,17.06,,1876,Uncategorized
PCG^X,PG&E Corp 6.000% Series A Mandatory Convertible Preferred Stock,40.97,,52999,Uncategorized
PEB^E,Pebblebrook Hotel Trust 6.375% Series E Cumulative Redeemable Preferred Shares of Beneficial Interest,19.9,,22538,Uncategorized
PEB^F,Pebblebrook Hotel Trust 6.3% Series F Cumulative Redeemable Preferred Shares of Beneficial Interest,19.9,,16419,Uncategorized
PEB^G,Pebblebrook Hotel Trust 6.375% Series G Cumulative Redeemable Preferred Shares of Beneficial Interest,19.89,,31138,Uncategorized
PEB^H,Pebblebrook Hotel Trust 5.700% Series H Cumulative Redeemable Preferred Shares of Beneficial Interest,17.9299,,23309,Uncategorized
PINE^A,Alpine Income Property Trust Inc. 8.00% Series A Cumulative Redeemable Preferred Stock,25.28,,1236,Uncategorized
PMT^A,PennyMac Mortgage Investment Trust 8.125% Series A Fixed-to-Floating Rate Cumulative Redeemable Preferred Shares of Beneficial Interest,23.23,,3892,Uncategorized
PMT^B,PennyMac Mortgage Investment Trust 8.00% Series B Fixed-to-Floating Rate Cumulative Redeemable Preferred Shares of Beneficial Interest,23.05,,10932,Uncategorized
PMT^C,PennyMac Mortgage Investment Trust 6.75% Series C Cumulative Redeemable Preferred Shares of Beneficial Interest,18.35,,33892,Uncategorized
PNFP^A,Pinnacle Financial Partners Inc. Fixed-to-Floating Rate Non-Cumulative Perpetual Preferred Stock Series A,25.72,,18456,Uncategorized
PNFP^B,Pinnacle Financial Partners Inc. Fixed-to-Floating Rate Non-Cumulative Perpetual Preferred Stock Series B,26.34,,10052,Uncategorized
PNFP^C,Pinnacle Financial Partners Inc. Fixed-to-Floating Rate Non-Cumulative Perpetual Preferred Stock Series C,25.37,,3453,Uncategorized
PSA^F,Public Storage Depositary Shares Each Representing 1/1000 of a 5.15% Cumulative Preferred Share of Beneficial Interest Series F par value $0.01 per share,20.73,,17808,Uncategorized
PSA^G,Public Storage Depositary Shares Each Representing 1/1000 of a 5.05% Cumulative Preferred Share of Beneficial Interest Series G,20.41,,14750,Uncategorized
PSA^H,Public Storage Depositary Shares Each Representing 1/1000 of a  5.60% Cumulative Preferred  Share of Beneficial Interest Series H,22.61,,21486,Uncategorized
PSA^I,Public Storage Depositary Shares Each Representing 1/1000 of a 4.875% Cumulative Preferred Share of Beneficial Interest Series I par value $0.01 per share,19.47,,12460,Uncategorized
PSA^J,Public Storage Depositary Shares Each Representing 1/1000 of a 4.700% Cumulative Preferred Share of Beneficial Interest Series J par value $0.01 per share,18.52,,7880,Uncategorized
