symbol,name,price,marketCap,volume,industry
BAC^P,Bank of America Corporation Depositary Shares each representing a 1/1000th interest in a share of 4.125% Non-Cumulative Preferred Stock Series PP,16.73,,35197,Uncategorized
BAC^Q,Bank of America Corporation Depositary shares each representing 1/1000th interest in a share of 4.250% Non-Cumulative Preferred Stock Series QQ,17.36,,72150,Uncategorized
BAC^S,Bank of America Corporation Depositary shares each representing 1/1000th interest in a share of 4.750% Non-Cumulative Preferred Stock Series SS,19.5,,29481,Uncategorized
BANC^F,Banc of California Inc. Depositary Shares each representing a 1/40th interest in a share of 7.75% non-cumulative perpetual preferred stock Series F,25.42,,10551,Uncategorized
BC^C,Brunswick Corporation 6.375% Notes due 2049,24.03,,8343,Uncategorized
BCV^A,Bancroft Fund Limited 5.375% Series A Cumulative Preferred Shares,21.3588,,3972,Uncategorized
BF/A,Brown Forman Corporation,28.4,,130781,Uncategorized
BF/B,Brown Forman Corporation,27.73,,2554184,Uncategorized
BFH^A,Bread Financial Holdings Inc. Depositary Shares each representing a 1/40th interest in a share of 8.625% Non-Cumulative Perpetual Preferred Stock Series A,25.0,,4268,Uncategorized
BFS^D,Saul Centers Inc. Depositary Shares each representing 1/100th of a share of 6.125% Series D Cumulative Redeemable Preferred Stock,20.365,,9114,Uncategorized
BFS^E,Saul Centers Inc. Depositary shares each representing a 1/100th fractional interest in a share of 6.000% Series E Cumulative Redeemable Preferred Stock,21.92,,2417,Uncategorized
BHR^B,Braemar Hotels & Resorts Inc. 5.50% Series B Cumulative Convertible Preferred Stock par value $0.01 per share,14.8,,3471,Uncategorized
BHR^D,Braemar Hotels & Resorts Inc. 8.25% Series D Cumulative Preferred Stock  par value $0.01 per share,16.4,,2243,Uncategorized
BIO/B,Bio-Rad Laboratories Inc.,299.45,,3,Uncategorized
BK^K,The Bank Of New York Mellon Corporation  Depositary Shares each representing a 1/4000th interest in a share of Series K Noncumulative Perpetual Preferred Stock,25.42,,10184,Uncategorized
BML^G,Bank of America Corporation Depositary Shares (Each representing a 1/1200th interest in a share of Floating Rate Non-Cumulative Preferred Stock  Series 1),19.305,,12136,Uncategorized
BML^H,Bank of America Corporation Depositary Shares (Each representing a 1/1200th interest in a Share of Floating Rate Non-Cumulative Preferred Stock Series 2),19.2322,,9262,Uncategorized
BML^J,Bank of America Corporation Depositary Shares (Each representing a 1/1200th interest in a Share of Floating Rate Non-Cumulative Preferred Stock Series 4),19.8,,24306,Uncategorized
BML^L,Bank of America Corporation Depositary Shares (Each representing a 1/1200th Interest in a Share of Floating Rate Non-Cumulative Preferred Stock Series 5),19.575,,4787,Uncategorized
BOH^A,Bank of Hawaii Corporation Depositary Shares Each Representing a 1/40th Interest in a Share of 4.375% Fixed Rate Non-Cumulative Perpetual Preferred Stock Series A,16.25,,2189,Uncategorized
BOH^B,Bank of Hawaii Corporation Depositary Shares Each Representing a 1/40th Interest in a Share of 8.000% Fixed Rate Non-Cumulative Perpetual Preferred Stock Series B,26.32,,29271,Uncategorized
BW^A,Babcock & Wilcox Enterprises Inc. 7.75% Series A Cumulative Perpetual Preferred Stock,21.32,,38275,Uncategorized
C^N,Citigroup Capital XIII 7.875% Fixed rate Floating Rate trust Preferred Securities (TruPS),30.0,,100564,Uncategorized
C^R,Citigroup Inc. Depositary Shares Each Representing a 1/1000th Interest in a Share of 6.250% Noncumulative Preferred Stock Series II,25.38,,87018,Uncategorized
CDR^B,Cedar Realty Trust Inc. 7.25% Series B Cumulative Redeemable Preferred Stock,20.875,,615,Uncategorized
CDR^C,Cedar Realty Trust Inc. 6.50% Series C Cumulative Redeemable Preferred Stock,20.94,,1613,Uncategorized
CFG^E,Citizens Financial Group Inc. Depositary Shares Each Representing 1/40th Interest in a Share of 5.000% Fixed-Rate Non-Cumulative Perpetual Preferred Stock Series E,19.33,,29455,Uncategorized
CFG^H,Citizens Financial Group Inc. Depositary Shares Each Representing a 1/40th Interest in a Share of 7.375% Fixed-Rate Non-Cumulative Perpetual Preferred Stock Series H,25.85,,17488,Uncategorized
CFG^I,Citizens Financial Group Inc. Depositary Shares Each Representing a 1/40th Interest in a Share of 6.500% Fixed-Rate Reset Non-Cumulative Perpetual Preferred Stock Series I,25.21,,5022,Uncategorized
CFR^B,Cullen/Frost Bankers Inc. Depositary Shares each representing a 1/40th ownership interest in a share of 4.450% non-cumulative perpetual preferred stock Series B,17.15,,3588,Uncategorized
CIM^A,Chimera Investment Corporation 8.00% Series A Cumulative Redeemable Preferred Stock,21.6,,8380,Uncategorized
CIM^B,Chimera Investment Corporation 8.00% Series B Fixed-to-Floating Rate Cumulative Redeemable Preferred Stock,24.31,,17042,Uncategorized
CIM^C,Chimera Investment Corporation 7.75% Series C Fixed-to-Floating Rate  Cumulative Redeemable  Preferred Stock,22.74,,16864,Uncategorized
CIM^D,Chimera Investment Corporation 8.00% Series D Fixed-to-Floating Rate Cumulative Redeemable Preferred Stock,24.24,,3855,Uncategorized
CLDT^A,Chatham Lodging Trust (REIT) 6.625% Series A Cumulative Redeemable Preferred Shares of Beneficial Interest,20.23,,9788,Uncategorized
CMS^B,CMS Energy Corporation Preferred Stock,79.13,,674,Uncategorized
CMS^C,CMS Energy Corporation Depositary Shares each representing a 1/1000th interest in a share of 4.200% Cumulative Redeemable Perpetual Preferred Stock Series C,17.21,,8508,Uncategorized
CNO^A,CNO Financial Group Inc. 5.125% Subordinated Debentures due 2060,18.0501,,3785,Uncategorized
CODI^A,Compass Diversified Holdings 7.250% Series A Preferred Shares representing beneficial interest in Compass Diversified Holdings,20.75,,1799,Uncategorized
CODI^B,Compass Diversified Holdings 7.875% Series B Fixed-to-Floating Rate Cumulative Preferred Shares representing beneficial interests in Compass Diversified Holdings,22.13,,7672,Uncategorized
CODI^C,Compass Diversified Holdings 7.875% Series C Cumulative Preferred Shares,21.65,,54995,Uncategorized
COF^I,Capital One Financial Corporation Depositary shares each representing a 1/40th interest in a share of Fixed Rate Non-Cumulative Perpetual Preferred Stock Series I of the Issuer,19.0327,,49074,Uncategorized
COF^J,Capital One Financial Corporation Depositary Shares Each Representing a 1/40th Interest in a Share of Fixed Rate Non- Cumulative Perpetual Preferred Stock Series J,18.29,,38175,Uncategorized
COF^K,Capital One Financial Corporation Depositary Shares Each Representing a 1/40th Ownership Interest in a Share of Fixed Rate Non-Cumulative Perpetual Preferred Stock Series K,17.62,,9694,Uncategorized
COF^L,Capital One Financial Corporation Depositary Shares Each Representing a 1/40th Interest in a Share of Fixed Rate Non-Cumulative Perpetual Preferred Stock Series L,16.57,,63210,Uncategorized
COF^N,Capital One Financial Corporation Depositary Shares Each Representing a 1/40th Ownership Interest in a Share of Fixed Rate Non-Cumulative Perpetual Preferred Stock Series N,16.15,,34966,Uncategorized
CRD/A,Crawford & Company,10.98,,30131,Uncategorized
CRD/B,Crawford & Company,10.22,,11123,Uncategorized
CTA^A,EIDP Inc. Preferred Stock $3.50 Series,54.19,,183,Uncategorized
CTA^B,EIDP Inc. Preferred Stock $4.50 Series,68.04,,833,Uncategorized
CTO^A,CTO Realty Growth Inc. 6.375% Series A Cumulative Redeemable Preferred Stock,20.75,,383,Uncategorized
DBRG^H,DigitalBridge Group Inc. 7.125% Series H ,16.9,,14418,Uncategorized
DBRG^I,DigitalBridge Group Inc. 7.15% Series I ,16.9899,,12106,Uncategorized
DBRG^J,DigitalBridge Group Inc. 7.125% Series J ,16.6001,,5487,Uncategorized
DCOM^,Dime Community Bancshares Inc. Fixed-Rate Non-Cumulative Perpetual Preferred Stock Series A,19.58,,1402,Uncategorized
DLR^J,Digital Realty Trust Inc. 5.250% Series J Cumulative Redeemable Preferred Stock,20.3,,10246,Uncategorized
DLR^K,Digital Realty Trust Inc. 5.850% Series K Cumulative Redeemable Preferred Stock par value $0.01 per share,22.88,,8607,Uncategorized
DLR^L,Digital Realty Trust Inc. 5.200% Series L Cumulative Redeemable Preferred Stock,20.06,,20602,Uncategorized
DUK^A,Duke Energy Corporation Depositary Shares each representing a 1/1000th interest in a share of 5.75% Series A Cumulative Redeemable Perpetual Preferred Stock,24.92,,79665,Uncategorized
DX^C,Dynex Capital Inc. 6.900% Series C Fixed-to-Floating Rate Cumulative Redeemable Preferred Stock,25.54,,7431,Uncategorized
ECC^D,Eagle Point Credit Company Inc. 6.75% Series D Preferred Stock,18.64,,4642,Uncategorized
ECF^A,Ellsworth Growth and Income Fund Ltd. 5.25% Series A Cumulative Preferred Shares (Liquidation Preference $25.00 per share),21.48,,511,Uncategorized
EFC^B,Ellington Financial Inc. 6.250% Series B Fixed-Rate Reset Cumulative Redeemable Preferred Stock,24.6,,1691,Uncategorized
EFC^C,Ellington Financial Inc. 8.625% Series C Fixed-Rate Reset Cumulative Redeemable Preferred Stock,25.345,,583,Uncategorized
EFC^D,Ellington Financial Inc. 7.00% Series D Cumulative Perpetual Redeemable Preferred Stock,23.12,,7309,Uncategorized
EP^C,El Paso Corporation Preferred Stock,50.25,,2879,Uncategorized
EPR^C,EPR Properties 5.75% Series C Cumulative Convertible Preferred Shares,25.19,,14318,Uncategorized
EPR^E,EPR Properties Series E Cumulative Conv Pfd Shs Ser E,32.11,,7656,Uncategorized
EPR^G,EPR Properties 5.750% Series G Cumulative Redeemable Preferred Shares,19.69,,11247,Uncategorized
EQH^A,Equitable Holdings Inc. Depositary Shares,19.9601,,43895,Uncategorized
EQH^C,Equitable Holdings Inc. Depositary Shares each representing a 1/1000th interest in a share of Fixed Rate Noncumulative Perpetual Preferred Stock Series C,16.46,,13068,Uncategorized
ET^I,Energy Transfer L.P. Series I Fixed Rate Perpetual Preferred Units,12.05,,39443,Uncategorized
ETI^,Entergy Texas Inc 5.375% Series A Preferred Stock Cumulative No Par Value,24.05,,6702,Uncategorized
F^B,Ford Motor Company 6.20% Notes due June 1 2059,21.13,,38494,Uncategorized
F^C,Ford Motor Company 6% Notes due December 1 2059,20.6,,36889,Uncategorized
F^D,Ford Motor Company 6.500% Notes due August 15 2062,22.38,,44647,Uncategorized
FBRT^E,Franklin BSP Realty Trust Inc. 7.50% Series E Cumulative Redeemable Preferred Stock,19.66,,13044,Uncategorized
FHN^C,First Horizon Corporation Depositary Shares each representing a 1/400th interest in a share of Non-Cumulative Perpetual Preferred Stock Series C,24.98,,13904,Uncategorized
FHN^E,First Horizon Corporation Depositary Shares each representing a 1/4000th interest in a share of Non-Cumulative Perpetual Preferred Stock Series E,24.74,,3585,Uncategorized
FHN^F,First Horizon Corporation Depositary Shares each representing 1/4000th Interest in a Share of Non-Cumulative Perpetual Preferred Stock Series F,17.69,,4407,Uncategorized
FHN^H,First Horizon Corporation Depositary Shares each representing a 1/4000th interest in a share of Non-Cumulative Perpetual Preferred Stock Series H,24.985,,34492,Uncategorized
FLG^A,Flagstar Bank N.A. Depositary shares each representing a 1/40th interest in a share of Fixed-to-Floating Rate Series A Noncumulative Perpetual Preferred Stock,22.92,,12612,Uncategorized
FLG^U,Flagstar Bank N.A. Bifurcated Option Note Unit SecuritiES,40.56,,3957,Uncategorized
FOUR^A,Shift4 Payments Inc. 6.00% Series A Mandatory Convertible Preferred Stock,56.99,,118506,Uncategorized
FRT^C,Federal Realty Investment Trust Depositary Shares each representing a 1/1000th interest in a 5.000% Series C Cumulative Redeemable Preferred Share,19.33,,4419,Uncategorized
GAB^G,Gabelli Equity Trust Inc. (The) Series G Cumulative Preferred Stock,20.3,,7186,Uncategorized
GAB^H,Gabelli Equity Trust Inc. (The) Pfd Ser H,20.372,,4348,Uncategorized
GAB^K,Gabelli Equity Trust Inc. (The) 5.00% Series K Cumulative Preferred Stock,20.67,,10868,Uncategorized
GAM^B,General American Investors Company Inc. Cumulative Preferred Stock,24.835,,20808,Uncategorized
GDV^H,The Gabelli Dividend & Income Trust 5.375% Series H Cumulative Preferred Shares,22.3201,,6312,Uncategorized
GDV^K,The Gabelli Dividend & Income Trust 4.250% Series K Cumulative Preferred Shares,17.9,,4341,Uncategorized
GGN^B,GAMCO Global Gold Natural Reources & Income Trust 5.00% Series B Cumulative 25.00 Liquidation Preference,20.04,,9869,Uncategorized
GGT^E,Gabelli Multi-Media Trust Inc. (The) 5.125% Series E Cumulative Preferred Stock,20.73,,71,Uncategorized
GGT^G,Gabelli Multi-Media Trust Inc. (The) 5.125% Series G Cumulative Preferred Shares,20.85,,1256,Uncategorized
GL^D,Globe Life Inc. 4.25% Junior Subordinated Debentures due 2061,15.84,,9138,Uncategorized
GLP^B,Global Partners LP 9.50% Series B Fixed Rate Cumulative Redeemable Perpetual Preferred Units representing limited partner interests,25.875,,7337,Uncategorized
GLU^A,The Gabelli Global Utility and Income Trust Series A Cumulative Puttable and Callable Preferred Shares,52.0,,276,Uncategorized
GLU^B,The Gabelli Global Utility and Income Trust Series B Cumulative Puttable and Callable Preferred Shares,50.3401,,313,Uncategorized
GNL^A,Global Net Lease Inc. 7.25% Series A Cumulative Redeemable Preferred Stock $0.01 par value per share,22.61,,823,Uncategorized
GNL^B,Global Net Lease Inc. 6.875% Series B Cumulative Redeemable Perpetual Preferred Stock,21.45,,2136,Uncategorized
GNL^D,Global Net Lease Inc. 7.50% Series D Cumulative Redeemable Perpetual Preferred Stock,23.42,,3554,Uncategorized
GNL^E,Global Net Lease Inc. 7.375% Series E Cumulative Redeemable Perpetual Preferred Stock,22.79,,4282,Uncategorized
GNT^A,GAMCO Natural Resources Gold & Income Tust  5.20% Series A Cumulative Preferred Shares (Liquidation Preference $25.00 per share),20.7294,,4299,Uncategorized
GPMT^A,Granite Point Mortgage Trust Inc. 7.00% Series A Fixed-to-Floating Rate Cumulative Redeemable Preferred Stock,20.04,,1441,Uncategorized
GPUS^D,Hyperscale Data Inc. 13.00% Series D Cumulative Redeemable Perpetual Preferred Stock,21.36,,443,Uncategorized
GRBK^A,Green Brick Partners Inc. Depositary Shares (each representing a 1/1000th fractional interest in a share of 5.75% Series A Cumulative Perpetual Preferred Stock),23.1299,,2841,Uncategorized
GS^A,Goldman Sachs Group Inc. (The) Depositary Shares each representing 1/1000th Interest in a Share of Floating Rate Non-Cumulative Preferred Stock Series A,19.24,,50185,Uncategorized
GS^C,Goldman Sachs Group Inc. (The) Depositary Share repstg 1/1000th Preferred Series C,19.35,,23706,Uncategorized
GS^D,Goldman Sachs Group Inc. (The) Dep Shs repstg 1/1000 Pfd Ser D Fltg,19.04,,97540,Uncategorized
GUT^C,Gabelli Utility Trust (The) 5.375% Series C Cumulative Preferred Shares,22.44,,2133,Uncategorized
HEI/A,Heico Corporation,205.52,,298778,Uncategorized
HFRO^A,Highland Opportunities and Income Fund 5.375% Series A Cumulative Preferred Shares,16.4801,,2342,Uncategorized
HFRO^B,Highland Opportunities and Income Fund 5.375% Series B Cumulative Preferred Shares,16.35,,6310,Uncategorized
HIG^G,The Hartford Insurance Group Inc. Depositary Shares each representing a 1/1000th interest in a share of 6.000% Non-Cumulative Preferred Stock Series G,25.1,,10117,Uncategorized
HL^B,Hecla Mining Company Preferred Stock,64.9,,912,Uncategorized
HPE^C,Hewlett Packard Enterprise Company 7.625% Series C Mandatory Convertible Preferred Stock,75.18,,112381,Uncategorized
HPP^C,Hudson Pacific Properties Inc. 4.750% Series C Cumulative Redeemable Preferred Stock,14.05,,6056,Uncategorized
HVII,Hennessy Capital Investment Corp. VII Ordinary Shares,10.4,,1178,Uncategorized
HVT/A,Haverty Furniture Companies Inc.,23.055,,69,Uncategorized
IIPR^A,Innovative Industrial Properties Inc. 9.00% Series A Cumulative Redeemable Preferred Stock,22.1,,88828,Uncategorized
INN^E,Summit Hotel Properties Inc. 6.250% Series E Cumulative Redeemable Preferred Stock,18.4,,684,Uncategorized
INN^F,Summit Hotel Properties Inc. 5.875% Series F Cumulative Redeemable Preferred Stock $0.01 par value per share,17.5,,9319,Uncategorized
IVR^C,INVESCO MORTGAGE CAPITAL INC 7.5% Fixed-to-Floating Series C Cumulative Redeemable Preferred Stock Liquation Preference $25.00 per Share,23.53,,12680,Uncategorized
JPM^C,J P Morgan Chase & Co Depositary Shares each representing a 1/400th interest in a share of 6.00% Non-Cumulative  Preferred Stock Series EE,25.37,,64694,Uncategorized
JPM^D,J P Morgan Chase & Co Depositary Shares each representing a 1/400th  interest in a share of 5.75% Non-Cumulative  Preferred Stock Series DD,24.79,,100612,Uncategorized
JPM^J,J P Morgan Chase & Co Depositary Shares each representing a 1/400th interest in a share of JPMorgan Chase & Co. 4.75% Non-Cumulative Preferred Stock Series GG,20.0,,45996,Uncategorized
JPM^K,J P Morgan Chase & Co Depositary Shares each representing a 1/400th interest in a share of 4.55% Non-Cumulative Preferred Stock Series JJ,19.16,,38610,Uncategorized
JPM^L,J P Morgan Chase & Co Depositary Shares each representing a 1/400th interest in a share of 4.625% Non-Cumulative Preferred Stock Series LL,19.46,,105687,Uncategorized
JPM^M,J P Morgan Chase & Co Depositary Shares each representing a 1/400th interest in a share of 4.20% Non-Cumulative Preferred Stock Series MM,17.95,,122958,Uncategorized
JXN^A,Jackson Financial Inc. Depositary Shares each representing a 1/1000th interest in a share of Fixed-Rate Reset Noncumulative Perpetual Preferred Stock Series A,26.13,,10004,Uncategorized
KEY^I,KeyCorp Depositary Shares Each Representing a 1/40th Ownership Interest in a Share of Fixed-to-Floating Rate Perpetual Non-Cumulative Preferred Stock Series E,25.051,,25138,Uncategorized
KEY^J,KeyCorp Depositary Shares each representing a 1/40th ownership interest in a share of Fixed Rate Perpetual Non-Cumulative Preferred Stock Series F,21.55,,13009,Uncategorized
KEY^K,KeyCorp Depositary Shares each representing a 1/40th ownership interest in a share of Fixed Rate Perpetual Non-Cumulative Preferred Stock Series G,21.4,,13727,Uncategorized
KEY^L,KeyCorp Depositary Shares each representing a 1/40th ownership interest in a share of Fixed Rate Perpetual Non-Cumulative Preferred Stock Series H,24.85,,45536,Uncategorized
KIM^L,Kimco Realty Corporation Class L Depositary Shares each of which represents a one-one thousandth fractional interest in a share of 5.125% Class L Cumulative Redeemable Preferred Stock liquidation preference $25000.00 per share,19.5701,,5675,Uncategorized
KIM^M,Kimco Realty Corporation Class M Depositary Shares each of which represents a one-one thousandth fractional interest in a share of 5.25% Class M Cumulative Redeemable Preferred Stock liquidation preference $25000.00 per share,20.15,,16946,Uncategorized
KIM^N,Kimco Realty Corporation Depositary Shares each representing 1/1000th interest in a share of 7.25% Class N Cumulative Convertible Perpetual Preferred Stock,61.19,,122,Uncategorized
KKR^D,KKR & Co. Inc. 6.25% Series D Mandatory Convertible Preferred Stock,43.91,,67870,Uncategorized
KREF^A,KKR Real Estate Finance Trust Inc. 6.50% Series A Cumulative Redeemable Preferred Stock,18.08,,17137,Uncategorized
LFT^A,Lument Finance Trust Inc. 7.875% Series A Cumulative Redeemable Preferred Stock,19.91,,397,Uncategorized
LNC^D,Lincoln National Corporation Depositary Shares Each Representing a 1/1000th Interest in a Share of 9.000% Non-Cumulative Preferred Stock Series D,26.43,,46824,Uncategorized
LOB^A,Live Oak Bancshares Inc. Depositary Shares Each Representing a 1/40th Interest in a Share of 8.375% Fixed Rate Series A Non-Cumulative Perpetual Preferred Stock,25.24,,2960,Uncategorized
LXP^C,LXP Industrial Trust 6.5% Series C Cumulative Convertible Preferred Stock,46.65,,1115,Uncategorized
MAA^I,Mid-America Apartment Communities Inc. 8.50% Series I Cumulative Redeemable Preferred Stock,54.53,,52,Uncategorized
MDV^A,Modiv Industrial Inc. 7.375% Series A Cumulative Redeemable Perpetual Preferred Stock,24.92,,483,Uncategorized
MER^K,Bank of America Corporation Income Capital Obligation Notes initially due December 15 2066,25.683,,20954,Uncategorized
MET^A,MetLife Inc. Preferred Series A Floating Rate,20.99,,28964,Uncategorized
MET^E,MetLife Inc. Depositary Shares ,22.72,,53609,Uncategorized
MET^F,MetLife Inc. Depositary Shares each representing a 1/1000th interest in a share of 4.75% Non-Cumulative Preferred Stock Series F,19.16,,90471,Uncategorized
MFA^B,MFA Financial Inc. Preferred Series B,20.866,,6295,Uncategorized
MFA^C,MFA Financial Inc. 6.50% Series C Fixed-to-Floating Rate Cumulative Redeemable Preferred Stock,23.76,,10639,Uncategorized
MITT^A,TPG Mortgage Investment Trust Inc. 8.25% Series A Cumulative Redeemable Preferred Stock,23.0854,,812,Uncategorized
MITT^B,TPG Mortgage Investment Trust Inc. 8.00% Series B Cumulative Redeemable Preferred Stock,22.13,,2027,Uncategorized
MITT^C,TPG Mortgage Investment Trust Inc. 8.00% Series C Fixed-to-Floating Rate Cumulative Redeemable Preferred Stock $0.01 par value per share,25.135,,5130,Uncategorized
MS^A,Morgan Stanley Dep Shs repstg 1/1000 Pfd Ser A,19.34,,98954,Uncategorized
MS^E,Morgan Stanley DEPOSITARY SHARES REP 1/1000TH SHARES FIXED/FLTG PREFERRED STOCK SERIES E,25.3415,,44859,Uncategorized
MS^F,Morgan Stanley Dep Shs Rpstg 1/1000th Int Prd Ser F Fxd to Flag,25.24,,248329,Uncategorized
MS^I,Morgan Stanley Depository Shares Representing 1/1000th Preferred Series 1 Fixed to Floating Non (Cum),25.115,,88398,Uncategorized
MS^K,Morgan Stanley Depositary Shares each representing 1/1000th of a share of Fixed-to-Floating Rate Non-Cumulative Preferred Stock  Series K,24.27,,38155,Uncategorized
MS^L,Morgan Stanley Depositary Shares each representing 1/1000th of a share of 4.875% Non-Cumulative Preferred Stock Series L,20.48,,11888,Uncategorized
MS^O,Morgan Stanley Depositary Shares each representing 1/1000th of a share of 4.250% Non-Cumulative Preferred Stock Series O,17.46,,73199,Uncategorized
MS^P,Morgan Stanley Depositary Shares each representing 1/1000th of a share of 6.500% Non-Cumulative Preferred Stock Series P,25.32,,49353,Uncategorized
MS^Q,Morgan Stanley Depositary Shares each representing 1/1000th of a share of 6.625% Non-Cumulative Preferred Stock Series Q,25.62,,48111,Uncategorized
MTB^H,M&T Bank Corporation Perpetual Fixed-to-Floating Rate Non-Cumulative Preferred Stock Series H,25.06,,8463,Uncategorized
MTB^J,M&T Bank Corporation Depositary Shares each representing a 1/400th ownership interest in a share of Perpetual 7.500% Non-Cumulative Preferred Stock Series J,26.39,,19213,Uncategorized
MTB^K,M&T Bank Corporation Depositary Shares each representing a 1/400th interest in a share of Perpetual 6.350% Non-Cumulative Preferred Stock Series K,25.06,,9003,Uncategorized
NCV^A,Virtus Convertible & Income Fund 5.625% Series A Cumulative Preferred Shares,20.83,,7088,Uncategorized
NCZ^A,Virtus Convertible & Income Fund II 5.50% Series A Cumulative Preferred Shares,20.265,,3003,Uncategorized
NEE^N,NextEra Energy Capital Holdings Inc. Series N Junior Subordinated Debentures due March 1 2079,23.88,,19190,Uncategorized
NEE^S,NextEra Energy Inc. 7.299% Corporate Units,58.2,,36175,Uncategorized
NEE^T,NextEra Energy Inc. 7.234% Corporate Units,53.73,,6874,Uncategorized
NEE^U,NextEra Energy Inc. Series U Junior Subordinated Debentures due June 1 2085,25.49,,17619,Uncategorized
NEE^V,NextEra Energy Inc. 7.375% Corporate Units,51.63,,6171,Uncategorized
NEE^W,NextEra Energy Capital Holdings Inc. Series Z Junior Subordinated Debentures due April 15 2086,25.15,,75518,Uncategorized
NGL^B,NGL ENERGY PARTNERS LP 9.00% Class B Fixed-to-Floating Rate Cumulative Redeemable Perpetual Preferred Units representing limited partnership interests,25.2499,,10161,Uncategorized
NGL^C,NGL ENERGY PARTNERS LP 9.625% Class C Fixed-to-Floating Rate Cumulative  Redeemable Perpetual Preferred Units representing  limited partner interests,25.48,,336,Uncategorized
NLY^F,Annaly Capital Management Inc 6.95% Series F,25.9,,69215,Uncategorized
NLY^G,Annaly Capital Management Inc 6.50% Series G Fixed-to-Floating Rate Cumulative Redeemable Preferred Stock,25.02,,19715,Uncategorized
NLY^I,Annaly Capital Management Inc 6.750% Series I Fixed-to-Floating Rate Cumulative Redeemable Preferred Stock,25.665,,17593,Uncategorized
NLY^J,Annaly Capital Management Inc. 8.875% Series J Fixed-Rate Cumulative Redeemable Preferred Stock,26.1,,6219,Uncategorized
NREF^A,NexPoint Real Estate Finance Inc. 8.50% Series A Cumulative Redeemable Preferred Stock,23.18,,1035,Uncategorized
NSA^A,National Storage Affiliates Trust 6.000% Series A Cumulative Redeemable Preferred Shares of Beneficial Interest (Liquidation Preference $25.00 per share),22.97,,11647,Uncategorized
NSA^B,National Storage Affiliates Trust 6.000% Series B Cumulative Redeemable Preferred Shares of Beneficial Interest,32.5,,1977,Uncategorized
NXDT^A,NexPoint Diversified Real Estate Trust 5.50% Series A Cumulative Preferred Shares ($25.00 liquidation preference per share),13.29,,2944,Uncategorized
OAK^A,Brookfield Oaktree Holdings LLC 6.625% Series A Preferred Units,20.91,,3671,Uncategorized
OAK^B,Brookfield Oaktree Holdings LLC 6.550% Series B Preferred Units,20.8,,6964,Uncategorized
OPP^A,RiverNorth/DoubleLine Strategic Opportunity Fund Inc. 4.375% Series A Cumulative Preferred Stock,16.835,,2425,Uncategorized
OPP^B,RiverNorth/DoubleLine Strategic Opportunity Fund Inc. 4.75% Series B Cumulative Preferred Stock,18.33,,4750,Uncategorized
OPP^C,RiverNorth/DoubleLine Strategic Opportunity Fund Inc. 6.00% Series C Term Preferred Stock (Liquidation Preference $10.00 per share),10.3,,375,Uncategorized
ORCL^D,Oracle Corporation Depositary Shares each representing a 1/2000th interest in a sh of 6.50% Series D Mandatory Convertible Preferred Stock,50.36,,2916339,Uncategorized
PBI^B,Pitney Bowes Inc 6.70% Notes Due 2043,21.0,,14077,Uncategorized
PCG^A,Pacific Gas & Electric Co. 6% Preferred Stock,22.7,,8882,Uncategorized
PCG^B,Pacific Gas & Electric Co. 5 1/2% Preferred Stock,20.98,,7907,Uncategorized
